quoteText,bookTitle,bookAuthor,tags
"A reliable way to make people believe in falsehoods is frequent repetition, because familiarity is not easily distinguished from truth. Authoritarian institutions and marketers have always known this fact.","Thinking, Fast and Slow",Daniel Kahneman,"['psychology', 'science', 'social-behavior']"
"Nothing in life is as important as you think it is, while you are thinking about it","Thinking, Fast and Slow",Daniel Kahneman,['focusing-illusion']
Our comforting conviction that the world makes sense rests on a secure foundation: our almost unlimited ability to ignore our ignorance.,"Thinking, Fast and Slow",Daniel Kahneman,[]
"If you care about being thought credible and intelligent, do not use complex language where simpler language will do.","Thinking, Fast and Slow",Daniel Kahneman,[]
Intelligence is not only the ability to reason; it is also the ability to find relevant material in memory and to deploy attention when needed.,"Thinking, Fast and Slow",Daniel Kahneman,[]
"The psychologist, Paul Rozin, an expert on disgust, observed that a single cockroach will completely wreck the appeal of a bowl of cherries, but a cherry will do nothing at all for a bowl of cockroaches.","Thinking, Fast and Slow",Daniel Kahneman,[]
The idea that the future is unpredictable is undermined every day by the ease with which the past is explained.,"Thinking, Fast and Slow",Daniel Kahneman,"['future', 'prediction', 'psychology']"
"Odd as it may seem, I am my remembering self, and the experiencing self, who does my living, is like a stranger to me.","Thinking, Fast and Slow",Daniel Kahneman,"['experience', 'memory', 'reflection', 'self']"
"This is the essence of intuitive heuristics: when faced with a difficult question, we often answer an easier one instead, usually without noticing the substitution.","Thinking, Fast and Slow",Daniel Kahneman,[]
We are prone to overestimate how much we understand about the world and to underestimate the role of chance in events.,"Thinking, Fast and Slow",Daniel Kahneman,[]
A general “law of least effort” applies to cognitive as well as physical,"Thinking, Fast and Slow",Daniel Kahneman,[]
"The confidence that individuals have in their beliefs depends mostly on the quality of the story they can tell about what they see, even if they see little.","Thinking, Fast and Slow",Daniel Kahneman,[]
"we can be blind to the obvious, and we are also blind to our blindness.","Thinking, Fast and Slow",Daniel Kahneman,[]
"I have always believed that scientific research is another domain where a form of optimism is essential to success: I have yet to meet a successful scientist who lacks the ability to exaggerate the importance of what he or she is doing, and I believe that someone who lacks a delusional sense of significance will wilt in the face of repeated experiences of multiple small failures and rare successes, the fate of most researchers.","Thinking, Fast and Slow",Daniel Kahneman,[]
"A reliable way of making people believe in falsehoods is frequent repetition, because familiarity is not easily distinguished from truth.","Thinking, Fast and Slow",Daniel Kahneman,[]
The world makes much less sense than you think. The coherence comes mostly from the way your mind works.,"Thinking, Fast and Slow",Daniel Kahneman,"['mind', 'psychology']"
The easiest way to increase happiness is to control your use of time. Can you find more time to do the things you enjoy doing?,"Thinking, Fast and Slow",Daniel Kahneman,[]
You are more likely to learn something by finding surprises in your own behavior than by hearing surprising facts about people in general.,"Thinking, Fast and Slow",Daniel Kahneman,['behavioral-psychology']
"Mood evidently affects the operation of System 1: when we are uncomfortable and unhappy, we lose touch with our intuition.","Thinking, Fast and Slow",Daniel Kahneman,"['creativity', 'gullibility', 'mood', 'rationality']"
Familiarity breeds liking.,"Thinking, Fast and Slow",Daniel Kahneman,[]
The illusion that we understand the past fosters overconfidence in our ability to predict the future.,"Thinking, Fast and Slow",Daniel Kahneman,[]
"Confidence is a feeling, which reflects the coherence of the information and the cognitive ease of processing it. It is wise to take admissions of uncertainty seriously, but declarations of high confidence mainly tell you that an individual has constructed a coherent story in his mind, not necessarily that the story is true.","Thinking, Fast and Slow",Daniel Kahneman,[]
"The test of learning psychology is whether your understanding of situations you encounter has changed, not whether you have learned a new fact.","Thinking, Fast and Slow",Daniel Kahneman,['psychology']
Nothing in life is as important as you think it is when you are thinking about it.,"Thinking, Fast and Slow",Daniel Kahneman,"['biases', 'focus', 'focusing-illusion', 'heuristics', 'importance', 'priorities', 'thinking']"
"acquisition of skills requires a regular environment, an adequate opportunity to practice, and rapid and unequivocal feedback about the correctness of thoughts and actions.","Thinking, Fast and Slow",Daniel Kahneman,[]
People tend to assess the relative importance of,"Thinking, Fast and Slow",Daniel Kahneman,[]
"Because we tend to be nice to other people when they please us and nasty when they do not, we are statistically punished for being nice and rewarded for being nasty.","Thinking, Fast and Slow",Daniel Kahneman,[]
The premise of this book is that it is easier to recognize other people’s mistakes than our own.,"Thinking, Fast and Slow",Daniel Kahneman,[]
"We focus on our goal, anchor on our plan, and neglect relevant base rates, exposing ourselves to the planning fallacy. We focus on what we want to do and can do, neglecting the plans and skills of others. Both in explaining the past and in predicting the future, we focus on the causal role of skill and neglect the role of luck. We are therefore prone to an illusion of control. We focus on what we know and neglect what we do not know, which makes us overly confident in our beliefs.","Thinking, Fast and Slow",Daniel Kahneman,[]
We are prone to blame decision makers for good decisions that worked out badly and to give them too little credit for successful moves that appear obvious only after the fact.,"Thinking, Fast and Slow",Daniel Kahneman,[]
"when people believe a conclusion is true, they are also very likely to believe arguments that appear to support it, even when these arguments are unsound.","Thinking, Fast and Slow",Daniel Kahneman,[]
"Experts who acknowledge the full extent of their ignorance may expect to be replaced by more confident competitors, who are better able to gain the trust of clients. An unbiased appreciation of uncertainty is a cornerstone of rationality—but it is not what people and organizations want.","Thinking, Fast and Slow",Daniel Kahneman,[]
a stable relationship requires that good interactions outnumber bad interactions by at least 5 to 1.,"Thinking, Fast and Slow",Daniel Kahneman,[]
"A simple rule can help: before an issue is discussed, all members of the committee should be asked to write a very brief summary of their position. This procedure makes good use of the value of the diversity of knowledge and opinion in the group. The standard practice of open discussion gives too much weight to the opinions of those who speak early and assertively, causing others to line up behind them.","Thinking, Fast and Slow",Daniel Kahneman,[]
higher income is associated with a reduced ability to enjoy the small pleasures of life.,"Thinking, Fast and Slow",Daniel Kahneman,[]
"Jonathan Haidt said in another context, “The emotional tail wags the rational dog.","Thinking, Fast and Slow",Daniel Kahneman,[]
Remember this rule: intuition cannot be trusted in the absence of stable regularities in the environment.,"Thinking, Fast and Slow",Daniel Kahneman,[]
Nothing in life is as important as you think it is when you are thinking of it.,"Thinking, Fast and Slow",Daniel Kahneman,"['focusing-illusion', 'reflection']"
"To derive the most useful information from multiple sources of evidence, you should always try to make these sources independent of each other.","Thinking, Fast and Slow",Daniel Kahneman,[]
"Indeed, there is evidence that people are more likely to be influenced by empty persuasive messages, such as commercials, when they are tired and depleted.","Thinking, Fast and Slow",Daniel Kahneman,[]
"We have all heard such stories of expert intuition: the chess master who walks past a street game and announces “White mates in three” without stopping, or the physician who makes a complex diagnosis after a single glance at a patient. Expert intuition strikes us as magical, but it is not. Indeed, each of us performs feats of intuitive expertise many times each day. Most of us are pitch-perfect in detecting anger in the first word of a telephone call, recognize as we enter a room that we were the subject of the conversation, and quickly react to subtle signs that the driver of the car in the next lane is dangerous. Our everyday intuitive abilities are no less marvelous than the striking insights of an experienced firefighter or physician—only more common. The psychology of accurate intuition involves no magic. Perhaps the best short statement of it is by the great Herbert Simon, who studied chess masters and showed that after thousands of hours of practice they come to see the pieces on the board differently from the rest of us. You can feel Simon’s impatience with the mythologizing of expert intuition when he writes: “The situation has provided a cue; this cue has given the expert access to information stored in memory, and the information provides the answer. Intuition is nothing more and nothing less than recognition.","Thinking, Fast and Slow",Daniel Kahneman,[]
"The worse the consequence, the greater the hindsight bias.","Thinking, Fast and Slow",Daniel Kahneman,[]
"I call it theory-induced blindness: once you have accepted a theory and used it as a tool in your thinking, it is extraordinarily difficult to notice its flaws. If you come upon an observation that does not seem to fit the model, you assume that there must be a perfectly good explanation that you are somehow missing.","Thinking, Fast and Slow",Daniel Kahneman,[]
"You can do several things at once, but only if they are easy and undemanding.","Thinking, Fast and Slow",Daniel Kahneman,[]
We are far too willing to reject the belief that much of what we see in life is random.,"Thinking, Fast and Slow",Daniel Kahneman,[]
"However, optimism is highly valued, socially and in the market; people and firms reward the providers of dangerously misleading information more than they reward truth tellers. One of the lessons of the financial crisis that led to the Great Recession is that there are periods in which competition, among experts and among organizations, creates powerful forces that favor a collective blindness to risk and uncertainty.","Thinking, Fast and Slow",Daniel Kahneman,[]
"If you care about being thought credible and intelligent, do not use complex language where simpler language will do. My Princeton colleague Danny Oppenheimer refuted a myth prevalent among undergraduates about the vocabulary that professors find most impressive. In an article titled ""Consequences of Erudite Vernacular Utilized Irrespective of Necessity: Problems with Using Long Words Needlessly,"" he showed that couching familiar ideas in pretentious language is taken as a sign of poor intelligence and low credibility.","Thinking, Fast and Slow",Daniel Kahneman,['psychology']
it is much easier to strive for perfection when you are never bored.,"Thinking, Fast and Slow",Daniel Kahneman,[]
"if you have had to force yourself to do something, you are less willing or less able to exert self-control when the next challenge comes around. The phenomenon has been named ego depletion.","Thinking, Fast and Slow",Daniel Kahneman,[]
"To be useful, your beliefs should be constrained by the logic of probability.","Thinking, Fast and Slow",Daniel Kahneman,[]
The world in our heads is not a precise replica of reality; our expectations about the frequency of events are distorted by the prevalence and emotional intensity of the messages to which we are exposed.,"Thinking, Fast and Slow",Daniel Kahneman,[]
"Jumping to conclusions is efficient if the conclusions are likely to be correct and the costs of an occasional mistake acceptable. Jumping to conclusions is risky when the situation is unfamiliar, the stakes are high and there is no time to collect more information.","Thinking, Fast and Slow",Daniel Kahneman,"['intuition', 'neuroscience', 'non-fiction', 'psychology']"
"The experiencing self does not have a voice. The remembering self is sometimes wrong, but it is the one that keeps score and governs what we learn from living, and it is the one that makes decisions. What we learn from the past is to maximize the qualities of our future memories, not necessarily of our future experience. This is the tyranny of the remembering self.","Thinking, Fast and Slow",Daniel Kahneman,[]
"A reliable way to make people believe in falsehoods is frequent repetition, because familiarity is not easily distinguished from truth.","Thinking, Fast and Slow",Daniel Kahneman,[]
The most effortful forms of slow thinking are those that require you to think fast.,"Thinking, Fast and Slow",Daniel Kahneman,[]
"Those who avoid the sin of intellectual sloth could be called “engaged.” They are more alert, more intellectually active, less willing to be satisfied with superficially attractive answers, more skeptical about their intuitions.","Thinking, Fast and Slow",Daniel Kahneman,[]
"If a satisfactory answer to a hard question is not found quickly, System 1 will find a related question that is easier and will answer it. I call the operation of answering one question in place of another substitution.","Thinking, Fast and Slow",Daniel Kahneman,[]
"In a state of flow, however, maintaining focused attention on these absorbing activities requires no exertion of self-control, thereby freeing resources to be directed to the task at hand.","Thinking, Fast and Slow",Daniel Kahneman,[]
"People who are poor think like traders, but the dynamics are quite different. Unlike traders, the poor are not indifferent to the differences between gaining and giving up. Their problem is that all their choices are between losses. Money that is spent on one good is the loss of another good that could have been purchased instead. For the poor, costs are losses.","Thinking, Fast and Slow",Daniel Kahneman,[]
"If you were allowed one wish for your child, seriously consider wishing him or her optimism.","Thinking, Fast and Slow",Daniel Kahneman,[]
Highly intelligent women tend to marry men who are less intelligent than they are.,"Thinking, Fast and Slow",Daniel Kahneman,[]
"As cognitive scientists have emphasized in recent years, cognition is embodied; you think with your body, not only with your brain.","Thinking, Fast and Slow",Daniel Kahneman,[]
"The evidence of priming studies suggests that reminding people of their mortality increases the appeal of authoritarian ideas, which may become reassuring in the context of the terror of death.","Thinking, Fast and Slow",Daniel Kahneman,[]
An inability to be guided by a “healthy fear” of bad consequences is a disastrous flaw.,"Thinking, Fast and Slow",Daniel Kahneman,[]
"The illusion that one has understood the past feeds the further illusion that one can predict and control the future. These illusions are comforting. They reduce the anxiety that we would experience if we allowed ourselves to fully acknowledge the uncertainties of existence. We all have a need for the reassuring message that actions have appropriate consequences, and that success will reward wisdom and courage. Many business books are tailor-made to satisfy this need.","Thinking, Fast and Slow",Daniel Kahneman,[]
"It is the consistency of the information that matters for a good story, not its completeness. Indeed, you will often find that knowing little makes it easier to fit everything you know into a coherent pattern.","Thinking, Fast and Slow",Daniel Kahneman,[]
"In essence, the optimistic style involves taking credit for successes but little blame for failures.","Thinking, Fast and Slow",Daniel Kahneman,[]
"If you are genetically endowed with an optimistic bias, you hardly need to be told that you are a lucky person—you already feel fortunate. An optimistic attitude is largely inherited, and it is part of a general disposition for well-being, which may also include a preference for seeing the bright side of everything. If you were allowed one wish for your child, seriously consider wishing him or her optimism. Optimists are normally cheerful and happy, and therefore popular; they are resilient in adapting to failures and hardships, their chances of clinical depression are reduced, their immune system is stronger, they take better care of their health, they feel healthier than others and are in fact likely to live longer. A study of people who exaggerate their expected life span beyond actuarial predictions showed that they work longer hours, are more optimistic about their future income, are more likely to remarry after divorce (the classic “triumph of hope over experience”), and are more prone to bet on individual stocks. Of","Thinking, Fast and Slow",Daniel Kahneman,[]
A divorce is like a symphony with a screeching sound at the end—the fact that it ended badly does not mean it was all bad.,"Thinking, Fast and Slow",Daniel Kahneman,[]
"Finally, the illusions of validity and skill are supported by a powerful professional culture. We know that people can maintain an unshakable faith in any proposition, however absurd, when they are sustained by a community of like-minded believers. Given the professional culture of the financial community, it is not surprising that large numbers of individuals in that world believe themselves to be among the chosen few who can do what they believe others cannot.","Thinking, Fast and Slow",Daniel Kahneman,[]
A compelling narrative fosters an illusion of inevitability.,"Thinking, Fast and Slow",Daniel Kahneman,"['cognitive-bias', 'narrative']"
"We know that people can maintain an unshakable faith in any proposition, however absurd, when they are sustained by a community of like-minded believers","Thinking, Fast and Slow",Daniel Kahneman,['blind-faith']
luck plays a large role in every story of success; it is almost always easy to identify a small change in the story that would have turned a remarkable achievement into a mediocre outcome.,"Thinking, Fast and Slow",Daniel Kahneman,[]
"For example, students of policy have noted that the availability heuristic","Thinking, Fast and Slow",Daniel Kahneman,[]
"A happy mood loosens the control of System 2 over performance: when in a good mood, people become more intuitive and more creative but also less vigilant and more prone to logical errors. Here again, as in the mere exposure effect, the connection makes biological sense. A good mood is a signal that things are generally going well, the environment is safe, and it is all right to let one’s guard down. A bad mood indicates that things are not going very well, there may be a threat, and vigilance is required.","Thinking, Fast and Slow",Daniel Kahneman,[]
"The gorilla study illustrates two important facts about our minds: we can be blind to the obvious, and we are also blind to our blindness.","Thinking, Fast and Slow",Daniel Kahneman,[]
"Narrative fallacies arise inevitably from our continuous attempt to make sense of the world. The explanatory stories that people find compelling are simple; are concrete rather than abstract; assign a larger role to talent, stupidity, and intentions than to luck; and focus on a few striking events that happened rather than on the countless events that failed to happen. Any recent salient event is a candidate to become the kernel of a causal narrative. Taleb suggests that we humans constantly fool ourselves by constructing flimsy accounts of the past and believing they are true.","Thinking, Fast and Slow",Daniel Kahneman,[]
"Confusing experience with the memory of it is a compelling cognitive illusion—and it is the substitution that makes us believe a past experience can be ruined. The experiencing self does not have a voice. The remembering self is sometimes wrong, but it is the one that keeps score and governs what we learn from living, and it is the one that makes decisions. What we learn from the past is to maximize the qualities of our future memories, not necessarily of our future experience. This is the tyranny of the remembering self.","Thinking, Fast and Slow",Daniel Kahneman,[]
"declarations of high confidence mainly tell you that an individual has constructed a coherent story in his mind, not necessarily that the story is true.","Thinking, Fast and Slow",Daniel Kahneman,[]
"You have no compelling moral intuitions to guide you in solving that problem. Your moral feelings are attached to frames, to descriptions of reality rather than to reality itself.","Thinking, Fast and Slow",Daniel Kahneman,[]
Do we still remember the question we are trying to answer? Or have we substituted an easier one?,"Thinking, Fast and Slow",Daniel Kahneman,[]
"Intelligence is not only the ability to reason; it is also the ability to find relevant material in memory and to deploy attention when needed. Memory function is an attribute of System 1. However, everyone has the option of slowing down to conduct an active search of memory for all possibly relevant facts—just as they could slow down to check the intuitive answer in the bat-and-ball problem. The extent of deliberate checking and search is a characteristic of System 2, which varies among individuals.","Thinking, Fast and Slow",Daniel Kahneman,[]
"The nervous system consumes more glucose than most other parts of the body, and effortful mental activity appears to be especially expensive in the currency of glucose.","Thinking, Fast and Slow",Daniel Kahneman,[]
"Bad emotions, bad parents, and bad feedback have more impact than good ones, and bad information is processed more thoroughly than good. The","Thinking, Fast and Slow",Daniel Kahneman,[]
the proper way to elicit information from a group is not by starting with a public discussion but by confidentially collecting each person’s judgment. This procedure makes better use of the knowledge available to members of the group than the common practice of open discussion.,"Thinking, Fast and Slow",Daniel Kahneman,[]
Jumping to conclusions is a safer sport in the world of our imagination than it is in reality.,"Thinking, Fast and Slow",Daniel Kahneman,[]
"A general limitation of the human mind is its imperfect ability to reconstruct past states of knowledge, or beliefs that have changed. Once you adopt a new view of the world (or of any part of it), you immediately lose much of your ability to recall what you used to believe before your mind changed.","Thinking, Fast and Slow",Daniel Kahneman,[]
"In An Enquiry Concerning Human Understanding, published in 1748, the Scottish philosopher David Hume reduced the principles of association to three: resemblance, contiguity in time and place, and causality. Our concept of association has changed radically since Hume’s days, but his three principles still provide a good start.","Thinking, Fast and Slow",Daniel Kahneman,[]
"It is useful to remember, however, that neglecting valid stereotypes inevitably results in suboptimal judgments. Resistance to stereotyping is a laudable moral position, but the simplistic idea that the resistance is costless is wrong. The costs are worth paying to achieve a better society, but denying that the costs exist, while satisfying to the soul and politically correct, is not scientifically defensible.","Thinking, Fast and Slow",Daniel Kahneman,[]
"People who are cognitively busy are also more likely to make selfish choices, use sexist language, and make superficial judgments in social situations.","Thinking, Fast and Slow",Daniel Kahneman,[]
"When forecasting the outcomes of risky projects, executives too easily fall victim to the planning fallacy. In its grip, they make decisions based on delusional optimism rather than on a rational weighting of gains, losses, and probabilities. They overestimate benefits and underestimate costs. They spin scenarios of success while overlooking the potential for mistakes and miscalculations. As a result, they pursue initiatives that are unlikely to come in on budget or on time or to deliver the expected returns—or even to be completed. In this view, people often (but not always) take on risky projects because they are overly optimistic about the odds they face. I will return to this idea several times in this book—it probably contributes to an explanation of why people litigate, why they start wars, and why they open small businesses.","Thinking, Fast and Slow",Daniel Kahneman,[]
"The most surprising discovery made by Baumeister’s group shows, as he puts it, that the idea of mental energy is more than a mere metaphor. The nervous system consumes more glucose than most other parts of the body, and effortful mental activity appears to be especially expensive in the currency of glucose.","Thinking, Fast and Slow",Daniel Kahneman,[]
"The idea that large historical events are determined by luck is profoundly shocking, although it is demonstrably true.","Thinking, Fast and Slow",Daniel Kahneman,[]
