quoteText,bookTitle,bookAuthor,tags
"The role of time has been a refrain in this part of the book. It is logical to describe the life of the experiencing self as a series of moments, each with a value. The value of an episode—I have called it a hedonimeter total—is simply the sum of the values of its moments. But this is not how the mind represents episodes. The remembering self, as I have described it, also tells stories and makes choices, and neither the stories nor the choices properly represent time. In storytelling mode, an episode is represented by a few critical moments, especially the beginning, the peak, and the end. Duration is neglected.","Thinking, Fast and Slow",Daniel Kahneman,[]
The dominance of conclusions over arguments is most pronounced where emotions are involved. The psychologist Paul Slovic has proposed an affect heuristic in which people let their likes and dislikes determine their beliefs about the world.,"Thinking, Fast and Slow",Daniel Kahneman,[]
"More generally, the financial benefits of self-employment are mediocre: given the same qualifications, people achieve higher average returns by selling their skills to employers than by setting out on their own. The","Thinking, Fast and Slow",Daniel Kahneman,[]
Plans are best-case scenarios. Let’s avoid anchoring on plans when we forecast actual outcomes. Thinking about ways the plan could go wrong is one way to do it.,"Thinking, Fast and Slow",Daniel Kahneman,[]
"Ten or fifteen years later, a large gap had opened between those who had resisted temptation and those who had not. The resisters had higher measures of executive control in cognitive tasks, and especially the ability to reallocate their attention effectively.","Thinking, Fast and Slow",Daniel Kahneman,[]
"Contrary to the rules of philosophers of science, who advise testing hypotheses by trying to refute them, people (and scientists, quite often) seek data that are likely to be compatible with the beliefs they currently hold.","Thinking, Fast and Slow",Daniel Kahneman,[]
"Questioning what we believe and want is difficult at the best of times, and especially difficult when we most need to do it, but we can benefit from the informed opinions of others.","Thinking, Fast and Slow",Daniel Kahneman,[]
"There are many different experiences we would rather continue than stop, including both mental and physical pleasures. One of the examples I had in mind for a situation that Helen would wish to continue is total absorption in a task, which Mihaly Csikszentmihalyi calls flow—a state that some artists experience in their creative moments and that many other people achieve when enthralled by a film, a book, or a crossword puzzle: interruptions are not welcome in any of these situations. I also had memories of a happy early childhood in which I always cried when my mother came to tear me away from my toys to take me to the park, and cried again when she took me away from the swings and the slide. The resistance to interruption was a sign I had been having a good time, both with my toys and with the swings.","Thinking, Fast and Slow",Daniel Kahneman,[]
The list of situations and tasks that are now known to deplete self-control is long and varied. All involve conflict and the need to suppress a natural tendency. They include:,"Thinking, Fast and Slow",Daniel Kahneman,[]
"In other words, people who spend their time, and earn their living, studying a particular topic produce poorer predictions than dart-throwing monkeys who would have distributed their choices evenly over the options. Even in the region they knew best, experts were not significantly better than nonspecialists.","Thinking, Fast and Slow",Daniel Kahneman,[]
The truth is that small schools are not better on average; they are simply more variable.,"Thinking, Fast and Slow",Daniel Kahneman,[]
"And the more luck was involved, the less there is to be learned.","Thinking, Fast and Slow",Daniel Kahneman,[]
"The gigantic samples allow extremely fine analyses, which have confirmed the importance of situational factors, physical health, and social contact in experienced well-being. Not surprisingly, a headache will make a person miserable, and the second best predictor of the feelings of a day is whether a person did or did not have contacts with friends or relatives. It is only a slight exaggeration to say that happiness is the experience of spending time with people you love and who love you.","Thinking, Fast and Slow",Daniel Kahneman,[]
"Questioning what we believe and want is difficult at the best of times,","Thinking, Fast and Slow",Daniel Kahneman,[]
impressive series of studies by Thomas Åstebro sheds light on what happens when optimists receive bad news. He drew his data from a Canadian organization—the Inventor’s Assistance Program—which collects a small fee to provide inventors with an objective assessment of the commercial prospects of their idea.,"Thinking, Fast and Slow",Daniel Kahneman,[]
"Tetlock also found that experts resisted admitting that they had been wrong, and when they were compelled to admit error, they had a large collection of excuses: they had been wrong only in their timing, an unforeseeable event had intervened, or they had been wrong but for the right reasons.","Thinking, Fast and Slow",Daniel Kahneman,[]
"Many decisions are based on beliefs concerning the likelihood of uncertain events such as the outcome of an election, the guilt of a defendant, or the future value of the dollar.","Thinking, Fast and Slow",Daniel Kahneman,[]
But those with the most knowledge are often less reliable. The reason is that the person who acquires more knowledge develops an enhanced illusion of her skill and becomes unrealistically overconfident. “We reach the point of diminishing marginal predictive returns,"Thinking, Fast and Slow",Daniel Kahneman,[]
"To get the idea, take a sheet of paper and draw a 2½-inch line going up, starting at the bottom of the page—without a ruler. Now take another sheet, and start at the top and draw a line going down until it is 2½ inches from the bottom. Compare the lines. There is a good chance that your first estimate of 2½ inches was shorter than the second. The reason is that you do not know exactly what such a line looks like; there is a range of uncertainty. You stop near the bottom of the region of uncertainty when you start from the bottom of the page and near the top of the region when you start from the top. Robyn Le Boeuf and Shafir found many examples of that mechanism in daily experience. Insufficient adjustment neatly explains why you are likely to drive too fast when you come off the highway onto city streets—especially if you are talking with someone as you drive. Insufficient adjustment is also a source of tension between exasperated parents and teenagers who enjoy loud music in their room. Le Boeuf and Shafir note that a “well-intentioned child who turns down exceptionally loud music to meet a parent’s demand that it be played at a ‘reasonable’ volume may fail to adjust sufficiently from a high anchor, and may feel that genuine attempts at compromise are being overlooked.” The driver and the child both deliberately adjust down, and both fail to adjust enough.","Thinking, Fast and Slow",Daniel Kahneman,[]
Please imagine a ladder with steps numbered from zero at the bottom to 10 at the top. The top of the ladder represents the best possible life for you and the bottom of the ladder represents the worst possible life for you. On which step of the ladder would you say you personally feel you stand at this time?,"Thinking, Fast and Slow",Daniel Kahneman,[]
I made myself smile and I’m actually feeling better!,"Thinking, Fast and Slow",Daniel Kahneman,[]
These students can solve much more difficult problems when they are not tempted to accept a superficially plausible answer that comes readily to mind.,"Thinking, Fast and Slow",Daniel Kahneman,[]
"These findings add to the growing evidence that good mood, intuition, creativity, gullibility, and increased reliance on System 1 form a cluster. At the other pole, sadness, vigilance, suspicion, an analytic approach, and increased effort also go together. A happy mood loosens the control of System 2 over performance: when in a good mood, people become more intuitive and more creative but also less vigilant and more prone to logical errors. Here again, as in the mere exposure effect, the connection makes biological sense. A good mood is a signal that things are generally going well, the environment is safe, and it is all right to let one’s guard down. A bad mood indicates that things are not going very well, there may be a threat, and vigilance is required. Cognitive ease is both a cause and a consequence of a pleasant feeling.","Thinking, Fast and Slow",Daniel Kahneman,[]
"Anything that makes it easier for the associative machine to run smoothly will also bias beliefs. A reliable way to make people believe in falsehoods is frequent repetition, because familiarity is not easily distinguished from truth. Authoritarian institutions and marketers have always known this fact.","Thinking, Fast and Slow",Daniel Kahneman,[]
"Why is it so difficult for us to think statistically? We easily think associatively, we think metaphorically, we think causally, but statistics requires thinking about many things at once, which is something that System 1 is not designed to do.","Thinking, Fast and Slow",Daniel Kahneman,[]
"The principle of independent judgments (and decorrelated errors) has immediate applications for the conduct of meetings, an activity in which executives in organizations spend a great deal of their working days. A simple rule can help: before an issue is discussed, all members of the committee should be asked to write a very brief summary of their position.","Thinking, Fast and Slow",Daniel Kahneman,[]
"How closely does System 2 monitor the suggestions of System 1? His reasoning was that we know a significant fact about anyone who says that the ball costs 10¢: that person did not actively check whether the answer was correct, and her System 2 endorsed an intuitive answer that it could have rejected with a small investment of effort.","Thinking, Fast and Slow",Daniel Kahneman,[]
"However, the magic of error reduction works well only when the observations are independent and their errors uncorrelated. If the observers share a bias, the aggregation of judgments will not reduce it. Allowing the observers to influence each other effectively reduces the size of the sample, and with it the precision of the group estimate.","Thinking, Fast and Slow",Daniel Kahneman,[]
"Especially when the original critique is sharply worded, the reply and the rejoinder are often exercises in what I have called sarcasm for beginners and advanced sarcasm.","Thinking, Fast and Slow",Daniel Kahneman,[]
"More than 50% of students at Harvard, MIT, and Princeton gave the intuitive—incorrect—answer.","Thinking, Fast and Slow",Daniel Kahneman,[]
"She is a hedgehog. She has a theory that explains everything, and it gives her the illusion that she understands the world.","Thinking, Fast and Slow",Daniel Kahneman,[]
"When something cement does not fit into the current context of activated ideas, the system detects an abnormality, as you just experienced. You had no particular idea of what was coming after something, but you knew when the word cement came that it was abnormal in that sentence. Studies of brain responses have shown that violations of normality are detected with astonishing speed and subtlety.","Thinking, Fast and Slow",Daniel Kahneman,"['abnormal', 'subtlety']"
"In a memorable example, Dawes showed that marital stability is well predicted by a formula: frequency of lovemaking minus frequency of quarrels You don’t want your result to be a negative number.","Thinking, Fast and Slow",Daniel Kahneman,[]
"Betty is much more likely to take her chances, as others do when faced with very bad options. As","Thinking, Fast and Slow",Daniel Kahneman,[]
"our mind is strongly biased toward causal explanations and does not deal well with “mere statistics.” When our attention is called to an event, associative memory will look for its cause—more precisely, activation will automatically spread to any cause that is already stored in memory.","Thinking, Fast and Slow",Daniel Kahneman,[]
"When you take the long view of many similar decisions, you can see that paying a premium to avoid a small risk of a large loss is costly. A similar analysis applies to each of the cells of the fourfold pattern: systematic deviations from expected value are costly in the long run – and this rule applies to both risk aversion and risk seeing. Consistent overweighting of improbable outcomes – a feature of intuitive decision making – eventually leads to inferior outcomes.","Thinking, Fast and Slow",Daniel Kahneman,"['improbable-outcomes', 'intuitive-decision-making']"
"In the competition with the inside view, the outside view doesn’t stand a chance.","Thinking, Fast and Slow",Daniel Kahneman,[]
"The power of format creates opportunities for manipulation, which people with an axe to grind know how to exploit. Slovic and his colleagues cite an article that states that “approximately 1,000 homicides a year are committed nationwide by seriously mentally ill individuals who are not taking their medication.” Another way of expressing the same fact is that “1,000 out of 273,000,000 Americans will die in this manner each year.” Another is that “the annual likelihood of being killed by such an individual is approximately 0.00036%.” Still another: “1,000 Americans will die in this manner each year, or less than one-thirtieth the number who will die of suicide and about one-fourth the number who will die of laryngeal cancer.” Slovic points out that “these advocates are quite open about their motivation: they want to frighten the general public about violence by people with mental disorder, in the hope that this fear will translate into increased funding for mental health services.","Thinking, Fast and Slow",Daniel Kahneman,[]
"our inborn readiness to separate physical and intentional causality explains the near universality of religious beliefs. He observes that “we perceive the world of objects as essentially separate from the world of minds, making it possible for us to envision soulless bodies and bodiless souls.” The two modes of causation that we are set to perceive make it natural for us to accept the two central beliefs of many religions: an immaterial divinity is the ultimate cause of the physical world, and immortal souls temporarily control our bodies while we live and leave them behind as we die. In Bloom’s view, the two concepts of causality were shaped separately by evolutionary forces, building the origins of religion into the structure of System 1. The","Thinking, Fast and Slow",Daniel Kahneman,[]
"Multiple international bodies have specified that the absence of scientific evidence of potential damage is not sufficient justification for taking risks. As the jurist Cass Sunstein points out, the precautionary principle is costly, and when interpreted strictly it can be paralyzing.","Thinking, Fast and Slow",Daniel Kahneman,[]
"More often than not, risk takers underestimate the odds they face, and do not invest sufficient effort to find out what the odds are. Because they misread the risks, optimistic entrepreneurs often believe they are prudent, even when they are not. Their confidence in their future success sustains a positive mood that helps them obtain resources from others, raise the morale of their employees, and enhance their prospects of prevailing. When action is needed, optimism, even of the mildly delusional variety, may be a good thing.","Thinking, Fast and Slow",Daniel Kahneman,[]
"puzzles were legible, but the font induced cognitive strain. The results tell a clear story: 90% of the students who saw the CRT in normal font made at least one mistake in the test, but the proportion dropped to 35% when the font was barely legible. You read this correctly: performance was better with the bad font. Cognitive strain, whatever its source, mobilizes System 2, which is more likely to reject the intuitive answer suggested by System 1.","Thinking, Fast and Slow",Daniel Kahneman,[]
"The idea of old age had not come to their conscious awareness, but their actions had changed nevertheless. This remarkable priming phenomenon—the influencing of an action by the idea—is known as the ideomotor effect.","Thinking, Fast and Slow",Daniel Kahneman,[]
your subjective experience consists largely of the story that your System 2 tells itself about what is going on.,"Thinking, Fast and Slow",Daniel Kahneman,[]
Most of this book is about the workings of System 1 and the mutual influences between it and System 2.,"Thinking, Fast and Slow",Daniel Kahneman,[]
students can solve much more difficult problems when they are not tempted to accept a superficially plausible answer that comes readily to mind. The ease with which they are satisfied enough to stop thinking is rather troubling.,"Thinking, Fast and Slow",Daniel Kahneman,[]
"Starting from a completely unexpected event, your System 1 made as much sense as possible of the situation—two simple words, oddly juxtaposed—by linking the words in a causal story; it evaluated the possible threat (mild to moderate) and created a context for future developments by preparing you for events that had just become more likely; it also created a context for the current event by evaluating how surprising it was. You ended up as informed about the past and as prepared for the future as you could be.","Thinking, Fast and Slow",Daniel Kahneman,[]
"The most important aspect of both examples is that a definite choice was made, but you did not know it. Only one interpretation came to mind, and you were never aware of the ambiguity. System 1 does not keeop track of alternatives that it rejects, or even of the fact that there were alternatives. Conscious doubt is not in the repertoire of System 1; it requires maintaining incompatible interpretations in mind at the same time, which demands mental effort. Uncertainty and doubt are the domains of System 2.","Thinking, Fast and Slow",Daniel Kahneman,"['interpretation', 'uncertainty']"
Burton Malkiel’s wonderful book A Random Walk Down Wall Street.,"Thinking, Fast and Slow",Daniel Kahneman,[]
Nothing in life is quite as important as you think it is while you are thinking about it.,"Thinking, Fast and Slow",Daniel Kahneman,[]
"when people believe a conclusion is true, they are also very likely to believe arguments that appear to support it,","Thinking, Fast and Slow",Daniel Kahneman,[]
You can see why the common admonition to “act calm and kind regardless of how you feel” is very good advice: you are likely to be rewarded by actually feeling calm and,"Thinking, Fast and Slow",Daniel Kahneman,[]
"This start-up looks as if it could not fail, but the base rate of success in the industry is extremely low. How do we know this case is different?","Thinking, Fast and Slow",Daniel Kahneman,[]
"The sequence in which we observe characteristics of a person is often determined by chance. Sequence matters, however, because the halo effect increases the weight of first impressions, sometimes to the point that subsequent information is mostly wasted.","Thinking, Fast and Slow",Daniel Kahneman,[]
"The naturalist Stephen Jay Gould described his own struggle with the Linda problem. He knew the correct answer, of course, and yet, he wrote, “a little homunculus in my head continues to jump up and down, shouting at me—‘but she can’t just be a bank teller; read the description.’” The little homunculus is of course Gould’s System 1 speaking to him in insistent tones. (The two-system terminology had not yet been introduced when he wrote.) The correct answer to the short version of the Linda problem was the majority response in only one of our studies: 64% of a group of graduate students in the social sciences at Stanford and at Berkeley correctly judged “feminist bank teller” to be less probable","Thinking, Fast and Slow",Daniel Kahneman,[]
"The prominence of causal intuitions is a recurrent theme in this book because people are prone to apply causal thinking inappropriately, to situations that require statistical reasoning. Statistical thinking derives conclusions about individual cases from properties of categories and ensembles. Unfortunately, System 1 does not have the capability for this mode of reasoning; System 2 can learn to think statistically, but few people receive the necessary training.","Thinking, Fast and Slow",Daniel Kahneman,[]
"Human beings have invented the concept of “risk” to help them understand and cope with the dangers and uncertainties of life. Although these dangers are real, there is no such thing as “real risk” or “objective risk.","Thinking, Fast and Slow",Daniel Kahneman,[]
"The example also shows that it is costly to be risk averse for gains and risk seeking for losses. These attitudes make you willing to pay a premium to obtain a sure gain rather than face a gamble, and also willing to pay a premium (in expected value) to avoid a sure loss.","Thinking, Fast and Slow",Daniel Kahneman,[]
"Because of the coincidence of two planes crashing last month, she now prefers to take the train. That’s silly. The risk hasn’t really changed; it is an availability bias.","Thinking, Fast and Slow",Daniel Kahneman,[]
"Everyone has some awareness of the limited capacity of attention, and our social behavior makes allowances for these limitations. When the driver of a car is overtaking a truck on a narrow road, for example, adult passengers quite sensibly stop talking. They know that distracting the driver is not a good idea, and they also suspect that he is temporarily deaf and will not hear what they say. Intense focusing on a task can make people effectively blind, even to stimuli that normally attract attention.","Thinking, Fast and Slow",Daniel Kahneman,[]
"If you wish to experience your System 2 working at full tilt, the following exercise will do; it should bring you to the limits of your cognitive abilities within 5 seconds. To start, make up several strings of 4 digits, all different, and write each string on an index card.","Thinking, Fast and Slow",Daniel Kahneman,[]
"System 1 operates automatically and quickly, with little or no effort and no sense of voluntary control. System 2 allocates attention to the effortful mental activities that demand it, including complex computations. The operations of System 2 are often associated with the subjective experience of agency, choice, and concentration.","Thinking, Fast and Slow",Daniel Kahneman,[]
"In July 1997, the proposed new Scottish Parliament building in Edinburgh was estimated to cost up to £40 million. By June 1999, the budget for the building was £109 million. In April 2000, legislators imposed a £195 million “cap on costs.” By November 2001, they demanded an estimate of “final cost,” which was set at £241 million. That estimated final cost rose twice in 2002, ending the year at £294.6 million. It rose three times more in 2003, reaching £375.8 million by June. The building was finally completed in 2004 at an ultimate cost of roughly £431 million.","Thinking, Fast and Slow",Daniel Kahneman,[]
The errors of a theory are rarely found in what it asserts explicitly; they hide in what it ignores or tacitly assumes.,"Thinking, Fast and Slow",Daniel Kahneman,[]
The psychologist Mihaly Csikszentmihalyi (pronounced six-cent-mihaly) has done,"Thinking, Fast and Slow",Daniel Kahneman,[]
"there are many pseudo-experts who have no idea that they do not know what they are doing (the illusion of validity), and that as a general proposition subjective confidence is commonly too high and often uninformative.","Thinking, Fast and Slow",Daniel Kahneman,[]
"The wide confidence interval is a confession of ignorance, which is not socially acceptable for someone who is paid to be knowledgeable in financial matters. Even if they knew how little they know, the executives would be penalized for admitting it.","Thinking, Fast and Slow",Daniel Kahneman,[]
"When experts and the public disagree on their priorities, he says, “Each side must respect the insights and intelligence of the other.","Thinking, Fast and Slow",Daniel Kahneman,[]
"The premortem has two main advantages: it overcomes the groupthink that affects many teams once a decision appears to have been made, and it unleashes the imagination of knowledgeable individuals in a much-needed direction.","Thinking, Fast and Slow",Daniel Kahneman,[]
"Systems 1 and 2 are both active whenever we are awake. System 1 runs automatically and System 2 is normally in a comfortable low-effort mode, in which only a fraction of its capacity is engaged. System 1 continuously generates suggestions for System 2: impressions, intuitions, intentions, and feelings. If endorsed by System 2, impressions and intuitions turn into beliefs, and impulses turn into voluntary actions. When all goes smoothly, which is most of the time, System 2 adopts the suggestions of System 1 with little or no modification. You generally believe your impressions and act on your desires, and that is fine—usually. When System 1 runs into difficulty, it calls on System 2 to support more detailed and specific processing that may solve the problem of the moment. System 2 is mobilized when a question arises for which System 1 does not offer an answer. [S]ystem 2 is activated when an event is detected that violates the model of the world that System 1 maintains.","Thinking, Fast and Slow",Daniel Kahneman,[]
