quoteText,bookTitle,bookAuthor,tags
"In an experiment that became an instant classic, the psychologist John Bargh and his collaborators asked students at New York University—most aged eighteen to twenty-two—to assemble four-word sentences from a set of five words (for example, “finds he it yellow instantly”). For one group of students, half the scrambled sentences contained words associated with the elderly, such as Florida, forgetful, bald, gray, or wrinkle. When they had completed that task, the young participants were sent out to do another experiment in an office down the hall. That short walk was what the experiment was about. The researchers unobtrusively measured the time it took people to get from one end of the corridor to the other. As Bargh had predicted, the young people who had fashioned a sentence from words with an elderly theme walked down the hallway significantly more slowly than the others.","Thinking, Fast and Slow",Daniel Kahneman,[]
"The psychologist Mihaly Csikszentmihalyi (pronounced six-cent-mihaly) has done more than anyone else to study this state of effortless attending, and the name he proposed for it, flow, has become part of the language. People who experience flow describe it as “a state of effortless concentration so deep that they lose their sense of time, of themselves, of their problems,","Thinking, Fast and Slow",Daniel Kahneman,[]
"One day over breakfast, a medical resident asked how Dr. Apgar would make a systematic assessment of a newborn. “That’s easy,” she replied. “You would do it like this.” Apgar jotted down five variables (heart rate, respiration, reflex, muscle tone, and color) and three scores (0, 1, or 2, depending on the robustness of each sign). Realizing that she might have made a breakthrough that any delivery room could implement, Apgar began rating infants by this rule one minute after they were born. A baby with a total score of 8 or above was likely to be pink, squirming, crying, grimacing, with a pulse of 100 or more—in good shape. A baby with a score of 4 or below was probably bluish, flaccid, passive, with a slow or weak pulse—in need of immediate intervention. Applying Apgar’s score, the staff in delivery rooms finally had consistent standards for determining which babies were in trouble, and the formula is credited for an important contribution to reducing infant mortality. The Apgar test is still used every day in every delivery room.","Thinking, Fast and Slow",Daniel Kahneman,[]
"Self-control and deliberate thought apparently draw on the same limited budget of effort.... This is how the law of least effort comes to be a law. Even in the absence of time pressure, maintaining a coherent train of thought requires discipline.","Thinking, Fast and Slow",Daniel Kahneman,[]
"an organization is a factory that manufactures judgments and decisions. Every factory must have ways to ensure the quality of its products in the initial design, in fabrication, and in final inspections. The corresponding stages in the production of decisions are the framing of the problem that is to be solved, the collection of relevant information leading to a decision, and reflection and review. An organization that seeks to improve its decision product should routinely look for efficiency improvements at each of these stages. The","Thinking, Fast and Slow",Daniel Kahneman,[]
Little repetition is needed for learning.,"Thinking, Fast and Slow",Daniel Kahneman,[]
"Our mind has a useful capability to focus spontaneously on whatever is odd, different, or unusual.","Thinking, Fast and Slow",Daniel Kahneman,"['book', 'daniel-kahneman', 'nonfiction', 'psychology', 'quote', 'quote-of-the-day', 'thinking-fast-and-slow']"
It is difficult to accept changes for the worse.,"Thinking, Fast and Slow",Daniel Kahneman,[]
"As Nassim Taleb pointed out in The Black Swan, our tendency to construct and believe coherent narratives of the past makes it difficult for us to accept the limits of our forecasting ability. Everything makes sense in hindsight, a fact that financial pundits exploit every evening as they offer convincing accounts of the day’s events.","Thinking, Fast and Slow",Daniel Kahneman,[]
I decided to evaluate my portfolio only once a quarter. I am too loss averse to make sensible decisions in the face of daily price fluctuations.,"Thinking, Fast and Slow",Daniel Kahneman,[]
Laziness is built deep into our nature.,"Thinking, Fast and Slow",Daniel Kahneman,[]
"Bernoulli’s model lacks the idea of a reference point, expected utility theory does not represent the obvious fact that the outcome that is good for Anthony is bad for Betty. His model could explain Anthony’s risk aversion, but it cannot explain Betty’s risk-seeking preference for the gamble, a behavior that is often observed in entrepreneurs and in generals when all their options are bad.","Thinking, Fast and Slow",Daniel Kahneman,[]
"Consider the following: “Will Mindik be a good leader? She is intelligent and strong…” An answer quickly came to your mind, and it was yes. You picked the best answer based on the very limited information available, but you jumped the gun. What if the next two adjectives were corrupt and cruel? Take note of what you did not do as you briefly thought of Mindik as a leader. You did not start by asking, “What would I need to know before I formed an opinion about the quality of someone’s leadership?” System 1 got to work on its own from the first adjective: intelligent is good, intelligent and strong is very good. This is the best story that can be constructed from two adjectives, and System 1 delivered it with great cognitive ease. The story will be revised if new information comes in (such as Mindik is corrupt), but there is no waiting and no subjective discomfort. And there also remains a bias favoring the first impression.","Thinking, Fast and Slow",Daniel Kahneman,[]
"If the content of a screen saver on an irrelevant computer can affect your willingness to help strangers without your being aware of it, how free are you?","Thinking, Fast and Slow",Daniel Kahneman,[]
"Companies with pronounceable names do better than others for the first week after the stock is issued,","Thinking, Fast and Slow",Daniel Kahneman,[]
"We saw in the discussion of the law of small numbers that a message, unless it is immediately rejected as a lie, will have the same effect on the associative system regardless of its reliability. The gist of the message is the story, which is based on whatever information is available, even if the quantity of the information is slight and its quality is poor: WYSIATI. When you read a story about the heroic rescue of a wounded mountain climber, its effect on your associative memory is much the same if it is a news report or the synopsis of a film. Anchoring results from this associative activation. Whether the story is true, or believable, matters little, if at all. The powerful effect of random anchors is an extreme case of this phenomenon, because a random anchor obviously provides no information at all. Earlier I discussed the bewildering variety of priming effects, in which your thoughts and behavior may be influenced by stimuli to which you pay no attention at all, and even by stimuli of which you are completely unaware. The main moral of priming research is that our thoughts and our behavior are influenced, much more than we know or want, by the environment of the moment. Many people find the priming results unbelievable, because they do not correspond to subjective experience. Many others find the results upsetting, because they threaten the subjective sense of agency and autonomy. If the content of a screen saver on an irrelevant computer can affect your willingness to help strangers without your being aware of it, how free are you? Anchoring effects are threatening in a similar way. You are always aware of the anchor and even pay attention to it, but you do not know how it guides and constrains your thinking, because you cannot imagine how you would have thought if the anchor had been different (or absent). However, you should assume that any number that is on the table has had an anchoring effect on you, and if the stakes are high you should mobilize yourself (your System 2) to combat the effect.","Thinking, Fast and Slow",Daniel Kahneman,[]
"I describe mental life by the metaphor of two agents, called System 1 and System 2, which respectively produce fast and slow thinking. I speak of the features of intuitive and deliberate thought as if they were traits and dispositions of two characters in your mind. In the picture that emerges from recent research, the intuitive System 1 is more influential than your experience tells you, and it is the secret author of many of the choices and judgments you make.","Thinking, Fast and Slow",Daniel Kahneman,[]
"A correlation of .30 implies that you would find the stronger CEO leading the stronger firm in about 60% of the pairs—an improvement of a mere 10 percentage points over random guessing, hardly grist for the hero worship of CEOs we so often witness.","Thinking, Fast and Slow",Daniel Kahneman,[]
People have a limitation in their minds: an excessive confidence in what they think they know.  ,"Thinking, Fast and Slow by Daniel Kahneman - A 30-minute Summary",InstaRead,[]
"Daniel Kahneman’s book Thinking, Fast and Slow,","Do No Harm: Stories of Life, Death and Brain Surgery",Henry Marsh,[]
Paul Slovic: Slovic is a psychologist who has proposed that people let their likes and dislikes determine their beliefs about the world without really seeking out the truth.,"Thinking, Fast and Slow by Daniel Kahneman - A 30-minute Summary",InstaRead,[]
"Two Systems of Knowing In his book Thinking, Fast and Slow, Daniel Kahneman describes our two analytic systems. What he calls System 1 (or the automatic system) is unconscious, intuitive, and immediate. It draws on our senses and memories to size up a situation in the blink of an eye. It’s the running back dodging tackles in his dash for the end zone. It’s the Minneapolis cop, walking up to a driver he’s pulled over on a chilly day, taking evasive action even before he’s fully aware that his eye has seen a bead of sweat run down the driver’s temple.",Make It Stick: The Science of Successful Learning,Peter C. Brown,[]
"The ten instincts and cognitive psychology. Our thinking on the ten instincts was influenced by the work of a number of brilliant cognitive scientists. Some of the books that completely changed our thinking about the mind and about how we should teach facts about the world are: Dan Ariely, Predictably Irrational (2008), The Upside of Irrationality (2010), and The Honest Truth About Dishonesty (2012); Steven Pinker, How the Mind Works (1997), The Stuff of Thought (2007), The Blank Slate (2002), and The Better Angels of Our Nature (2011); Carol Tavris and Elliot Aronson, Mistakes Were Made (But Not by Me) (2007); Daniel Kahneman, Thinking, Fast and Slow (2011); Walter Mischel, The Marshmallow Test (2014); Philip E. Tetlock and Dan Gardner, Superforecasting (2015); Jonathan Gottschall, The Storytelling Animal (2012); Jonathan Haidt, The Happiness Hypothesis (2006) and The Righteous Mind (2012); and Thomas Gilovich, How We Know What Isn’t So (1991).",Factfulness: Ten Reasons We're Wrong About the World—and Why Things Are Better Than You Think,Hans Rosling,[]
"results are shocking. More than 50% of students at Harvard, MIT, and Princeton gave the intuitive—incorrect—answer.","Thinking, Fast and Slow",Daniel Kahneman,[]
"Why call them System 1 and System 2 rather than the more descriptive “automatic system” and “effortful system”? The reason is simple: “Automatic system” takes longer to say than “System 1” and therefore takes more space in your working memory. This matters, because anything that occupies your working memory reduces your ability to think.","Thinking, Fast and Slow",Daniel Kahneman,[]
"The bat-and-ball problem is our first encounter with an observation that will be a recurrent theme of this book: many people are overconfident, prone to place too much faith in their intuitions. They apparently find cognitive effort at least mildly unpleasant and avoid it as much as possible.","Thinking, Fast and Slow",Daniel Kahneman,[]
"it’s clear now that there are three cognitive features at the heart of prospect theory. They play an essential role in the evaluation of financial outcomes and are common to many automatic processes of perception, judgment, and emotion. They should be seen as operating characteristics of System 1.","Thinking, Fast and Slow",Daniel Kahneman,[]
"To derive the most useful information from multiple sources of evidence, you should always try to make these sources independent of each other. This rule is part of good police procedure. When there are multiple witnesses to an event, they are not allowed to discuss it before giving their testimony. The goal is not only to prevent collusion by hostile witnesses, it is also to prevent unbiased witnesses from influencing each other. Witnesses who exchange their experiences will tend to make similar errors in their testimony, reducing the total value of the information they provide. Eliminating redundancy from your sources of information is always a good idea. The principle of independent judgments (and decorrelated errors) has immediate applications for the conduct of meetings, an activity in which executives in organizations spend a great deal of their working days. A simple rule can help: before an issue is discussed, all members of the committee should be asked to write a very brief summary of their position. This procedure makes good use of the value of the diversity of knowledge and opinion in the group. The standard practice of open discussion gives too much weight to the opinions of those who speak early and assertively, causing others to line up behind them.","Thinking, Fast and Slow",Daniel Kahneman,[]
"focusing on a task can make people effectively blind, even to stimuli that normally attract attention. The most dramatic demonstration was offered by Christopher Chabris and Daniel Simons in their book The Invisible Gorilla. They constructed a short film of two teams passing basketballs, one team wearing white shirts, the other wearing black. The viewers of the film are instructed to count the number of passes made by the white team, ignoring the black players. This task is difficult and completely absorbing. Halfway through the video, a woman wearing a gorilla suit appears, crosses the court, thumps her chest, and moves on. The gorilla is in view for 9 seconds. Many thousands of people have seen the video, and about half of them do not notice anything unusual. It is the counting task—and especially the instruction to ignore one of the teams—that causes the blindness. No one who watches the video without that task would miss the gorilla. Seeing and orienting are automatic functions of System 1, but they depend on the allocation of some attention to the relevant stimulus. The authors note that the most remarkable observation of their study is that people find its results very surprising. Indeed, the viewers who fail to see the gorilla are initially sure","Thinking, Fast and Slow",Daniel Kahneman,[]
"If subjective confidence is not to be trusted, how can we evaluate the probable validity of an intuitive judgment? When do judgments reflect true expertise? When do they display an illusion of validity? The answer comes from the two basic conditions for acquiring a skill: an environment that is sufficiently regular to be predictable an opportunity to learn these regularities through prolonged practice When both these conditions are satisfied, intuitions are likely to be skilled. Chess is an extreme example of a regular environment, but bridge and poker also provide robust statistical regularities that can support skill. Physicians, nurses, athletes, and firefighters also face complex but fundamentally orderly situations. The accurate intuitions that Gary Klein has described are due to highly valid cues that the expert’s System 1 has learned to use, even if System 2 has not learned to name them. In contrast, stock pickers and political scientists who make long-term forecasts operate in a zero-validity environment. Their failures reflect the basic unpredictability of the events that they try to forecast.","Thinking, Fast and Slow",Daniel Kahneman,[]
"optimism is highly valued, socially and in the market; people and firms reward the providers of dangerously misleading information more than they reward truth tellers. One","Thinking, Fast and Slow",Daniel Kahneman,[]
"Many parents have discovered, perhaps with some guilt, that they can read a story to a child while thinking of something else.","Thinking, Fast and Slow",Daniel Kahneman,"['parenting', 'parents']"
"there are periods in which competition, among experts and among organizations, creates powerful forces that favor a collective blindness to risk and uncertainty.","Thinking, Fast and Slow",Daniel Kahneman,[]
"The familiarity of one phrase in the statement sufficed to make the whole statement feel familiar, and therefore true.","Thinking, Fast and Slow",Daniel Kahneman,[]
"The spontaneous search for an intuitive solution sometimes fails—neither an expert solution nor a heuristic answer comes to mind. In such cases we often find ourselves switching to a slower, more deliberate and effortful form of thinking. This is the slow thinking of the title. Fast thinking includes both variants of intuitive","Thinking, Fast and Slow",Daniel Kahneman,[]
"For some of our most important beliefs we have no evidence at all, except that people we love and trust hold these beliefs. Considering","Thinking, Fast and Slow",Daniel Kahneman,[]
"In another experiment in the series, participants were told that they would shortly have a get-acquainted conversation with another person and were asked to set up two chairs while the experimenter left to retrieve that person. Participants primed by money chose to stay much farther apart than their nonprimed peers (118 vs. 80 centimeters). Money-primed undergraduates also showed a greater preference for being alone.","Thinking, Fast and Slow",Daniel Kahneman,[]
A recurrent theme of this book is that luck plays a large role in every story of success; it is almost always easy to identify a small change in the story that would have turned a remarkable achievement into a mediocre outcome. Our,"Thinking, Fast and Slow",Daniel Kahneman,[]
"Because of the halo effect, we get the causal relationship backward: we are prone to believe that the firm fails because its CEO is rigid, when the truth is that the CEO appears to be rigid because the firm is failing. This is how illusions of understanding are born.","Thinking, Fast and Slow",Daniel Kahneman,[]
"People adjust less (stay closer to the anchor) when their mental resources are depleted, either because their memory is loaded with digits or because they are slightly drunk.","Thinking, Fast and Slow",Daniel Kahneman,[]
"thought—the expert and the heuristic—as well as the entirely automatic mental activities of perception and memory, the operations that enable you to know there is a lamp on your desk or retrieve the name of the capital of Russia.","Thinking, Fast and Slow",Daniel Kahneman,[]
Very little repetition is needed for a new experience to feel normal!,"Thinking, Fast and Slow",Daniel Kahneman,[]
Cognitive ease is both a cause and a consequence of a pleasant feeling.,"Thinking, Fast and Slow",Daniel Kahneman,[]
Richer and more realistic assumptions do not suffice to make a theory successful. Scientists,"Thinking, Fast and Slow",Daniel Kahneman,[]
the proper way to elicit information from a group is not by starting with a public discussion but by confidentially collecting each person’s judgment,"Thinking, Fast and Slow",Daniel Kahneman,[]
But we should not expect performance in officer training and in combat to be predictable from behavior on an obstacle field—behavior both on the test and in the real world is determined by many factors that are specific to the particular situation. Remove,"Thinking, Fast and Slow",Daniel Kahneman,[]
"people are first depleted by a task in which they eat virtuous foods such as radishes and celery while resisting the temptation to indulge in chocolate and rich cookies. Later, these people will give up earlier than normal when faced with a difficult cognitive task.","Thinking, Fast and Slow",Daniel Kahneman,[]
"The wide confidence interval is a confession of ignorance, which is not socially acceptable for someone who is paid to be knowledgeable in financial matters. Even if they knew how little they know, the executives would be penalized for admitting it. President Truman famously asked for a “one-armed economist” who would take a clear stand; he was sick and tired of economists who kept saying, “On the other hand…","Thinking, Fast and Slow",Daniel Kahneman,[]
"A reliable way to make people believe in falsehoods is frequent repetition, because familiarity is not easily distinguished from truth. Authoritarian institutions and marketers have always known this fact. But it was psychologists who discovered that you do not have to repeat the entire statement of a fact or idea to make it appear true. People who were repeatedly exposed to the phrase “the body temperature of a chicken” were more likely to accept as true the statement that “the body temperature of a chicken is 144°","Thinking, Fast and Slow",Daniel Kahneman,[]
"The third principle is loss aversion. When directly compared or weighted against each other, losses loom larger than gains. This asymmetry between the power of positive and negative expectations or experiences has an evolutionary history. Organisms that treat threats as more urgent than opportunities have a better chance to survive and reproduce.","Thinking, Fast and Slow",Daniel Kahneman,[]
"In several experiments, people were able to resist the effects of ego depletion when given a strong incentive to do so. In contrast, increasing effort is not an option when you must keep six digits in short-term memory while performing a task. Ego depletion","Thinking, Fast and Slow",Daniel Kahneman,[]
"You can feel Simon’s impatience with the mythologizing of expert intuition when he writes: “The situation has provided a cue; this cue has given the expert access to information stored in memory, and the information provides the","Thinking, Fast and Slow",Daniel Kahneman,[]
answer. Intuition is nothing more and nothing less than recognition.,"Thinking, Fast and Slow",Daniel Kahneman,[]
The halo effect and outcome bias combine to explain the extraordinary appeal of books that seek to draw operational morals from systematic examination of successful businesses.,"Thinking, Fast and Slow",Daniel Kahneman,[]
"I have heard of too many people who “knew well before it happened that the 2008 financial crisis was inevitable.” This sentence contains a highly objectionable word, which should be removed from our vocabulary in discussions of major events. The word is, of course, knew. Some people thought well in advance that there would be a crisis, but they did not know it. They now say they knew it because the crisis did in fact happen. This is a misuse of an important concept. In everyday language, we apply the word know only when what was known is true and can be shown to be true. We can know something only if it is both true and knowable. But the people who thought there would be a crisis (and there are fewer of them than now remember thinking it) could not conclusively show it at the time. Many intelligent and well-informed people were keenly interested in the future of the economy and did not believe a catastrophe was imminent; I infer from this fact that the crisis was not knowable. What is perverse about the use of know in this context is not that some individuals get credit for prescience that they do not deserve. It is that the language implies that the world is more knowable than it is. It helps perpetuate a pernicious illusion.","Thinking, Fast and Slow",Daniel Kahneman,[]
"You will from time to time meet a patient who shares a disturbing tale of multiple mistakes in his previous treatment. He has been seen by several clinicians, and all failed him. The patient can lucidly describe how his therapists misunderstood him, but he has quickly perceived that you are different. You share the same feeling, are convinced that you understand him, and will be able to help.” At this point my teacher raised his voice as he said, “Do not even think of taking on this patient! Throw him out of the office! He is most likely a psychopath and you will not be able to help him.","Thinking, Fast and Slow",Daniel Kahneman,[]
Imagine that we are a year into the future. We implemented the plan as it now exists. The outcome was a disaster. Please take 5 to 10 minutes to write a brief history of that disaster.,"Thinking, Fast and Slow",Daniel Kahneman,[]
"Even in countries that have been targets of intensive terror campaigns, such as Israel, the weekly number of casualties almost never came close to the number of traffic deaths.","Thinking, Fast and Slow",Daniel Kahneman,[]
"it is much easier, as well as far more enjoyable, to identify and label the mistakes of others than to recognize our own.","Thinking, Fast and Slow",Daniel Kahneman,[]
"many people are overconfident, prone to place too much faith in their intuitions","Thinking, Fast and Slow",Daniel Kahneman,[]
It appears to be a feature of System 1 that cognitive ease is associated with good feelings.,"Thinking, Fast and Slow",Daniel Kahneman,[]
