quoteText,bookTitle,bookAuthor,tags
"History reports that the men who can manage men manage the men who can manage only things, and the men who can manage money manage all.",The Lessons of History,Will Durant,[]
"you can’t fool all the people all the time,” but you can fool enough of them to rule a large country.",The Lessons of History,Will Durant,[]
"In progressive societies the concentration[of wealth] may reach a point where the strength of number in the many poor rivals the strength of ability in the few rich; then the unstable equilibrium generates a critical situation, which history has diversely met by legislation redistributing wealth or by revolution distributing poverty.",The Lessons of History,Will Durant,"['capitalism', 'socialism', 'wealth']"
"The present is the past rolled up for action, and the past is the present unrolled for understanding.",The Lessons of History,Ariel Durant,['history']
"The fear of capitalism has compelled socialism to widen freedom, and the fear of socialism has compelled capitalism to increase equality. East is West and West is East, and soon the twain will meet.",The Lessons of History,Will Durant,[]
"In the last 3,421 years of recorded history only 268 have seen no war.",The Lessons of History,Will Durant,[]
"Most history is guessing, and the rest is prejudice.",The Lessons of History,Will Durant,[]
"The only real revolution is in the enlightenment of the mind and the improvement of character, the only real emancipation is individual, and the only real revolutionists are philosophers and saints.",The Lessons of History,Will Durant,[]
"It is not the race that makes the civilization, it is the civilization that makes the people: circumstances geographical, economic, and political create a culture, and the culture creates a human type.",The Lessons of History,Will Durant,[]
"We frolic in our emancipation from theology, but have we developed a natural ethic—a moral code independent of religion—strong enough to keep our instincts of acquisition, pugnacity, and sex from debasing our civilization into a mire of greed, crime, and promiscuity? Have we really outgrown intolerance, or merely transferred it from religious to national, ideological, or racial hostilities?",The Lessons of History,Will Durant,[]
"We must operate with partial knowledge, and be provisionally content with probabilities.",The Lessons of History,Ariel Durant,['life']
"Normally and generally men are judged by their ability to produce—except in war, when they are ranked according to their ability to destroy.",The Lessons of History,Will Durant,[]
"When the universe has crushed him man will still be nobler than that which kills him, because he knows that he is dying, and of its victory the universe knows nothing.",The Lessons of History,Will Durant,[]
One of the lessons of history is that the gods can be silent in many languages.,The Story of Civilization,Will Durant,['philosophy']
"History is, above all else, the creation and recording of that heritage; progress is its increasing abundance, preservation, transmission, and use. To those of us who study history not merely as a warning reminder of man’s follies and crimes, but also as an encouraging remembrance of generative souls, the past ceases to be a depressing chamber of horrors; it becomes a celestial city, a spacious country of the mind, wherein a thousand saints, statesmen, inventors, scientists, poets, artists, musicians, lovers, and philosophers still live and speak, teach and carve and sing. The historian will not mourn because he can see no meaning in human existence except that which man puts into it; let it be our pride that we ourselves may put meaning into our lives, and sometimes a significance that transcends death. If a man is fortunate he will, before he dies, gather up as much as he can of his civilized heritage and transmit it to his children. And to his final breath he will be grateful for this inexhaustible legacy, knowing that it is our nourishing mother and our lasting life.",The Lessons of History,Will Durant,['philosophy']
"Our knowledge of any past event is always incomplete, probably inaccurate, beclouded by ambivalent evidence and biased historians, and perhaps distorted by our own patriotic or religious partisanship. “Most history is guessing, and the rest is prejudice.",The Lessons of History,Will Durant,[]
"The present is the past rolled up for action, and the past is the present unrolled for understanding",The Lessons of History,Will Durant,[]
"If race or class war divides us into hostile camps, changing political argument into blind hate, one side or the other may overturn the hustings with the rule of the sword. If our economy of freedom fails to distribute wealth as ably as it has created it, the road to dictatorship will be open to any man who can persuasively promise security to all; and a martial government, under whatever charming phrases, will engulf the democratic world.",The Lessons of History,Will Durant,[]
Animals eat one another without qualm; civilized men consume one another by due process of law. Co-operation,The Lessons of History,Will Durant,[]
So the conservative who resists change is as valuable as the radical who proposes it—perhaps as much more valuable as roots are more vital than grafts.,The Lessons of History,Will Durant,[]
"Economic development specializes functions, differentiates abilities, and makes men unequally valuable to their group.",The Lessons of History,Will Durant,[]
"Generally religion and puritanism prevail in periods when the laws are feeble and morals must bear the burden of maintaining social order; skepticism and paganism (other factors being equal) progress as the rising power of law and government permits the decline of the church, the family, and morality without basically endangering the stability of the state.",The Lessons of History,Will Durant,[]
"[...] violent revolutions do not so much redistribute wealth as destroy it. There may be a redivision of the land, but the natural inequality of men soon re-creates an inequality of possessions and privileges, and raises to power a new minority with essentially the same instincts as in the old. The only real revolution is in the enlightenment of the mind and the improvement of character, the only real emancipation is individual, and the only real revolutionists are philosophers and saints.",The Lessons of History,Will Durant,[]
"it was fear that first made the gods”25 —fear of hidden forces in the earth, rivers, oceans, trees, winds, and sky. Religion became the propitiatory worship of these forces through offerings, sacrifice, incantation, and prayer.",The Lessons of History,Will Durant,[]
"The historian always oversimplifies, and hastily selects a manageable minority of facts and faces out of a crowd of souls and events whose multitudinous complexity he can never quite embrace or comprehend.",The Lessons of History,Will Durant,[]
"Utopias of equality are biologically doomed, and the best that the amiable philosopher can hope for is an approximate equality of legal justice and educational opportunity. A",The Lessons of History,Will Durant,[]
"The influence of geographic factors diminishes as technology grows. The character and contour of a terrain may offer opportunities for agriculture, mining, or trade, but only the imagination and initiative of leaders, and the hardy industry of followers, can transform the possibilities into fact...Man, not the earth, makes civilization.",The Lessons of History,Ariel Durant,['life']
History in the large is the conflict of minorities; the majority applauds the victor and supplies the human material of social experiment.,The Lessons of History,Will Durant,[]
"So the first biological lesson of history is that life is competition. Competition is not only the life of trade, it is the trade of life—peaceful when food abounds, violent when the mouths outrun the food. Animals eat one another without qualm; civilized men consume one another by due process of law. Co-operation is real, and increases with social development, but mostly because it is a tool and form of competition; we co-operate in our group—our family, community, club, church, party, “race,” or nation—in order to strengthen our group in its competition with other groups. Competing groups have the qualities of competing individuals: acquisitiveness, pugnacity, partisanship, pride. Our states, being ourselves multiplied, are what we are; they write our natures in bolder type, and do our good and evil on an elephantine scale. We are acquisitive, greedy, and pugnacious because our blood remembers millenniums through which our forebears had to chase and fight and kill in order to survive, and had to eat to their gastric capacity for fear they should not soon capture another feast. War is a nation’s way of eating. It promotes co-operation because it is the ultimate form of competition. Until our states become members of a large and effectively protective group they will continue to act like individuals and families in the hunting stage.",The Lessons of History,Will Durant,[]
"centripetal organization unifying a culture in all its phases into a unique, coherent, and artistic form; the other a period of centrifugal disorganization in which creed and culture decompose in division and criticism, and end in a chaos of individualism, skepticism, and artistic aberrations.",The Lessons of History,Will Durant,[]
"We conclude that the concentration of wealth is natural and inevitable, and is periodically alleviated by violent or peaceable partial redistribution. In this view all economic history is the slow heartbeat of the social organism, a vast systole and diastole of concentrating wealth and compulsive recirculation.",The Lessons of History,Will Durant,"['durant', 'economics', 'history']"
The second biological lesson of history is that life is selection. In the competition for food or mates or power some organisms succeed and some fail. In the struggle for existence some individuals are better equipped than others to meet the tests of survival.,The Lessons of History,Will Durant,[]
"The third biological lesson of history is that life must breed. Nature has no use for organisms, variations, or groups that cannot reproduce abundantly.",The Lessons of History,Will Durant,[]
"Nature smiles at the union of freedom and equality in our utopias. For freedom and equality are sworn and everlasting enemies, and when one prevails the other dies.",The Lessons of History,Will Durant,[]
Until our states become members of a large and effectively protective group they will continue to act like individuals and families in the hunting stage.,The Lessons of History,Will Durant,[]
"Inequality is not only natural and inborn, it grows with the complexity of civilization.",The Lessons of History,Will Durant,[]
"Pascal: “When the universe has crushed him man will still be nobler than that which kills him, because he knows that he is dying, and of its victory the universe knows nothing.",The Lessons of History,Will Durant,[]
"The root of the greatest errors in philosophy lies in projecting our human purposes, criteria and preferences into the objective universe.",The Story of Philosophy: The Lives and Opinions of the World's Greatest Philosophers,Will Durant,"['good-and-evil', 'philosophy', 'projection', 'spinoza']"
"Ideally parentage should be a privilege of health, not a by-product of sexual agitation. Is",The Lessons of History,Will Durant,[]
"Society is founded not on the ideals but on the nature of man,",The Lessons of History,Will Durant,[]
"New situations, however, do arise, requiring novel, unstereotyped responses; hence development, in the higher organisms, requires a capacity for experiment and innovation—the social correlates of variation and mutation. Social evolution is an interplay of custom with origination. Here the initiative individual—the “great man,” the “hero,” the “genius”—regains his place as a formative force in history. He is not quite the god that Carlyle described; he grows out of his time and land, and is the product and symbol of events as well as their agent and voice; without some situation requiring a new response his new ideas would be untimely and impracticable",The Lessons of History,Will Durant,[]
"So the conservative who resists change is as valuable as the radical who proposes it—perhaps as much more valuable as roots are more vital than grafts. It is good that new ideas should be heard, for the sake of the few that can be used; but it is also good that new ideas should be compelled to go through the mill of objection, opposition, and contumely; this is the trial heat which innovations must survive before being allowed to enter the human race.",The Lessons of History,Will Durant,[]
Man’s sins may be the relics of his rise rather than the stigmata of his fall.,The Lessons of History,Will Durant,[]
"In progressive societies the concentration may reach a point where the strength of number in the many poor rivals the strength of ability in the few rich; then the unstable equilibrium generates a critical situation, which history has diversely met by legislation redistributing wealth or by revolution distributing poverty.",The Lessons of History,Will Durant,[]
"This is the secret of the political history of modern India. Weakened by division, it succumbed to invaders; impoverished by invaders, it lost all power of resistance, and took refuge in supernatural consolations; it argued that both mastery and slavery were superficial delusions, and concluded that freedom of the body or the nation was hardly worth defending in so brief a life. The bitter lesson that may be drawn from this tragedy is that eternal vigilance is the price of civilization. A nation must love peace, but keep its powder dry.",Our Oriental Heritage,Will Durant,[]
"All deductions having been made, democracy has done less harm, and more good, than any other form of government. It gave to human existence a zest and camaraderie that outweighed its pitfalls and defects. It gave to thought and science and enterprise the freedom essential to their operation and growth. It broke down the walls of privilege and class, and in each generation it raised up ability from every rank and place. Under its stimulus Athens and Rome became the most creative cities in history, and America in two centuries has provided abundance for an unprecedentedly large proportion of its population. Democracy has now dedicated itself resolutely to the spread and lengthening of education, and to the maintenance of public health. If equality of educational opportunity can be established, democracy will be real and justified. For this is the vital truth beneath its catchwords: that though men cannot be equal, their access to education and opportunity can be made more nearly equal. The rights of man are not rights to office and power, but the rights of entry into every avenue that may nourish and test a man’s fitness for office and power. A right is not a gift of God or nature but a privilege which it is good for the group that the individual should have.",The Lessons of History,Will Durant,[]
"A knowledge of history may teach us that civilization is a co-operative product, that nearly all peoples have contributed to it; it is our common heritage and debt; and the civilized soul will reveal itself in treating every man or woman, however lowly, as a representative of one of these creative and contributory groups.",The Lessons of History,Will Durant,[]
So the conservative who resists change is as valuable as the radical who proposes it -perhaps as much more valuable as roots are more vital than grafts.,The Lessons of History,Will Durant,[]
"Democracy is the most difficult of all forms of government, since it requires the widest spread of intelligence, and we forgot to make ourselves intelligent when we made ourselves sovereign.",The Lessons of History,Ariel Durant,"['decadence', 'democracy', 'government', 'intelligence']"
"gave Wang a copy of Joseph Campbell’s great book The Hero with a Thousand Faces, because he is a classic hero and I thought it might help him. I also gave him The Lessons of History, a 104-page distillation of the major forces through history by Will and Ariel Durant, and River Out of Eden by the insightful Richard Dawkins, which explains how evolution works. He gave me Georgi Plekhanov’s classic On the Role of the Individual in History.",Principles: Life and Work,Ray Dalio,[]
"done. Every time I go to China, we meet for sixty to ninety minutes. We talk about what’s happening in the world, and how that relates to thousands of years of history and the never-changing nature of mankind. We discuss a wide range of other topics as well, ranging from physics to artificial intelligence. We are both keenly interested in how most everything happens over and over again, the forces behind those patterns, and the principles that work and don’t work in dealing with them. I gave Wang a copy of Joseph Campbell’s great book The Hero with a Thousand Faces, because he is a classic hero and I thought it might help him. I also gave him The Lessons of History, a 104-page distillation of the major forces through history by Will and Ariel Durant, and River Out of Eden by the insightful Richard Dawkins, which explains how evolution works. He gave me Georgi Plekhanov’s classic On the Role of the Individual in History. All these books showed how the same things happened over and",Principles: Life and Work,Ray Dalio,[]
"and I thought it might help him. I also gave him The Lessons of History, a 104-page distillation of the major forces through history by Will and Ariel Durant, and River Out of Eden by the insightful Richard Dawkins, which explains how evolution works. He gave me Georgi Plekhanov’s classic On the Role of the Individual in History. All these books showed how the same things happened over and over again throughout history.",Principles: Life and Work,Ray Dalio,[]
"Utopias of equality are biologically doomed, and the best that the amiable philosopher can hope for is an approximate equality of legal justice and educational opportunity. A society",The Lessons of History,Will Durant,[]
History is so indifferently rich that a case for almost any conclusion from it can be made by a selection of instances.,The Lessons of History,Will Durant,[]
"The Lessons of History, a 104-page distillation of the major forces through history by Will and Ariel Durant,",Principles: Life and Work,Ray Dalio,[]
"So the conservative who resists change is as valuable as the radical who proposes it—perhaps as much more valuable as roots are more vital than grafts. It is good that new ideas should be heard, for the sake of the few that can be used; but it is also good that new ideas should be compelled to go through the mill of objection, opposition, and contumely; this is the trial heat which innovations must survive before being allowed to enter the human race. It is good that the old should resist the young, and that the young should prod the old; out of this tension, as out of the strife of the sexes and the classes, comes a creative tensile strength, a stimulated development, a secret and basic unity and movement of the whole.",The Lessons of History,Will Durant,[]
"I gave Wang a copy of Joseph Campbell’s great book The Hero with a Thousand Faces, because he is a classic hero and I thought it might help him. I also gave him The Lessons of History, a 104-page distillation of the major forces through history by Will and Ariel Durant, and River Out of Eden by the insightful Richard Dawkins, which explains how evolution works. He gave me Georgi Plekhanov’s classic On the Role of the Individual in History. All these books showed how the same things happened over and over again throughout history.",Principles: Life and Work,Ray Dalio,[]
"We have defined civilization as “social order promoting cultural creation.”67 It is political order secured through custom, morals, and law, and economic order secured through a continuity of production and exchange; it is cultural creation through freedom and facilities for the origination, expression, testing, and fruition of ideas, letters, manners, and arts. It is an intricate and precarious web of human relationships, laboriously built and readily destroyed.",The Lessons of History,Will Durant,[]
"For freedom and equality are sworn and everlasting enemies, and when one prevails the other dies. Leave men free, and their natural inequalities will multiply almost geometrically, as in England and America in the nineteenth century under laissez-faire. To check the growth of inequality, liberty must be sacrificed, as in Russia after 1917. Even when repressed, inequality grows; only the man who is below the average in economic ability desires equality; those who are conscious of superior ability desire freedom; and in the end superior ability has its way.",The Lessons of History,Will Durant,[]
"Plato’s reduction of political evolution to a sequence of monarchy, aristocracy, democracy, and dictatorship found another illustration in the history of Rome.",The Lessons of History,Will Durant,[]
Nothing is clearer in history than the adoption by successful rebels of the methods they were accustomed to condemn in the forces they deposed.,The Lessons of History,Will Durant,[]
"Evolution in man during recorded time has been social rather than biological: it has proceeded not by heritable variations in the species, but mostly by economic, political, intellectual, and moral innovation transmitted to individuals and generations by imitation, custom, or education.",The Lessons of History,Will Durant,[]
"In England and the United States, in Denmark, Norway, and Sweden, in Switzerland and Canada, democracy is today sounder than ever before. It has defended itself with courage and energy against the assaults of foreign dictatorship, and has not yielded to dictatorship at home. But if war continues to absorb and dominate it, or if the itch to rule the world requires a large military establishment and appropriation, the freedoms of democracy may one by one succumb to the discipline of arms and strife. If race or class war divides us into hostile camps, changing political argument into blind hate, one side or the other may overturn the hustings with the rule of the sword. If our economy of freedom fails to distribute wealth as ably as it has created it, the road to dictatorship will be open to any man who can persuasively promise security to all; and a martial government, under whatever charming phrases, will engulf the democratic world.",The Lessons of History,Will Durant,[]
men and women have gambled in every age. In every age men have been dishonest and governments have been corrupt;,The Lessons of History,Will Durant,[]
"Morals are the rules by which a society exhorts (as laws are the rules by which it seeks to compel) its members and associations to behavior consistent with its order,",The Lessons of History,Will Durant,[]
"The idea of hell disappeared from educated thought, even from pulpit homilies. Presbyterians became ashamed of the Westminster Confession, which had pledged them to belief in a God who had created billions of men and women despite his foreknowledge that, regardless of their virtues and crimes, they were predestined to everlasting hell.",The Lessons of History,Will Durant,[]
"The rate of concentration varies (other factors being equal) with the economic freedom permitted by morals and the laws. Despotism may for a time retard the concentration; democracy, allowing the most liberty,",The Lessons of History,Will Durant,[]
So the first biological lesson of history is that life is competition.,The Lessons of History,Will Durant,[]
"The father gets accustomed to descend to the level of his sons and to fear them, and the son to be on a level with his father, having no shame or fear of his parents…. The teacher fears and flatters his scholars, and the scholars despise their masters and tutors…. The old do not like to be thought morose and authoritative, and therefore they imitate the young….",The Lessons of History,Will Durant,[]
Social evolution is an interplay of custom with origination.,The Lessons of History,Will Durant,[]
"Inequality is not only natural and inborn, it grows with the complexity of civilization. Hereditary inequalities breed social and artificial inequalities; every invention or discovery is made or seized by the exceptional individual, and makes the strong stronger, the weak relatively weaker, than before. Economic development specializes functions, differentiates abilities, and makes men unequally valuable to their group.",The Lessons of History,Will Durant,[]
"Nature smiles at the union of freedom and equality in our utopias. For freedom and equality are sworn and everlasting enemies, and when one prevails the other dies. Leave men free, and their natural inequalities will multiply almost geometrically, as in England and America in the nineteenth century under laissez-faire. To check the growth of inequality, liberty must be sacrificed, as in Russia after 1917. Even when repressed, inequality grows; only the man who is below the average in economic ability desires equality; those who are conscious of superior ability desire freedom; and in the end superior ability has its way.",The Lessons of History,Will Durant,[]
"If the human brood is too numerous for the food supply, Nature has three agents for restoring the balance: famine, pestilence, and war.",The Lessons of History,Will Durant,[]
