quoteText,bookTitle,bookAuthor,tags
"Monitoring the results of delegation resembles the monitoring used in quality assurance. We should apply quality assurance principles and monitor at the lowest-added-value stage of the process. For example, review rough drafts of reports that you have delegated; don’t wait until your subordinates have spent time polishing them into final form before you find out that you have a basic problem with the contents.",High Output Management,Andrew S. Grove,[]
"To use your calendar as a production-planning tool, you must accept responsibility for two things: 1.  You should move toward the active use of your calendar, taking the initiative to fill the holes between the time-critical events with non-time-critical though necessary activities. 2.  You should say “no” at the outset to work beyond your capacity to handle.",High Output Management,Andrew S. Grove,[]
"To use your calendar as a production-planning tool, you must accept responsibility for two things: 1.  You should move toward the active use of your calendar, taking the initiative to fill the holes between the time-critical events with non-time-critical though necessary activities. 2.  You should say “no” at the outset to work beyond your capacity to handle. It is important to say “no” earlier rather than later because we’ve learned that to wait until something reaches a higher value stage and then abort due to lack of capacity means losing more money and time.",High Output Management,Andrew S. Grove,[]
What is important is the thinking you force yourself to go through to understand the relationship between the various aspects of your production process.,High Output Management,Andrew S. Grove,[]
"As a rule of thumb, a manager whose work is largely supervisory should have six to eight subordinates; three or four are too few and ten are too many. This range comes from a guideline that a manager should allocate about a half day per week to each of his subordinates.",High Output Management,Andrew S. Grove,[]
"because of the ease with which Japanese office workers communicate, they have, in fact, been slow to embrace electronic mail.",High Output Management,Andrew S. Grove,[]
"To digress a bit, I also think that one-on-ones at home can help family life. As the father of two teenage daughters, I have found that the conversation in such a time together is very different in tone and kind from what we say to each other in other circumstances. The one-on-one makes each of us take the other seriously and allows subtle and complicated matters to come up for discussion. Obviously, no notes are taken, as father and daughter usually go out for dinner at a restaurant, but a family one-on-one very much resembles a business one-on-one. I strongly recommend both practices.",High Output Management,Andrew S. Grove,[]
"Thus, a very important way to increase productivity is to arrange the work flow inside our black box so that it will be characterized by high output per activity, which is to say high-leverage activities.",High Output Management,Andrew S. Grove,[]
"The “delegator” and “delegatee” must share a common information base and a common set of operational ideas or notions on how to go about solving problems, a",High Output Management,Andrew S. Grove,[]
"But be sure to know exactly what you’re doing, and avoid the charade of insincere delegation, which can produce immense negative managerial leverage.",High Output Management,Andrew S. Grove,[]
"Accordingly, managerial output can be linked to managerial activity by the equation: Managerial Output = Output of organization   = L1 × A1 + L2 × A2 +… This equation says that for every activity a manager performs—A1, A2, and so on—the output of the organization should increase by some degree. The extent to which that output is thereby increased is determined by the leverage of that activity—L1, L2, and so on. A manager’s output is thus the sum of the result of individual activities having varying degrees of leverage. Clearly the key to high output means being sensitive to the leverage of what you do during the day. Managerial productivity—that is, the output of a manager per unit of time worked—can be increased in three ways: 1.  Increasing the rate with which a manager performs his activities, speeding up his work. 2.  Increasing the leverage associated with the various managerial activities. 3.  Shifting the mix of a manager’s activities from those with lower to those with higher leverage. Let us consider first the leverage of various types of managerial work. HIGH-LEVERAGE ACTIVITIES These can be achieved in three basic ways: •  When many people are affected by one manager. •  When a person’s activity or behavior over a long period of time is affected by a manager’s brief, well-focused set of words or actions. •  When a large group’s work is affected by an individual supplying a unique, key piece of",High Output Management,Andrew S. Grove,[]
"This is called work simplification. To get leverage this way, you first need to create a flow chart of the production process as it exists. Every single step must be shown on it; no step should be omitted in order to pretty things up on paper. Second, count the number of steps in the flow chart so that you know how many you started with. Third, set a rough target for reduction of the number of steps. In the first round of work simplification, our experience shows that you can reasonably expect a 30 to 50 percent reduction.",High Output Management,Andrew S. Grove,[]
"What is the role of the supervisor in the staff meeting—a leader, observer, expediter, questioner, decision-maker? The answer, of course, is all of them. Please",High Output Management,Andrew S. Grove,[]
"The absolute truth is that if you don’t know what you want, you won’t get it. So",High Output Management,Andrew S. Grove,[]
"Once responsibility has been assumed, however, finding the solution is relatively easy. This is because the move from blaming others to assuming responsibility constitutes an emotional step, while the move from assuming responsibility to finding the solution is an intellectual one, and the latter is easier.",High Output Management,Andrew S. Grove,[]
"What is the role of the supervisor in the staff meeting—a leader, observer, expediter, questioner, decision-maker? The answer, of course, is all of them. Please note that lecturer is not listed. A",High Output Management,Andrew S. Grove,[]
"What is the role of the supervisor in a one-on-one? He should facilitate the subordinate’s expression of what’s going on and what’s bothering him. The supervisor is there to learn and to coach. Peter Drucker sums up the supervisor’s job here very nicely: “The good time users among managers do not talk to their subordinates about their problems but they know how to make the subordinates talk about theirs.” How is this done? By applying Grove’s Principle of Didactic Management, “Ask one more question!",High Output Management,Andrew S. Grove,[]
A team will perform well only if peak performance is elicited from the individuals in it. This,High Output Management,Andrew S. Grove,[]
"Do any exceptions exist to the universality of hybrid organizations? The only exceptions that come to my mind are conglomerates, which are typically organized in a totally mission-oriented form. Why are they an exception to our rule? Because they do not have a common business purpose.",High Output Management,Andrew S. Grove,[]
"Your information sources should complement one another, and also be redundant because that gives you a way to verify what you’ve learned.",High Output Management,Andrew S. Grove,[]
"information-gathering is the basis of all other managerial work, which is why I choose to spend so much of my day doing it.",High Output Management,Andrew S. Grove,[]
"You often do things at the office designed to influence events slightly, maybe making a phone call to an associate suggesting that a decision be made in a certain way, or sending a note or a memo that shows how you see a particular situation, or making a comment during an oral presentation. In such instances you may be advocating a preferred course of action, but you are not issuing an instruction or a command. Yet you’re doing something stronger than merely conveying information. Let’s call it “nudging” because through it you nudge an individual or a meeting in the direction you would like. This is an immensely important managerial activity in which we engage all the time, and it should be carefully distinguished from decision-making that results in firm, clear directives. In reality, for every unambiguous decision we make, we probably nudge things a dozen times.",High Output Management,Andrew S. Grove,[]
"Before you are horrified by how much time I spend in meetings, answer a question: which of the activities—information-gathering, information-giving, decision-making, nudging, and being a role model—could I have performed outside a meeting? The answer is practically none. Meetings provide an occasion for managerial activities. Getting together with others is not, of course, an activity—it is a medium.",High Output Management,Andrew S. Grove,[]
"Managerial productivity—that is, the output of a manager per unit of time worked—can be increased in three ways: 1.  Increasing the rate with which a manager performs his activities, speeding up his work. 2.  Increasing the leverage associated with the various managerial activities. 3.  Shifting the mix of a manager’s activities from those with lower to those with higher leverage.",High Output Management,Andrew S. Grove,[]
"Most people use their calendars as a repository of “orders” that come in. Someone throws an order to a manager for his time, and it automatically shows up on his calendar. This is mindless passivity. To gain better control of his time, the manager should use his calendar as a “production” planning tool, taking a firm initiative to schedule work that is not time-critical between those “limiting steps” in the day.",High Output Management,Andrew S. Grove,[]
"we should try to make our managerial work take on the characteristics of a factory, not a job shop. Accordingly, we should do everything we can to prevent little stops and starts in our day as well as interruptions brought on by big emergencies.",High Output Management,Andrew S. Grove,[]
"But because you must coordinate your work with that of other managers, you can only move toward regularity if others do too. In other words, the same blocks of time must be used for like activities. For example, at Intel Monday mornings have been set aside throughout the corporation as the time when planning groups meet.",High Output Management,Andrew S. Grove,[]
"Manufacturers turn out standard products. By analogy, if you can pin down what kind of interruptions you’re getting, you can prepare standard responses for those that pop up most often.",High Output Management,Andrew S. Grove,[]
"Also, if you use the production principle of batching—that is, handling a group of similar chores at one time—many interruptions that come from your subordinates can be accumulated and handled not randomly, but at staff and at one-on-one meetings, the subject of the next chapter. If such meetings are held regularly, people can’t protest too much if they’re asked to batch questions and problems for scheduled times, instead of interrupting you whenever they want.",High Output Management,Andrew S. Grove,[]
"The key is this: understand that interrupters have legitimate problems that need to be handled. That’s why they’re bringing them to you. But you can channel the time needed to deal with them into organized, scheduled form by providing an alternative to interruption—a scheduled meeting or an office hour. The point is to impose a pattern on the way a manager copes with problems. To make something regular that was once irregular is a fundamental production principle, and that’s how you should try to handle the interruptions that plague you.",High Output Management,Andrew S. Grove,[]
"A key point about a one-on-one: It should be regarded as the subordinate’s meeting, with its agenda and tone set by him. There’s good reason for this. Somebody needs to prepare for the meeting. The supervisor with eight subordinates would have to prepare eight times; the subordinate only once. So the latter should be asked to prepare an outline, which is very important because it forces him to think through in advance all of the issues and points he plans to raise. Moreover, with an outline, the supervisor knows at the outset what is to be covered and can therefore help to set the pace of the meeting according to the “meatiness” of the items on the agenda.",High Output Management,Andrew S. Grove,[]
What is the role of the supervisor in a one-on-one? He should facilitate the subordinate’s expression of what’s going on and what’s bothering him. The supervisor is there to learn and to coach.,High Output Management,Andrew S. Grove,[]
"Because it is easier to monitor something with which you are familiar, if you have a choice you should delegate those activities you know best. But recall the pencil experiment and understand before the fact that this will very likely go against your emotional grain.",High Output Management,Andrew S. Grove,[]
"How is this done? By applying Grove’s Principle of Didactic Management, “Ask one more question!” When the supervisor thinks the subordinate has said all he wants to about a subject, he should ask another question.",High Output Management,Andrew S. Grove,[]
"My day always ends when I’m tired and ready to go home, not when I’m done. I am never done. Like a housewife’s, a manager’s work is never done.",High Output Management,Andrew S. Grove,[]
"Having so much of Intel organized in functional units also has its disadvantages. The most important is the information overload hitting a functional group when it must respond to the demands made on it by diverse and numerous business units. Even conveying needs and demands often becomes very difficult—a business unit has to go through a number of management layers to influence decision-making in a functional group. Nowhere is this more evident than in the negotiations that go on to secure a portion of centralized—and limited—resources of the corporation, be it production capacity, computer time, or space in a shared building. Indeed, things often move beyond negotiation to intense and open competition among business units for the resources controlled by the functional groups. The bottom line here is that both the negotiation and competition waste time and energy because neither contributes to the output or the general good of the company.",High Output Management,Andrew S. Grove,[]
"What are some of the advantages of organizing much of a company in a mission-oriented form? There is only one. It is that the individual units can stay in touch with the needs of their business or product areas and initiate changes rapidly when those needs change. That is it. All other considerations favor the functional-type of organization. But the business of any business is to respond to the demands and needs of its environment, and the need to be responsive is so important that it always leads to much of any organization being grouped in mission-oriented units.",High Output Management,Andrew S. Grove,[]
Here I would like to propose Grove’s Law: All large organizations with a common business purpose end up in a hybrid organizational form.,High Output Management,Andrew S. Grove,[]
"To put a man on the moon, NASA asked several major contractors and many subcontractors to work together, each on a different aspect of the project. An unintended consequence of the moon shot was the development of a new organizational approach: matrix management.",High Output Management,Andrew S. Grove,[]
"the system is needed to make hybrid organizations work, and while people will strive to find something simpler, the reality is that it doesn’t exist. A strictly functional organization, which is clear conceptually, tends to remove engineering and manufacturing (or the equivalent groups in your firm) from the marketplace, leaving them with no idea of what the customers want. A highly mission-oriented organization, in turn, may have definite crisp reporting relationships and clear and unambiguous objectives at all times. However, the fragmented state of affairs that results causes inefficiency and poor overall performance.",High Output Management,Andrew S. Grove,[]
"For Maslow, motivation is closely tied to the idea of needs, which cause people to have drives, which in turn result in motivation. A need once satisfied stops being a need and therefore stops being a source of motivation. Simply put, if we are to create and maintain a high degree of motivation, we must keep some needs unsatisfied at all times.",High Output Management,Andrew S. Grove,[]
"we must first overcome cultural prejudice. Our society respects someone’s throwing himself into sports, but anybody who works very long hours is regarded as sick, a workaholic. So the prejudices of the majority say that sports are good and fun, but work is drudgery, a necessary evil, and in no way a source of pleasure.",High Output Management,Andrew S. Grove,[]
"The role of the manager here is also clear: it is that of the coach. First, an ideal coach takes no personal credit for the success of his team, and because of that his players trust him. Second, he is tough on his team. By being critical, he tries to get the best performance his team members can provide. Third, a good coach was likely a good player himself at one time. And having played the game well, he also understands it well.",High Output Management,Andrew S. Grove,[]
"commonality of operational values, priorities, and preferences—how an organization works together—is a must if the progression in managerial style is to occur. Without that commonality, an organization can become easily confused and lose its sense of purpose. Accordingly, the responsibility for transmitting common values rests squarely with the supervisor. He is, after all, accountable for the output of the people who report to him; then, too, without a shared set of values a supervisor cannot effectively delegate.",High Output Management,Andrew S. Grove,[]
"Much confusion exists between what is strategy and what is tactics. Although the distinction is rarely of practical significance, here’s one that might be useful. As you formulate in words what you plan to do, the most abstract and general summary of those actions meaningful to you is your strategy. What you’ll do to implement the strategy is your tactics. Frequently, a strategy at one managerial level is the tactical concern of the next higher level.",High Output Management,Andrew S. Grove,[]
"giving performance reviews is a very complicated and difficult business and that we, managers, don’t do an especially good job at it. The fact is that giving such reviews is the single most important form of task-relevant feedback we as supervisors can provide. It is how we assess our subordinates’ level of performance and how we deliver that assessment to them individually. It is also how we allocate the rewards—promotions, dollars, stock options, or whatever we may use. As we saw earlier, the review will influence a subordinate’s performance—positively or negatively—for a long time, which makes the appraisal one of the manager’s highest-leverage activities.",High Output Management,Andrew S. Grove,[]
"The review is usually dedicated to two things: first, the skill level of the subordinate, to determine what skills are missing and to find ways to remedy that lack; and second, to intensify the subordinate’s motivation in order to get him on a higher performance curve for the same skill level (see the illustration on this page).",High Output Management,Andrew S. Grove,[]
"The long and short of it: if performance matters in your operation, performance reviews are absolutely necessary.",High Output Management,Andrew S. Grove,[]
"The biggest problem with most reviews is that we don’t usually define what it is we want from our subordinates, and, as noted earlier, if we don’t know what we want, we are surely not going to get it.",High Output Management,Andrew S. Grove,[]
"as you review a manager, should you be judging his performance or the performance of the group under his supervision? You should be doing both. Ultimately what you are after is the performance of the group, but the manager is there to add value in some way.",High Output Management,Andrew S. Grove,[]
"remember that as you plan you must answer the question: What do I have to do today to solve—or better, avoid—tomorrow’s problem? Thus, the true output of the planning process is the set of tasks it causes to be implemented. The output of Intel’s annual plan, for instance, is the actions taken and changes prompted as a result of the thinking process that took place throughout the organization. I, for one, hardly ever look at the bound volume finally called the Annual Plan. In other words, the output of the planning process is the decisions made and the actions taken as a result of the process.",High Output Management,Andrew S. Grove,[]
"Finally, remember that by saying “yes”—to projects, a course of action, or whatever—you are implicitly saying “no” to something else. Each time you make a commitment, you forfeit your chance to commit to something else.",High Output Management,Andrew S. Grove,[]
"One big pitfall to be avoided is the “potential trap.” At all times you should force yourself to assess performance, not potential. By “potential” I mean form rather than substance.",High Output Management,Andrew S. Grove,[]
"the performance rating of a manager cannot be higher than the one we would accord to his organization! It is very important to assess actual performance, not appearances; real output, not good form.",High Output Management,Andrew S. Grove,[]
"By elevating someone, we are, in effect, creating role models for others in our organization.",High Output Management,Andrew S. Grove,[]
management by objectives—MBO,High Output Management,Andrew S. Grove,[]
"A successful MBO system needs only to answer two questions: 1.  Where do I want to go? (The answer provides the objective.) 2.  How will I pace myself to see if I am getting there? (The answer gives us milestones, or key results.)",High Output Management,Andrew S. Grove,[]
"all a manager can do is create an environment in which motivated people can flourish. Because better motivation means better performance, not a change of attitude or feeling, a subordinate’s saying “I feel motivated” means nothing. What matters is if he performs better or worse because his environment changed. An attitude may constitute an indicator, a “window into the black box” of human motivation, but it is not the desired result or output. Better performance at a given skill level is.",High Output Management,Andrew S. Grove,[]
the most important consideration should be this: the shift back and forth between the two types of organizations can and should be initiated to match the operational styles and aptitudes of the managers running the individual units.,High Output Management,Andrew S. Grove,[]
"Your general planning process should consist of analogous thinking. Step 1 is to establish projected need or demand: What will the environment demand from you, your business, or your organization? Step 2 is to establish your present status: What are you producing now? What will you be producing as your projects in the pipeline are completed? Put another way, where will your business be if you do nothing different from what you are now doing? Step 3 is to compare and reconcile steps 1 and 2. Namely, what more (or less) do you need to do to produce what your environment will demand?",High Output Management,Andrew S. Grove,[]
"Under the ferocious attack of aggressively priced, high-quality Japanese DRAMs, we were forced to retreat and cut prices to a level where being in the DRAM business brought us major losses. Ultimately, the losses forced us to do something extraordinarily difficult: to back out of the business that the company was founded upon, and to focus on another business that we thought we were best at—the microprocessor business. While this adjustment sounds quite logical and straightforward in theory, in reality its implementation required us to move and redeploy a lot of our employees, let some of them go, and shutter a number of factories. We did all this because under this strong attack, we learned that we must lead with our strength. Being second best in a tough environment is just not good enough.",High Output Management,Andrew S. Grove,[]
a strong and positive corporate culture is absolutely essential if dual reporting and decision-making by peers are to work.,High Output Management,Andrew S. Grove,[]
"As we founded, organized, and managed Intel, we found that all our employees “produce” in some sense—some make chips, others prepare bills, while still others create software designs or advertising copy. We also found that when we approached any work done at Intel with this basic understanding in mind, the principles and discipline of production gave us a systematic way of managing it, much as the language and concepts of finance created a common approach to evaluating and managing investments of any sort.",High Output Management,Andrew S. Grove,[]
"The second idea is that the work of a business, of a government bureacracy, of most forms of human activity, is something pursued not by individuals but by teams.",High Output Management,Andrew S. Grove,[]
