quoteText,bookTitle,bookAuthor,tags
"What should be covered in a one-on-one? We can start with performance figures, indicators used by the subordinate, such as incoming order rates, production output, or project status. Emphasis should be on indicators that signal trouble. The meeting should also cover anything important that has happened since the last meeting: current hiring problems, people problems in general, organizational problems and future plans, and—very, very important—potential problems. Even when a problem isn’t tangible, even if it’s only an intuition that something’s wrong, a subordinate owes it to his supervisor to tell him, because it triggers a look into the organizational black box. The most important criterion governing matters to be talked about is that they be issues that preoccupy and nag the subordinate. These are often obscure and take time to surface, consider, and resolve.",High Output Management,Andrew S. Grove,[]
"As a supervisor, you have to be very sensitive toward the various money needs of your subordinates and show empathy toward them. You must be especially careful not to project your own circumstances onto others.",High Output Management,Andrew S. Grove,[]
"If you avoid the presenter’s eyes, yawn, or read the newspaper it’s worse than not being there at all. Lack of interest undermines the confidence of the presenter. Remember that you are spending a big part of your working day at the review. Make that time as valuable for yourself and your organization as you can. Pay attention and jot down things you’ve heard that you might try. Ask questions if something is not clear to you and speak up if you can’t go along with an approach being recommended. And if a presenter makes a factual error, it is your responsibility to go on record. Remember, you are being paid to attend the meeting, which is not meant to be a siesta in the midst of an otherwise busy day. Regard attendance at the meeting for what it is: work. Mission-Oriented",High Output Management,Andrew S. Grove,[]
"Now, I’m sure that at various times you will take exception to what you read in this book. “This may be fine at Intel,” you will say, “but it would never fly at PDQ, where I work. Nothing does until the Old Man himself decrees it. Short of a palace revolution, I can’t use anything you recommend.” Let me assure you that you will be able to use most of what I say. As a middle manager, of any sort, you are in effect a chief executive of an organization yourself. Don’t wait for the principles and practices you find appealing to be imposed from the top. As a micro CEO, you can improve your own and your group’s performance and productivity, whether or not the rest of the company follows suit.",High Output Management,Andrew S. Grove,[]
"This may sound like too much regimentation for you, but whether it’s that or needed discipline depends on your point of view. If the chairman forces you to show up at a meeting prepared and on time, you might consider him a drill sergeant. But if you show up on time, ready to work, and someone else doesn’t and isn’t, you’ll probably begrudge the person responsible for wasting your time. It must be much the same in an operating room. Some people working there may not like a surgeon insisting upon precision, but I am one patient who would much prefer a disciplined operating room to any other kind. Once",High Output Management,Andrew S. Grove,[]
