quoteText,bookTitle,bookAuthor,tags
"Remember too that your time is your one finite resource, and when you say “yes” to one thing you are inevitably saying “no” to another.",High Output Management,Andrew S. Grove,[]
"The absolute truth is that if you don’t know what you want, you won’t get it.",High Output Management,Andrew S. Grove,[]
"But in the end self-confidence mostly comes from a gut-level realization that nobody has ever died from making a wrong business decision, or taking inappropriate action, or being overruled. And everyone in your operation should be made to understand this.",High Output Management,Andrew S. Grove,[]
"Here I’d like to introduce the concept of leverage, which is the output generated by a specific type of work activity. An activity with high leverage will generate a high level of output; an activity with low leverage, a low level of output.",High Output Management,Andrew S. Grove,[]
"Remember that by saying “yes”—to projects, a course of action, or whatever—you are implicitly saying “no” to something else.",High Output Management,Andrew S. Grove,[]
"We must recognize that no amount of formal planning can anticipate changes such as globalization and the information revolution we’ve referred to above. Does that mean that you shouldn’t plan? Not at all. You need to plan the way a fire department plans. It cannot anticipate where the next fire will be, so it has to shape an energetic and efficient team that is capable of responding to the unanticipated as well as to any ordinary event.",High Output Management,Andrew S. Grove,[]
"Just as you would not permit a fellow employee to steal a piece of office equipment worth $2,000, you shouldn’t let anyone walk away with the time of his fellow managers.",High Output Management,Andrew S. Grove,[]
"My day always ends when I’m tired and ready to go home, not when I’m done. I am never done.",High Output Management,Andrew S. Grove,[]
"Let chaos reign, then rein in chaos.",High Output Management,Andrew S. Grove,[]
"[..] in the work of the soft professions, it becomes very difficult to distinguish between output and activity. And as noted, stressing output is the key to improving productivity, while looking to increase activity can result in just the opposite.",High Output Management,Andrew S. Grove,[]
"To get acceptable quality at the lowest cost, it is vitally important to reject defective material at a stage where its accumulated value is at the lowest possible level. Thus, as noted, we are better off catching a bad raw egg than a cooked one, and screening out our college applicant before he visits Intel. In short, reject before investing further value.",High Output Management,Andrew S. Grove,[]
Reports are more a medium of self-discipline than a way to communicate information. Writing the report is important; reading it often is not.,High Output Management,Andrew S. Grove,[]
"The old saying has it that when we promote our best salesman and make him a manager, we ruin a good salesman and get a bad manager. But if we think about it, we see we have no choice but to promote the good salesman. Should our worst salesman get the job? When we promote our best, we are saying to our subordinates that performance is what counts.",High Output Management,Andrew S. Grove,[]
"At Intel, we put ourselves through an annual strategic long-range planning effort in which we examine our future five years off. But what is really being influenced here? It is the next year—and only the next year.",High Output Management,Andrew S. Grove,[]
we confused the manager’s general competence and maturity with his task-relevant maturity.,High Output Management,Andrew S. Grove,[]
"When a person is not doing his job, there can only be two reasons for it. The person either can’t do it or won’t do it; he is either not capable or not motivated. To determine which, we can employ a simple mental test: if the person’s life depended on doing the work, could he do it? If the answer is yes, that person is not motivated; if the answer is no, he is not capable.",High Output Management,Andrew S. Grove,[]
"Are you trying new ideas, new techniques, and new technologies, and I mean personally trying them, not just reading about them? Or are you waiting for others to figure out how they can re-engineer your workplace—and you out of that workplace?",High Output Management,Andrew S. Grove,[]
The output of a manager is the output of the organizational units under his or her supervision or influence.,High Output Management,Andrew S. Grove,[]
"The single most important task of a manager is to elicit peak performance from his subordinates. So if two things limit high output, a manager has two ways to tackle the issue: through training and motivation.",High Output Management,Andrew S. Grove,[]
"Once someone’s source of motivation is self-actualization, his drive to perform has no limit. Thus, its most important characteristic is that unlike other sources of motivation, which extinguish themselves after the needs are fulfilled, self-actualization continues to motivate people to ever higher levels of performance.",High Output Management,Andrew S. Grove,[]
"you have to accept that no matter where you work, you are not an employee—you are in a business with one employee: yourself. You are in competition with millions of similar businesses. There are millions of others all over the world, picking up the pace, capable of doing the same work that you can do and perhaps more eager to do it. Now, you may be tempted to look around your workplace and point to your fellow workers as rivals, but they are not. They are outnumbered—a thousand to one, one hundred thousand to one, a million to one—by people who work for organizations that compete with your firm. So if you want to work and continue to work, you must continually dedicate yourself to retaining your individual competitive advantage.",High Output Management,Andrew S. Grove,[]
The key to survival is to learn to add more value—and,High Output Management,Andrew S. Grove,[]
"Eliciting peak performance means going up against something or somebody. Let me give you a simple example. For years the performance of the Intel facilities maintenance group, which is responsible for keeping our buildings clean and neat, was mediocre, and no amount of pressure or inducement seemed to do any good. We then initiated a program in which each building’s upkeep was periodically scored by a resident senior manager, dubbed a “building czar.” The score was then compared with those given the other buildings. The condition of all of them dramatically improved almost immediately. Nothing else was done; people did not get more money or other rewards. What they did get was a racetrack, an arena of competition. If your work is facilities maintenance, having your building receive the top score is a powerful source of motivation. This is key to the manager’s approach and involvement: he has to see the work as it is seen by the people who do that work every day and then create indicators so that his subordinates can watch their “racetrack” take shape.",High Output Management,Andrew S. Grove,[]
The art of management lies in the capacity to select from the many activities of seemingly comparable significance the one or two or three that provide leverage well beyond the others and concentrate on them.,High Output Management,Andrew S. Grove,[]
"The value system at Intel is completely the reverse. The Ph.D. in computer science who knows an answer in the abstract, yet does not apply it to create some tangible output, gets little recognition, but a junior engineer who produces results is highly valued and esteemed. And that is how it should be.",High Output Management,Andrew S. Grove,[]
delegation without follow-through is abdication.,High Output Management,Andrew S. Grove,[]
A manager’s output = The output of his organization + The output of the neighboring organizations under his influence,High Output Management,Andrew S. Grove,[]
All production flows have a basic characteristic: the material becomes more valuable as it moves through the process.,High Output Management,Andrew S. Grove,[]
A common rule we should always try to heed is to detect and fix any problem in a production process at the lowest-value stage possible.,High Output Management,Andrew S. Grove,[]
"In general, meddling stems from a supervisor exploiting too much superior work knowledge (real or imagined). The negative leverage produced comes from the fact that after being exposed to many such instances, the subordinate will begin to take a much more restricted view of what is expected of him, showing less initiative in solving his own problems and referring them instead to his supervisor.",High Output Management,Andrew S. Grove,[]
There is no question that having standards and believing in them and staffing an administrative unit objectively using forecasted workloads will help you to maintain and enhance productivity.,High Output Management,Andrew S. Grove,[]
"if your organization uses e-mail, a lot more people know what’s going on in your business than did before, and they know it a lot faster than they used to.",High Output Management,Andrew S. Grove,[]
"Middle managers are the muscle and bone of every sizable organization, no matter how loose or “flattened” the hierarchy, but they are largely ignored despite their immense importance to our society and economy.",High Output Management,Andrew S. Grove,[]
"So in the end careful interviewing doesn’t guarantee you anything, it merely increases your odds of getting lucky.",High Output Management,Andrew S. Grove,[]
"When the need to stretch is not spontaneous, management needs to create an environment to foster it.",High Output Management,Andrew S. Grove,[]
"if we want to cultivate achievement-driven motivation, we need to create an environment that values and emphasizes output.",High Output Management,Andrew S. Grove,[]
You cannot stay in the self-actualized mode if you’re always worried about failure.,High Output Management,Andrew S. Grove,[]
"a big part of a middle manager’s work is to supply information and know-how, and to impart a sense of the preferred method of handling things to the groups under his control and influence. A manager also makes and helps to make decisions. Both kinds of basic managerial tasks can only occur during face-to-face encounters, and therefore only during meetings. Thus I will assert again that a meeting is nothing less than the medium through which managerial work is performed. That means we should not be fighting their very existence, but rather using the time spent in them as efficiently as possible. The",High Output Management,Andrew S. Grove,[]
"ask both the manufacturing and the sales departments to prepare a forecast, so that people are responsible for performing against their own predictions.",High Output Management,Andrew S. Grove,[]
"But if we have carefully chosen indicators that characterize an administrative unit and watch them closely, we are ready to apply the methods of factory control to administrative work. We can use de facto standards, inferred from the trend data, to forecast the number of people needed to accomplish various anticipated tasks. By rigorous application of the principles of forecasting, manpower can be reassigned from one area to another, and the headcount made to match the forecasted growth or decline in administrative activity. Without rigor, the staffing of administrative units would always be left at its highest level and, given Parkinson’s famous law, people would find ways to let whatever they’re doing fill the time available for its completion.",High Output Management,Andrew S. Grove,[]
"If the decision-making process has proceeded correctly up to this point, the senior manager will be making the decision having had the full benefit of free discussion wherein all points of view, facts, opinions, and judgments were aired without position-power prejudice. In other words, it is legitimate—in fact, sometimes unavoidable—for the senior person to wield position-power authority if the clear decision stage is reached and no consensus has developed. It is not legitimate—in fact, it is destructive—for him to wield that authority any earlier. This is often not easy. We Americans tend to be reluctant to exercise position power deliberately and explicitly—it is just “not nice” to give orders. Such reluctance on the part of the senior manager can prolong the first phase of the decision-making process—the time of free discussion—past the optimum point, and the decision will be put off.",High Output Management,Andrew S. Grove,[]
one of the manager’s key tasks is to settle six important questions in advance: •  What decision needs to be made? •  When does it have to be made? • Who will decide? •  Who will need to be consulted prior to making the decision? •  Who will ratify or veto the decision? •  Who will need to be informed of the decision?,High Output Management,Andrew S. Grove,[]
can think of no better way to make the decision-making process straightforward than to apply before the fact the structure imposed by our six questions.,High Output Management,Andrew S. Grove,[]
"The number of possible indicators you can choose is virtually limitless, but for any set of them to be useful, you have to focus each indicator on a specific operational goal.",High Output Management,Andrew S. Grove,[]
"Which five would they be? Put another way, which five pieces of information would you want to look at each day, immediately upon arriving at your office?",High Output Management,Andrew S. Grove,[]
"But at least you know that alternatives do exist: equipment capacity, manpower, and inventory can be traded off against each other and then balanced against delivery time.",High Output Management,Andrew S. Grove,[]
"Because each alternative costs money, your task is to find the most cost-effective way to deploy your resources—the key to optimizing all types of productive work. Bear in mind that in this and in other such situations there is a right answer, the one that can give you the best delivery time and product quality at the lowest possible cost. To find that right answer, you must develop a clear understanding of the trade-offs between the various factors—manpower, capacity, and inventory—and you must reduce the understanding to a quantifiable set of relationships.",High Output Management,Andrew S. Grove,[]
"We have now turned things into a continuous operation at the expense of flexibility, and we can no longer prepare each customer’s order exactly when and how he requests it. So our customers have to adjust their expectations if they want to enjoy the benefits of our new mode: lower cost and more predictable product quality.",High Output Management,Andrew S. Grove,[]
"Values and behavioral norms are simply not transmitted easily by talk or memo, but are conveyed very effectively by doing and doing visibly.",High Output Management,Andrew S. Grove,[]
a genuinely effective indicator will cover the output of the work unit and not simply the activity involved.,High Output Management,Andrew S. Grove,[]
"Transactions between companies are usually governed by the free market. When we buy a commodity product from a vendor, we are trying to get it at the best possible price, and vice versa. But what happens when the value of something is not easily defined? What happens, for instance, when it takes a group of people to accomplish a certain task?",High Output Management,Andrew S. Grove,[]
"The nature of control is now based on contractual obligations, which define the kind of work you will do and the standards that will govern it.",High Output Management,Andrew S. Grove,[]
"In return for stopping at a red light, we count on other drivers to do the same thing, and we can drive through green lights. But for lawbreakers we need policemen, and with them, as with supervisors, we introduce overhead.",High Output Management,Andrew S. Grove,[]
What decision needs to be made? •  When does it have to be made? • Who will decide? •  Who will need to be consulted prior to making the decision? •  Who will ratify or veto the decision? •  Who will need to be informed of the decision?,High Output Management,Andrew S. Grove,[]
"When the environment changes more rapidly than one can change rules, or when a set of circumstances is so ambiguous and unclear that a contract between the parties that attempted to cover all possibilities would be prohibitively complicated, we need another mode of control, which is based on cultural values. Its most important characteristic is that the interest of the larger group to which an individual belongs takes precedence over the interest of the individual himself. When such values are at work, some emotionally loaded words come into play—words like trust—because you are surrendering to the group your ability to protect yourself. And for this to happen, you must believe that you all share a common set of values, a common set of objectives, and a common set of methods. These, in turn, can only be developed by a great deal of common, shared experience.",High Output Management,Andrew S. Grove,[]
"A manager must keep many balls in the air at the same time and shift his energy and attention to activities that will most increase the output of his organization. In other words, he should move to the point where his leverage will be the greatest.",High Output Management,Andrew S. Grove,[]
"An imaginary composite index can be applied to measure an environment’s complexity, uncertainty, and ambiguity, which we’ll call the CUA factor.",High Output Management,Andrew S. Grove,[]
"Let’s apply our model to the work of a new employee. What is his motivation? It is very much based on self-interest. So you should give him a clearly structured job with a low CUA factor. If he does well, he will begin to feel more at home, worry less about himself, and start to care more about his team. He learns that if he is on a boat and wants to get ahead, it is better for him to help row than to run to the bow.",High Output Management,Andrew S. Grove,[]
"This is why promotion from within tends to be the approach favored by corporations with strong corporate cultures. Bring young people in at relatively low-level, well-defined jobs with low CUA factors, and over time they will share experiences with their peers, supervisors, and subordinates and will learn the values, objectives, and methods of the organization. They will gradually accept, even flourish in, the complex world of multiple bosses and peer decision-making.",High Output Management,Andrew S. Grove,[]
A poor performer has a strong tendency to ignore his problem.,High Output Management,Andrew S. Grove,[]
"Take, for instance, the task of training a sales force to sell a new product. The three types of production operations can be easily identified. The conversion of large amounts of raw data about the product into meaningful selling strategies comprehensible to the sales personnel is a process step, which transforms data into strategies. The combination of the various sales strategies into a coherent program can be compared to an assembly step. Here the appropriate product-selling strategies and pertinent market data (such as competitive pricing and availability) are made to flow into one presentation, along with such things as brochures, handouts, and flip charts. The test operation comes in the form of a “dry run” presentation with a selected group of field sales personnel and field sales management. If the dry run fails the test, the material must be “reworked” (another well-established manufacturing concept) to meet the concerns and objections of the test audience.",High Output Management,Andrew S. Grove,[]
The output of a manager is the output of the organizational units under his or her supervision or influence,High Output Management,Andrew S. Grove,[]
"If it becomes clear that you are not going to get your subordinate past the blame-others stage, you will have to assume the formal role of the supervisor, endowed with position power, and say, “This is what I, as your boss, am instructing you to do. I understand that you do not see it my way. You may be right or I may be right. But I am not only empowered, I am required by the organization for which we both work to give you instructions, and this is what I want you to do…” And proceed to secure your subordinate’s commitment to the course of action you want and thereafter monitor his performance against that commitment.",High Output Management,Andrew S. Grove,[]
"As for cultural values, management has to develop and nurture the common set of values, objectives, and methods essential for the existence of trust. How do we do that? One way is by articulation, by spelling out these values, objectives, and methods. The other, even more important, way is by example. If our behavior at work will be regarded as in line with the values we profess, that fosters the development of a group culture.",High Output Management,Andrew S. Grove,[]
"alternatives do exist: equipment capacity, manpower, and inventory can be traded off against each other and then balanced against delivery time.",High Output Management,Andrew S. Grove,[]
"Because the art and science of forecasting is so complex, you might be tempted to give all forecasting responsibility to a single manager who can be made accountable for it. But this usually does not work very well. What works better is to ask both the manufacturing and the sales departments to prepare a forecast, so that people are responsible for performing against their own predictions.",High Output Management,Andrew S. Grove,[]
"In order to build anything great, you have to be an optimist, because by definition you are trying to do something that most people would consider impossible. Optimists most certainly do not listen to leading indicators of bad news.",High Output Management,Andrew S. Grove,[]
"So even if you’re just an invited participant, you should ask yourself if the meeting—and your attendance—is desirable and justified.",High Output Management,Andrew S. Grove,[]
"If you only understand one thing about building products, you must understand that energy put in early in the process pays off tenfold and energy put in at the end of the program pays off negative tenfold.",High Output Management,Andrew S. Grove,[]
"High managerial productivity, I argue, depends largely on choosing to perform tasks that possess high leverage.",High Output Management,Andrew S. Grove,[]
"In other words, one of the manager’s key tasks is to settle six important questions in advance: •  What decision needs to be made? •  When does it have to be made? • Who will decide? •  Who will need to be consulted prior to making the decision? •  Who will ratify or veto the decision? •  Who will need to be informed of the decision?",High Output Management,Andrew S. Grove,[]
Let’s look at how the questions above fit into the four categories.,High Output Management,Andrew S. Grove,[]
"The two basic managerial roles produce two basic kinds of meetings. In the first kind of meeting, called a process-oriented meeting, knowledge is shared and information is exchanged. Such meetings take place on a regularly scheduled basis. The purpose of the second kind of meeting is to solve a specific problem. Meetings of this sort, called mission-oriented, frequently produce a decision. They are ad hoc affairs, not scheduled long in advance, because they usually can’t be.",High Output Management,Andrew S. Grove,[]
A manager’s output = the output of his organization + the output of the neighboring organizations under his influence.,High Output Management,Andrew S. Grove,[]
"In other words, the output of the planning process is the decisions made and the actions taken as a result of the process.",High Output Management,Andrew S. Grove,[]
"As a means to obtain this leverage, a manager must understand, as Andy writes: “When a person is not doing his job, there can only be two reasons for it. The person either can’t do it or won’t do it; he is either not capable or not motivated.” This insight enables a manager to dramatically focus her efforts. All you can do to improve the output of an employee is motivate and train. There is nothing else.",High Output Management,Andrew S. Grove,[]
But today’s gap represents a failure of planning sometime in the past.,High Output Management,Andrew S. Grove,[]
I have seen far too many people who upon recognizing today’s gap try very hard to determine what decision has to be made to close it. But today’s gap represents a failure of planning sometime in the past.,High Output Management,Andrew S. Grove,[]
"We now discover that management is not just a team game, it is a game in which we have to fashion a team of teams, where the various individual teams exist in some suitable and mutually supportive relationship with each other.",High Output Management,Andrew S. Grove,[]
"The key idea is that we construct our production flow by starting with the longest (or most difficult, or most sensitive, or most expensive) step and work our way back.",High Output Management,Andrew S. Grove,[]
"our capital authorization process itself is important, not the authorization itself. To prepare and justify a capital spending request, people go through a lot of soul-searching analysis and juggling, and it is this mental exercise that is valuable. The formal authorization is useful only because it enforces the discipline of the process.",High Output Management,Andrew S. Grove,[]
