quoteText,bookTitle,bookAuthor,tags
"The governing ideal was not merely to keep up with the Joneses, but to be the Joneses—to own the same model of car or dishwasher or lawn mower.",The Long Tail: Why the Future of Business Is Selling Less of More,Chris Anderson,[]
"For a generation of customers used to doing their buying research via search engine, a company’s brand is not what the company says it is, but what Google says it is.",The Long Tail: Why the Future of Business Is Selling Less of More,Chris Anderson,[]
"Then television took over, birthing the ultimate in lockstep culture.",The Long Tail: Why the Future of Business Is Selling Less of More,Chris Anderson,[]
"In the 1950s and 1960s, it was a safe assumption that nearly everyone in your office had watched the same thing the previous night.",The Long Tail: Why the Future of Business Is Selling Less of More,Chris Anderson,[]
"Today we’re not so much fragmenting as we are re-forming along different dimensions. These days our watercoolers are increasingly virtual; there are many different ones; and the people who gather around them are self-selected. Rather than being loosely connected with people thanks to superficial mass-cultural overlaps, we have the ability to be more strongly tied to just as many if not more people with a shared affinity for niche culture.",The Long Tail: Why the Future of Business is Selling Less of More,Chris Anderson,"['blockbuster', 'consumer-behavior', 'consumption', 'culture', 'economics', 'long-tail', 'mass-culture', 'niches']"
"In short, we’re seeing a shift from mass culture to massively parallel culture.",The Long Tail: Why the Future of Business Is Selling Less of More,Chris Anderson,[]
only peer production has the capacity to extend as far as the Long Tail can go.,The Long Tail: Why the Future of Business Is Selling Less of More,Chris Anderson,[]
"Everybody says they want to hear from consumers. Well, be careful what you ask for: Now they won’t shut up.",The Long Tail: Why the Future of Business Is Selling Less of More,Chris Anderson,[]
Along with the fragmentation of markets is coming the fragmentation of marketing.,The Long Tail: Why the Future of Business Is Selling Less of More,Chris Anderson,[]
"When you think about it, the hyperlink is the ultimate act of generosity online. When somebody links to another site, what they’re doing is telling their readers to go elsewhere.",The Long Tail: Why the Future of Business Is Selling Less of More,Chris Anderson,[]
"Whatever Microsoft product you use or have an interest in, there’s an engineer or product manager carrying on a conversation in public about it.",The Long Tail: Why the Future of Business Is Selling Less of More,Chris Anderson,[]
The natural model for music and anything else where the marginal costs of manufacturing and distribution are close to zero is variable pricing.,The Long Tail: Why the Future of Business Is Selling Less of More,Chris Anderson,[]
