quoteText,bookTitle,bookAuthor,tags
"Vulnerability doesn’t come after trust—it precedes it. Leaping into the unknown, when done alongside others, causes the solid ground of trust to materialize beneath our feet.",The Culture Code: The Secrets of Highly Successful Groups,Daniel Coyle,[]
The road to success is paved with mistakes well handled.,The Culture Code: The Secrets of Highly Successful Groups,Daniel Coyle,[]
"Give a good idea to a mediocre team, and they’ll find a way to screw it up. Give a mediocre idea to a good team, and they’ll find a way to make it better. The goal needs to be to get the team right, get them moving in the right direction, and get them to see where they are making mistakes and where they are succeeding.",The Culture Code: The Secrets of Highly Successful Groups,Daniel Coyle,[]
"Hire people smarter than you. Fail early, fail often. Listen to everyone’s ideas. Face toward the problems. B-level work is bad for your soul. It’s more important to invest in good people than in good ideas.",The Culture Code: The Secrets of Highly Successful Groups,Daniel Coyle,[]
"When we hear a fact, a few isolated areas of our brain light up, translating words and meanings. When we hear a story, however, our brain lights up like Las Vegas, tracing the chains of cause, effect, and meaning. Stories are not just stories; they are the best invention ever created for delivering mental models that drive behavior.",The Culture Code: The Secrets of Highly Successful Groups,Daniel Coyle,[]
"As Dave Cooper says, I screwed that up are the most important words any leader can say.",The Culture Code: The Secrets of Highly Successful Groups,Daniel Coyle,[]
I’m giving you these comments because I have very high expectations and I know that you can reach them.,The Culture Code: The Secrets of Highly Successful Groups,Daniel Coyle,[]
"the number-one job is to take care of each other. I didn’t always know that, but I know it now.",The Culture Code: The Secrets of Highly Successful Groups,Daniel Coyle,[]
"One misconception about highly successful cultures is that they are happy, lighthearted places. This is mostly not the case. They are energized and engaged, but at their core their members are oriented less around achieving happiness than around solving hard problems together. This task involves many moments of high-candor feedback, uncomfortable truth-telling, when they confront the gap between where the group is, and where it ought to be.",The Culture Code: The Secrets of Highly Successful Groups,Daniel Coyle,[]
"Belonging cues are behaviors that create safe connection in groups. They include, among others, proximity, eye contact, energy, mimicry, turn taking, attention, body language, vocal pitch, consistency of emphasis, and whether everyone talks to everyone else in the group.",The Culture Code: The Secrets of Highly Successful Groups,Daniel Coyle,[]
We are all paid to solve problems. Make sure to pick fun people to solve problems with.,The Culture Code: The Secrets of Highly Successful Groups,Daniel Coyle,[]
"While successful culture can look and feel like magic, the truth is that it’s not. Culture is a set of living relationships working toward a shared goal. It’s not something you are. It’s something you do.",The Culture Code: The Secrets of Highly Successful Groups,Daniel Coyle,[]
"You can’t prevent mistakes, but you can solve problems graciously.",The Culture Code: The Secrets of Highly Successful Groups,Daniel Coyle,[]
"No shortcuts,” “Work hard, be nice,” “Don’t eat the marshmallow,” “Team and family,” “If there’s a problem, we look for the solution,” “Read, baby, read,” “All of us will learn,” “KIPPsters do the right thing when no one is watching,” “Everything is earned,” “Be the constant, not the variable,” “If a teammate needs help, we give; if we need help, we ask,” “No robots,” and “Prove the doubters wrong.",The Culture Code: The Secrets of Highly Successful Groups,Daniel Coyle,[]
"Building purpose in a creative group is not about generating a brilliant moment of breakthrough but rather about building systems that can churn through lots of ideas in order to help unearth the right choices. This is why Catmull has learned to focus less on the ideas than on people—specifically, on providing teams with tools and support to locate paths, make hard choices, and navigate the arduous process together.",The Culture Code: The Secrets of Highly Successful Groups,Daniel Coyle,[]
"You know the phrase ‘Don’t shoot the messenger’?” Edmondson says. “In fact, it’s not enough to not shoot them. You have to hug the messenger and let them know how much you need that feedback. That way you can be sure that they feel safe enough to tell you the truth next time.",The Culture Code: The Secrets of Highly Successful Groups,Daniel Coyle,[]
"Thinking about your ancestors makes you smarter. A research team led by Peter Fischer found that spending a few minutes contemplating your family tree (as opposed to contemplating a friend, or a shopping list, or nothing at all) significantly boosted performance on tests of cognitive intelligence. Their hypothesis is that thinking about our connections to the group increases our feelings of autonomy and control.",The Culture Code: The Secrets of Highly Successful Groups,Daniel Coyle,[]
"[Building purpose is...] not as simple as carving a mission statement in granite or encouraging everyone to recite a hymnal of catchphrases. It's a never-ending process of trying, failing, reflecting and above all learning. High-purpose environments don't descend on groups from on high; they are dug out of the ground, over and over, as a group navigates it's problems together and evolves to meet the challenges of a fast-changing world.",The Culture Code: The Secrets of Highly Successful Groups,Daniel Coyle,"['culture', 'mission', 'performance']"
"There’s a tendency in our business, as in all businesses, to value the idea as opposed to the person or a team of people,” he says. “But that’s not accurate. Give a good idea to a mediocre team, and they’ll find a way to screw it up. Give a mediocre idea to a good team, and they’ll find a way to make it better. The goal needs to be to get the team right, get them moving in the right direction, and get them to see where they are making mistakes and where they are succeeding.",The Culture Code: The Secrets of Highly Successful Groups,Daniel Coyle,[]
"Actually, when you look more closely at the sentence, it contains three separate cues: 1. You are part of this group. 2. This group is special; we have high standards here. 3. I believe you can reach those standards. These signals provide a clear message that lights up the unconscious brain: Here is a safe place to give effort.",The Culture Code: The Secrets of Highly Successful Groups,Daniel Coyle,[]
"This is a different way of thinking about human beings,"" Pentland says. ""Individuals aren't really individuals. They're more like musicians in a jazz quartet, forming a web of unconscious actions and reactions to complement others in the group. You don't look at the informational content of the messages; you look at patterns that show how the message is being sent. Those patterns contain many signals that tell us about the relationship and what's really going on beneath the surface.",The Culture Code: The Secrets of Highly Successful Groups,Daniel Coyle,[]
"In Conversation, Resist the Temptation to Reflexively Add Value: The most important part of creating vulnerability often resides not in what you say but in what you do not say. This means having the willpower to forgo easy opportunities to offer solutions and make suggestions. Skilled listeners do not interrupt with phrases like Hey, here’s an idea or Let me tell you what worked for me in a similar situation because they understand that it’s not about them. They use a repertoire of gestures and phrases that keep the other person talking. “One of the things I say most often is probably the simplest thing I say,” says Givechi. “ ‘Say more about that.",The Culture Code: The Secrets of Highly Successful Groups,Daniel Coyle,[]
"The goal needs to be to get the team right, get them moving in the right direction, and get them to see where they are making mistakes and where they are succeeding.",The Culture Code: The Secrets of Highly Successful Groups,Daniel Coyle,[]
"High-purpose environments are filled with small, vivid signals designed to create a link between the present moment and a future ideal. They provide the two simple locators that every navigation process requires: Here is where we are and Here is where we want to",The Culture Code: The Secrets of Highly Successful Groups,Daniel Coyle,[]
"Building habits of group vulnerability is like building a muscle. It takes time, repetition, and the willingness to feel pain in order to achieve gains.",The Culture Code: The Secrets of Highly Successful Groups,Daniel Coyle,[]
"In other words, a small thank-you caused people to behave far more generously to a completely different person. This is because thank-yous aren’t only expressions of gratitude; they’re crucial belonging cues that generate a contagious sense of safety, connection, and motivation.",The Culture Code: The Secrets of Highly Successful Groups,Daniel Coyle,[]
Build a Wall Between Performance Review and Professional Development:,The Culture Code: The Secrets of Highly Successful Groups,Daniel Coyle,[]
"Cohesion happens not when members of a group are smarter but when they are lit up by clear, steady signals of safe connection.",The Culture Code: The Secrets of Highly Successful Groups,Daniel Coyle,[]
"Envision a reachable goal, and envision the obstacles. The thing is, as Oettingen discovered, this method works, triggering significant changes in behavior and motivation.",The Culture Code: The Secrets of Highly Successful Groups,Daniel Coyle,[]
"He always asks questions, and those questions are always the same: personal, direct, focused on the big picture. What did you think of it? What would you have done in that situation?",The Culture Code: The Secrets of Highly Successful Groups,Daniel Coyle,[]
"Purpose isn’t about tapping into some mystical internal drive but rather about creating simple beacons that focus attention and engagement on the shared goal. Successful cultures do this by relentlessly seeking ways to tell and retell their story. To do this, they build what we’ll call high-purpose environments.",The Culture Code: The Secrets of Highly Successful Groups,Daniel Coyle,[]
"When you ask people inside highly successful groups to describe their relationship with one another, they all tend to choose the same word. This word is not friends or team or tribe or any other equally plausible term. The word they use is family.",The Culture Code: The Secrets of Highly Successful Groups,Daniel Coyle,[]
The real courage is seeing the truth and speaking the truth to each other.,The Culture Code: The Secrets of Highly Successful Groups,Daniel Coyle,[]
"One misconception about highly successful cultures is that they are happy, lighthearted places. This is mostly not the case. They are energized and engaged, but at their core their members are oriented less around achieving happiness than around solving hard problems together.",The Culture Code: The Secrets of Highly Successful Groups,Daniel Coyle,[]
"In Conversation, Resist the Temptation to Reflexively Add Value: The most important part of creating vulnerability often resides not in what you say but in what you do not say. This means having the willpower to forgo easy opportunities to offer solutions and make suggestions. Skilled listeners do not interrupt with phrases like Hey, here’s an idea or Let me tell you what worked for me in a similar situation because they understand that it’s not about them.",The Culture Code: The Secrets of Highly Successful Groups,Daniel Coyle,[]
"One of the things I say most often is probably the simplest thing I say,” says Givechi. “ ‘Say more about that.’ ",The Culture Code: The Secrets of Highly Successful Groups,Daniel Coyle,[]
"Aim for Candor; Avoid Brutal Honesty: Giving honest feedback is tricky, because it can easily result in people feeling hurt or demoralized. One useful distinction, made most clearly at Pixar, is to aim for candor and avoid brutal honesty. By aiming for candor—feedback that is smaller, more targeted, less personal, less judgmental, and equally impactful—it’s easier to maintain a sense of safety and belonging in the group.",The Culture Code: The Secrets of Highly Successful Groups,Daniel Coyle,[]
What is one thing that I currently do that you’d like me to continue to do? • What is one thing that I don’t currently do frequently enough that you think I should do more often? • What can I do to make you more effective?,The Culture Code: The Secrets of Highly Successful Groups,Daniel Coyle,[]
"A lot of coaches can yell or be nice, but what Pop does is different,” says assistant coach Chip Engelland. “He delivers two things over and over: He’ll tell you the truth, with no bullshit, and then he’ll love you to death.",The Culture Code: The Secrets of Highly Successful Groups,Daniel Coyle,[]
"Make the Leader Occasionally Disappear: Several leaders of successful groups have the habit of leaving the group alone at key moments. One of the best at this is Gregg Popovich. Most NBA teams run time-outs according to a choreographed protocol: First the coaches huddle as a group for a few seconds to settle on a message, then they walk over to the bench to deliver that message to the players. However, during about one time-out a month, the Spurs coaches huddle for a time-out…and then never walk over to the players. The players sit on the bench, waiting for Popovich to show up. Then, as they belatedly realize he isn’t coming, they take charge, start talking among themselves, and figure out a plan.",The Culture Code: The Secrets of Highly Successful Groups,Daniel Coyle,[]
"High-purpose environments are filled with small, vivid signals designed to create a link between the present moment and a future ideal.",The Culture Code: The Secrets of Highly Successful Groups,Daniel Coyle,[]
"Give a mediocre idea to a good team, and they’ll find a way to make it better. The goal needs to be to get the team right, get them moving in the right direction, and get them to see where they are making mistakes and where they are succeeding.",The Culture Code: The Secrets of Highly Successful Groups,Daniel Coyle,[]
"Jack Zenger and Joseph Folkman, who run a leadership consultancy, analyzed 3,492 participants in a manager development program and found that the most effective listeners do four things: 1. They interact in ways that make the other person feel safe and supported 2. They take a helping, cooperative stance 3. They occasionally ask questions that gently and constructively challenge old assumptions 4. They make occasional suggestions to open up alternative paths",The Culture Code: The Secrets of Highly Successful Groups,Daniel Coyle,[]
"Robert Rosenthal found a way. He approached a California public elementary school and offered to test the school’s students with a newly developed intelligence-identification tool, called the Harvard Test of Inflected Acquisition, which could accurately predict which children would excel academically in the coming year. The school naturally agreed, and the test was administered to the entire student body. A few weeks later, teachers were provided with the names of the children (about 20 percent of the student body) who had tested as high-potentials. These particular children, the teachers were informed, were special. Though they might not have performed well in the past, the test indicated that they possessed “unusual potential for intellectual growth.” (The students were not informed of the test results.) The following year Rosenthal returned to measure how the high-potential students had performed. Exactly as the test had predicted, the first- and second-grade high-potentials had succeeded to a remarkable degree: The first-graders gained 27 IQ points (versus 12 points for the rest of the class); and the second-graders gained 17 points (versus 7 points). In addition, the high-potentials thrived in ways that went beyond measurement. They were described by their teachers as being more curious, happier, better adjusted, and more likely to experience success as adults. What’s more, the teachers reported that they had enjoyed teaching that year more than any year in the past. Here’s the twist: the Harvard Test of Inflected Acquisition was complete baloney. In fact, the “high-potentials” had been selected at random. The real subject of the test was not the students but the narratives that drive the relationship between the teachers and the students. What happened, Rosenthal discovered, was replacing one story—These are average kids—with a new one—These are special kids, destined to succeed—served as a locator beacon that reoriented the teachers, creating a cascade of behaviors that guided the student toward that future. It didn’t matter that the story was false, or that the children were, in fact, randomly selected. The simple, glowing idea—This child has unusual potential for intellectual growth—aligned motivations, awareness, and behaviors.",The Culture Code: The Secrets of Highly Successful Groups,Daniel Coyle,[]
"We have a place in our brain that’s always worried about what people think of us, especially higher-ups. As far as our brain is concerned, if our social system rejects us, we could die. Given that our sense of danger is so natural and automatic, organizations have to do some pretty special things to overcome that natural trigger.",The Culture Code: The Secrets of Highly Successful Groups,Daniel Coyle,[]
We focus on what we can see—individual skills. But individual skills are not what matters. What matters is the interaction.,The Culture Code: The Secrets of Highly Successful Groups,Daniel Coyle,[]
"small thank-you caused people to behave far more generously to a completely different person. This is because thank-yous aren’t only expressions of gratitude; they’re crucial belonging cues that generate a contagious sense of safety, connection, and motivation.",The Culture Code: The Secrets of Highly Successful Groups,Daniel Coyle,[]
One of the best measures of any group’s culture is its learning velocity—how quickly it improves its performance of a new skill.,The Culture Code: The Secrets of Highly Successful Groups,Daniel Coyle,[]
"Researchers discovered that one particular form of feedback boosted student effort and performance so immensely that they deemed it “magical feedback.” Students who received it chose to revise their papers far more often than students who did not, and their performance improved significantly. The feedback was not complicated. In fact, it consisted of one simple phrase. I’m giving you these comments because I have very high expectations and I know that you can reach them. That’s it. Just nineteen words.",The Culture Code: The Secrets of Highly Successful Groups,Daniel Coyle,[]
"Capitalize on Threshold Moments: When we enter a new group, our brains decide quickly whether to connect. So successful cultures treat these threshold moments as more important than any other.",The Culture Code: The Secrets of Highly Successful Groups,Daniel Coyle,[]
"The main challenge to building a clear sense of purpose is that the world is cluttered with noise, distractions, and endless alternative purposes.",The Culture Code: The Secrets of Highly Successful Groups,Daniel Coyle,[]
"In any interaction, we have a natural tendency to try to hide our weaknesses and appear competent. If you want to create safety, this is exactly the wrong move.",The Culture Code: The Secrets of Highly Successful Groups,Daniel Coyle,[]
"Skills of proficiency are about doing a task the same way, every single time.",The Culture Code: The Secrets of Highly Successful Groups,Daniel Coyle,[]
"Fill the group’s windshield with clear, accessible models of excellence. • Provide high-repetition, high-feedback training. • Build vivid, memorable rules of thumb (if X, then Y). • Spotlight and honor the fundamentals of the skill.",The Culture Code: The Secrets of Highly Successful Groups,Daniel Coyle,[]
"Creative skills, on the other hand, are about empowering a group to do the hard work of building something that has never existed before.",The Culture Code: The Secrets of Highly Successful Groups,Daniel Coyle,[]
"Keenly attend to team composition and dynamics. • Define, reinforce, and relentlessly protect the team’s creative autonomy. • Make it safe to fail and to give feedback. • Celebrate hugely when the group takes initiative.",The Culture Code: The Secrets of Highly Successful Groups,Daniel Coyle,[]
"So he banished that metric and replaced it with Personal Emotional Connections (PECs), or creating a bond outside the conversation about the product. It’s impossible, of course, to measure PECs precisely, but the goal here is not precision; it is to create awareness and alignment and to direct behavior toward the group’s mission.",The Culture Code: The Secrets of Highly Successful Groups,Daniel Coyle,[]
"If I could get a sense of the way your culture works by meeting just one person, who would that person be?)",The Culture Code: The Secrets of Highly Successful Groups,Daniel Coyle,[]
"She’s really listening, hearing what you said and asking what it means, digging deeper,” says Nili Metuki, design researcher. “She doesn’t let things stay unclear, even when they’re uncomfortable. Especially when they’re uncomfortable.",The Culture Code: The Secrets of Highly Successful Groups,Daniel Coyle,[]
What is one thing that I currently do that you’d like me to continue to do? What is one thing that I don’t currently do frequently enough that you think I should do more often? • What can I do to make you more effective?,The Culture Code: The Secrets of Highly Successful Groups,Daniel Coyle,[]
"your cellphone, she is feeding that flame. Cohesion happens not when members of a group are smarter but when they are lit up by clear, steady signals of safe connection.",The Culture Code: The Secrets of Highly Successful Groups,Daniel Coyle,[]
"Skunking is spraying negative energy into the workplace, as skunks do when they’re frightened.",The Culture Code: The Secrets of Highly Successful Groups,Daniel Coyle,[]
"The executives [listening to the pitches] thought they were evaluating the plans based on rational measures, such as: How original is this idea? How does it fit the current market? How well developed is this plan?” Pentland wrote. “While listening to the pitches, though, another part of their brain was registering other crucial information, such as: How much does this person believe in this idea? How confident are they when speaking? How determined are they to make this work? And the second set of information—information that the business executives didn’t even know they were assessing—is what influenced their choice of business plans to the greatest degree.",The Culture Code: The Secrets of Highly Successful Groups,Daniel Coyle,[]
"A year ago IDEO decided to scale Givechi’s abilities across the organization. They asked her to create modules of questions teams could ask themselves, then provided those modules to design teams as tools to help them improve. For example, here are a few: The one thing that excites me about this particular opportunity is I confess, the one thing I’m not so excited about with this particular opportunity is On this project, I’d really like to get better at The interesting thing about Givechi’s questions is how transcendently simple they are.",The Culture Code: The Secrets of Highly Successful Groups,Daniel Coyle,[]
"They demonstrated that a series of small, humble exchanges—Anybody have any ideas? Tell me what you want, and I’ll help you—can unlock a group’s ability to perform. The key, as we’re about to learn, involves the willingness to perform a certain behavior that goes against our every instinct: sharing vulnerability.",The Culture Code: The Secrets of Highly Successful Groups,Daniel Coyle,[]
"They did not rely on any outside structure or safety net. They were the structure, and if any of them failed, the group would fail.",The Culture Code: The Secrets of Highly Successful Groups,Daniel Coyle,[]
"they suck, and it’s also where they start to not suck.",The Culture Code: The Secrets of Highly Successful Groups,Daniel Coyle,[]
"group’s performance by 30 to 40 percent. The drop-off is consistent whether he plays the Jerk, the Slacker, or the Downer.",The Culture Code: The Secrets of Highly Successful Groups,Daniel Coyle,[]
"This group performed well no matter what he did. Nick said it was mostly because of one guy. You can see this guy is causing Nick to get almost infuriated—his negative moves aren’t working like they had in the other groups, because this guy could find a way to flip it and engage everyone and get people moving toward the goal.",The Culture Code: The Secrets of Highly Successful Groups,Daniel Coyle,[]
"This approach extended to the raucous all-employee street hockey games in the parking lot (“No one held back when fighting the founders for the puck,” recalled one player) and to the all-company Friday forums, where anyone could challenge the founders with any question under the sun, no matter how controversial—and vice versa. Like the hockey games, the Friday forums often turned into collision-filled affairs.",The Culture Code: The Secrets of Highly Successful Groups,Daniel Coyle,[]
