quoteText,bookTitle,bookAuthor,tags
they all performed the same vital function: to flood the environment with narrative links between what they were doing now and what it meant.,The Culture Code: The Secrets of Highly Successful Groups,Daniel Coyle,[]
The other feature of this list is that many of these signals could easily be viewed as obvious and redundant.,The Culture Code: The Secrets of Highly Successful Groups,Daniel Coyle,[]
"The entire time the Ranger commander was on the radio with his guys. He was talking, giving orders—‘Do this, look out for that.’ He was acting like a coach on the sidelines yelling plays. At some point this commander notices I’m not saying a word, and he gives me this look, almost in disbelief. Like, why aren’t you telling your guys what to do? It was pretty striking. Our guys and their guys, doing the same mission. He’s talking the whole time, and we aren’t saying a thing. And the answer is, because we don’t need to. I know my guys are going to solve the problems themselves.",The Culture Code: The Secrets of Highly Successful Groups,Daniel Coyle,[]
Purpose isn’t about tapping into some mystical internal drive but rather about creating simple beacons that focus attention and engagement on the shared goal.,The Culture Code: The Secrets of Highly Successful Groups,Daniel Coyle,[]
But they succeeded because they understood that being vulnerable together is the only way a team can become invulnerable.,The Culture Code: The Secrets of Highly Successful Groups,Daniel Coyle,[]
"He delivers two things over and over: He’ll tell you the truth, with no bullshit, and then he’ll love you to death.",The Culture Code: The Secrets of Highly Successful Groups,Daniel Coyle,[]
"Give a good idea to a mediocre team, and they’ll find a way to screw it up. Give a mediocre idea to a good team, and they’ll find a way to make it better.",The Culture Code: The Secrets of Highly Successful Groups,Daniel Coyle,[]
Stories are not just stories; they are the best invention ever created for delivering mental models that drive behavior.,The Culture Code: The Secrets of Highly Successful Groups,Daniel Coyle,[]
"This is the way high-purpose environments work. They are about sending not so much one big signal as a handful of steady, ultra-clear signals that are aligned with a shared goal.",The Culture Code: The Secrets of Highly Successful Groups,Daniel Coyle,[]
"Spotlight Your Fallibility Early On—Especially If You’re a Leader: In any interaction, we have a natural tendency to try to hide our weaknesses and appear competent. If you want to create safety, this is exactly the wrong move. Instead, you should open up, show you make mistakes, and invite input with simple phrases like “This is just my two cents.” “Of course, I could be wrong here.” “What am I missing?” “What do you think?",The Culture Code: The Secrets of Highly Successful Groups,Daniel Coyle,[]
"One of the most vital moments for creating safety is when a group shares bad news or gives tough feedback. In these moments, it’s important not simply to tolerate the difficult news but to embrace it.",The Culture Code: The Secrets of Highly Successful Groups,Daniel Coyle,[]
"We have a place in our brain that's always worried about what people think of us, especially higher ups. As far as our brain is concerned, if our social system rejects us, we could die. Given that our sense of danger is so natural and automatic, organizations have to do some pretty special things to overcome that natural trigger.",The Culture Code: The Secrets of Highly Successful Groups,Daniel Coyle,"['build-safety', 'culture', 'organizations']"
"Laszlo Bock, Work Rules (New York: Grand Central Publishing, 2015) David Brooks, The Social Animal (New York: Random House, 2011) Arie de Geus, The Living Company (Boston, MA: Harvard Business Review Press, 2002) Angela Duckworth, Grit: The Power of Perseverance and Passion (New York: Scribner, 2016) Charles Duhigg, The Power of Habit: Why We Do What We Do in Life and Business (New York: Random House, 2012) Amy Edmondson, Teaming: How Organizations Learn, Innovate, and Compete in the Knowledge Economy (San Francisco: Jossey-Bass Pfeiffer, 2012) Adam Grant, Give and Take (New York: Viking, 2013) Richard Hackman, Leading Teams (Boston, MA: Harvard Business Review Press, 2002) Chip and Dan Heath, Switch: How to Change Things When Change is Hard (New York: Broadway Books, 2010) Sebastian Junger, Tribe: On Homecoming and Belonging (New York: HarperCollins, 2016) James Kerr, Legacy (London: Constable & Robinson, 2013) Patrick Lencioni, The Five Dysfunctions of a Team: A Leadership Fable (San Francisco: Jossey-Bass, 2002) Stanley McChrystal, Team of Teams: New Rules of Engagement for a Complex World (New York: Portfolio, 2015). Mark Pagel, Wired for Culture (New York: W. W. Norton & Company, 2012) Daniel Pink, Drive: The Surprising Truth About What Motivates Us (New York: Riverhead Books, 2009) Amanda Ripley, The Smartest Kids in the World: And How They Got That Way (New York: Simon & Schuster, 2013) Edgar H. Schein, Helping (Oakland, CA: Berrett-Koehler Publishers, 2009) Edgar H. Schein, Humble Inquiry (Oakland, CA: Berrett-Koehler Publishers, 2013) Peter M. Senge, The Fifth Discipline (New York: Doubleday Business, 1990) Michael Tomasello, Why We Cooperate (Cambridge, MA: MIT Press, 2009)",The Culture Code: The Secrets of Highly Successful Groups,Daniel Coyle,[]
"The story of the good apples is surprising in two ways. First, we tend to think group performance depends on measurable abilities like intelligence, skill, and experience, not on a subtle pattern of small behaviors. Yet in this case those small behaviors made all the difference. The second surprise is that Jonathan succeeds without taking any of the actions we normally associate with a strong leader. He doesn’t take charge or tell anyone what to do. He doesn’t strategize, motivate, or lay out a vision. He doesn’t perform so much as create conditions for others to perform, constructing an environment whose key feature is crystal clear: We are solidly connected. Jonathan’s group succeeds not because its members are smarter but because they are safer.",The Culture Code: The Secrets of Highly Successful Groups,Daniel Coyle,[]
Safety is not mere emotional weather but rather the foundation on which strong culture is built.,The Culture Code: The Secrets of Highly Successful Groups,Daniel Coyle,[]
"When you ask people inside highly successful groups to describe their relationship with one another, they all tend to choose the same word. This word is not friends or team or tribe or any other equally plausible term. The word they use is family. What’s more, they tend to describe the feeling of those relationships in the same way.",The Culture Code: The Secrets of Highly Successful Groups,Daniel Coyle,[]
"I made a list: Close physical proximity, often in circles Profuse amounts of eye contact Physical touch (handshakes, fist bumps, hugs) Lots of short, energetic exchanges (no long speeches) High levels of mixing; everyone talks to everyone Few interruptions Lots of questions Intensive, active listening Humor, laughter Small, attentive courtesies (thank-yous, opening doors, etc.) One more thing: I found that spending time inside these groups was almost physically addictive.",The Culture Code: The Secrets of Highly Successful Groups,Daniel Coyle,[]
"belonging cues can’t be reduced to an isolated moment but rather consist of a steady pulse of interactions within a social relationship. Their function is to answer the ancient, ever-present questions glowing in our brains: Are we safe here? What’s our future with these people? Are there dangers lurking?",The Culture Code: The Secrets of Highly Successful Groups,Daniel Coyle,[]
Having one person tell other people what to do is not a reliable way to make good decisions.,The Culture Code: The Secrets of Highly Successful Groups,Daniel Coyle,[]
"This place is like a greenhouse,” Hsieh says. “In some greenhouses, the leader plays the role of the plant that every other plant aspires to. But that’s not me. I’m not the plant that everyone aspires to be. My job is to architect the greenhouse.",The Culture Code: The Secrets of Highly Successful Groups,Daniel Coyle,[]
"Close physical proximity, often in circles Profuse amounts of eye contact Physical touch (handshakes, fist bumps, hugs) Lots of short, energetic exchanges (no long speeches) High levels of mixing; everyone talks to everyone Few interruptions Lots of questions Intensive, active listening Humor, laughter Small, attentive courtesies (thank-yous, opening doors, etc.)",The Culture Code: The Secrets of Highly Successful Groups,Daniel Coyle,[]
"Creating engagement around a clear, simple set of priorities can function as a lighthouse, orienting behavior and providing a path toward a goal.",The Culture Code: The Secrets of Highly Successful Groups,Daniel Coyle,[]
The trick is not just to send the signal but to create engagement around it.,The Culture Code: The Secrets of Highly Successful Groups,Daniel Coyle,[]
1—Build Safety—explores how signals of connection generate bonds of belonging and identity. Skill 2—Share Vulnerability—explains how habits of mutual risk drive trusting cooperation. Skill 3—Establish Purpose—tells how narratives create shared goals and values.,The Culture Code: The Secrets of Highly Successful Groups,Daniel Coyle,[]
Culture is a set of living relationships working toward a shared goal. It’s not something you are. It’s something you do.,The Culture Code: The Secrets of Highly Successful Groups,Daniel Coyle,[]
"1 The Google/Overture pattern is not unique to them. In the 1990s, sociologists James Baron and Michael Hannan analyzed the founding cultures of nearly two hundred technology start-ups in Silicon Valley. They found that most followed one of three basic models: the star model, the professional model, and the commitment model. The star model focused on finding and hiring the brightest people. The professional model focused on building the group around specific skill sets. The commitment model, on the other hand, focused on developing a group with shared values and strong emotional bonds. Of these, the commitment model consistently led to the highest rates of success. During the tech-bubble burst of 2000, the start-ups that used the commitment model survived at a vastly higher rate than the other two models, and achieved initial public offerings three times more often.",The Culture Code: The Secrets of Highly Successful Groups,Daniel Coyle,[]
Group performance depends on behavior that communicates one powerful overarching idea: We are safe and connected.,The Culture Code: The Secrets of Highly Successful Groups,Daniel Coyle,[]
"Make Sure the Leader Is Vulnerable First and Often: As we’ve seen, group cooperation is created by small, frequently repeated moments of vulnerability.",The Culture Code: The Secrets of Highly Successful Groups,Daniel Coyle,[]
The kindergartners succeed not because they are smarter but because they work together in a smarter way. They are tapping into a simple and powerful method in which a group of ordinary people can create a performance far beyond the sum of their parts.,The Culture Code: The Secrets of Highly Successful Groups,Daniel Coyle,[]
"most of us instinctively see vulnerability as a condition to be hidden. But science shows that when it comes to creating cooperation, vulnerability is not a risk but a psychological requirement.",The Culture Code: The Secrets of Highly Successful Groups,Daniel Coyle,[]
"The mechanism of cooperation can be summed up as follows: Exchanges of vulnerability, which we naturally tend to avoid, are the pathway through which trusting cooperation is built.",The Culture Code: The Secrets of Highly Successful Groups,Daniel Coyle,[]
"When I visited groups for this book, I met a lot of people who possessed traits of warmth and curiosity—so many, in fact, that I began to think of them as Nyquists. They were polite, reserved, and skilled listeners. They radiated a safe, nurturing vibe. They possessed deep knowledge that spanned domains and had a knack for asking questions that ignited motivation and ideas. (The best way to find the Nyquist is usually to ask people: If I could get a sense of the way your culture works by meeting just one person, who would that person be?)",The Culture Code: The Secrets of Highly Successful Groups,Daniel Coyle,[]
"She’s really listening, hearing what you said and asking what it means, digging deeper,” says Nili Metuki, design researcher. “She doesn’t let things stay unclear, even when they’re uncomfortable. Especially when they’re uncomfortable",The Culture Code: The Secrets of Highly Successful Groups,Daniel Coyle,[]
"What these healers all had in common was that they were brilliant listeners. They would sit down, take a long patient history, and really get to know their patients,” Marci says. “They were all incredibly empathic people who were really good at connecting with people and forming trusting bonds. So that’s when I realized that the interesting part wasn’t the healing but the listening, and the relationship being formed.",The Culture Code: The Secrets of Highly Successful Groups,Daniel Coyle,[]
"Concordances happen when one person can react in an authentic way to the emotion being projected in the room,” Marci says. “It’s about understanding in an empathic way, then doing something in terms of gesture, comment, or expression that creates a connection.",The Culture Code: The Secrets of Highly Successful Groups,Daniel Coyle,[]
"The key to creating psychological safety, as Pentland and Edmondson emphasize, is to recognize how deeply obsessed our unconscious brains are with it. A mere hint of belonging is not enough; one or two signals are not enough. We are built to require lots of signaling, over and over. This is why a sense of belonging is easy to destroy and hard to build.",The Culture Code: The Secrets of Highly Successful Groups,Daniel Coyle,[]
"Nick was able to disrupt the chemistry of the groups merely by sending a few cues of nonbelonging. His behavior was a powerful signal to the group—We are not safe—which immediately caused the group’s performance to fall apart. Jonathan, on the other hand, delivered a steady pulse of subtle behaviors that signaled safety. He connected individually, listened intently, and signaled the importance of the relationship. He was a wellspring of belonging cues, and the group responded accordingly.",The Culture Code: The Secrets of Highly Successful Groups,Daniel Coyle,[]
It’s possible to predict performance by ignoring all the informational content in the exchange and focusing on a handful of belonging cues.,The Culture Code: The Secrets of Highly Successful Groups,Daniel Coyle,[]
"That kind of thing happened all the time.” It was normal. Google personnel were interacting exactly as the kindergartners in the spaghetti-marshmallow challenge interacted. They did not manage their status or worry about who was in charge. Their small building produced high levels of proximity and face-to-face interaction. Page’s technique of igniting whole-group debates around solving tough problems sent a powerful signal of identity and connection, as did the no-holds-barred hockey games and wide-open Friday forums. (Everyone in the group talks and listens in roughly equal measure.) They communicated in short, direct bursts. (Members face one another, and their conversations and gestures are energetic.) Google was a hothouse of belonging cues; its people worked shoulder to shoulder and safely connected, immersed in their projects.",The Culture Code: The Secrets of Highly Successful Groups,Daniel Coyle,[]
"This idea—that belonging needs to be continually refreshed and reinforced—is worth dwelling on for a moment. If our brains processed safety logically, we would not need this steady reminding. But our brains did not emerge from millions of years of natural selection because they process safety logically. They emerged because they are obsessively on the lookout for danger.",The Culture Code: The Secrets of Highly Successful Groups,Daniel Coyle,[]
"On the face of it, these awkward moments at Pixar, the SEALs, and Gramercy Tavern don’t make sense. These groups seem to intentionally create awkward, painful interactions that look like the opposite of smooth cooperation. The fascinating thing is, however, these awkward, painful interactions generate the highly cohesive, trusting behavior necessary for smooth cooperation.",The Culture Code: The Secrets of Highly Successful Groups,Daniel Coyle,[]
"The moment you’re part of a group, the amygdala tunes in to who’s in that group and starts intensely tracking them. Because these people are valuable to you. They were strangers before, but they’re on your team now, and that changes the whole dynamic. It’s such a powerful switch—it’s a big top-down change, a total reconfiguration of the entire motivational and decision-making system.",The Culture Code: The Secrets of Highly Successful Groups,Daniel Coyle,[]
"It’s useful to contrast the missileers’ dysfunctional culture with that of their navy counterparts who work in nuclear submarines. At first glance, the two groups seem roughly similar: Both spend vast amounts of time isolated from the rest of society, both are tasked with memorizing and executing tedious protocols, and both are oriented toward Cold War nuclear deterrence missions whose time has passed. Where they differ, however, is in the density of the belonging cues in their respective environments. Sailors in submarines have close physical proximity, take part in purposeful activity (global patrols that include missions beyond deterrence), and are part of a career pathway that can lead to the highest positions in the navy. Perhaps as a result, the nuclear submarine fleet has thus far mostly avoided the kinds of problems that plague the missileers, and in many cases have developed high-performing cultures.",The Culture Code: The Secrets of Highly Successful Groups,Daniel Coyle,[]
"How does a cranky, demanding coach create the most cohesive team in all of sports? One common answer is that the Spurs are smart about drafting and developing unselfish, hardworking, team-oriented individuals. This is a tempting explanation, because the Spurs clearly make a concerted effort to select high-character individuals. (Their scouting template includes a check box labeled “Not a Spur.” A check in this box means the player will not be pursued, no matter how talented he is.)",The Culture Code: The Secrets of Highly Successful Groups,Daniel Coyle,[]
"approaches every relationship. He fills their cups.” When Popovich wants to connect with a player, he moves in tight enough that their noses nearly touch; it’s almost like a challenge—an intimacy contest. As warm-ups continue, he keeps roving, connecting. A former player walks up, and Popovich beams, his face lighting up in a toothy grin. They talk for five minutes, catching up on life, kids, and teammates. “Love you, brother,” Popovich says as they part.",The Culture Code: The Secrets of Highly Successful Groups,Daniel Coyle,[]
"Duncan and Popovich evolved into what amounts to a father-son relationship, a high-trust, no-bullshit connection that provides a vivid model for other players, especially when it comes to absorbing Popovich’s high-volume truth-telling. As more than one Spur put it, If Tim can take Pop’s coaching, how can I not take it?",The Culture Code: The Secrets of Highly Successful Groups,Daniel Coyle,[]
"The team watched in silence as the story unfolded: Martin Luther King, Jr., Lyndon Johnson, and the Selma marches. When it was over, Popovich asked questions. He always asks questions, and those questions are always the same: personal, direct, focused on the big picture. What did you think of it? What would you have done in that situation? The players thought, answered, nodded. The room shifted and became something of a seminar, a conversation. They talked. They were not surprised because on the Spurs this kind of thing happens all the time.",The Culture Code: The Secrets of Highly Successful Groups,Daniel Coyle,[]
The Spurs eat together approximately as often as they play basketball together.,The Culture Code: The Secrets of Highly Successful Groups,Daniel Coyle,[]
"It’s not an accident that concordance happens when there’s one person talking and the other person listening,” Marci says. “It’s very hard to be empathic when you’re talking. Talking is really complicated, because you’re thinking and planning what you’re going to say, and you tend to get stuck in your own head. But not when you’re listening. When you’re really listening, you lose time. There’s no sense of yourself, because it’s not about you. It’s all about this task—to connect completely to that person.",The Culture Code: The Secrets of Highly Successful Groups,Daniel Coyle,[]
"Building habits of group vulnerability is like building a muscle. It takes time, repetition, and the willingness to feel pain in order to achieve gains. And as with building muscle, the first key is to approach the process with a plan.",The Culture Code: The Secrets of Highly Successful Groups,Daniel Coyle,[]
Make Sure the Leader Is Vulnerable First and Often:,The Culture Code: The Secrets of Highly Successful Groups,Daniel Coyle,[]
"none carries more power than the moment when a leader signals vulnerability. As Dave Cooper says, I screwed that up are the most important words any leader can say.",The Culture Code: The Secrets of Highly Successful Groups,Daniel Coyle,[]
"Laszlo Bock, former head of People Analytics at Google, recommends that leaders ask their people three questions: What is one thing that I currently do that you’d like me to continue to do? What is one thing that I don’t currently do frequently enough that you think I should do more often? What can I do to make you more effective?",The Culture Code: The Secrets of Highly Successful Groups,Daniel Coyle,[]
"A key rule of BrainTrusts is that the team is not allowed to suggest solutions, only to highlight problems. This rule maintains the project leaders’ ownership of the task, and helps prevent them from assuming a passive, order-taking role.",The Culture Code: The Secrets of Highly Successful Groups,Daniel Coyle,[]
Make the Leader Occasionally Disappear: Several leaders of successful groups have the habit of leaving the group alone at key moments.,The Culture Code: The Secrets of Highly Successful Groups,Daniel Coyle,[]
"In the first two sections of this book we’ve focused on safety and vulnerability. We’ve seen how small signals—You are safe, We share risk here—connect people and enable them to work together as a single entity. But now it’s time to ask: What’s this all for? What are we working toward? When I visited the successful groups, I noticed that whenever they communicated anything about their purpose or their values, they were as subtle as a punch in the nose.",The Culture Code: The Secrets of Highly Successful Groups,Daniel Coyle,[]
"These groups, who by all rights should know what they stand for, devote a surprising amount of time telling their own story, reminding each other precisely what they stand for—then repeating it ad infinitum.",The Culture Code: The Secrets of Highly Successful Groups,Daniel Coyle,[]
"starlings’ cohesion is built on relentless attention to a small set of signals. Basically, each starling tracks the six or seven birds closest to it, sending and receiving cues of direction, speed, acceleration, and distance. That shared habit of intensive, up-close watching, amplified through the flock, allows the group to behave as one. In other words, the reason starling flocks can behave so intelligently has nothing to do with telepathy or magic and everything to do with a simpler ability: to pay focused attention to a small handful of key markers.",The Culture Code: The Secrets of Highly Successful Groups,Daniel Coyle,[]
"High-purpose environments are filled with small, vivid signals designed to create a link between the present moment and a future ideal. They provide the two simple locators that every navigation process requires: Here is where we are and Here is where we want to go. The surprising thing, from a scientific point of view, is how responsive we are to this pattern of signaling.",The Culture Code: The Secrets of Highly Successful Groups,Daniel Coyle,[]
"It’s called mental contrasting, and it seems less like science than the kind of advice you might come across on a late-night infomercial: Envision a reachable goal, and envision the obstacles. The thing is, as Oettingen discovered, this method works, triggering significant changes in behavior and motivation.",The Culture Code: The Secrets of Highly Successful Groups,Daniel Coyle,[]
"Oettingen’s work doesn’t line up with how we normally think about motivation and goals. We normally think about them as being intrinsic to a person. People are either motivated or they’re not; accordingly, we describe motivation with terms like desire or heart. But in these experiments, motivation is not a possession but rather the result of a two-part process of channeling your attention: Here’s where you’re at and Here’s where you want to go.",The Culture Code: The Secrets of Highly Successful Groups,Daniel Coyle,[]
What matters is establishing this link and consistently creating engagement around it. What matters is telling the story.,The Culture Code: The Secrets of Highly Successful Groups,Daniel Coyle,[]
