quoteText,bookTitle,bookAuthor,tags
"It is more important that milestones be sharp-edged and unambiguous than that they be easily verifiable by the boss. Rarely will a man lie about milestone progress, if the milestone is so sharp that he can't deceive himself. But if the milestone is fuzzy, the boss often understands a different report from that which the man gives. To supplement Sophocles, no one enjoys bearing bad news, either, so it gets softened without any real intent to deceive.",The Mythical Man-Month: Essays on Software Engineering,Frederick P. Brooks Jr.,[]
"Lehman and Belady have studied the history of successive releases in a large operating system.[6] They find that the total number of modules increases linearly with release number, but that the number of modules affected increases exponentially with release number. All repairs tend to destroy the structure, to increase the entropy and disorder of the system. Less and less effort is spent on fixing original design flaws; more and more is spent on fixing flaws introduced by earlier fixes. As time passes, the system becomes less and less well-ordered. Sooner or later the fixing ceases to gain any ground. Each forward step is matched by a backward one. Although in principle usable forever, the system has worn out as a base for progress. Furthermore, machines change, configurations change, and user requirements change, so the system is not in fact usable forever. A brand-new, from-the-ground-up redesign is necessary.",The Mythical Man-Month: Essays on Software Engineering,Frederick P. Brooks Jr.,[]
"I believe the hard part of building software to be the specification, design, and testing of this conceptual construct, not the labor of representing it and testing the fidelity of the representation. We still make syntax errors, to be sure; but they are fuzz compared to the conceptual errors in most systems. If this is true, building software will always be hard. There is inherently no silver bullet.",The Mythical Man-Month: Essays on Software Engineering,Frederick P. Brooks Jr.,[]
"the disaster is due to termites, not tornadoes; and the schedule has slipped imperceptibly but inexorably.",The Mythical Man-Month: Essays on Software Engineering,Frederick P. Brooks Jr.,[]
"It seems that in all fields, however, the jobs where things get done never have formal authority commensurate with responsibility.",The Mythical Man-Month: Essays on Software Engineering,Frederick P. Brooks Jr.,[]
Buy versus build. The most radical possible solution for constructing software is not to construct it at all.,The Mythical Man-Month: Essays on Software Engineering,Frederick P. Brooks Jr.,[]
"The opportunity to be creative and inventive in implementation is not significantly diminished by working within a given external specification, and the order of creativity may even be enhanced by that discipline.",The Mythical Man-Month: Essays on Software Engineering,Frederick P. Brooks Jr.,[]
"Even at a cost of $100,000, a purchased piece of software is costing only about as much as one programmer-year. And delivery is immediate! Immediate at least for products that really exist, products whose developer can refer the prospect to a happy user. Moreover, such products tend to be much better documented and somewhat better maintained than homegrown software. The development of the mass market is, I believe, the most profound long-run trend in software engineering. The cost of software has always been development cost, not replication cost. Sharing that cost among even a few users radically cuts the per-user cost. Another way of looking at it is that the use of n copies of a software system effectively multiplies the productivity of its developers by n. That is an enhancement of the productivity of the discipline and of the nation.",The Mythical Man-Month: Essays on Software Engineering,Frederick P. Brooks Jr.,[]
"The big change has been in the hardware/software cost ratio. The buyer of a $2-million machine in 1960 felt that he could afford $250,000 more for a customized payroll program, one that slipped easily and nondisruptively into the computer-hostile social environment. Buyers of $50,000 office machines today cannot conceivably afford customized payroll programs; so they adapt their payroll procedures to the packages available.",The Mythical Man-Month: Essays on Software Engineering,Frederick P. Brooks Jr.,[]
"Therefore the most important function that software builders do for their clients is the iterative extraction and refinement of the product requirements. For the truth is, the clients do not know what they want. They usually do not know what questions must be answered, and they almost never have thought of the problem in the detail that must be specified. Even the simple answer—""Make the new software system work like our old manual information-processing system""—is in fact too simple. Clients never want exactly that. Complex software systems are, moreover, things that act, that move, that work. The dynamics of that action are hard to imagine. So in planning any software activity, it is necessary to allow for an extensive iteration between the client and the designer as part of the system definition.",The Mythical Man-Month: Essays on Software Engineering,Frederick P. Brooks Jr.,[]
"If, as I believe, the conceptual structures we construct today are too complicated to be accurately specified in advance, and too complex to be built faultlessly, then we must take a radically different approach. Let us turn to nature and study complexity in living things, instead of just the dead works of man. Here we find constructs whose complexities thrill us with awe. The brain alone is intricate beyond mapping, powerful beyond imitation, rich in diversity, self-protecting, and self-renewing. The secret is that it is grown, not built. So it must be with our software systems. Some years ago Harlan Mills proposed that any software system should be grown by incremental development.[11] That is, the system should first be made to run, even though it does nothing useful except call the proper set of dummy subprograms. Then, bit by bit it is fleshed out, with the subprograms in turn being developed into actions or calls to empty stubs in the level below. I have seen the most dramatic results since I began urging this technique on the project builders in my software engineering laboratory class. Nothing in the past decade has so radically changed my own practice, or its effectiveness. The approach necessitates top-down design, for it is a top-down growing of the software. It allows easy backtracking. It lends itself to early prototypes. Each added function and new provision for more complex data or circumstances grows organically out of what is already there. The morale effects are startling. Enthusiasm jumps when there is a running system, even a simple one. Efforts redouble when the first picture from a new graphics software system appears on the screen, even if it is only a rectangle. One always has, at every stage in the process, a working system. I find that teams can grow much more complex entities in four months than they can build.",The Mythical Man-Month: Essays on Software Engineering,Frederick P. Brooks Jr.,[]
"I have long enjoyed asking candidate programmers, ""Where is next November?"" If the question is too cryptic, then, ""Tell me about your mental model of the calendar."" The really good programmers have strong spatial senses; they usually have geometric models of time; and they quite often understand the first question without elaboration. They have highly individualistic models.",The Mythical Man-Month: Essays on Software Engineering,Frederick P. Brooks Jr.,[]
"Power tools for the mind. The most dramatic way to improve the productivity of management information systems (MIS) programmers is to go down to your local computer store and buy off the shelf what they would have built. This is not ridiculous; the availability of cheap, powerful shrink-wrapped software has met many needs that formerly would have occasioned custom packages. These power tools for the mind are more like electric drills, saws, and sanders than they are like big complex production tools.",The Mythical Man-Month: Essays on Software Engineering,Frederick P. Brooks Jr.,[]
Any product that is sufficiently big or urgent to require the effort of many minds thus encounters a peculiar difficulty: the result must be conceptually coherent to the single mind of the user and at the same time designed by many minds.,The Mythical Man-Month: Essays on Software Engineering,Frederick P. Brooks Jr.,[]
"The success of the scaling-up process depends upon the fact that the conceptual integrity of each piece has been radically improved—that the number of minds determining the design has been divided by seven. So it is possible to put 200 people on a problem and face the problem of coordinating only 20 minds, those of the surgeons. For that coordination problem, however, separate techniques must be used, and these are discussed in succeeding chapters. Let it suffice here to say that the entire system also must have conceptual integrity, and that requires a system architect to design it all, from the top down. To make that job manageable, a sharp distinction must be made between architecture and implementation, and the system architect must confine himself scrupulously to architecture.",The Mythical Man-Month: Essays on Software Engineering,Frederick P. Brooks Jr.,[]
"Third, enumerating the frequencies explicitly helps everyone recognize which decisions depend upon which user set properties. Even this sort of informal sensitivity analysis is valuable. When it develops that very important decisions are hinging on some particular guess, then it is worth the cost to establish better estimates for that value.",The Mythical Man-Month: Essays on Software Engineering,Frederick P. Brooks Jr.,[]
To summarize: write down explicit guesses for the attributes of the user set. It is far better to be explicit and wrong than to be vague.,The Mythical Man-Month: Essays on Software Engineering,Frederick P. Brooks Jr.,[]
"I will contend that conceptual integrity is the most important consideration in system design. It is better to have a system omit certain anomalous features and improvements, but to reflect one set of design ideas, than to have one that contains many good but independent and uncoordinated ideas.",The Mythical Man-Month: Essays on Software Engineering,Frederick P. Brooks Jr.,[]
"Indeed, the cost-performance ratio of the product will depend most heavily on the implementer, just as ease of use depends most heavily on the architect.",The Mythical Man-Month: Essays on Software Engineering,Frederick P. Brooks Jr.,[]
"it sprang from a conviction that the quality of the people on a project, and their organization and management, are much more important factors in success than are the tools they use or the technical approaches they take. Subsequent researches have supported that conviction. Boehm's COCOMO model finds that the quality of the team is by far the largest factor in its success, indeed four times more potent than the next largest factor.",The Mythical Man-Month: Essays on Software Engineering,Frederick P. Brooks Jr.,[]
"Conceptual integrity does require that a system reflect a single philosophy and that the specification as seen by the user flow from a few minds. Because of the real division of labor into architecture, implementation, and realization, however, this does not imply that a system so designed will take longer to build. Experience shows the opposite, that the integral system goes together faster and takes less time to test. In effect, a widespread horizontal division of labor has been sharply reduced by a vertical division of labor, and the result is radically simplified communications and improved conceptual integrity.",The Mythical Man-Month: Essays on Software Engineering,Frederick P. Brooks Jr.,[]
"The large organization will consist of many semi-autonomous units, which we may call quasi-firms. Each of them will have a large amount of freedom, to give the greatest possible chance to creativity and entrepreneurship. . . . Each quasi-firm must have both a profit and loss account, and a balance sheet.",The Mythical Man-Month: Essays on Software Engineering,Frederick P. Brooks Jr.,[]
"The computer has brought a similar fluidity to many other media: artistic drawings, building plans, mechanical drawings, musical compositions, photographs, video sequences, slide presentations, multimedia works, and even to spreadsheets. In each case, the manual method of production required recopying the bulky unchanged parts in order to see changes in context. Now we enjoy for each medium the same benefits that time-sharing brought to software creation—the ability to revise and to assess instantly the effect without losing one's train of thought.",The Mythical Man-Month: Essays on Software Engineering,Frederick P. Brooks Jr.,[]
"Radically better software robustness and productivity are to be had only by moving up a level, and making programs by the composition of modules, or objects. An especially promising trend is the use of mass-market packages as the platforms on which richer and more customized products are built. A truck-tracking system is built on a shrink-wrapped database and communications package; so is a student information system. The want ads in computer magazines offer hundreds of Hypercard stacks and customized templates for Excel, dozens of special functions in Pascal for MiniCad or functions in AutoLisp for AutoCad.",The Mythical Man-Month: Essays on Software Engineering,Frederick P. Brooks Jr.,[]
"This really does attack essence. Because the build-on-package phenomenon does not today affect the average MIS programmer, it is not yet very visible to the software engineering discipline. Nevertheless, it will grow rapidly, because it does attack the essence of fashioning conceptual constructs. The shrink-wrapped package provides a big module of function, with an elaborate but proper interface, and its internal conceptual structure does not have to be designed at all. High-function software products such as Excel or 4th Dimension are big modules indeed, but they serve as known, documented, tested modules with which to build customized systems. Next-level application builders get richness of function, a shorter development time, a tested component, better documentation, and radically lower cost. The difficulty, of course, is that the shrink-wrapped software package is designed as a stand-alone entity whose functions and interfaces metaprogrammers cannot change. Moreover, and more seriously, shrink-wrapped package builders seemingly have little incentive to make their products suitable as modules in a larger system. I",The Mythical Man-Month: Essays on Software Engineering,Frederick P. Brooks Jr.,[]
"The metaprogrammer who uses one, or especially several, applications as components in a larger system. This is the user whose needs are poorly met today. This is also the use which promises substantial effectiveness gains in building new applications.",The Mythical Man-Month: Essays on Software Engineering,Frederick P. Brooks Jr.,[]
"The programmer at wit's end for lack of space can often do best by disentangling himself from his code, rearing back, and contemplating his data. Representation is the essence of programming.",The Mythical Man-Month: Essays on Software Engineering,Frederick P. Brooks Jr.,[]
"I believe that large programming projects suffer management problems different in kind from small ones, due to division of labor. I believe the critical need to be the preservation of the conceptual integrity of the product itself.",The Mythical Man-Month: Essays on Software Engineering,Frederick P. Brooks Jr.,[]
"And so from a statistical mechanical model, Belady and Lehman arrive for programming-systems at a more general conclusion supported by the experience of all the earth. ""Things are always at their best in the beginning,"" said Pascal. C. S.",The Mythical Man-Month: Essays on Software Engineering,Frederick P. Brooks Jr.,[]
"And so from a statistical mechanical model, Belady and Lehman arrive for programming-systems at a more general conclusion supported by the experience of all the earth. ""Things are always at their best in the beginning,"" said Pascal.",The Mythical Man-Month: Essays on Software Engineering,Frederick P. Brooks Jr.,[]
"Finally, there is the delight of working in such a tractable medium. The programmer, like the poet, works only slightly removed from pure thought-stuff. He builds his castles in the air, from air, creating by exertion of the imagination. Few media of creation are so flexible, so easy to polish and rework, so readily capable of realizing grand conceptual structures. (As we shall see later, this very tractability has its own problems.) Yet the program construct, unlike the poet's words, is real in the sense that it moves and works, producing visible outputs separate from the construct itself. It prints results, draws pictures, produces sounds, moves arms. The magic of myth and legend has come true in our time. One types the correct incantation on a keyboard, and a display screen comes to life, showing things that never were nor could be.",The Mythical Man-Month: Essays on Software Engineering,Frederick P. Brooks Jr.,[]
the conceptual integrity of a system determines its ease of use.,The Mythical Man-Month: Essays on Software Engineering,Frederick P. Brooks Jr.,[]
"Fifth, when schedule slippage is recognized, the natural (and traditional) response is to add manpower. Like dousing a fire with gasoline, this makes matters worse, much worse. More fire requires more gasoline, and thus begins a regenerative cycle which ends in disaster.",The Mythical Man-Month: Essays on Software Engineering,Frederick P. Brooks Jr.,[]
"Nothing even convincing, much less exciting, has yet emerged from such efforts. I am persuaded that nothing will.",The Mythical Man-Month: Essays on Software Engineering,Frederick P. Brooks Jr.,[]
"Oversimplifying outrageously, we state Brooks's Law: Adding manpower to a late software project makes it later. This then is the demythologizing of the man-month. The number of months of a project depends upon its sequential constraints. The maximum number of men depends upon the number of independent subtasks. From these two quantities one can derive schedules using fewer men and more months.",The Mythical Man-Month: Essays on Software Engineering,Frederick P. Brooks Jr.,[]
"For it to be successful, the architect must • remember that the builder has the inventive and creative responsibility for the implementation; so the architect suggests, not dictates; • always be prepared to suggest a way of implementing anything he specifies, and be prepared to accept any other way that meets the objectives as well; • deal quietly and privately in such suggestions; • be ready to forego credit for suggested improvements. Normally the builder will counter by suggesting changes to the architecture. Often he is right—some minor feature may have unexpectedly large costs when the implementation is worked out.",The Mythical Man-Month: Essays on Software Engineering,Frederick P. Brooks Jr.,[]
"The manual, or written specification, is a necessary tool, though not a sufficient one. The manual is the external specification of the product. It describes and prescribes every detail of what the user sees.",The Mythical Man-Month: Essays on Software Engineering,Frederick P. Brooks Jr.,[]
"The manual, or written specification, is a necessary tool, though not a sufficient one. The manual is the external specification of the product. It describes and prescribes every detail of what the user sees. As such, it is the chief product of the architect.",The Mythical Man-Month: Essays on Software Engineering,Frederick P. Brooks Jr.,[]
"The programmed computer has all the fascination of the pinball machine or the jukebox mechanism, carried to the ultimate. Fourth",The Mythical Man-Month: Essays on Software Engineering,Frederick P. Brooks Jr.,[]
"The brain alone is intricate beyond mapping, powerful beyond imitation, rich in diversity, self-protecting, and self-renewing. The secret is that it is grown, not built. So it must be with our software systems.",The Mythical Man-Month: Essays on Software Engineering,Frederick P. Brooks Jr.,[]
"Observe that for the programmer, as for the chef, the urgency of the patron may govern the scheduled completion of the task, but it cannot govern the actual completion. An omelette, promised in two minutes, may appear to be progressing nicely. But when it has not set in two minutes, the customer has two choices—wait or eat it raw. Software customers have had the same choices. The",The Mythical Man-Month: Essays on Software Engineering,Frederick P. Brooks Jr.,[]
"Fostering a total-system, user-oriented attitude may well be the most important function of the programming manager.",The Mythical Man-Month: Essays on Software Engineering,Frederick P. Brooks Jr.,[]
"Hustle provides the cushion, the reserve capacity, that enables a team to cope with routine mishaps, to anticipate and forfend minor calamities. The calculated response, the measured effort, are the wet blankets that dampen hustle. As we have seen, one must get excited about a one-day slip. Such are the elements of catastrophe.",The Mythical Man-Month: Essays on Software Engineering,Frederick P. Brooks Jr.,[]
"A computer program is a message from a man to a machine. The rigidly marshaled syntax and the scrupulous definitions all exist to make intention clear to the dumb engine. But a written program has another face, that which tells its story to the human user. For even the most private of programs, some such communication is necessary; memory will fail the author-user, and he will require refreshing on the details of his handiwork. How much more vital is the documentation for a public program, whose user is remote from the author in both time and space! For the program product, the other face to the user is fully as important as the face to the machine. Most of us have quietly excoriated the remote and anonymous author of some skimpily documented program. And many of us have therefore tried to instill in new programmers an attitude about documentation that would inspire for a lifetime, overcoming sloth and schedule pressure. By and large we have failed. I think we have used wrong methods.",The Mythical Man-Month: Essays on Software Engineering,Frederick P. Brooks Jr.,[]
"Second, our estimating techniques fallaciously confuse effort with progress, hiding the assumption that men and months are interchangeable.",The Mythical Man-Month: Essays on Software Engineering,Frederick P. Brooks Jr.,[]
"Cosgrove has perceptively pointed out that the programmer delivers satisfaction of a user need rather than any tangible product. And both the actual need and the user's perception of that need will change as programs are built, tested, and used.[3]",The Mythical Man-Month: Essays on Software Engineering,Frederick P. Brooks Jr.,[]
"Very good professional programmers are ten times as productive as poor ones, at same training and two-year experience level.",The Mythical Man-Month: Essays on Software Engineering,Frederick P. Brooks Jr.,[]
"The industry is changing now, as many small companies are being acquired by larger ones. It remains to be seen if the larger acquirers will understand the importance of preserving the creativity of smallness.",The Mythical Man-Month: Essays on Software Engineering,Frederick P. Brooks Jr.,[]
"This great church is an incomparable work of art. There is neither aridity nor confusion in the tenets it sets forth. . . . It is the zenith of a style, the work of artists who had understood and assimilated all their predecessors' successes, in complete possession of the techniques of their times, but using them without indiscreet display nor gratuitous feats of skill. It was Jean d'Orbais who undoubtedly conceived the general plan of the building, a plan which was respected, at least in its essential elements, by his successors. This is one of the reasons for the extreme coherence and unity of the edifice. —REIMS CATHEDRAL GUIDEBOOK[1] Conceptual",The Mythical Man-Month: Essays on Software Engineering,Frederick P. Brooks Jr.,[]
"Ease of use is enhanced only if the time gained in functional specification exceeds the time lost in learning, remembering, and searching manuals.",The Mythical Man-Month: Essays on Software Engineering,Frederick P. Brooks Jr.,[]
conceptual integrity of a system determines its ease of use. Good features and ideas that do not integrate with a system's basic concepts are best left out.,The Mythical Man-Month: Essays on Software Engineering,Frederick P. Brooks Jr.,[]
"Another important set of new ideas for designing the bugs out of programs derives largely from Dijkstra,[3] and is built on a theoretical structure by B öhm and Jacopini.[4] Basically the approach is to design programs whose control structures consist only of loops defined by a statement such as DO WHILE, and conditional portions delineated into groups of statements marked with brackets and conditioned by an IF . . . THEN . . . ELSE. B öhm and Jacopini show these structures to be theoretically sufficient; Dijkstra argues that the alternative, unrestrained branching via GO TO, produces structures that lend themselves to logical errors. The basic notion is surely sound.",The Mythical Man-Month: Essays on Software Engineering,Frederick P. Brooks Jr.,[]
"Falkoff, A. D., K. E. Iverson, E. H. Sussenguth, ""A formal description of System/360,"" IBM Systems Journal, 3, 3 (1964), pp. 198–261.",The Mythical Man-Month: Essays on Software Engineering,Frederick P. Brooks Jr.,[]
