quoteText,bookTitle,bookAuthor,tags
"First, writing the decisions down is essential. Only when one writes do the gaps appear and the inconsistencies protrude. The act of writing turns out to require hundreds of mini-decisions, and it is the existence of these that distinguishes clear, exact policies from fuzzy ones. Second, the documents will communicate the decisions to others. The manager will be continually amazed that policies he took for common knowledge are totally unknown by some member of his team. Since his fundamental job is to keep everybody going in the same direction, his chief daily task will be communication, not decision-making, and his documents will immensely lighten this load.",The Mythical Man-Month: Essays on Software Engineering,Frederick P. Brooks Jr.,[]
"But for any particular set of options, a more monolithic program would take less space. It's rather like a car; if the map light, cigarette lighter, and clock are priced together as a single option, the package will cost less than if one can choose each separately.",The Mythical Man-Month: Essays on Software Engineering,Frederick P. Brooks Jr.,[]
"The magic of myth and legend has come true in our time. One types the correct incantation on a keyboard, and a display screen comes to life, showing things that never were nor could be.",The Mythical Man-Month: Essays on Software Engineering,Frederick P. Brooks Jr.,[]
testing is usually the most mis-scheduled part of programming.,The Mythical Man-Month: Essays on Software Engineering,Frederick P. Brooks Jr.,[]
The number of months of a project depends upon its sequential constraints. The maximum number of men depends upon the number of independent subtasks.,The Mythical Man-Month: Essays on Software Engineering,Frederick P. Brooks Jr.,[]
"Good cooking takes time. If you are made to wait, it is to serve you better, and to please you.",The Mythical Man-Month: Essays on Software Engineering,Frederick P. Brooks Jr.,[]
The means by which communication is obviated are division of labor and specialization of function. The tree-like structure of organizations reflects the diminishing need for detailed communication when division and specialization of labor are applied,The Mythical Man-Month: Essays on Software Engineering,Frederick P. Brooks Jr.,[]
"Now I do not think software managers have less inherent courage and firmness than chefs, nor than other engineering managers. But false scheduling to match the patron's desired date is much more common in our discipline than elsewhere in engineering. It is very difficult to make a vigorous, plausible, and job-risking defense of an estimate that is derived by no quantitative method, supported by little data, and certified chiefly by the hunches of the managers. Clearly",The Mythical Man-Month: Essays on Software Engineering,Frederick P. Brooks Jr.,[]
"Communication and its consequent, organization, are critical for success. The techniques of communication and organization demand from the manager much thought and as much experienced competence as the software technology itself.",The Mythical Man-Month: Essays on Software Engineering,Frederick P. Brooks Jr.,[]
