quoteText,bookTitle,bookAuthor,tags
"Adding manpower to a late software project, makes it later.",The Mythical Man-Month: Essays on Software Engineering,Frederick P. Brooks Jr.,[]
"Systems program building is an entropy-decreasing process, hence inherently metastable. Program maintenance is an entropy-increasing process, and even its most skillful execution only delays the subsidence of the system into unfixable obsolescence.",The Mythical Man-Month: Essays on Software Engineering,Frederick P. Brooks Jr.,[]
"As time passes, the system becomes less and less well-ordered. Sooner or later the fixing cease to gain any ground. Each forward step is matched by a backward one. Although in principle usable forever, the system has worn out as a base for progress. ...A brand-new, from-the-ground-up redesign is necessary.",The Mythical Man-Month: Essays on Software Engineering,Frederick P. Brooks Jr.,[]
"The general tendency is to over-design the second system, using all the ideas and frills that were cautiously sidetracked on the first one.",The Mythical Man-Month: Essays on Software Engineering,Frederick P. Brooks Jr.,[]
"A baseball manager recognizes a nonphysical talent, hustle, as an essential gift of great players and great teams. It is the characteristic of running faster than necessary, moving sooner than necessary, trying harder than necessary. It is essential for great programming teams, too.",The Mythical Man-Month: Essays on Software Engineering,Frederick P. Brooks,['management']
"The management question, therefore, is not whether to build a pilot system and throw it away. You will do that. The only question is whether to plan in advance to build a throwaway, or to promise to deliver the throwaway to customers.",The Mythical Man-Month: Essays on Software Engineering,Frederick P. Brooks Jr.,[]
"The programmer, like the poet, works only slightly removed from pure thought-stuff. He builds his castles in the air, from air, creating by exertion of the imagination.",The Mythical Man-Month: Essays on Software Engineering,Frederick P. Brooks Jr.,[]
"Einstein repeatedly argued that there must be simplified explanations of nature, because God is not capricious or arbitrary. No such faith comforts the software engineer.",The Mythical Man-Month: Essays on Software Engineering,Frederick P. Brooks Jr.,"['brooks', 'einstein', 'programming', 'software-development', 'software-engineering']"
Men and months are interchangeable commodities only when a task can be partitioned among many workers with no communication among them (Fig. 2.1). This is true of reaping wheat or picking cotton; it is not even approximately true of systems programming.,The Mythical Man-Month: Essays on Software Engineering,Frederick P. Brooks Jr.,[]
"For the human makers of things, the incompletenesses and inconsistencies of our ideas become clear only during implementation.",The Mythical Man-Month: Essays on Software Engineering,Frederick P. Brooks Jr.,[]
The challenge and the mission are to find real solutions to real problems on actual schedules with available resources.,The Mythical Man-Month: Essays on Software Engineering,Frederick P. Brooks Jr.,[]
A basic principle of data processing teaches the folly of trying to maintain independent files in synchonism.,The Mythical Man-Month: Essays on Software Engineering,Frederick Phillips Brooks,"['architecture', 'documentation', 'maintenance']"
"By documenting a design, the designer exposes himself to the criticisms of everyone, and he must be able to defend everything he writes. If the organizational structure is threatening in any way, nothing is going to be documented until it is completely defensible.",The Mythical Man-Month: Essays on Software Engineering,Frederick P. Brooks Jr.,[]
"An omelette, promised in two minutes, may appear to be progressing nicely. But when it has not set in two minutes, the customer has two choices—wait or eat it raw. Software customers have had the same choices. The cook has another choice; he can turn up the heat. The result is often an omelette nothing can save—burned in one part, raw in another.",The Mythical Man-Month: Essays on Software Engineering,Frederick P. Brooks Jr.,[]
Organizations which design systems are constrained to produce systems which are copies of the communication structures of these organizations.,The Mythical Man-Month: Essays on Software Engineering,Frederick P. Brooks Jr.,[]
"Conceptual integrity in turn dictates that the design must proceed from one mind, or from a very small number of agreeing resonant minds.",The Mythical Man-Month: Essays on Software Engineering,Frederick P. Brooks Jr.,[]
Adding manpower to a late software project makes it later.,The Mythical Man-Month: Essays on Software Engineering,Frederick P. Brooks Jr.,[]
"In fact, flow charting is more preached than practiced. I have never seen an experienced programmer who routinely made detailed flow charts before beginning to write programs",The Mythical Man-Month: Essays on Software Engineering,Frederick P. Brooks Jr.,[]
"Today I am more convinced than ever. Conceptual integrity is central to product quality. Having a system architect is the most important single step toward conceptual integrity. These principles are by no means limited to software systems, but to the design of any complex construct, whether a computer, an airplane, a Strategic Defense Initiative, a Global Positioning System. After teaching a software engineering laboratory more than 20 times, I came to insist that student teams as small as four people choose a manager and a separate architect. Defining distinct roles in such small teams may be a little extreme, but I have observed it to work well and to contribute to design success even for small teams.",The Mythical Man-Month: Essays on Software Engineering,Frederick P. Brooks Jr.,['software-development']
"Adjusting to the requirement for perfection is, I think, the most difficult part of learning to program.",The Mythical Man-Month: Essays on Software Engineering,Frederick P. Brooks Jr.,[]
"Observe that for the programmer, as for the chef, the urgency of the patron may govern the scheduled completion of the task, but it cannot govern the actual completion.",The Mythical Man-Month: Essays on Software Engineering,Frederick P. Brooks Jr.,[]
"Study after study shows that the very best designers produce structures that are faster, smaller, simpler, cleaner, and produced with less effort. The differences between the great and the average approach an order of magnitude.",The Mythical Man-Month: Essays on Software Engineering,Frederick P. Brooks Jr.,[]
"...give a great deal of attention to keeping his managers and his technical people as interchangeable as their talents allow. The barriers are sociological... To overcome this problem some laboratories, such as Bell Labs, abolish all job titles. Each professional employee is a ""member of technical staff.",The Mythical Man-Month: Essays on Software Engineering,Frederick P. Brooks Jr.,['definitive']
"Architecture must be carefully distinguished from implementation. As Blaauw has said, ""Where architecture tells what happens, implementation tells how it is made to happen.",The Mythical Man-Month: Essays on Software Engineering,Frederick P. Brooks Jr.,[]
How does a project get to be a year late? . . . . One day at a time.,The Mythical Man-Month: Essays on Software Engineering,Frederick P. Brooks Jr.,[]
"First, one must perform perfectly. The computer resembles the magic of legend in this respect, too. If one character, one pause, of the incantation is not strictly in proper form, the magic doesn't work. Human beings are not accustomed to being perfect, and few areas of human activity demand it. Adjusting to the requirement for perfection is, I think, the most difficult part of learning to program.[1]",The Mythical Man-Month: Essays on Software Engineering,Frederick P. Brooks Jr.,[]
"Because ease of use is the purpose, this ratio of function to conceptual complexity is the ultimate test of system design. Neither function alone nor simplicity alone defines a good design. This point is widely misunderstood. Operating System/360 is hailed by its builders as the finest ever built, because it indisputably has the most function. Function, and not simplicity, has always been the measure of excellence for its designers. On the other hand, the Time-Sharing System for the PDP-10 is hailed by its builders as the finest, because of its simplicity and the spareness of its concepts. By any measure, however, its function is not even in the same class as that of OS/360. As soon as ease of use is held up as the criterion, each of these is seen to be unbalanced, reaching for only half of the true goal.",The Mythical Man-Month: Essays on Software Engineering,Frederick P. Brooks Jr.,[]
"By the architecture of a system, I mean the complete and detailed specification of the user interface. For a computer this is the programming manual. For a compiler it is the language manual. For a control program it is the manuals for the language or languages used to invoke its functions. For the entire system it is the union of the manuals the user must consult to do his entire job. The architect of a system, like the architect of a building, is the user's agent. It is his job to bring professional and technical knowledge to bear in the unalloyed interest of the user, as opposed to the interests of the salesman, the fabricator, etc.[2] Architecture must be carefully distinguished from implementation. As Blaauw has said, ""Where architecture tells what happens, implementation tells how it is made to happen.""[3] He gives as a simple example a clock, whose architecture consists of the face, the hands, and the winding knob. When a child has learned this architecture, he can tell time as easily from a wristwatch as from a church tower. The implementation, however, and its realization, describe what goes on inside the case—powering by any of many mechanisms and accuracy control by any of many.",The Mythical Man-Month: Essays on Software Engineering,Frederick P. Brooks Jr.,[]
"An architect's first work is apt to be spare and clean. He knows he doesn't know what he's doing, so he does it carefully and with great restraint.",The Mythical Man-Month: Essays on Software Engineering,Frederick P. Brooks Jr.,[]
"Peopleware. A major contribution during recent years has been DeMarco and Lister's 1987 book, Peopleware: Productive Projects and Teams. Its underlying thesis is that ""The major problems of our work are not so much technological as sociological in nature."" It abounds with gems such as, ""The manager's function is not to make people work, it is to make it possible for people to work."" It deals with such mundane topics as space, furniture, team meals together. DeMarco and Lister provide real data from their Coding War Games that show stunning correlation between performances of programmers from the same organization, and between workplace characteristics and both productivity and defect levels. The top performers' space is quieter, more private, better protected against interruption, and there is more of it. . . . Does it really matter to you . . . whether quiet, space, and privacy help your current people to do better work or [alternatively] help you to attract and keep better people?[19]",The Mythical Man-Month: Essays on Software Engineering,Frederick P. Brooks Jr.,[]
"Conway's Law predicts: ""Organizations which design systems are constrained to produce systems which are copies of the communication structures of these organizations.""[1] Conway goes on to point out that the organization chart will initially reflect the first system design, which is almost surely not the right one. If the system design is to be free to change, the organization must be prepared to change.",The Mythical Man-Month: Essays on Software Engineering,Frederick P. Brooks Jr.,[]
"Years later, when I got to college, I learned about an important theory of psychology called Learned Helplessness, developed by Dr. Martin E. P. Seligman. This theory, backed up by years of research, is that a great deal of depression grows out of a feeling of helplessness: the feeling that you cannot control your environment.",The Mythical Man-Month: Essays on Software Engineering,Frederick P. Brooks Jr.,['software-development']
"When a child has learned this architecture, he can tell time as easily from a wristwatch as from a church tower.",The Mythical Man-Month: Essays on Software Engineering,Frederick P. Brooks Jr.,[]
"Program maintenance involves no cleaning, lubrication, or repair of deterioration. It consists chiefly of changes that repair design defects. Much more often than with hardware, these changes include added functions. Usually they are visible to the user. The total cost of maintaining a widely used program is typically 40 percent or more of the cost of developing it. Surprisingly, this cost is strongly affected by the number of users. More users find more bugs.",The Mythical Man-Month: Essays on Software Engineering,Frederick P. Brooks Jr.,[]
"Any attempt to fix it with minimum effort will repair the local and obvious, but unless the structure is pure or the documentation very fine, the far-reaching effects of the repair will be overlooked. Second, the repairer is usually not the man who wrote the code, and often he is a junior programmer or trainee.",The Mythical Man-Month: Essays on Software Engineering,Frederick P. Brooks Jr.,[]
"It is more important that milestones be sharp-edged and unambiguous than that they be easily verifiable by the boss. Rarely will a man lie about milestone progress, if the milestone is so sharp that he can't deceive himself. But if the milestone is fuzzy, the boss often understands a different report from that which the man gives.",The Mythical Man-Month: Essays on Software Engineering,Frederick P. Brooks Jr.,[]
"Reducing the role conflict. The boss must first distinguish between action information and status information. He must discipline himself not to act on problems his managers can solve, and never to act on problems when he is explicitly reviewing status.",The Mythical Man-Month: Essays on Software Engineering,Frederick P. Brooks Jr.,[]
"Digital computers are themselves more complex than most things people build; they have very large numbers of states. This makes conceiving, describing, and testing them hard. Software systems have orders of magnitude more states than computers do. Likewise, a scaling-up of a software entity is not merely a repetition of the same elements in larger size; it is necessarily an increase in the number of different elements. In most cases, the elements interact with each other in some nonlinear fashion, and the complexity of the whole increases much more than linearly. The complexity of software is an essential property, not an accidental one.",The Mythical Man-Month: Essays on Software Engineering,Frederick P. Brooks Jr.,[]
More software projects have gone awry for lack of calendar time than for all other causes combined.,The Mythical Man-Month: Essays on Software Engineering,Frederick P. Brooks Jr.,[]
Why is programming fun? What delights may its practitioner expect as his reward?,The Mythical Man-Month: Essays on Software Engineering,Frederick P. Brooks Jr.,"['code', 'development', 'programming', 'software']"
"To only a fraction of the human race does God give the privilege of earning one's bread doing what one would have gladly pursued free, for passion. I am very thankful.",The Mythical Man-Month: Essays on Software Engineering,Frederick P. Brooks Jr.,[]
Simplicity and straightforwardness proceed from conceptual integrity.,The Mythical Man-Month: Essays on Software Engineering,Frederick P. Brooks Jr.,[]
"For the human makers of things, the incompletenesses and inconsistencies of our ideas become clear only during implementation. Thus it is that writing, experimentation, ""working out"" are essential disciplines for the theoretician.",The Mythical Man-Month: Essays on Software Engineering,Frederick P. Brooks Jr.,[]
"Especially noteworthy is his comment that new people added late in a development project must be team players willing to pitch in and work within the process, and not attempt to alter or improve the process itself!",The Mythical Man-Month: Essays on Software Engineering,Frederick P. Brooks Jr.,[]
Organizations must be designed around the people available; not people fitted into pure-theory organizations.,The Mythical Man-Month: Essays on Software Engineering,Frederick P. Brooks Jr.,['business-advice']
"I believe the hard part of building software to be the specification, design, and testing of this conceptual construct, not the labor of representing it and testing the fidelity of the representation. We still make syntax errors, to be sure; but they are fuzz compared to the conceptual errors in most systems.",The Mythical Man-Month: Essays on Software Engineering,Frederick P. Brooks Jr.,[]
"Parnas argues strongly that the goal of everyone seeing everything is totally wrong; parts should be encapsulated so that no one needs to or is allowed to see the internals of any parts other than his own, but should see only the interfaces. 7.15 Parnas's proposal is a recipe for disaster. [I have been quite convinced otherwise by Parnas, and totally changed my mind.]",The Mythical Man-Month: Essays on Software Engineering,Frederick P. Brooks Jr.,[]
Never go to sea with two chronometers; take one or three.,The Mythical Man-Month: Essays on Software Engineering,Frederick P. Brooks Jr.,[]
Vocabulary learning constitutes no small part of the intellectual barrier to reuse.,The Mythical Man-Month: Essays on Software Engineering,Frederick P. Brooks Jr.,[]
"So far, so good. The problem, however, is how to build things that today take 5000 man-years, not things that take 20 or 30.",The Mythical Man-Month: Essays on Software Engineering,Frederick P. Brooks Jr.,[]
Underestimates do not change significantly during the activity until about three weeks before the scheduled completion.,The Mythical Man-Month: Essays on Software Engineering,Frederick P. Brooks Jr.,[]
"We need research to appropriate for the software reuse problem the large body of knowledge as to how people acquire language. Some of the lessons are immediately obvious: • People learn in sentence contexts, so we need to publish many examples of composed products, not just libraries of parts. • People do not memorize anything but spelling. They learn syntax and semantics incrementally, in context, by use. • People group word composition rules by syntactic classes, not by compatible subsets of objects.",The Mythical Man-Month: Essays on Software Engineering,Frederick P. Brooks Jr.,[]
Extrapolation of times for the hundred-yard dash shows that a man can run a mile in under three minutes.,The Mythical Man-Month: Essays on Software Engineering,Frederick P. Brooks Jr.,[]
"On another project the best engineering manager I ever saw served often as a giant flywheel, his inertia damping the fluctuations that came from market and management people.",The Mythical Man-Month: Essays on Software Engineering,Frederick P. Brooks Jr.,[]
"The hard thing about building software is deciding what to say, not saying it. No facilitation of expression can give more than marginal gains.",The Mythical Man-Month: Essays on Software Engineering,Frederick P. Brooks Jr.,[]
"One can visualize a debugging assistant that offers very generalized suggestions at first, but as more and more system structure is embodied in the rule base, becomes more and more particular in the hypotheses it generates and the tests it recommends.",The Mythical Man-Month: Essays on Software Engineering,Frederick P. Brooks Jr.,[]
"But a written program has another face, that which tells its story to the human user. For even the most private of programs, some such communication is necessary; memory will fail the author-user, and he will require refreshing on the details of his handiwork.",The Mythical Man-Month: Essays on Software Engineering,Frederick P. Brooks Jr.,[]
"The solution, I think, is to merge the files, to incorporate the documentation in the source program. This is at once a powerful incentive toward proper maintenance, and an insurance that the documentation will always be handy to the program user. Such programs are called self-documenting.",The Mythical Man-Month: Essays on Software Engineering,Frederick P. Brooks Jr.,[]
"I do not believe we will find the magic here. Program verification is a very powerful concept, and it will be very important for such things as secure operating system kernels. The technology does not promise, however, to save labor. Verifications are so much work that only a few substantial programs have ever been verified. Program verification does not mean error-proof programs. There is no magic here, either. Mathematical proofs also can be faulty. So whereas verification might reduce the program-testing load, it cannot eliminate it. More seriously, even perfect program verification can only establish that a program meets its specification. The hardest part of the software task is arriving at a complete and consistent specification, and much of the essence of building a program is in fact the debugging of the specification.",The Mythical Man-Month: Essays on Software Engineering,Frederick P. Brooks Jr.,[]
"Adjusting to the requirement for perfection is, I think, the most difficult part of learning to program.[1]",The Mythical Man-Month: Essays on Software Engineering,Frederick P. Brooks Jr.,[]
"The programmer builds from pure thought-stuff: concepts and very flexible representations thereof. Because the medium is tractable, we expect few difficulties in implementation; hence our pervasive optimism. Because our ideas are faulty, we have bugs; hence our optimism is unjustified.",The Mythical Man-Month: Essays on Software Engineering,Frederick P. Brooks Jr.,[]
"Our project had not been under way six months before we hit another problem. The workbook was about five feet thick! If we had stacked up the 100 copies serving programmers in our offices in Manhattan's Time-Life Building, they would have towered above the building itself. Furthermore, the daily change distribution averaged two inches, some 150 pages to be interfiled in the whole. Maintenance of the workbook began to take a significant time from each workday.",The Mythical Man-Month: Essays on Software Engineering,Frederick P. Brooks Jr.,[]
"In the seminal high-tech book The Mythical Man-Month, IBM veteran and computer science professor Frederick Brooks argued that adding manpower to complex software projects actually delayed progress. One reason was that the time and money spent on communication increased in proportion to the number of people on a project.",The Everything Store: Jeff Bezos and the Age of Amazon,Brad Stone,[]
Programming then is fun because it gratifies creative longings built deep within us and delights sensibilities we have in common with all men.,The Mythical Man-Month: Essays on Software Engineering,Frederick P. Brooks Jr.,[]
"On balance I think the microfiche was a very happy mechanism, and I would recommend it over a paper workbook for very large projects.",The Mythical Man-Month: Essays on Software Engineering,Frederick P. Brooks Jr.,[]
"Why Have Formal Documents? First, writing the decisions down is essential. Only when one writes do the gaps appear and the inconsistencies protrude. The act of writing turns out to require hundreds of mini-decisions, and it is the existence of these that distinguishes clear, exact policies from fuzzy ones. Second, the documents will communicate the decisions to others. The manager will be continually amazed that policies he took for common knowledge are totally unknown by some member of his team.",The Mythical Man-Month: Essays on Software Engineering,Frederick P. Brooks Jr.,[]
"If there are n workers on a project, there are (n2–n)/2 interfaces across which there may be communication, and there are potentially almost 2n teams within which coordination must occur. The purpose of organization is to reduce the amount of communication and coordination necessary; hence organization is a radical attack on the communication problems treated above. The means by which communication is obviated are division of labor and specialization of function. The tree-like structure of organizations reflects the diminishing need for detailed communication when division and specialization of labor are applied.",The Mythical Man-Month: Essays on Software Engineering,Frederick P. Brooks Jr.,[]
"Finally, a manager's documents give him a data base and checklist. By reviewing them periodically he sees where he is, and he sees what changes of emphasis or shifts in direction are needed.",The Mythical Man-Month: Essays on Software Engineering,Frederick P. Brooks Jr.,[]
The job done least well by project managers is to utilize the technical genius who is not strong on management talent.,The Mythical Man-Month: Essays on Software Engineering,Frederick P. Brooks Jr.,[]
"Structuring an organization for change is much harder than designing a system for change. Each man must be assigned to jobs that broaden him, so that the whole force is technically flexible.",The Mythical Man-Month: Essays on Software Engineering,Frederick P. Brooks Jr.,[]
The fundamental problem with program maintenance is that fixing a defect has a substantial (20–50 percent) chance of introducing another. So the whole process is two steps forward and one step back.,The Mythical Man-Month: Essays on Software Engineering,Frederick P. Brooks Jr.,[]
