quoteText,bookTitle,bookAuthor,tags
"Test-drive employees Interviews are only worth so much. Some people sound like pros but don’t work like pros. You need to evaluate the work they can do now, not the work they say they did in the past. The best way to do that is to actually see them work. Hire them for a miniproject, even if it’s for just twenty or forty hours. You’ll see how they make decisions. You’ll see if you get along. You’ll see what kind of questions they ask. You’ll get to judge them by their actions instead of just their words. You can even make up a fake project. In a factory in South Carolina, BMW built a simulated assembly line where job candidates get ninety minutes to perform a variety of work-related tasks.* Cessna, the airplane manufacturer, has a role-playing exercise for prospective managers that simulates the day of an executive. Candidates work through memos, deal with (phony) irate customers, and handle other problems. Cessna has hired more than a hundred people using this simulation.† These companies have realized that when you get into a real work environment, the truth comes out. It’s one thing to look at a portfolio, read a resumé, or conduct an interview. It’s another to actually work with someone.",ReWork,Jason Fried,[]
"Recommended Reading Linda Barry, What It Is Hugh MacLeod, Ignore Everybody Jason Fried + David Heinemeier Hansson, Rework Lewis Hyde, The Gift Jonathan Lethem, The Ecstasy of Influence David Shields, Reality Hunger Scott McCloud, Understanding Comics Anne Lamott, Bird by Bird Mihaly Csikszentmihalyi, Flow Ed Emberley, Make a World",Steal Like an Artist: 10 Things Nobody Told You About Being Creative,Austin Kleon,[]
Make you part of your product or service. Inject what’s unique about the way you think into what you sell. Decommoditize your product. Make it something no one else can offer.,ReWork,Jason Fried,[]
You need less than you think,ReWork: Change the Way You Work Forever,Jason Fried,[]
It makes no sense to tell everyone to look at you if you’re not ready to be looked at yet.,ReWork,Jason Fried,[]
"Find a judo solution, one that delivers maximum efficiency with minimum effort.",ReWork: Change the Way You Work Forever,Jason Fried,[]
"Why don’t we just call plans what they really are: guesses. Start referring to your business plans as business guesses, your financial plans as financial guesses, and your strategic plans as strategic guesses. Now you can stop worrying about them as much. They just aren’t worth the stress.",ReWork: Change the Way You Work Forever,Jason Fried,[]
"Decide what you’re going to do this week, not this year. Figure out the next most important thing and do that. Make decisions right before you do something, not far in advance.",ReWork: Change the Way You Work Forever,Jason Fried,[]
There’s a beauty to imperfection. This is the essence of the Japanese principle of wabi-sabi. Wabi-sabi values character and uniqueness over a shiny facade.,ReWork: Change the Way You Work Forever,Jason Fried,[]
"If you want to do something, you’ve got to do it now. You can’t put it on a shelf and wait two months to get around to it. You can’t just say you’ll do it later. Later, you won’t be pumped up about it anymore.",ReWork: Change the Way You Work Forever,Jason Fried,[]
guesstimating,ReWork: Change the Way You Work Forever,Jason Fried,[]
"As you get going, keep in mind why you’re doing what you’re doing. Great businesses have a point of view, not just a product or service. You have to believe in something. You need to have a backbone. You need to know what you’re willing to fight for. And then you need to show the world.",ReWork: Change the Way You Work Forever,Jason Fried,[]
They’ll feel a bond with you and see you as human beings instead of a faceless company.,ReWork,Jason Fried,[]
"Stanley Kubrick gave this advice to aspiring filmmakers: “Get hold of a camera and some film and make a movie of any kind at all.”6 Kubrick knew that when you’re new at something, you need to start creating. The most important thing is to begin. So get a camera, hit Record, and start shooting.",ReWork: Change the Way You Work Forever,Jason Fried,[]
"Track coach Bill Bowerman decided that his team needed better, lighter running shoes. So he went out to his workshop and poured rubber into the family waffle iron. That’s how Nike’s famous waffle sole was born.‡",ReWork,Jason Fried,[]
"A business without a path to profit isn’t a business, it’s a hobby.",ReWork,Jason Fried,[]
"Southwest—unlike most other airlines, which fly multiple aircraft models—flies only Boeing 737s. As a result, every Southwest pilot, flight attendant, and ground-crew member can work any flight. Plus, all of Southwest’s parts fit all of its planes. All that means lower costs and a business that’s easier to run. They made it easy on themselves.",ReWork,Jason Fried,[]
You’re better off with a kick-ass half than a half-assed whole.,ReWork,Jason Fried,[]
"When you let customers outgrow you, you'll most likely wind up with a product that's basic - and that's fine. Small, simple, basic needs are constant. There's an endless supply of customers who need exactly that.",Rework,"Jason Fried, David Heinemeier Hansson, Matthew Linderman, 37 Signals",[]
"If you’re just going to be like everyone else, why are you even doing this?",ReWork,Jason Fried,[]
Don’t make up problems you don’t have yet. It’s not a problem until it’s a real problem.,ReWork,Jason Fried,[]
Failure is not a prerequisite for success. A Harvard Business School study found already-successful entrepreneurs are far more likely to succeed again (the success rate for their future companies is 34 percent). But entrepreneurs whose companies failed the first time had almost the same follow-on success rate as people starting a company for the first time: just 23 percent. People who failed before have the same amount of success as people who have never tried at all.* Success is the experience that actually counts.,ReWork,Jason Fried,[]
"A lot of companies have a similar front-of-house/back-of-house split. The people who make the product work in the “kitchen” while support handles the customers. Unfortunately, that means the product’s chefs never get to directly hear what customers are saying. Too bad. Listening to customers is the best way to get in tune with a product’s strengths and weaknesses.",ReWork: Change the Way You Work Forever,Jason Fried,[]
Don’t be afraid to show your flaws.,ReWork: Change the Way You Work Forever,Jason Fried,[]
"If someone sends out a resumé to three hundred companies, that’s a huge red flag right there. There’s no way that applicant has researched you. There’s no way he knows what’s different about your company. If you hire based on this garbage, you’re missing the point of what hiring is about. You want a specific candidate who cares specifically about your company, your products, your customers, and your job.",ReWork: Change the Way You Work Forever,Jason Fried,[]
The best are everywhere,ReWork: Change the Way You Work Forever,Jason Fried,[]
"If you constantly fret about timing things perfectly, they’ll never happen.",ReWork,Jason Fried,[]
"Draw a line in the sand As you get going, keep in mind why you’re doing what you’re doing. Great businesses have a point of view, not just a product or service. You have to believe in something. You need to have a backbone. You need to know what you’re willing to fight for. And then you need to show the world. A strong stand is how you attract superfans. They point to you and defend you. And they spread the word further, wider, and more passionately than any advertising could. Strong opinions aren’t free. You’ll turn some people off. They’ll accuse you of being arrogant and aloof. That’s life. For everyone who loves you, there will be others who hate you. If no one’s upset by what you’re saying, you’re probably not pushing hard enough. (And you’re probably boring, too.) Lots of people hate us because our products do less than the competition’s. They’re insulted when we refuse to include their pet feature. But we’re just as proud of what our products don’t do as we are of what they do. We design them to be simple because we believe most software is too complex: too many features, too many buttons, too much confusion. So we build software that’s the opposite of that. If what we make isn’t right for everyone, that’s OK. We’re willing to lose some customers if it means that others love our products intensely. That’s our line in the sand. When you don’t know what you believe, everything becomes an argument. Everything is debatable. But when you stand for something, decisions are obvious. For example, Whole Foods stands for selling the highest quality natural and organic products available. They don’t waste time deciding over and over again what’s appropriate. No one asks, “Should we sell this product that has artificial flavors?” There’s no debate. The answer is clear. That’s why you can’t buy a Coke or a Snickers there. This belief means the food is more expensive at Whole Foods. Some haters even call it Whole Paycheck and make fun of those who shop there. But so what? Whole Foods is doing pretty damn well. Another example is Vinnie’s Sub Shop, just down the street from our office in Chicago. They put this homemade basil oil on subs that’s just perfect. You better show up on time, though. Ask when they close and the woman behind the counter will respond, “We close when the bread runs out.” Really? “Yeah. We get our bread from the bakery down the street early in the morning, when it’s the freshest. Once we run out (usually around two or three p.m.), we close up shop. We could get more bread later in the day, but it’s not as good as the fresh-baked bread in the morning. There’s no point in selling a few more sandwiches if the bread isn’t good. A few bucks isn’t going to make up for selling food we can’t be proud of.” Wouldn’t you rather eat at a place like that instead of some generic sandwich chain?",ReWork,Jason Fried,[]
"firing people, damaging morale, and changing the entire way you do business. Ramping up doesn’t have to be your goal. And we’re not talking just about the number of employees you have either. It’s also true for expenses, rent, IT infrastructure, furniture, etc. These things don’t just happen to you. You decide whether or not to take them on. And if you do take them on, you’ll be taking on new headaches, too. Lock in lots of expenses and you force yourself into building a complex business—one that’s a lot more difficult and stressful to run. Don’t be insecure about aiming to be a small business.",ReWork,Jason Fried,[]
We're willing to loase some customers if it means that others love our products intensely. That's our line in the sand.,Rework,Jason Fried,[]
"When good enough gets the job done, go for it. It's way better than wasting resources or, even worse, doing nothing because you can't afford the complex solution.",Rework,Jason Fried,[]
Scaring away new customers is worse than losing old customers.,Rework,Jason Fried,[]
"So let your latest grand ideas cool off for a while first. By all means, have as many great ideas as you can. Get excited about them. Just don't act in the heat of the moment. Write them down and park them for a few days. Then, evaluate their actual priority with a calm mind.",Rework,Jason Fried,[]
Too much time in academia can actually do you harm. There are a lot of skills that are useful in academia that aren't worth much outside of it.,Rework,Jason Fried,[]
"It's easy to shoot down good ideas, interesting policies, or worthwhile experiments by assuming that whatever you decide now needs to work for years on end. It's just not so, especially for a small business. If circumstances change, your decisions can change. Decisions are temporary.",Rework,Jason Fried,[]
"That would never work in the real world.” You hear it all the time when you tell people about a fresh idea. This real world sounds like an awfully depressing place to live. It’s a place where new ideas, unfamiliar approaches, and foreign concepts always lose. The only things that win are what people already know and do, even if those things are flawed and inefficient. Scratch the surface and you’ll find these “real world” inhabitants are filled with pessimism and despair. They expect fresh concepts to fail. They assume society isn’t ready for or capable of change.",ReWork,Jason Fried,[]
"A successful alone-time period means letting go of communication addiction. During alone time, give up instant messages, phone calls, e-mail, and meetings. Just shut up and get to work. You'll be surprised how much more you get done.",Rework,"Jason Fried, David Heinemeier Hansson, Matthew Linderman, 37 Signals",[]
"So build an audience. Speak, write, blog, tweet, make videos - whatever. Share information that's valuable and you'll slowly but surely build a loyal audience. Then when you need to get the word out, the right people will already be listening.",Rework,"Jason Fried, David Heinemeier Hansson, Matthew Linderman, 37 Signals",[]
"It’s a beautiful way to put it: Leave the poetry in what you make. When something becomes too polished, it loses its soul. It seems robotic. So talk like you really talk. Reveal things that others are unwilling to discuss. Be upfront about your shortcomings. Show the latest version of what you’re working on, even if you’re not done yet. It’s OK if it’s not perfect. You might not seem as professional, but you will seem a lot more genuine.",ReWork,Jason Fried,[]
"Also, don’t be timid about your conclusions. Sometimes abandoning what you’re working on is the right move, even if you’ve already put in a lot of effort. Don’t throw good time after bad work.",ReWork,Jason Fried,[]
"One of the worst ways is the non-apology apology, which sounds like an apology but doesn’t really accept any blame. For example, “We’re sorry if this upset you.” Or “I’m sorry that you don’t feel we lived up to your expectations.” Whatever.",ReWork,Jason Fried,[]
"When you treat people like children, you get children’s work. Yet that’s exactly how a lot of companies and managers treat their employees. Employees need to ask permission before they can do anything. They need to get approval for every tiny expenditure.",ReWork,Jason Fried,[]
"It’s why we like real flowers that wilt, not perfect plastic ones that never change.",ReWork,Jason Fried,[]
right—premature hiring is the death of many companies.,ReWork,Jason Fried,[]
You wind up building what investors want instead of what customers want.,ReWork,Jason Fried,[]
"You can’t build on top of “We’ll decide later,” but you can build on top of “Done.",ReWork,Jason Fried,[]
Stop saying ASAP. We get it. It’s implied. Everyone wants things done as soon as they can be done.,ReWork,Jason Fried,[]
"Don’t worry about “the one that got away.” It’s much worse to have people on staff who aren’t doing anything meaningful. There’s plenty of talent out there. When you do have a real need, you’ll find someone who fits well. Great has nothing to do with it. If you don’t need someone, you don’t need someone.",ReWork: Change the Way You Work Forever,Jason Fried,[]
down-to-earth.,ReWork,Jason Fried,[]
"Anyone who creates a new business is a starter. You don’t need an MBA, a certificate, a fancy suit, a briefcase, or an above-average tolerance for risk. You just need an idea, a touch of confidence, and a push to get started.",ReWork,Jason Fried,[]
"Contrast (failure) that with learning from your successes. Success gives you real ammunition. When something succeeds, you know what worked - and you can do it again. And the next time, you'll probably do it even better.",Rework,Jason Fried,[]
What you do is your legacy. Don't sit around and wait for someone else to make the change you want to see. And don't think it takes a huge team to make that difference either.,Rework,Jason Fried,[]
"The easiest, most straightforward way to create a great product or service is to make something you want to use.",Rework,Jason Fried,[]
"Don’t be insecure about aiming to be a small business. Anyone who runs a business that’s sustainable and profitable, whether it’s big or small, should be proud.",ReWork,Jason Fried,[]
Policies are organizational scar tissue. They are codified overreactions to situations that are unlikely to happen again. They are collective punishment for the misdeeds of an individual.,ReWork,Jason Fried,[]
Get the chisel out and start making something real. Anything else is just a distraction.,ReWork: Change the Way You Work Forever,Jason Fried,[]
"You don’t have to live with a decision forever. If you make a mistake, you can correct it later.",ReWork,Jason Fried,[]
"The real world isn’t a place, it’s an excuse. It’s a justification for not trying. It has nothing to do with you.",ReWork,Jason Fried,[]
"estimates that stretch weeks, months, and years into the future are fantasies.",ReWork: Change the Way You Work Forever,Jason Fried,[]
The way you build momentum is by getting something done and then moving on to the next thing. No one likes to be stuck on an endless project with no finish line in sight.,ReWork,Jason Fried,[]
"That would never work in the real world.” You hear it all the time when you tell people about a fresh idea. This real world sounds like an awfully depressing place to live. It’s a place where new ideas, unfamiliar approaches, and foreign concepts always lose. The only things that win are what people already know and do, even if those things are flawed and inefficient. Scratch the surface and you’ll find these “real world” inhabitants are filled with pessimism and despair. They expect fresh concepts to fail. They assume society isn’t ready for or capable of change. Even worse, they want to drag others down into their tomb. If you’re hopeful and ambitious, they’ll try to convince you your ideas are impossible. They’ll say you’re wasting your time. Don’t believe them. That world may be real for them, but it doesn’t mean you have to live in it.",ReWork,Jason Fried,[]
"The solution: Break the big thing into smaller things. The smaller it is, the easier it is to estimate. You’re probably still going to get it wrong, but you’ll be a lot less wrong than if you estimated a big project. If something takes twice as long as you expected, better to have it be a small project that’s a couple weeks over rather than a long one that’s a couple months over. Keep breaking your time frames down into",ReWork,Jason Fried,[]
"THAT WOULD NEVER work in the real world.” You hear it all the time when you tell people about a fresh idea. This real world sounds like an awfully depressing place to live. It’s a place where new ideas, unfamiliar approaches, and foreign concepts always lose. The only things that win are what people already know and do, even if those things are flawed and inefficient. Scratch the surface and you’ll find these “real world” inhabitants are filled with pessimism and despair. They expect fresh concepts to fail. They assume society isn’t ready for or capable of change. Even worse, they want to drag others down into their tomb. If you’re hopeful and ambitious, they’ll try to convince you your ideas are impossible. They’ll say you’re wasting your time. Don’t believe them. That world may be real for them, but it doesn’t mean you have to live in it. We know because our company fails the real-world test in all kinds of ways. In the real world, you can’t have more than a dozen employees spread out in eight different cities on two continents. In the real world, you can’t attract millions of customers without any salespeople or advertising. In the real world, you can’t reveal your formula for success to the rest of the world. But we’ve done all those things and prospered. The real world isn’t a place, it’s an excuse. It’s a justification for not trying. It has nothing to do with you.",ReWork: Change the Way You Work Forever,Jason Fried,[]
"It’s the stuff you leave out that matters. So constantly look for things to remove, simplify, and streamline. Be a curator. Stick to what’s truly essential. Pare things down until you’re left with only the most important stuff. Then do it again. You can always add stuff back in later if you need to.",ReWork,Jason Fried,[]
"When things aren’t working, the natural inclination is to throw more at the problem. More people, time, and money. All that ends up doing is making the problem bigger. The right way to go is the opposite direction: Cut back.",ReWork,Jason Fried,[]
A lot of companies focus on the next big thing. They latch on to what’s hot and new. They follow the latest trends and technology. That’s a fool’s path. You start focusing on fashion instead of substance. You start paying attention to things that are constantly changing instead of things that last.,ReWork,Jason Fried,[]
You have to be able to improvise. You have to be able to pick up opportunities that come along.,Rework,Jason Fried,[]
It’s tempting for people to obsess over tools instead of what they’re going to do with those tools.,ReWork: Change the Way You Work Forever,Jason Fried,[]
Other people’s failures are just that: other people’s failures. If,ReWork: Change the Way You Work Forever,Jason Fried,[]
"So talk like you really talk. Reveal things that others are unwilling to discuss. Be upfront about your shortcomings. Show the latest version of what you’re working on, even if you’re not done yet. It’s OK if it’s not perfect. You might not seem as professional, but you will seem a lot more genuine.",ReWork,Jason Fried,[]
"You’re better off focusing on getting your story into a trade publication or picked up by a niche blogger. With these outlets, the barrier is much lower. You can send an e-mail and get a response (and maybe even a post) the same day. There’s no editorial board or PR person involved. There’s no pipeline your message has to go through.",ReWork,Jason Fried,[]
Marketing isn’t just a few individual events. It’s the sum total of everything you do.,ReWork,Jason Fried,[]
The right time to hire is when there’s more work than you can handle for a sustained period of time.,ReWork,Jason Fried,[]
You’ll be doing your company more harm than good if you bring in talented people who have nothing important to do.,ReWork,Jason Fried,[]
You need an environment where everyone feels safe enough to be honest when things get tough. You need to know how far you can push someone. You need to know what people really mean when they say something. So hire slowly. It’s the only way to avoid winding up at a cocktail party of strangers.,ReWork,Jason Fried,[]
"But after that, the curve flattens out. There’s surprisingly little difference between a candidate with six months of experience and one with six years. The real difference comes from the individual’s dedication, personality, and intelligence.",ReWork,Jason Fried,[]
"That means you need to avoid hiring delegators, those people who love telling others what to do. Delegators are dead weight for a small team. They clog the pipes for others by coming up with busywork. And when they run out of work to assign, they make up more—regardless of whether it needs to be done. Delegators love to pull people into meetings, too. In fact, meetings are a delegator’s best friend. That’s where he gets to seem important. Meanwhile, everyone else who attends is pulled away from getting real work done.",ReWork,Jason Fried,[]
"Managers of one are people who come up with their own goals and execute them. They don’t need heavy direction. They don’t need daily check-ins. They do what a manager would do—set the tone, assign items, determine what needs to get done, etc.—but they do it by themselves and for themselves. These people free you from oversight. They set their own direction. When you leave them alone, they surprise you with how much they’ve gotten done. They don’t need a lot of hand-holding or supervision.",ReWork,Jason Fried,[]
"Evolution doesn’t linger on past failures, it’s always building upon what worked. So should you.",ReWork,Jason Fried,[]
The message should come from the top. The highest-ranking person available should take control in a forceful way. Spread the message far and wide. Use whatever megaphone you have. Don’t try to sweep it under the rug. “No comment” is not an option. Apologize the way a real person would and explain what happened in detail. Honestly be concerned about the fate of your customers—then prove it.,ReWork,Jason Fried,[]
"If you decide you absolutely must get together, try to make your meeting a productive one by sticking to these simple rules: Set a timer. When it rings, meeting’s over. Period. Invite as few people as possible. Always have a clear agenda. Begin with a specific problem. Meet at the site of the problem instead of a conference room. Point to real things and suggest real changes. End with a solution and make someone responsible for implementing it.",ReWork,Jason Fried,[]
You shouldn’t expect the job to be someone’s entire life—at least not if you want to keep them around for a long time.,ReWork,Jason Fried,[]
A few bucks isn’t going to make up for selling food we can’t be proud of.,ReWork,Jason Fried,[]
