quoteText,bookTitle,bookAuthor,tags
"What you do is what matters, not what you think or say or plan.",Rework,Jason Fried,"['actions', 'deeds', 'inspirational', 'work-ethic']"
"When you don’t know what you believe, everything becomes an argument. Everything is debatable. But when you stand for something, decisions are obvious.",Rework,Jason Fried,['kindlehighlight']
"Workaholics aren't heroes. They don't save the day, they just use it up. The real hero is home because she figured out a faster way",Rework,Jason Fried,[]
"Plus, if you’re a copycat, you can never keep up. You’re always in a passive position. You never lead; you always follow. You give birth to something that’s already behind the times—just a knockoff, an inferior version of the original. That’s no way to live.",Rework,Jason Fried,['originality']
"Find a judo solution, one that delivers maximum efficiency with minimum effort. When good enough gets the job done, go for it.",Rework,Jason Fried,[]
Working without a plan may seem scary. But blindly following a plan that has no relationship with reality is even scarier.,Rework,Jason Fried,[]
"If circumstances change, your decisions can change. Decisions are temporary.",Rework,Jason Fried,[]
"If you are trying to decide among a few people to fill a position hire the best writer. it doesn't matter if the person is marketer, salesperson, designer, programmer, or whatever, their writing skills will pay off. That's because being a good writer is about more than writing clear writing. Clear writing is a sign of clear thinking. great writers know how to communicate. they make things easy to understand. they can put themselves in someone else's shoes. they know what to omit. And those are qualities you want in any candidate. Writing is making a comeback all over our society... Writing is today's currency for good ideas.",Rework,Jason Fried,"['inspirational', 'talent']"
"Workaholics don't actually accomplish more than nonworkaholics. They may claim to be perfectionists, but that just mean they're wasting time fixating on inconsequential details instead of moving on to the next task.",Rework,Jason Fried and David Heinemeier Hansson,['work-ethics']
"Until you actually start making something, your brilliant idea is just that, an idea.",Rework,Jason Fried,[]
"Unless you are a fortune-teller, long-term business planning is a fantasy",Rework,Jason Fried,[]
"If you build software, every error message is marketing",Rework,Jason Fried,['work-ethics']
"That world may be real for them, but it doesn't mean you have to live in it.",Rework,Jason Fried,[]
"If you're opening a hot dog stand, you could worry about the condiments, the cart, the name, the decoration. But the first thing you should worry aout is the hot dog. The hot dogs are the epicenter. Everything else is secondary.",Rework,Jason Fried,['work-ethics']
It’s a lot harder to pull your head up and ask why.,Rework,Jason Fried,['kindlehighlight']
"Think about it this way: If you had to launch your business in two weeks, what would you cut out?",ReWork,"Jason Fried, David Heinemeier Hansson",['kindlehighlight']
"There are four-letter words you should never use in business. They're not fuck or shit. They're need, must, can't, easy, just, only and fast. These words gets in the way of healthy communication",Rework,"Jason Fried, David Heinemeier Hansson",[]
"It’s a beautiful way to put it: Leave the poetry in what you make. When something becomes too polished, it loses its soul. It seems robotic.",Rework,Jason Fried,['kindlehighlight']
Don't let yourself off the hook with excuses.,Rework,Jason Fried,[]
"The problem with abstractions (like reports and documents) is that they create illusions of agreement. A hundred people can read the same words, but in their heads, they’re imagining a hundred different things.",ReWork,"Jason Fried, David Heinemeier Hansson",['kindlehighlight']
"Meetings: ""They often include at least one moron who inevitably",Rework,Jason Fried,[]
"When you treat people like children, you get children’s work.",ReWork,Jason Fried,[]
Small is not just a stepping-stone. Small is a great destination itself,Rework,Jason Fried,[]
Standing for something isn’t just about writing it down. It’s about believing it and living it.,ReWork,Jason Fried,[]
"Marketing is not a department Do you have a marketing department? If not, good. If you do, don’t think these are the only people responsible for marketing. Accounting is a department. Marketing isn’t. Marketing is something everyone in your company is doing 24/7/365. Just as you cannot not communicate, you cannot not market: Every time you answer the phone, it’s marketing. Every time you send an e-mail, it’s marketing. Every time someone uses your product, it’s marketing. Every word you write on your Web site is marketing. If you build software, every error message is marketing. If you’re in the restaurant business, the after-dinner mint is marketing. If you’re in the retail business, the checkout counter is marketing. If you’re in a service business, your invoice is marketing. Recognize that all of these little things are more important than choosing which piece of swag to throw into a conference goodie bag. Marketing isn’t just a few individual events. It’s the sum total of everything you do.",ReWork,Jason Fried,[]
"When everything constantly needs approval, you create a culture of nonthinkers.",ReWork: Change the Way You Work Forever,Jason Fried,[]
"Whenever you can, swap “Let’s think about it” for “Let’s decide on it.” Commit to making decisions. Don’t wait for the perfect solution. Decide and move forward.",ReWork,Jason Fried,[]
"People automatically associate quitting with failure, but sometimes that's exactly what you should do. If you already spent too much time on something that wasn't worth it, walk away. You can't get that time back. The worst thing you can do now is waste even more time.",Rework,"Jason Fried, David Heinemeier Hansson, Matthew Linderman, 37 Signals",[]
Plans let past drives the future.,Rework,Jason Fried,[]
It's better to have people be happy using someone else's product than disgruntled using yours.,Rework,Jason Fried,['work-ethics']
Press Releases are spam,Rework,Jason Fried,['work-ethics']
Limited resources force you to make do with what you've got. There's no room for waste. And that forces you to be creative.,Rework,Jason Fried,[]
"If no one’s upset by what you’re saying, you’re probably not pushing hard enough. (And you’re probably boring, too.)",ReWork,Jason Fried,[]
Policies are organizational scar tissue. They are codified overreactions to situations that are unlikely to happen again. They are collective punishment for the misdeeds of an individual. This is how bureaucracies are born. No one sets out to create a bureaucracy. They sneak up on companies slowly. They are created one policy—one scar—at a time. So don’t scar on the first cut. Don’t create a policy because one person did something wrong once. Policies are only meant for situations that come up over and over again.,ReWork,Jason Fried,[]
WE ALL HAVE ideas. Ideas are immortal. They last forever. What doesn’t last forever is inspiration. Inspiration is like fresh fruit or milk: It has an expiration date.,ReWork: Change the Way You Work Forever,Jason Fried,[]
"If you constantly fret about timing things perfectly, they'll never happen.",Rework,Jason Fried,[]
"Teach and you'll form a bond you just don't get from traditional marketing tactics. Buying people's attention with a magazine or online banner ad is one thing. Earning their loyalty by teaching them forms a whole different connection. They'll trust you more. They'll respect you more. Even if they don't use your product, they can still be your fans.",Rework,Jason Fried,[]
"Ever find yourself working on something without knowing exactly why? Someone just told you to do it. It's pretty common, actually. That's why it's important to ask why you're working on _____. What is this for? Who benefits? What's the motivation behind it? Knowing the answers to these questions will help you better understand the work itself.",Rework,"Jason Fried, David Heinemeier Hansson, Matthew Linderman, 37 Signals",[]
"A business without a path to profit isn't a business, it's a hobby.",Rework,Jason Fried,[]
It's like when you're on hold and a recorded voice comes on telling you how much the company values you as a customer. Really? Then maybe you should hire some more support people so I don't have to wait thirty minutes to get help.,Rework,Jason Fried,['funny']
"Pass on hiring people you don't need, even if you think that person's a great catch.",Rework,Jason Fried,['work-ethics']
"Culture is action, not words.",ReWork: Change the Way You Work Forever,Jason Fried,[]
"Delegators love to pull people into meetings, too. In fact, meetings are a delegator’s best friend. That’s where he gets to seem important. Meanwhile, everyone else who attends is pulled away from getting real work done.",ReWork,Jason Fried,[]
All companies have customers. Lucky companies have fans. But the most fortunate companies have audiences.,ReWork: Change the Way You Work Forever,Jason Fried,[]
No time is no excuse,ReWork: Change the Way You Work Forever,Jason Fried,[]
How long someone’s been doing it is overrated. What matters is how well they’ve been doing it.,ReWork: Change the Way You Work Forever,Jason Fried,[]
Don’t make up problems you don’t have yet. It’s not a problem until it’s a real problem. Most of the things you worry about never happen anyway.,ReWork: Change the Way You Work Forever,Jason Fried,[]
Failure is not a pre-requisite for success. Already successful entrepreneurs are far more likely to succeed again than who failed,Rework,Jason Fried,[]
"Workaholics aren’t heroes. They don’t save the day, they just use it up. The real hero is already home because she figured out a faster way to get things done.",ReWork,Jason Fried,[]
Writing is today 's currency for good ideas.,Rework,"Jason Fried, David Heinemeier Hansson",[]
You don’t make a great museum by putting all the art in the world into a single room. That’s a warehouse.,ReWork: Change the Way You Work Forever,Jason Fried,[]
It’s entirely your responsibility to make your dreams come true.,ReWork: Change the Way You Work Forever,Jason Fried,[]
"When you build an audience, you don’t have to buy people’s attention—they give it to you. This is a huge advantage. So build an audience. Speak, write, blog, tweet, make videos—whatever. Share information that’s valuable and you’ll slowly but surely build a loyal audience.",ReWork,Jason Fried,[]
What do you call a generic pitch sent out to hundreds of strangers hgoping that one will bite? Spam.,Rework,Jason Fried,['business']
"When you want something bad enough, you make the time—regardless of your other obligations. The truth is most people just don’t want it bad enough. Then they protect their ego with the excuse of time. Don’t let yourself off the hook with excuses. It’s entirely your responsibility to make your dreams come true.",ReWork: Change the Way You Work Forever,Jason Fried,[]
"You don’t need an MBA, a certificate, a fancy suit, a briefcase, or an above-average tolerance for risk. You just need an idea, a touch of confidence, and a push to get started.",ReWork: Change the Way You Work Forever,Jason Fried,[]
"Hire great writers If you are trying to decide among a few people to fill a position, hire the best writer. It doesn’t matter if that person is a marketer, salesperson, designer, programmer, or whatever; their writing skills will pay off. That’s because being a good writer is about more than writing. Clear writing is a sign of clear thinking. Great writers know how to communicate. They make things easy to understand. They can put themselves in someone else’s shoes. They know what to omit. And those are qualities you want in any candidate.",ReWork: Change the Way You Work Forever,Jason Fried,[]
The most important thing is to begin.,ReWork: Change the Way You Work Forever,Jason Fried,[]
"People will respect you more if you are open, honest, public, and responsive during a crisis. Don’t hide behind spin or try to keep your bad news on the down low. You",ReWork: Change the Way You Work Forever,Jason Fried,[]
"The longer something takes, the less likely it is that you're going to finish it.",Rework,Jason Fried,[]
"Everyone should be encouraged to start his own business, not just some rare breed that self-identifies as entrepreneurs.",ReWork: Change the Way You Work Forever,Jason Fried,[]
"If you're just going to be like everyone else, why are you even doing this? If you merely replicate competitors, there's no point for your existence. Even if you wind up losing, it's better to go down fighting for what you believe in instead of just imitating others.",Rework,"Jason Fried, David Heinemeier Hansson, Matthew Linderman, 37 Signals",[]
"Easy is a word that’s used to describe other people’s jobs. “That should be easy for you to do, right?” But notice how rarely people describe their own tasks as easy. For you, it’s “Let me look into it”—but for others, it’s “Get it done.",ReWork,Jason Fried,[]
"It’s OK if it’s not perfect. You might not seem as professional, but you will seem a lot more genuine.",ReWork: Change the Way You Work Forever,Jason Fried,[]
"Check the cover letter. In a cover letter, you get actual communication instead of a list of skills, verbs, and years of irrelevance.",ReWork: Change the Way You Work Forever,Jason Fried,[]
Don't throw good time after bad work.,Rework,Jason Fried,['inspirational']
Starting a business on the side while keeping your day job can provide all the cash flow you need.,ReWork: Change the Way You Work Forever,Jason Fried,[]
"no one’s upset by what you’re saying, you’re probably not pushing hard enough. (And you’re probably boring, too.)",ReWork: Change the Way You Work Forever,Jason Fried,[]
"When you are new at something, you need to start creating.",Rework,Jason Fried,[]
"Once you [work on your idea extra hours], you'll learn whether your excitement and interest is real or just a passing phase.",Rework,Jason Fried,[]
Ideas are cheap and plentiful. The original pitch idea is such a small part of a business that it’s almost negligible. The real question is how well you execute.,ReWork,Jason Fried,[]
"We all have that one friend who says, ""I had the idea for eBay. If only I had acted on it, I'd be a billionaire!"" That logic is pathetic and delusional. Having the idea for eBay has nothing to do with actually creating eBay. What you do is what matters, not what you think or say or plan.",Rework,"Jason Fried, David Heinemeier Hansson, Matthew Linderman, 37 Signals",[]
"So ask yourself, ""What can we do in two weeks?"" And then do it. Get out there and let people use it, taste it, play it, or whatever. The quicker it's in the hands of customers, the better off you'll be.",Rework,"Jason Fried, David Heinemeier Hansson, Matthew Linderman, 37 Signals",[]
"When you build a product or service, you make the call on hundreds of tiny decisions each day. If you’re solving someone else’s problem, you’re constantly stabbing in the dark. When you solve your own problem, the light comes on. You know exactly what the right answer is.",ReWork: Change the Way You Work Forever,Jason Fried,[]
You don’t create a culture. It happens. This is why new companies don’t have a culture. Culture is the by-product of consistent behavior.,ReWork: Change the Way You Work Forever,Jason Fried,[]
"Easy. Easy is a word that’s used to describe other people’s jobs. “That should be easy for you to do, right?” But notice how rarely people describe their own tasks as easy. For you, it’s “Let me look into it”—but for others, it’s “Get it done.",ReWork: Change the Way You Work Forever,Jason Fried,[]
"If you've never given a speech before, do you want your first speech to be in front of ten thousand people or ten people? You don't want everyone to watch you starting your business. It makes no sense to tell everyone to look at you if you're not ready to be looked at yet.",Rework,"Jason Fried, David Heinemeier Hansson, Matthew Linderman, 37 Signals",[]
"When we start designing something, we sketch out ideas with a big, thick Sharpie marker, instead of a ballpoint pen. Why? Pen points are too fine. They’re too high-resolution. They encourage you to worry about things that you shouldn’t worry about yet, like perfecting the shading or whether to use a dotted or dashed line. You end up focusing on things that should still be out of focus.",ReWork,Jason Fried,[]
"In Jason Fried’s book Rework, he writes that one of the smartest investments a business can make is in hiring great writers, and I completely agree. No",#GIRLBOSS,Sophia Amoruso,[]
"Decisions are progress. Each one you make is a brick in your foundation. You can’t build on top of “We’ll decide later,” but you can build on top of",ReWork,Jason Fried,[]
"Besides, the perfect time never arrives. You’re always too young or old or busy or broke or something else. If you constantly fret about timing things perfectly, they’ll never happen.",ReWork: Change the Way You Work Forever,Jason Fried,[]
"Give up on the guesswork. Decide what you’re going to do this week, not this year. Figure out the next most important thing and do that. Make decisions right before you do something, not far in advance.",ReWork: Change the Way You Work Forever,Jason Fried,[]
"The owner actually tried the oil and chooses to carry it based on its taste. It’s not about packaging, marketing, or price. It’s about quality. He tried it and knew his store had to carry it. That’s the approach you should take too.",ReWork: Change the Way You Work Forever,Jason Fried,[]
"It doesn’t matter how much you plan, you’ll still get some stuff wrong anyway. Don’t make things worse by overanalyzing and delaying before you even get going.",ReWork,Jason Fried,[]
"They’re need, must, can’t, easy, just, only, and fast. These words get in the way of healthy communication. They are red flags that introduce animosity, torpedo good discussions, and cause projects to be late.",ReWork,Jason Fried,[]
Working more doesn’t mean you care more or get more done. It just means you work more.,ReWork,Jason Fried,[]
"Pour yourself into your product and everything around your product too: how you sell it, how you support it, how you explain it, and how you deliver it. Competitors can never copy the you in your product.",ReWork: Change the Way You Work Forever,Jason Fried,[]
"Everyone on your team should be connected to your customers—maybe not every day, but at least a few times throughout the year. That’s the only way your team is going to feel the hurt your customers are experiencing. It’s feeling the hurt that really motivates people to fix the problem. And the flip side is true too: The joy of happy customers or ones who have had a problem solved can also be wildly motivating. So",ReWork,Jason Fried,[]
"People are creatures of habit. That’s why they react to change in such a negative way. They’re used to using something in a certain way and any change upsets the natural order of things. So they push back. They complain. They demand that you revert to the way things were. But that doesn’t mean you should act. Sometimes you need to go ahead with a decision you believe in, even if it’s unpopular at first.",ReWork,Jason Fried,[]
But what if …?” “What happens when …?” “Don’t we need to plan for …?” Don’t make up problems you don’t have yet. It’s not a problem until it’s a real problem. Most of the things you worry about never happen anyway.,ReWork,Jason Fried,[]
"Long projects zap morale. The longer it takes to develop, the less likely it is to launch. Make the call, make progress, and get something out now—while you’ve got the motivation and momentum to do so.",ReWork,Jason Fried,[]
Clear writing is a sign of clear thinking. Great writers know how to communicate. They make things easy to understand.,ReWork,Jason Fried,[]
"If you think a competitor sucks, say so. When you do that, you’ll find that others who agree with you will rally to your side. Being the anti-______ is a great way to differentiate yourself and attract followers. For example, Dunkin’ Donuts positioned itself as the anti-Starbucks. Its ads once mocked Starbucks for using “Fritalian” terms instead of small, medium, and large. Another Dunkin’ campaign was centered on a taste test in which it beat Starbucks. There was even a site called DunkinBeatStarbucks.com where visitors could send e-cards with statements like “Friends don’t let friends drink Starbucks.",ReWork,Jason Fried,[]
You rarely regret saying no. But you often wind up regretting saying yes.,ReWork,Jason Fried,[]
The truth is most people just don’t want it bad enough. Then they protect their ego with the excuse of time. Don’t let yourself off the hook with excuses. It’s entirely your responsibility to make your dreams come true.,ReWork,Jason Fried,[]
"Unless you’re a fortune-teller, long-term business planning is a fantasy. There are just too many factors that are out of your hands: market conditions, competitors, customers, the economy, etc. Writing a plan makes you feel in control of things you can’t actually control. Why don’t we just call plans what they really are: guesses. Start referring to your business plans as business guesses, your financial plans as financial guesses, and your strategic plans as strategic guesses. Now you can stop worrying about them as much. They just aren’t worth the stress.",ReWork,Jason Fried,[]
Culture is the byproduct of consistent behavior.,ReWork,Jason Fried,[]
"To keep your momentum and motivation up, get in the habit of accomplishing small victories along the way.",ReWork,Jason Fried,[]
"Sometimes you need to say, “We’re going in a new direction because that’s what makes sense today.",ReWork: Change the Way You Work Forever,Jason Fried,[]
"Even worse, they want to drag others down into their tomb. If you’re hopeful and ambitious, they’ll try to convince you your ideas are impossible. They’ll say you’re wasting your time.",ReWork: Change the Way You Work Forever,Jason Fried,[]
"Leonard Koren, author of a book on wabi-sabi, gives this advice: Pare down to the essence, but don’t remove the poetry. Keep things clean and unencumbered but don’t sterilize.",ReWork: Change the Way You Work Forever,Jason Fried,[]
"These companies have realized that when you get into a real work environment, the truth comes out.",ReWork: Change the Way You Work Forever,Jason Fried,[]
"Start referring to your business plans as business guesses,",ReWork,Jason Fried,[]
There’s a beauty to imperfection. This is the essence of the Japanese principle of wabi-sabi. Wabi-sabi values character and uniqueness over a shiny facade. It teaches that cracks and scratches in things should be embraced. It’s also about simplicity. You strip things down and then use what you have.,ReWork: Change the Way You Work Forever,Jason Fried,[]
"When you just copy and paste, you miss that. You just repurpose the last layer instead of understanding all the layers underneath.",ReWork: Change the Way You Work Forever,Jason Fried,[]
You may feel out of your element at times. You might even feel like you suck. That’s all right. You can hire your way out of that feeling or you can learn your way out of it. Try learning first. What you give up in initial execution will be repaid many times over by the wisdom you gain.,ReWork: Change the Way You Work Forever,Jason Fried,[]
"Similarly, if you lose someone, don’t replace him immediately. See how long you can get by without that person and that position.",ReWork: Change the Way You Work Forever,Jason Fried,[]
Great companies start in garages all the time. Yours can too.,ReWork,Jason Fried,[]
"People will respect you more if you are open, honest, public, and responsive during a crisis. Don’t hide behind spin or try to keep your bad news on the down low. You want your customers to be as informed as possible.",ReWork: Change the Way You Work Forever,Jason Fried,[]
Cut your ambition in half. You’re better off with a kick-ass half than a half-assed whole.,ReWork: Change the Way You Work Forever,Jason Fried,[]
"It’s the stuff you leave out that matters. So constantly look for things to remove, simplify, and streamline. Be a curator.",ReWork: Change the Way You Work Forever,Jason Fried,[]
Don’t shy away from the fact that your product or service does less. Highlight it. Be proud of it. Sell it as aggressively as competitors sell their extensive feature lists.,ReWork: Change the Way You Work Forever,Jason Fried,[]
