quoteText,bookTitle,bookAuthor,tags
"Somehow over the years people have gotten the impression that Wal-Mart was... just this great idea that turned into an overnight success. But...it was an outgrowth of everything we’d been doing since [1945].... And like most overnight successes, it was about twenty years in the making.",Good to Great: Why Some Companies Make the Leap... and Others Don't,Jim Collins,[]
"Enduring great companies don’t exist merely to deliver returns to shareholders. Indeed, in a truly great company, profits and cash flow become like blood and water to a healthy body: They are absolutely essential for life, but they are not the very point of life.",Good to Great: Why Some Companies Make the Leap... and Others Don't,Jim Collins,[]
"Jim Collins describes his own version of Virtuoso leadership in what he calls the Level 5 leader, someone who “builds enduring greatness through a paradoxical blend of personal humility and professional will.”2 Collins tells us that, while he believes many individuals with the potential to be Level 5 leaders exist in our world, they’re difficult to spot because their humility prevents them from taking credit for the positive results of their superb leadership. He says, “Our research exposed Level 5 as a key component inside the black box of what it takes to shift a company from good to great.",Return on Character: The Real Reason Leaders and Their Companies Win,Fred Kiel,[]
Do not hesitate to make changes when hiring mistakes are found. Either reassign people to the right roles or drop them completely.,Good To Great by Jim Collins: Summary of the Key Ideas in One Hour or Less,Eighty Twenty Publishing,[]
Create a list of significant replicable successes your enterprise has achieved. This should include new initiatives and offerings that have far exceeded expectations.,Turning the Flywheel: A Monograph to Accompany Good to Great,Jim Collins,[]
Motivating employees to do better is a waste of time as the right people are capable of motivating themselves.,Good To Great by Jim Collins: Summary of the Key Ideas in One Hour or Less,Eighty Twenty Publishing,[]
"Leading as a charismatic visionary—a “genius with a thousand helpers” upon whom everything depends—is time telling. Shaping a culture that can thrive far beyond any single leader is clock building. Searching for a single great idea upon which to build success is time telling. Building an organization that can generate many great ideas is clock building. Leaders who build enduring great companies tend to be clock builders, not time tellers. For true clock builders, success comes when the organization proves its greatness not just during one leader’s tenure but also when the next generation of leadership further increases flywheel momentum.",Turning the Flywheel: A Monograph to Accompany Good to Great,Jim Collins,[]
the greatest danger in business and life lies not in outright failure but in achieving success without understanding why you were successful in the first place.,Turning the Flywheel: A Monograph to Accompany Good to Great,Jim Collins,[]
"Jim Collins, author of Good to Great: Why Some Companies Make the Leap… And Others Don’t,",Scaling Up: How a Few Companies Make It...and Why the Rest Don't,Verne Harnish,[]
"Jim Collins, in his bestselling book Good to Great,",The Hard Thing About Hard Things: Building a Business When There Are No Easy Answers,Ben Horowitz,[]
"As the adage goes, “good” can be an enemy of “great”: it can stop us from striving for more. It keeps us satisfied and content with something that is above average but not outstanding. In","Good to Great: Why Some Companies Make the Leap...And Others Don't by Jim Collins | Key Takeaways, Analysis & Review",Instaread,[]
"A Hedgehog Concept is a simple, crystalline concept that flows from deeply understanding the intersection of the following three circles: (1) what you’re deeply passionate about, (2) what you can be the best in the world at, and (3) what drives your economic or resource engine.",Turning the Flywheel: A Monograph to Accompany Good to Great,Jim Collins,[]
A flywheel need not be entirely unique. Two successful organizations can have similar flywheels. What matters most is how well you understand your flywheel and how well you execute on each component over a long series of iterations.,Turning the Flywheel: A Monograph to Accompany Good to Great,Jim Collins,[]
"Similarly, across all our rigorous matched-pair research studies (Built to Last, Good to Great, How the Mighty Fall, and Great by Choice), we found no systematic correlation between achieving the highest levels of performance and being first into the game.",Turning the Flywheel: A Monograph to Accompany Good to Great,Jim Collins,[]
"But what truly set the big winners apart was their ability to turn initial success into a sustained flywheel, even if they started out behind the pioneers.9",Turning the Flywheel: A Monograph to Accompany Good to Great,Jim Collins,[]
"Jim Collins’s Good to Great, in which",Essentialism: The Disciplined Pursuit of Less,Greg McKeown,[]
"Greatness is not a function of circumstance. Greatness, it turns out, is largely a matter of conscious choice.’ —Jim Collins, Good to Great (2001)",The Unusual Billionaires,Saurabh Mukherjea,[]
"THE COURAGE TO SAY NO Early in our development as leaders we assume that when opportunity knocks, we must answer the door and embrace whoever or whatever is standing there. But Mike Nappa was right when he wrote, “Opportunity does not equal obligation.”15 The ability to identify and focus on the few necessary things is a hallmark of great leadership. In his book Good to Great, Jim Collins encourages business leaders to develop a “stop doing” list: Most of us lead busy but undisciplined lives. We have ever expanding “to do” lists, trying to build momentum by doing, doing, doing—and doing more. And it rarely works. Those who built the good-to-great companies, however, made as much use of “stop doing” lists as the “to do” lists. They displayed a remarkable discipline to unplug all sorts of extraneous junk.… They displayed remarkable courage to channel their resources into only one or a few arenas.16",Next Generation Leader,Andy Stanley,[]
"In Built to Last, Jerry Porras and I observed that those who build enduring great companies reject the “Tyranny of the OR” (the view that things must be either A OR B but not both). Instead, they liberate themselves with the “Genius of the AND.” Instead of choosing between A OR B, they figure out a way to have both A AND B. When it comes to the flywheel, you need to fully embrace the Genius of the AND, sustain the flywheel AND renew the flywheel.",Turning the Flywheel: A Monograph to Accompany Good to Great,Jim Collins,[]
"Great companies did not simply employ best practices, they also focused on determining and abandoning detrimental practices.",Good To Great by Jim Collins: Summary of the Key Ideas in One Hour or Less,Eighty Twenty Publishing,[]
"Then Nancy read Jim Collins’s Good to Great, in which he contends if there’s one thing you are passionate about – and that you can be best at – you should do just that one thing. That’s when she realised the real opportunity to differentiate the company might be in the very type of work nobody else in the industry wanted to do: designing presentations.",Essentialism: The Disciplined Pursuit of Less,Greg McKeown,[]
"Avoid hiring on dubious qualifications. When in doubt, move on to the next candidate.",Good To Great by Jim Collins: Summary of the Key Ideas in One Hour or Less,Eighty Twenty Publishing,[]
"what truly set the big winners apart was their ability to turn initial success into a sustained flywheel, even if they started out behind the pioneers.",Turning the Flywheel: A Monograph to Accompany Good to Great,Jim Collins,[]
Compile a list of failures and disappointments. This should include new initiatives and offerings by your enterprise that have failed outright or fell far below expectations.,Turning the Flywheel: A Monograph to Accompany Good to Great,Jim Collins,[]
"The most important decisions that businesspeople make are not what decisions, but who decisions. —JIM COLLINS, AUTHOR OF GOOD TO GREAT",Who: The A Method for Hiring,Geoff Smart,[]
"Ken Blanchard, of Tom Friedman and of Seth Godin, The Starfish and the Spider by Ori Brafman and Rod Beckstrom, First, Break All the Rules by Marcus Buckingham, Good to Great by Jim Collins, The 7 Habits of Highly Effective People by Stephen Covey, The 4-Hour Workweek by Tim Ferriss, Never Eat Alone by Keith Ferrazzi,",Start with Why: How Great Leaders Inspire Everyone to Take Action,Simon Sinek,[]
"offered me new perspectives: the works of Ken Blanchard, of Tom Friedman and of Seth Godin, The Starfish and the Spider by Ori Brafman and Rod Beckstrom, First, Break All the Rules by Marcus Buckingham, Good to Great by Jim Collins, The 7 Habits of Highly Effective People by Stephen Covey, The 4-Hour Workweek by Tim Ferriss, Never Eat Alone by Keith Ferrazzi, E-Myth by Michael Gerber, The Tipping Point and Outliers by Malcolm Gladwell, Chaos by James Gleick, Emotional Intelligence by Daniel Goleman, Made to Stick by Chip and Dan Heath, Who Moved My Cheese? by Spencer Johnson, M.D., The Monk and the Riddle by Randy Komisar, The Five Dysfunctions of a Team by Patrick Lencioni, Freakonomics by Steven D. Levitt and Stephen J. Dubner, FISH! By Stephen Lundin, Harry Paul, John Christensen and Ken Blanchard, The Naked Brain by Richard Restack, Authentic Happiness by Martin Seligman, The Wisdom of Crowds by James Surowiecki, The Black Swan by Nicholas Taleb, American Mania by Peter Whybrow, M.D., and the single most important book everyone should read, the book that teaches us that we cannot control the circumstances around us, all we can control is our attitude—Man’s Search for Meaning by Viktor Frankl. I",Start with Why: How Great Leaders Inspire Everyone to Take Action,Simon Sinek,[]
"Jim Collins developed this idea further in his influential book Good to Great. According to Collins, organizations are much more likely to succeed if they, like the hedgehog, focus on one thing and do it well.","The Self-Discipline Blueprint: A Simple Guide to Beat Procrastination, Achieve Your Goals, and Get the Life You Want",Patrik Edblad,[]
"The leaders of good-to-great companies did not focus first on creating a vision or over-arching goal. Instead, they made sure to first get the best, brightest, and hardest-working people on board, while removing those that weren’t performing.",Good To Great by Jim Collins: Summary of the Key Ideas in One Hour or Less,Eighty Twenty Publishing,[]
"Management wizard Jim Collins, best-selling author of Good to Great and Built to Last, argues that what must glaringly separate great companies from mediocre ones is the latter’s tendency “to explain away the brutal facts rather than to confront the brutal facts head-on.",The Oz Principle: Getting Results Through Individual & Organizational Accountability,Roger Connors,[]
"Good to Great and Built to Last, both by Jim Collins, Mastering the Rockefeller Habits by Verne Harnish, and a bunch of books by Patrick Lencioni: The Advantage: Why Organizational Health Trumps Everything Else in Business, Death by Meeting, and Five Dysfunctions of the Team: A Leadership Fable.",Explosive Growth: A Few Things I Learned While Growing To 100 Million Users - And Losing $78 Million,Cliff Lerner,[]
"Stop doing"" lists are more important than""to do"" lists.",Good to Great: Why Some Companies Make the Leap... and Others Don't,Jim Collins,[]
"We are not imprisoned by our circumstances. We are not imprisoned by the luck we get or the inherent unfairness of life. We are not imprisoned by crushing setbacks, self-inflicted mistakes or our past success. We are not imprisoned by the time in which we live, by the number of hours in a day or even the number of hours we're granted in our very short lives. In the end, we can control only a tiny sliver of what happens to us. But even so, we are free to choose, free to become great by choice.","Good To Great [Hardcover] and Stop Thinking, Start Living 2 Books Collection Set",Jim Collins,['great-by-choice']
"Jim Collins, in his bestselling book Good to Great, demonstrates through massive research and comprehensive analysis that when it comes to CEO succession, internal candidates dramatically outperform external candidates. The core reason is knowledge. Knowledge of technology, prior decisions, culture, personnel, and more tends to be far more difficult to acquire than the skills required to manage a larger organization. Collins does not, however, explain why internal candidates sometimes fail as well. I will attempt to do so here. I will focus the discussion on two core skills for running an organization: First, knowing what to do. Second, getting the company to do what you know. While being a great CEO requires both skills, most CEOs tend to be more comfortable with one or the other. I call managers who are happier setting the direction of the company Ones and those who more enjoy making the company perform at the highest level Twos.",The Hard Thing About Hard Things: Building a Business When There Are No Easy Answers,Ben Horowitz,[]
"To use an analogy, the ""leadership is the answer to everything"" perspective is the modern equivalent of the, 'God is the answer to everything' perspective that held back our scientific understanding of the physical world in the Dark Ages.",Good to Great: Why Some Companies Make the Leap... and Others Don't,Jim Collins,"['business', 'leadership', 'theories-of-leadership']"
Consensus decisions are often at odds with intelligent decisions.,Good to Great: Why Some Companies Make the Leap... and Others Don't,Jim Collins,[]
"Good leadership is not just about creating a vision, but also about creating a culture where people speak the truth and face the honest facts.",Good To Great by Jim Collins: Summary of the Key Ideas in One Hour or Less,Eighty Twenty Publishing,[]
"Jim Collins’s Good to Great, in",Essentialism: The Disciplined Pursuit of Less,Greg McKeown,[]
It must capture the sequence that ignites and accelerates momentum.,Turning the Flywheel: A Monograph to Accompany Good to Great,Jim Collins,[]
