quoteText,bookTitle,bookAuthor,tags
"When you are tired of saying it, people are starting to hear it.","Measure What Matters: How Google, Bono, and the Gates Foundation Rock the World with OKRs",John Doerr,[]
"Not everything that can be counted counts, and not everything that counts can be counted.","Measure What Matters: How Google, Bono, and the Gates Foundation Rock the World with OKRs",John Doerr,[]
"Are these the right things for me/you/us to be focused on? If I/you/we complete them, will it be seen as a huge success? Do you have any feedback on how I/we could stretch even more?","Measure What Matters: How Google, Bono, and the Gates Foundation Rock the World with OKRs",John Doerr,[]
"hard goals” drive performance more effectively than easy goals. Second, specific hard goals “produce a higher level of output” than vaguely worded ones.","Measure What Matters: How Google, Bono, and the Gates Foundation Rock the World with OKRs",John Doerr,[]
"seminar on Intel strategy and operations. Resident professor: Dr. Andy Grove. In the space of an hour, Grove traced the company’s history, year by year. He summarized Intel’s core pursuits: a profit margin twice the industry norm, market leadership in any product line it entered, the creation of “challenging jobs” and “growth opportunities” for employees.* Fair enough, I thought, though I’d heard similar things at business school. Then he said something that left a lasting impression on me. He referenced his previous company, Fairchild, where he’d first met Noyce and Moore and went on to blaze a trail in silicon wafer research. Fairchild was the industry’s gold standard, but it had one great flaw: a lack of “achievement orientation.” “Expertise was very much valued there,” Andy explained. “That is why people got hired. That’s why people got promoted. Their effectiveness at translating that knowledge into actual results was kind of shrugged off.” At Intel, he went on, “we tend to be exactly the opposite. It almost doesn’t matter what you know. It’s what you can do with whatever you know or can acquire and actually accomplish [that] tends to be valued here.” Hence the company’s slogan: “Intel delivers.","Measure What Matters: How Google, Bono, and the Gates Foundation Rock the World with OKRs",John Doerr,[]
"If companies “don’t continue to innovate, they’re going to die—and I didn’t say iterate, I said innovate.","Measure What Matters: How Google, Bono, and the Gates Foundation Rock the World with OKRs",John Doerr,[]
