quoteText,bookTitle,bookAuthor,tags
"Feedback is an opinion, grounded in observations and experiences, which allows us to know what impression we make on others.” To reap the full benefits of OKRs, feedback must be integral to the process. If you don’t know how well you’re performing, how can you possibly get better? Today’s workers “want to be ‘empowered’ and ‘inspired,’ not told what to do. They want to provide feedback to their managers, not wait for a year to receive feedback from their managers. They want to discuss their goals on a regular basis, share them with others, and track progress from peers.” Public, transparent OKRs will trigger good questions from all directions: Are these the right things for me/you/us to be focused on? If I/you/we complete them, will it be seen as a huge success? Do you have any feedback on how I/we could stretch even more?","Measure What Matters: How Google, Bono, and the Gates Foundation Rock the World with OKRs",John E. Doerr,[]
The single greatest motivator is ‘making progress in one’s work.,"Measure What Matters: How Google, Bono, and the Gates Foundation Rock the World with OKRs",John E. Doerr,[]
"[T]he harder the goal the higher the level of performance. . . . Although subjects with very hard goals reached their goals far less often than subjects with very easy goals, the former consistently performed at a higher level than the latter.","Measure What Matters: How Google, Bono, and the Gates Foundation Rock the World with OKRs",John E. Doerr,[]
"Coach” Bill Campbell’s wisdom is invoked more fleetingly. Here, then, is our opportunity to celebrate Bill, a man who gave so much to so many. From his gift for honest, open communication to his zeal for data-driven operating excellence, the Coach embodied the very spirit of OKRs. So it’s only fitting that he graces our close.","Measure What Matters: How Google, Bono, and the Gates Foundation Rock the World with OKRs",John E. Doerr,[]
"For each objective, settle on no more than five measurable, unambiguous, time-bound key results—how the objective will be attained. By definition, completion of all key results equates to the attainment of the objective.","Measure What Matters: How Google, Bono, and the Gates Foundation Rock the World with OKRs",John E. Doerr,[]
"Encourage a healthy proportion of bottom-up OKRs—roughly half. Smash departmental silos by connecting teams with horizontally shared OKRs. Cross-functional operations enable quick and coordinated decisions, the basis for seizing a competitive advantage. Make all lateral, cross-functional dependencies explicit.","Measure What Matters: How Google, Bono, and the Gates Foundation Rock the World with OKRs",John E. Doerr,[]
"From Adobe’s experience, I’d say that a continuous performance management system has three requirements. The first is executive support. The second is clarity on company objectives and how they align with individual priorities—as set out in our “goals and expectations,” which equate to OKRs. The third is an investment in training to equip managers and leaders to be more effective. We’re not shipping people out to courses. We’re steering them to one-hour sessions online, with role-played vignettes: “Do you need to give difficult feedback? Here are the steps.","Measure What Matters: How Google, Bono, and the Gates Foundation Rock the World with OKRs",John E. Doerr,[]
"To safeguard quality while pushing for quantitative deliverables, one solution is to pair key results—to measure “both effect and counter-effect,” as","Measure What Matters: How Google, Bono, and the Gates Foundation Rock the World with OKRs",John E. Doerr,[]
"Vision-based leadership beats command-and-control. The flatter the org chart, the more agile the organization. When performance management is a networked, two-way street, individuals grow into greatness.","Measure What Matters: How Google, Bono, and the Gates Foundation Rock the World with OKRs",John E. Doerr,[]
"Early on in your career, when you’re an individual contributor, you’re graded on the volume and quality of your work. Then one day, all of a sudden, you’re a manager. Let’s assume you do well and move up to manage more and more people. Now you’re no longer paid for the amount of work you do; you’re paid for the quality of decisions you make. But no one tells you the rules have changed. When you hit a wall, you think, I’ll just work harder—that’s what got me here. What you should do is more counterintuitive: Stop for a moment and shut out the noise. Close your eyes to really see what’s in front of you, and then pick the best way forward for you and your team, relative to the organization’s needs. What’s neat about OKRs is that they formalize reflection. At least once each quarter, they make contributors step back into a quiet place and consider how their decisions align with the company. People start thinking in the macro. They become more pointed and precise, because you can’t write a ninety-page OKR dissertation. You have to choose three to five things and exactly how they should be measured. Then when the day comes and someone says, “Okay, you’re a manager,” you’ve already learned how to think like one. And that’s huge.","Measure What Matters: How Google, Bono, and the Gates Foundation Rock the World with OKRs",John E. Doerr,[]
"Andy Grove estimated that 90 minutes of a manager's time can enhance the quality of your subordinates work for 2 weeks... The point of the meeting, we wrote, 'the meeting's main purpose is mutual teaching and exchange of information. By talking about specific situations, the supervisor teaches the subordinate skills, know-how and suggests ways to approach things. At the same time, the subordinate provide the supervisor with detailed information about what he's doing and what he's concerned about and what is learned is absolutely essential if the supervisor is to make good decisions. A key point about 1-1s - it should be regarded as the subordinate's meeting with its agenda set by him. What's the role of a supervisor in a 1-1? He should facilitate the subordinate's expression of what's going on and what's bothering him. The supervisor should also encourage the discussion of heart to heart issues during 1-1s because this is the perfect forum for getting at subtle and deep work related items affecting his subordinate. Is he satisfied with his own performance? Does some frustration or obstacle gnaw at him? Does he have doubts about where he is going?' ... Effective 1-1s dig beneath the surface of day to day work. They have a set cadence.","Measure What Matters, Blitzscaling, Scale Up Millionaire, The Profits Principles 4 Books Collection Set",John Doerr,[]
"When you come down to it, alignment is about helping people understand what you want them to do. Most contributors will be motivated to ladder up to the top-line OKRs—assuming they know where to set the ladder. As our team got larger and more layered, we confronted new issues. One product manager was working on Premium, the enhanced subscription version of our app. Another focused on our API platform, to enable third parties like Fitbit to connect to MyFitnessPal and write data to it or applications on top of it. The third addressed our core login experience. All three had individual OKRs for what they hoped to accomplish—so far, so good. The problem was our shared engineering team, which got caught in the middle. The engineers weren’t aligned with the product managers’ objectives. They had their own infrastructure OKRs, to keep the plumbing going and the lights on. We assumed they could do it all—a big mistake. They got confused about what they should be working on, which could change without notice. (Sometimes it boiled down to which product manager yelled loudest.) As the engineers switched between projects from week to week, their efficiency dragged.","Measure What Matters: How Google, Bono, and the Gates Foundation Rock the World with OKRs",John E. Doerr,[]
"I felt super-frustrated. We’d hired all these talented people and were spending tons of money, but we weren’t going any faster. Things came to a head over a top-priority marketing OKR for personalized emails with targeted content. The objective was well constructed: We wanted to drive a certain minimum number of monthly active users to our blog. One important key result was to increase our click-through rate from emails. The catch was that no one in marketing had thought to inform engineering, which had already set its own priorities that quarter. Without buy-in from the engineers, the OKR was doomed before it started. Even worse, Albert and I didn’t find out it was doomed until our quarterly postmortem. (The project got done a quarter late.) That was our wake-up call, when we saw the need for more alignment between teams. Our OKRs were well crafted, but implementation fell short. When departments counted on one another for crucial support, we failed to make the dependency explicit. Coordination was hit-and-miss, with deadlines blown on a regular basis. We had no shortage of objectives, but our teams kept wandering away from one another. The following year, we tried to fix the problem with periodic integration meetings for the executive team. Each quarter our department heads presented their goals and identified dependencies. No one left the room until we’d answered some basic questions: Are we meeting everyone’s needs for buy-in? Is a team overstretched? If so, how can we make their objectives more realistic?","Measure What Matters: How Google, Bono, and the Gates Foundation Rock the World with OKRs",John E. Doerr,[]
"A tool, not a weapon. The OKR system, Grove wrote, “is meant to pace a person—to put a stopwatch in his own hand so he can gauge his own performance. It is not a legal document upon which to base a performance review.” To encourage risk taking and prevent sandbagging, OKRs and bonuses are best kept separate. (See chapter 15, “Continuous Performance Management: OKRs and CFRs.”)","Measure What Matters: How Google, Bono, and the Gates Foundation Rock the World with OKRs",John E. Doerr,[]
Superpower #3: Track for Accountability In God we trust; all others must bring data. —W. Edwards Deming,"Measure What Matters: How Google, Bono, and the Gates Foundation Rock the World with OKRs",John E. Doerr,[]
"the phrase “as measured by,” or a.m.b.—into Intel’s company OKRs. For example, “We will achieve a certain OBJECTIVE as measured by the following KEY RESULTS. . . .” Bill’s a.m.b made the implicit explicit to all.","Measure What Matters: How Google, Bono, and the Gates Foundation Rock the World with OKRs",John E. Doerr,[]
"Crush was a thoroughly cascaded set of OKRs, heavily driven from the top, but with input from below. At Andy Grove’s level, or even my level, you couldn’t know all the mechanics of how the battle should be won. A lot of this stuff has to flow uphill. You can tell people to clean up a mess, but should you be telling them which broom to use? When top management was saying “We’ve got to crush Motorola!” somebody at the bottom might have said “Our benchmarks are lousy; I think I’ll write some better benchmarks.” That was how we worked.","Measure What Matters: How Google, Bono, and the Gates Foundation Rock the World with OKRs",John E. Doerr,[]
"INTEL CORPORATE OBJECTIVE Establish the 8086 as the highest performance 16-bit microprocessor family, as measured by: KEY RESULTS (Q2 1980) Develop and publish five benchmarks showing superior 8086 family performance (Applications). Repackage the entire 8086 family of products (Marketing). Get the 8MHz part into production (Engineering, Manufacturing). Sample the arithmetic coprocessor no later than June 15 (Engineering).","Measure What Matters: How Google, Bono, and the Gates Foundation Rock the World with OKRs",John E. Doerr,[]
"Set goals from the bottom up. To promote engagement, teams and individuals should be encouraged to create roughly half of their own OKRs, in consultation with managers. When all goals are set top-down, motivation is corroded.",Measure What Matters,John E. Doerr,[]
"To encourage risk taking and prevent sandbagging, OKRs and bonuses are best kept separate.",Measure What Matters,John E. Doerr,[]
"When goals are public and visible to all, a “team of teams” can attack trouble spots wherever they surface. Adds Bock: “You can see immediately if somebody’s hitting the ball out of the park—you investigate. If somebody’s missing all the time, you investigate. Transparency creates very clear signals for everyone. You kick off virtuous cycles that reinforce your ability to actually get your work done. And the management tax is zero—it’s amazing.","Measure What Matters: How Google, Bono, and the Gates Foundation Rock the World with OKRs",John E. Doerr,[]
"At Intel, Andy recruited “aggressive introverts” in his own image, people who solved problems quickly, objectively, systematically, and permanently.","Measure What Matters: How Google, Bono, and the Gates Foundation Rock the World with OKRs",John Doerr,[]
"awareness in the United States. In May, we expanded our demographic by launching Chrome for OS X and Linux. At last, our browser was no longer a Windows-only product. Well into the third quarter, the outcome remained in doubt. Then we did a small thing that became a big thing: a passive alert for former Chrome users who’d been dormant. Weeks later, at the end of Q3, our user total had surged from 87 million to 107 million. And shortly after that, we reached 111 million seven-day actives. We had achieved our goal. Today, on mobile alone, there are more than a billion active users of Chrome. We couldn’t have gotten there without objectives and key results. OKRs are the way we think about everything at Google, the way we’ve always done it.","Measure What Matters: How Google, Bono, and the Gates Foundation Rock the World with OKRs",John E. Doerr,[]
"For an OKR system to function effectively, the team deploying it—whether a group of top executives or an entire organization—must adopt it universally. No exceptions, no opt-outs.","Measure What Matters: How Google, Bono, and the Gates Foundation Rock the World with OKRs",John E. Doerr,[]
"four OKR superpowers: focus, alignment, tracking, and stretching.",Measure What Matters,John E. Doerr,[]
"When an OKR rises to the top line, “all eyes in the company are on your team,” Rick says. “That’s a lot of eyes! We had no idea how we’d do it in three months, but we understood that owning a company-level OKR showed that our work took priority.",Measure What Matters,John E. Doerr,[]
"In both one-on-ones and team meetings, these wrap-ups consist of three parts: objective scoring, subjective self-assessment, and reflection.","Measure What Matters: How Google, Bono, and the Gates Foundation Rock the World with OKRs",John E. Doerr,[]
"Key results are the levers you pull, the marks you hit to achieve the goal. If an objective is well framed, three to five KRs will usually be adequate to reach it. Too many can dilute focus and obscure progress. Besides, each key result should be a challenge in its own right. If you’re certain you’re going to nail it, you’re probably not pushing hard enough.","Measure What Matters: How Google, Bono, and the Gates Foundation Rock the World with OKRs",John E. Doerr,[]
"Why is transparency important? Why would you want people across other departments to know your goals? And why does what we’re doing matter? What is true accountability? What’s the difference between accountability with respect (for others’ failings) and accountability with vulnerability (for our own)? How can OKRs help managers “get work done through others”? (That’s a big factor for scalability in a growing company.) How do we engage other teams to adopt our objective as a priority and help assure that we reach it? When is it time to stretch a team’s workload—or to ease off on the throttle? When do you shift an objective to a different team member, or rewrite a goal to make it clearer, or remove it completely? In building contributors’ confidence, timing is everything.","Measure What Matters: How Google, Bono, and the Gates Foundation Rock the World with OKRs",John E. Doerr,[]
some significant percentage of people are working on the wrong things. The challenge is knowing which ones.,"Measure What Matters: How Google, Bono, and the Gates Foundation Rock the World with OKRs",John E. Doerr,[]
"The reviews run for three hours, with a dozen senior executives taking their turn. Little time is spent on people’s greens. Instead, they “sell” their reds. The team votes on the most important at-risk OKRs for the company as a whole, then brainstorms together as long as it takes to get the objectives back on track. In the spirit of cross-departmental solidarity, individuals volunteer to “buy” their colleagues’ reds. As Art says, “We’re all here to help. We’re all in the same bathwater.” As far as I know, “selling your reds” is a unique use of OKRs, and one well worth emulating.","Measure What Matters: How Google, Bono, and the Gates Foundation Rock the World with OKRs",John E. Doerr,[]
"Grove was fascinated to find that some people, with no",Measure What Matters,John E. Doerr,[]
"As I see it, co-ownership weakens accountability. If an OKR fails, I don’t want two people blaming each other. Even when two or more teams have parallel objectives, their key results should be distinct.","Measure What Matters: How Google, Bono, and the Gates Foundation Rock the World with OKRs",John E. Doerr,[]
"When you come down to it, alignment is about helping people understand what you want them to do.","Measure What Matters: How Google, Bono, and the Gates Foundation Rock the World with OKRs",John E. Doerr,[]
"But exactly how do you build engagement? A two-year Deloitte study found that no single factor has more impact than “clearly defined goals that are written down and shared freely. . . . Goals create alignment, clarity, and job satisfaction","Measure What Matters: How Google, Bono, and the Gates Foundation Rock the World with OKRs",John E. Doerr,[]
"Key results are more earthbound and metric-driven. They typically include hard numbers for one or more gauges: revenue, growth, active users, quality, safety, market share, customer engagement.","Measure What Matters: How Google, Bono, and the Gates Foundation Rock the World with OKRs",John E. Doerr,[]
"Leaders must get across the why as well as the what. Their people need more than milestones for motivation. They are thirsting for meaning, to understand how their goals relate to the mission. And the process can’t stop with unveiling top-line OKRs at a quarterly all-hands meeting. As LinkedIn CEO Jeff Weiner likes to say, “When you are tired of saying it, people are starting to hear it.","Measure What Matters: How Google, Bono, and the Gates Foundation Rock the World with OKRs",John E. Doerr,[]
"A management methodology that helps to ensure that the company focuses efforts on the same important issues throughout the organization.” An OBJECTIVE, I explained, is simply WHAT is to be achieved, no more and no less. By definition, objectives are significant, concrete, action oriented, and (ideally) inspirational. When properly designed and deployed, they’re a vaccine against fuzzy thinking—and fuzzy execution","Measure What Matters: How Google, Bono, and the Gates Foundation Rock the World with OKRs",John E. Doerr,[]
A management methodology that helps to ensure that the company focuses efforts on the same important issues throughout the organization.,Measure What Matters,John E. Doerr,[]
"Goals may cause systematic problems in organizations due to narrowed focus, unethical behavior, increased risk taking, decreased cooperation, and decreased motivation.",Measure What Matters,John E. Doerr,[]
hard goals” drive performance more effectively than easy goals.,Measure What Matters,John E. Doerr,[]
"Second, specific hard goals “produce a higher level of output” than vaguely worded ones.",Measure What Matters,John E. Doerr,[]
"To be clear, I have the utmost reverence for entrepreneurs. I’m an inveterate techie who worships at the altar of innovation. But I’d also watched too many start-ups struggle with growth and scale and getting the right things done. So I’d come to a philosophy, my mantra: Ideas are easy. Execution is everything.","Measure What Matters: How Google, Bono, and the Gates Foundation Rock the World with OKRs",John E. Doerr,[]
"90 percent confirm that productivity is enhanced by well-defined, challenging goals.",Measure What Matters,John E. Doerr,[]
"clearly defined goals that are written down and shared freely …. Goals create alignment, clarity, and job satisfaction.",Measure What Matters,John E. Doerr,[]
goals “can inspire employees and improve performance.,Measure What Matters,John E. Doerr,[]
"Remember that an OKR can be modified or even scrapped at any point in its cycle. Sometimes the “right” key results surface weeks or months after a goal is put into play. OKRs are inherently works in progress, not commandments chiseled in stone.",Measure What Matters,John E. Doerr,[]
people who recorded their goals and sent weekly progress reports to a friend attained 43 percent more of their objectives than those who merely thought about goals without sharing them.,"Measure What Matters: How Google, Bono, and the Gates Foundation Rock the World with OKRs",John E. Doerr,[]
"From: Jonathan Rosenberg Date: Thu, Aug 5, 2010 at 2:59 PM Subject: Amidst boundless opportunities, 13 PMs whiff on OKRs (names included) Product Gang, As most of you know, I strongly believe that having a good set of quarterly OKRs is an important part of being successful at Google. That’s why I regularly send you notes reminding you to get them done on time, and why I ask managers to review them to make sure all of our OKRs are good. I’ve tried notes that are nice and notes that are mean. Personal favorites include threatening you with Jonathan’s Pit of Despair in October 07 and celebrating near perfection in July 08. Over time I iterated this carrot/stick approach until we reached near 100% compliance. Yay! So then I stopped sending notes, and look what happened: this quarter, SEVERAL of you didn’t get your OKRs done on time, and several others didn’t grade your Q2 OKRs. It turns out it’s not the type of note I send that matters, but the fact that I send anything at all! Names of the fallen are duly noted below (with a pass given to several AdMob employees who are new to the ways of Google, and to many of you who missed the deadline but still got them done in July). We have so many great opportunities before us (search, ads, display, YouTube, Android, enterprise, local, commerce, Chrome, TV, mobile, social . . .) that if you can’t come up with OKRs that get you excited about coming to work every day, then something must be wrong. In fact, if that’s really the case, come see me. In the meantime, please do your OKRs on time, grade your previous quarter’s OKRs, do a good job at it, and post them so that the OKR link from your moma [intranet] page works. This is not administrative busywork, it’s an important way to set your priorities for the quarter and ensure that we’re all working together. Jonathan","Measure What Matters: How Google, Bono, and the Gates Foundation Rock the World with OKRs",John Doerr,[]
"OKR wrap-ups are retrospective and forward-looking at the same time. An unfinished objective might be rolled over to the next quarter, with a fresh set of key results—or perhaps its moment has passed, and it is appropriately dropped.","Measure What Matters: How Google, Bono, and the Gates Foundation Rock the World with OKRs",John E. Doerr,[]
"Goal setting is more art than science. We weren’t just teaching people how to refine an objective or a measurable key result. We had a cultural agenda, as well. Why is transparency important? Why would you want people across other departments to know your goals? And why does what we’re doing matter? What is true accountability? What’s the difference between accountability with respect (for others’ failings) and accountability with vulnerability (for our own)? How can OKRs help managers “get work done through others”? (That’s a big factor for scalability in a growing company.) How do we engage other teams to adopt our objective as a priority and help assure that we reach it? When is it time to stretch a team’s workload—or to ease off on the throttle? When do you shift an objective to a different team member, or rewrite a goal to make it clearer, or remove it completely? In building contributors’ confidence, timing is everything.","Measure What Matters: How Google, Bono, and the Gates Foundation Rock the World with OKRs",John Doerr,[]
"Objectives are the “Whats.” They: express goals and intents; are aggressive yet realistic; must be tangible, objective, and unambiguous; should be obvious to a rational observer whether an objective has been achieved. The successful achievement of an objective must provide clear value","Measure What Matters: How Google, Bono, and the Gates Foundation Rock the World with OKRs",John E. Doerr,[]
"Cross-team OKRs should include all the groups who must materially participate in the OKR, and OKRs committing to each group’s contribution should appear explicitly in each such group’s OKRs. For","Measure What Matters: How Google, Bono, and the Gates Foundation Rock the World with OKRs",John E. Doerr,[]
