quoteText,bookTitle,bookAuthor,tags
"If you’re achieving all your goals, you’re not setting them aggressively enough.",Work Rules!: Insights from Inside Google That Will Transform How You Live and Lead,Laszlo Bock,[]
"If your goals are ambitious and crazy enough, even failure will be a pretty good achievement.",Work Rules!: Insights from Inside Google That Will Transform How You Live and Lead,Laszlo Bock,[]
All it takes is a belief that people are fundamentally good—and enough courage to treat your people like owners instead of machines. Machines do their jobs; owners do whatever is needed to make their companies and teams successful. People spend,Work Rules!: Insights from Inside Google That Will Transform How You Live and Lead,Laszlo Bock,[]
"So we ran the experiment. For a period of time, in our control groups of Googlers, people who were nominated for cash awards continued to receive them. In our experimental groups, nominated winners received trips, team parties, and gifts of the same value as the cash awards they would have received. Instead of making public stock awards, we sent teams to Hawaii. Instead of smaller awards, we provided trips to health resorts, blowout team dinners, or Google TVs for the home. The result was astounding. Despite telling us they would prefer cash over experiences, the experimental group was happier. Much happier. They thought their awards were 28 percent more fun, 28 percent more memorable, and 15 percent more thoughtful. This was true whether the experience was a team trip to Disneyland (it turns out most adults are still kids on the inside) or individual vouchers to do something on their own. And they stayed happier for a longer period of time than Googlers who received money. When resurveyed five months later, the cash recipients’ levels of happiness with their awards had dropped by about 25 percent. The experimental group was even happier about the award than when they received it. The joy of money is fleeting, but memories last forever.",Work Rules!: Insights from Inside Google That Will Transform How You Live and Lead,Laszlo Bock,[]
"Micromanagement is mismanagement. … [P]eople micromanage to assuage their anxieties about organizational performance: they feel better if they are continuously directing and controlling the actions of others—at heart, this reveals emotional insecurity on their part. It gives micromanagers the illusion of control (or usefulness). Another motive is lack of trust in the abilities of staff—micromanagers do not believe that their colleagues will successfully complete a task or discharge a responsibility even when they say they will.”108",Work Rules!: Insights from Inside Google That Will Transform How You Live and Lead,Laszlo Bock,[]
"How many people would you trade for your very best performer? If the number is more than five, you’re probably underpaying your best person. And if it’s more than ten, you’re almost certainly underpaying.",Work Rules!: Insights from Inside Google That Will Transform How You Live and Lead,Laszlo Bock,[]
"So what is Adam’s insight? Having workers meet the people they are helping is the greatest motivator, even if they only meet for a few minutes. It imbues one’s work with a significance that transcends careerism or money.",Work Rules!: Insights from Inside Google That Will Transform How You Live and Lead,Laszlo Bock,[]
"Work is far less meaningful and pleasant than it needs to be because well-intentioned leaders don’t believe, on a primal level, that people are good. Organizations build immense bureaucracies to control their people. These control structures are an admission that people can’t be trusted. Or at best, they suggest that one’s baser nature can be controlled and channeled by some enlightened figure with the wisdom to know what is best.",Work Rules!: Insights from Inside Google That Will Transform How You Live and Lead,Laszlo Bock,[]
"Put simply, because many professionals are almost always successful at what they do, they rarely experience failure. And because they have rarely failed, they have never learned how to learn from failure. … [T]hey become defensive, screen out criticism, and put the “blame” on anyone and everyone but themselves. In short, their ability to learn shuts down precisely at the moment they need it the most.",Work Rules!: Insights from Inside Google That Will Transform How You Live and Lead,Laszlo Bock,[]
The focus on process rather than purpose creates an insidious opportunity for sly employees to manipulate the system.,Work Rules!: Insights from Inside Google That Will Transform How You Live and Lead,Laszlo Bock,[]
"Companies then turn vice into virtue by bragging about how much they spend on training. But since when is spending a measure of quality results? Do people boast, “I’m in great shape—I spent $500 on my gym membership this month?” The presence of a huge training budget is not evidence that you’re investing in your people. It’s evidence that you failed to hire the right people to begin with.",Work Rules!: Insights from Inside Google That Will Transform How You Live and Lead,Laszlo Bock,[]
"Googlers working in engineering or product management can nominate themselves for promotion.xlv Interestingly enough, we found that women are less likely to nominate themselves for promotion, but that when they do, they are promoted at slightly higher rates than men.",Work Rules!: Insights from Inside Google That Will Transform How You Live and Lead,Laszlo Bock,[]
"Senior executives shouldn’t be wasting time debating whether the best background color for an ad is yellow or blue. Just run an experiment. This leaves management free to worry about the stuff that is hard to quantify, which is usually a much better use of their time.",Work Rules!: Insights from Inside Google That Will Transform How You Live and Lead,Laszlo Bock,[]
"Ujjwal Singh, Steve Crossan, and Abdel Karim Mardini partnered with engineers from Twitter following the Egyptian government’s shutdown of the Internet in early 2011 to create Speak2Tweet, a product that takes messages from a voice mailbox and transcribes them into Tweets broadcast around the world.35 This gave Egyptians a way to communicate en masse with the world and, by dialing into the voice mailbox, to listen to one another.",Work Rules!: Insights from Inside Google That Will Transform How You Live and Lead,Laszlo Bock,[]
"if you believe people are fundamentally good and worthy of trust, you must be honest and transparent with them. That includes telling them when they are lagging behind in their performance. But having a mission-driven, purposeful workplace also requires that you approach people with sensitivity.",Work Rules!: Insights from Inside Google That Will Transform How You Live and Lead,Laszlo Bock,[]
"A billion hours ago, modern Homo sapiens emerged. A billion minutes ago, Christianity began. A billion seconds ago, the IBM personal computer was released. A billion Google searches ago… was this morning. —HAL VARIAN, GOOGLE’S CHIEF ECONOMIST, DECEMBER 20, 2013",Work Rules!: Insights from Inside Google That Will Transform How You Live and Lead,Laszlo Bock,[]
"The very best people aren’t out there looking for work. Great-performing people are happy and being amply rewarded where they are today. They don’t occur to people as referrals, because why would you bother referring someone who is happy at their current job?",Work Rules!: Insights from Inside Google That Will Transform How You Live and Lead,Laszlo Bock,[]
The pedigree of your college education matters far less than what you have accomplished.,Work Rules!: Insights from Inside Google That Will Transform How You Live and Lead,Laszlo Bock,[]
"We have an embarrassingly simple solution. Never have the conversations at the same time. Annual reviews happen in November, and pay discussions happen a month later. Everyone at Google is eligible for stock grants, but those decisions are made a further six months down the line.",Work Rules!: Insights from Inside Google That Will Transform How You Live and Lead,Laszlo Bock,[]
"Building an exceptional team or institution starts with a founder. But being a founder doesn’t mean starting a new company. It is within anyone’s grasp to be the founder and culture-creator of their own team, whether you are the first employee or joining a company that has existed for decades.",Work Rules!: Insights from Inside Google That Will Transform How You Live and Lead,Laszlo Bock,[]
"When people gather together in unexpected ways, it inevitably spurs innovation—the third goal driving our programs. Amazon lists 54,950 books on innovation for sale, presenting many competing and often conflicting theories. Google, of course, has a number of approaches, but the most salient one is the way we use our benefits and also our environment to increase the number of “moments of serendipity” that spark creativity.",Work Rules!: Insights from Inside Google That Will Transform How You Live and Lead,Laszlo Bock,[]
"Ronald Burt, a sociologist at the University of Chicago, has shown that innovation tends to occur in the structural holes between social groups. These could be the gaps between business functional units, teams that tend not to interact, or even the quiet person at the end of the conference table who never says anything. Burt has a delicious way of putting it: “People who stand near the holes in a social structure are at higher risk of having good ideas.",Work Rules!: Insights from Inside Google That Will Transform How You Live and Lead,Laszlo Bock,[]
"But without state-approved syllabi and standardized testing, my education can only go so far.",Work Rules!: Insights from Inside Google That Will Transform How You Live and Lead,Laszlo Bock,[]
"Most companies manage people using a normal distribution, with most people labeled as average and two tails of weak and strong performers pushed out to the sides. The tails aren’t as symmetrical as when you look at height, because failing employees get fired and the worst don’t even make it in the door, so the left tail is cut short. Companies also treat people as if their actual output follows the same distribution. That’s an error. In fact, human performance in organizations follows a power law distribution for most jobs. Herman Aguinis and Ernest O’Boyle of Indiana University and the University of Iowa explain that “instead of a massive group of average performers dominating … through sheer numbers, a small group of elite performers [dominate] through massive performance.",Work Rules!: Insights from Inside Google That Will Transform How You Live and Lead,Laszlo Bock,[]
"A billion hours ago, modern Homo sapiens emerged. A billion minutes ago, Christianity began. A billion seconds ago, the IBM personal computer was released. A billion Google searches ago… was this morning.",Work Rules!: Insights from Inside Google That Will Transform How You Live and Lead,Laszlo Bock,[]
"And if people shoot for the starts and only hit the moon, don't treat them too harshly. Ease the pain of failure to leave room for learning. As Larry often says: If your goals are ambitious and crazy enough, even failure will be a pretty good achievement.",Work Rules!: Insights from Inside Google That Will Transform How You Live and Lead,Laszlo Bock,[]
"Marissa Mayer, at the time a Google vice president of product management and now CEO of Yahoo, told Steven Levy in his book In the Plex: “You can’t understand Google… unless you know that both Larry and Sergey were Montessori kids.”22 This teaching environment is tailored to a child’s learning needs and personality, and children are encouraged to question everything, act of their own volition, and create.",Work Rules!: Insights from Inside Google That Will Transform How You Live and Lead,Laszlo Bock,[]
"If you have facts, present them and we’ll use them. But if you have opinions, we’re gonna use mine.",Work Rules!: Insights from Inside Google That Will Transform How You Live and Lead,Laszlo Bock,[]
"The meaning of employee engagement is ambiguous among both academic researchers and among practitioners. … [The] term is used at different times to refer to psychological states, traits, and behaviors as well as their antecedents and outcomes.”107",Work Rules!: Insights from Inside Google That Will Transform How You Live and Lead,Laszlo Bock,[]
"see I wear only gray or blue suits,’ [President Obama] said. ‘I’m trying to pare down decisions. I don’t want to make decisions about what I’m eating or wearing. Because I have too many other decisions to make.’ He mentioned research that shows the simple act of making decisions degrades one’s ability to make further decisions. It’s why shopping is so exhausting. ‘You need to focus your decision-making energy. You need to routinize yourself. You can’t be going through the day distracted by trivia.",Work Rules!: Insights from Inside Google That Will Transform How You Live and Lead,Laszlo Bock,[]
How can you tell if you have found someone exceptional? My simple rule of thumb—and the second big change to make in how you hire—is: “Only hire people who are better than you.,Work Rules!: Insights from Inside Google That Will Transform How You Live and Lead,Laszlo Bock,[]
"If you’re committed to transforming your team or your organization, hiring better is the single best way to do it.",Work Rules!: Insights from Inside Google That Will Transform How You Live and Lead,Laszlo Bock,[]
The kind of workman who gives the business the best that is in him is the best kind of workman a business can have. And he cannot be expected to do this indefinitely without proper recognition. …,Work Rules!: Insights from Inside Google That Will Transform How You Live and Lead,Laszlo Bock,[]
"What’s a manager to do without these traditional sticks and carrots? The only thing that’s left. “Managers serve the team,",Work Rules!: Insights from Inside Google That Will Transform How You Live and Lead,Laszlo Bock,[]
"Closer to home, the 1999 film Office Space, which deadpanned the meaningless rituals and bureaucracy of a fictional technology company, became a cult hit because it was instantly recognizable. In the movie, programmer Peter Gibbons describes his job to a hypnotherapist: Peter: So I was sitting in my cubicle today, and I realized, ever since I started working, every single day of my life has been worse than the day before it. So that means that every single day that you see me, that’s on the worst day of my life. Dr. Swanson: What about today? Is today the worst day of your life? Peter: Yeah. Dr. Swanson: Wow, that’s messed up.14",Work Rules!: Insights from Inside Google That Will Transform How You Live and Lead,Laszlo Bock,[]
"Give people slightly more trust, freedom, and authority than you are comfortable giving them. If you’re not nervous, you haven’t given them enough.",Work Rules!: Insights from Inside Google That Will Transform How You Live and Lead,Laszlo Bock,[]
Power corrupts; absolute power corrupts absolutely.,Work Rules!: Insights from Inside Google That Will Transform How You Live and Lead,Laszlo Bock,[]
You can’t understand Google… unless you know that both Larry and Sergey were Montessori kids.”22,Work Rules!: Insights from Inside Google That Will Transform How You Live and Lead,Laszlo Bock,[]
"One of my hopes in writing this book is that anyone reading it starts thinking of themselves as a founder. Maybe not of an entire company, but the founder of a team, a family, a culture. The fundamental lesson from Google’s experience is that you must first choose whether you want to be a founder or an employee. It’s not a question of literal ownership. It’s a question of attitude.",Work Rules!: Insights from Inside Google That Will Transform How You Live and Lead,Laszlo Bock,[]
how to pay people—and how to do so fairly and in consonance with our values—has always been a serious question at Google.,Work Rules!: Insights from Inside Google That Will Transform How You Live and Lead,Laszlo Bock,[]
"As Larry often points out, “If you set a crazy, ambitious goal and miss it, you’ll still achieve something remarkable.",Work Rules!: Insights from Inside Google That Will Transform How You Live and Lead,Laszlo Bock,[]
Were the right low performers identified? Were the right people identified for promotion? Were the discussions meaningful? Was the process fair?,Work Rules!: Insights from Inside Google That Will Transform How You Live and Lead,Laszlo Bock,[]
"Superb hiring isn’t just about recruiting the biggest name, top salesperson, or cleverest engineer. It’s about finding the very best people who will be successful in the context of your organization, and who will make everyone around them more successful.",Work Rules!: Insights from Inside Google That Will Transform How You Live and Lead,Laszlo Bock,[]
"Unless your job is changing rapidly, this is a universal trap that we all fall into. It’s difficult to keep learning and stay motivated when the road stretching ahead of you looks exactly like the road behind you.",Work Rules!: Insights from Inside Google That Will Transform How You Live and Lead,Laszlo Bock,[]
"As Sergey has commented: “I do think I benefited from the Montessori education, which in some ways gives the students a lot more freedoms to do things at their own pace.” Marissa Mayer, at the time a Google vice president of product management and now CEO of Yahoo, told Steven Levy in his book In the Plex: “You can’t understand Google… unless you know that both Larry and Sergey were Montessori kids.”22 This teaching environment is tailored to a child’s learning needs and personality, and children are encouraged to question everything, act of their own volition, and create.",Work Rules!: Insights from Inside Google That Will Transform How You Live and Lead,Laszlo Bock,[]
"We couldn’t figure out why until we went out and did a user study at a nearby college, actually watching students try to use Google. According to Marissa Mayer, at the time a Googler and now CEO of Yahoo, they were so accustomed to cluttered websites that “flashed, revolved, and asked you to punch the monkey” that they thought there had to be more coming.165 They weren’t searching because they were waiting for the page to finish loading. Engineering vice president Jen Fitzpatrick added: “We wound up sticking a copyright tag at the bottom of the page, not so much because we needed a copyright on the page, but because it was a way to say ‘This is the end.’” The copyright notice fixed the problem.",Work Rules!: Insights from Inside Google That Will Transform How You Live and Lead,Laszlo Bock,[]
"one of our earliest challenges was that users would look at the Google Web page and not type anything. We couldn’t figure out why until we went out and did a user study at a nearby college, actually watching students try to use Google. According to Marissa Mayer, at the time a Googler and now CEO of Yahoo, they were so accustomed to cluttered websites that “flashed, revolved, and asked you to punch the monkey” that they thought there had to be more coming.165 They weren’t searching because they were waiting for the page to finish loading. Engineering vice president Jen Fitzpatrick added: “We wound up sticking a copyright tag at the bottom of the page, not so much because we needed a copyright on the page, but because it was a way to say ‘This is the end.’” The copyright notice fixed the problem.",Work Rules!: Insights from Inside Google That Will Transform How You Live and Lead,Laszlo Bock,[]
"Marissa Mayer, at the time a Google vice president of product management and now CEO of Yahoo, told Steven Levy in his book In the Plex: “You can’t understand Google… unless you know that both Larry and Sergey were Montessori kids.",Work Rules!: Insights from Inside Google That Will Transform How You Live and Lead,Laszlo Bock,[]
"As Larry often says: If your goals are ambitious and crazy enough, even failure will be a pretty good achievement.",Work Rules!: Insights from Inside Google That Will Transform How You Live and Lead,Laszlo Bock,[]
the most talented and creative people can’t be forced to work.,Work Rules!: Insights from Inside Google That Will Transform How You Live and Lead,Laszlo Bock,[]
"The joy of money is fleeting, but memories last forever.",Work Rules!: Insights from Inside Google That Will Transform How You Live and Lead,Laszlo Bock,[]
"Pick an area where your people are frustrated, and let them fix it.",Work Rules!: Insights from Inside Google That Will Transform How You Live and Lead,Laszlo Bock,[]
"If you want a nonhierarchical environment, you need visible reminders of your values. Otherwise, your human nature inevitably reasserts itself. Symbols and stories matter.",Work Rules!: Insights from Inside Google That Will Transform How You Live and Lead,Laszlo Bock,[]
"Jerry Ford says, ‘I’ll do that. Get out of the way, I’ll do that. No man ought to have to clean up after another man’s dog.",Work Rules!: Insights from Inside Google That Will Transform How You Live and Lead,Laszlo Bock,[]
"Jim Barksdale, the legendary CEO of Netscape, in one of these management meetings said, ‘If you have facts, present them and we’ll use them. But if you have opinions, we’re gonna use mine.",Work Rules!: Insights from Inside Google That Will Transform How You Live and Lead,Laszlo Bock,[]
"Entitlement, the creeping belief that just because you receive something you deserve it, is another risk in our approach. In a sense it’s unavoidable. We are biologically and psychologically inclined to habituate to new experiences. People quickly become accustomed to what is being offered, and it becomes a baseline expectation rather than something wonderful and delightful. This can create a spiral of increasing expectations and decreasing happiness.",Work Rules!: Insights from Inside Google That Will Transform How You Live and Lead,Laszlo Bock,[]
"People entered the debate believing Tibet was part of China or believing it wasn’t, and exited the debate the same way. People thought this was either free speech or appalling insensitivity, and they thought so at the outset and at the end. Eventually, the rate at which people were commenting slowed and the thread limped to a close.",Work Rules!: Insights from Inside Google That Will Transform How You Live and Lead,Laszlo Bock,[]
"As Olivier Serrat of the Asian Development Bank wrote, “Micromanagement is mismanagement.… [P]eople micromanage to assuage their anxieties about organizational performance: they feel better if they are continuously directing and controlling the actions of others—at heart, this reveals emotional insecurity on their part. It gives micromanagers the illusion of control (or usefulness). Another motive is lack of trust in the abilities of staff—micromanagers do not believe that their colleagues will successfully complete a task or discharge a responsibility even when they say they will.",Work Rules!: Insights from Inside Google That Will Transform How You Live and Lead,Laszlo Bock,[]
"Does your manager trust you?” is a profound question. If you believe people are fundamentally good, and if your organization is able to hire well, there is nothing to fear from giving your people freedom.",Work Rules!: Insights from Inside Google That Will Transform How You Live and Lead,Laszlo Bock,[]
"Rob Rosiello, who ran McKinsey’s Stamford, Connecticut, office while I was there, used to say that the most profitable line in the English language was “Would you like fries with that?",Work Rules!: Insights from Inside Google That Will Transform How You Live and Lead,Laszlo Bock,[]
"Jonathan Rosenberg once told me, “A crisis is an opportunity to have impact. Drop everything and deal with the crisis.” Changing the timing of performance reviews is perhaps a trivial kind of crisis, but I dropped everything and spent the next eight hours making phone calls until well past midnight. We ended up with a better answer, shaped by the people who were most affected, and I gained a broader network of people I could turn to for counsel and help.",Work Rules!: Insights from Inside Google That Will Transform How You Live and Lead,Laszlo Bock,[]
"Steven Pinker, in The Better Angels of Our Nature, argues that the world has become a better place over time, at least when measured by incidences of violence. In the pre-state, hunter-gatherer era, 15 percent of people died violently, declining to 3 percent in the early Roman, British, and Islamic empires. By the twentieth century, homicide in European countries had dropped by another order of magnitude. Today, rates of violent death are even lower. Pinker explains that “human nature has always comprised inclinations toward violence and inclinations that counteract them—such as self-control, empathy, fairness and reason.… Violence has declined because historical circumstances have increasingly favored our better angels.",Work Rules!: Insights from Inside Google That Will Transform How You Live and Lead,Laszlo Bock,[]
  Have a role-and-responsibilities discussion. Match your Noogler with a peer buddy. Help your Noogler build a social network. Set up onboarding check-ins once a month for your Noogler’s first six months. Encourage open dialogue. And,Work Rules!: Insights from Inside Google That Will Transform How You Live and Lead,Laszlo Bock,[]
"In 2010 alone, we conducted 8,157 A/B tests and more than 2,800 one-percent tests. Put another way, every single day in 2010 we ran more than thirty experiments to uncover what would best serve our users. And this was just for our search product. We",Work Rules!: Insights from Inside Google That Will Transform How You Live and Lead,Laszlo Bock,[]
