quoteText,bookTitle,bookAuthor,tags
"Ray Dalio, explains: “My most important principle is that getting at the truth… is essential for getting better. We get at truth through radical transparency and putting aside our ego barriers in order to explore our mistakes and personal weaknesses so that we can improve.”57",Work Rules!: Insights from Inside Google That Will Transform How You Live and Lead,Laszlo Bock,[]
"I once gave a talk in Chicago to a group of local chief human resources officers (CHROs) about Google’s culture. After the presentation, one CHRO stood up and sneered, “This is all well and good for Google. You have huge profit margins and can afford to treat your people so well. We can’t all do that.” I was going to explain that most of what we did cost us little to nothing. And that even in a time of flat wages you can still make work better, make people happier. Indeed, it’s when the economy is at its worst that treating people well matters most. Before",Work Rules!: Insights from Inside Google That Will Transform How You Live and Lead,Laszlo Bock,[]
"Tiger, what are you doing out here hitting balls at three a.m.?” “It doesn’t rain very often in Northern California,” replied the kid who went on to become one of the most successful golfers in history. “It’s the only chance I have to practice hitting in the rain.” You might expect this kind of diligence from the best athlete in his field. What is fascinating is how narrow the exercise’s scope was. He wasn’t practicing putting or hitting from a sand bunker. He spent four hours standing in the rain, hitting the same shot from the same spot, pursuing perfection in an intensely specific skill. It turns out that’s the best way to learn. K. Anders Ericsson, a professor of psychology at Florida State University, has studied the acquisition of expert-level skill for decades. The conventional wisdom is that it takes ten thousand hours of effort to become an expert. Ericsson instead found that it’s not about how much time you spend learning, but rather how you spend that time. He finds evidence that people who attain mastery of a field, whether they are violinists, surgeons, athletes,144 or even spelling bee champions,145approach learning in a different way from the rest of us. They shard their activities into tiny actions, like hitting the same golf shot in the rain for hours, and repeat them relentlessly. Each time, they observe what happens, make minor—almost imperceptible—adjustments, and improve. Ericsson refers to this as deliberate practice: intentional repetitions of similar, small tasks with immediate feedback, correction, and experimentation.",Work Rules!: Insights from Inside Google That Will Transform How You Live and Lead,Laszlo Bock,[]
"WORK RULES…FOR BUILDING A GREAT CULTURE Think of your work as a calling, with a mission that matters. Give people slightly more trust, freedom, and authority than you are comfortable giving them. If you’re not nervous, you haven’t given them enough.",Work Rules!: Insights from Inside Google That Will Transform How You Live and Lead,Laszlo Bock,[]
"This teaching environment is tailored to a child’s learning needs and personality, and children are encouraged to question everything, act of their own volition, and create.",Work Rules!: Insights from Inside Google That Will Transform How You Live and Lead,Laszlo Bock,[]
"In Give and Take, he writes about the power of purpose to",Work Rules!: Insights from Inside Google That Will Transform How You Live and Lead,Laszlo Bock,[]
The best predictor of how someone will perform in a job is a work sample test (29 percent).,Work Rules!: Insights from Inside Google That Will Transform How You Live and Lead,Laszlo Bock,[]
"People interpret strong cultures based on the artifacts, because they’re the most visible, but the values and assumptions underneath matter much more.",Work Rules!: Insights from Inside Google That Will Transform How You Live and Lead,Laszlo Bock,[]
"Over the coming decades the most gifted, hardest-working people on the planet will gravitate to places where they can do meaningful work and help shape the destiny of their organizations. But the case is also a moral one, rooted in the simplest maxim of all: Do unto others as you would have them do unto you.",Work Rules!: Insights from Inside Google That Will Transform How You Live and Lead,Laszlo Bock,[]
All it takes is a belief that people are fundamentally good—and enough courage to treat your people like owners instead of machines. Machines do their jobs; owners do whatever is needed to make their companies and teams successful.,Work Rules!: Insights from Inside Google That Will Transform How You Live and Lead,Laszlo Bock,[]
"If you have facts, present them and we’ll use them. But if you have opinions, we’re gonna use mine.’ ” The",Work Rules!: Insights from Inside Google That Will Transform How You Live and Lead,Laszlo Bock,[]
"Poor performance is rarely because the person is incompetent or a bad person. It’s typically a result of a gap in skill (which is either fixable or not) or will (where the person is not motivated to do the work). In the latter case, it could be a personal issue or a useful sign that there is something bigger wrong with the team that needs to be addressed.",Work Rules!: Insights from Inside Google That Will Transform How You Live and Lead,Laszlo Bock,[]
"K. Anders Ericsson, a professor of psychology at Florida State University, has studied the acquisition of expert-level skill for decades. The conventional wisdom is that it takes ten thousand hours of effort to become an expert. Ericsson instead found that it’s not about how much time you spend learning, but rather how you spend that time. He finds evidence that people who attain mastery of a field, whether they are violinists, surgeons, athletes,144 or even spelling bee champions,145 approach learning in a different way from the rest of us. They shard their activities into tiny actions, like hitting the same golf shot in the rain for hours, and repeat them relentlessly. Each time, they observe what happens, make minor—almost imperceptible—adjustments, and improve. Ericsson refers to this as deliberate practice: intentional repetitions of similar, small tasks with immediate feedback, correction, and experimentation.",Work Rules!: Insights from Inside Google That Will Transform How You Live and Lead,Laszlo Bock,[]
"Intrinsic motivation is the key to growth, but conventional performance management systems destroy that motivation.",Work Rules!: Insights from Inside Google That Will Transform How You Live and Lead,Laszlo Bock,[]
"The goal of our interview process is to predict how candidates will perform once they join the team. We achieve that goal by doing what the science says: combining behavioral and situational structured interviews with assessments of cognitive ability, conscientiousness, and leadership.xxvi",Work Rules!: Insights from Inside Google That Will Transform How You Live and Lead,Laszlo Bock,[]
"Google board member John Doerr introduced us to a practice he had seen Intel use with much success: OKRs, or Objectives and Key Results. The",Work Rules!: Insights from Inside Google That Will Transform How You Live and Lead,Laszlo Bock,[]
"We deliberately set ambitious goals that we know we won’t be able to achieve in all cases. If you’re achieving all your goals, you’re not setting them aggressively enough. Astro",Work Rules!: Insights from Inside Google That Will Transform How You Live and Lead,Laszlo Bock,[]
"On the topic of goals, the academic research agrees with your intuition: Having goals improves performance.",Work Rules!: Insights from Inside Google That Will Transform How You Live and Lead,Laszlo Bock,[]
"We have a market-based approach, where over time our goals all converge, because the top OKRs are known and everyone else’s OKRs are visible. Teams that are grossly out of alignment stand out, and the few major initiatives that touch everyone are easy enough to manage directly. So",Work Rules!: Insights from Inside Google That Will Transform How You Live and Lead,Laszlo Bock,[]
The science on rating systems is inconclusive.115 There’s no strong evidence to suggest that having three or five or ten or fifty rating points makes a difference. Our,Work Rules!: Insights from Inside Google That Will Transform How You Live and Lead,Laszlo Bock,[]
"Experimentation was vital. In the absence of external evidence, we had to develop our own, working with the leaders of each part of Google to help them test their ideas. At",Work Rules!: Insights from Inside Google That Will Transform How You Live and Lead,Laszlo Bock,[]
"to a 5-point rating scale: needs improvement, consistently meets expectations, exceeds expectations, strongly exceeds expectations, and superb. Similar",Work Rules!: Insights from Inside Google That Will Transform How You Live and Lead,Laszlo Bock,[]
"By simply having more rating categories to choose from, Group B unconsciously, inadvertently, and incorrectly decided that they have almost no star performers. Without",Work Rules!: Insights from Inside Google That Will Transform How You Live and Lead,Laszlo Bock,[]
Calibration adds a step. But it is critical to ensure fairness. A,Work Rules!: Insights from Inside Google That Will Transform How You Live and Lead,Laszlo Bock,[]
"A manager’s assessments are compared to those of managers leading similar teams, and they review their employees collectively: A group of five to ten managers meet and project on a wall their fifty to a thousand employees, discuss individuals, and agree on a fair rating. This",Work Rules!: Insights from Inside Google That Will Transform How You Live and Lead,Laszlo Bock,[]
"But once you have more than a few hundred people, employees are more comfortable trusting a reliable system than individual managers. Not",Work Rules!: Insights from Inside Google That Will Transform How You Live and Lead,Laszlo Bock,[]
"A fair process for ratings gets you only so far. As a manager, you want to tell people not only how they did, but also how to do better in the future. The question is: What is the most effective way to deliver those two messages? The answer: Do it in two distinct conversations. Intrinsic motivation is the key to growth, but conventional performance management systems destroy that motivation. Almost",Work Rules!: Insights from Inside Google That Will Transform How You Live and Lead,Laszlo Bock,[]
"But introduce extrinsic motivations, such as the promise of promotion or a raise, and the willingness and ability of the apprentice to learn starts to shut down. In",Work Rules!: Insights from Inside Google That Will Transform How You Live and Lead,Laszlo Bock,[]
"A similar dynamic exists when managers sit down to give employees their annual review and salary increase. The employees focus on the extrinsic reward—a raise, a higher rating—and learning shuts down. I",Work Rules!: Insights from Inside Google That Will Transform How You Live and Lead,Laszlo Bock,[]
"As long as ratings are directly linked to pay and career opportunities, every employee has this incentive to exploit the system.",Work Rules!: Insights from Inside Google That Will Transform How You Live and Lead,Laszlo Bock,[]
"And even if I don’t argue with my manager, he’s worried that I might. In",Work Rules!: Insights from Inside Google That Will Transform How You Live and Lead,Laszlo Bock,[]
"which companies are really paying unfairly: the ones where the best people make far more than average, or the ones where everyone is paid the same.",Work Rules!: Insights from Inside Google That Will Transform How You Live and Lead,Laszlo Bock,[]
They put more money toward the men to avoid what they feared would be a tough conversation.,Work Rules!: Insights from Inside Google That Will Transform How You Live and Lead,Laszlo Bock,[]
"When Alexander Graham Bell invented the telephone, he saw a missed call from Jeff Dean.",Work Rules!: Insights from Inside Google That Will Transform How You Live and Lead,Laszlo Bock,[]
"The first change is to hire more slowly. Only 10 percent of your applicants (at best!) will be top performers, so you go through far more applicants and interviews. I say at best, because in fact the top performers in most industries aren’t actually looking for work, precisely because they are top performers who are enjoying their success right where they are. So your odds of hiring a great person based on inbound applications are low. But it’s worth the wait because, as Alan Eustace, our SVP of Knowledge, often says, “A top-notch engineer is worth three hundred times or more than an average engineer. … I’d rather lose an entire incoming class of engineering graduates than one exceptional technologist.",Work Rules!: Insights from Inside Google That Will Transform How You Live and Lead,Laszlo Bock,[]
You can’t understand Google … unless you know that both Larry and Sergey were Montessori kids.,Work Rules!: Insights from Inside Google That Will Transform How You Live and Lead,Laszlo Bock,[]
"We all want our work to matter. Nothing is a more powerful motivator than to know that you are making a difference in the world. Amy Wrzesniewski of Yale University told me people see their work as just a job (“a necessity that’s not a major positive in their lives”), a career (something to “win” or “advance”), or a calling (“a source of enjoyment and fulfillment where you’re doing socially useful work”).",Work Rules!: Insights from Inside Google That Will Transform How You Live and Lead,Laszlo Bock,[]
"Traditional performance management systems make a big mistake. They combine two things that should be completely separate: performance evaluation and people development. Evaluation is necessary to distribute finite resources, like salary increases or bonus dollars. Development is just as necessary so people grow and improve.” 121 If you want people to grow, don’t have those two conversations at the same time. Make development a constant back-and-forth between you and your team members, rather than a year-end surprise.",Work Rules!: Insights from Inside Google That Will Transform How You Live and Lead,Laszlo Bock,[]
"When it’s time to conduct annual reviews, Googlers and their managers select a list of peer reviewers that includes not just peers, but also people junior to them.",Work Rules!: Insights from Inside Google That Will Transform How You Live and Lead,Laszlo Bock,[]
"As a former consultant, I can tell you that many tout engagement as a panacea. They measure engagement through a short questionnaire, typically including statements like: “I have a best friend at work,” “In the last seven days, I have received recognition or praise for doing good work,” or “My supervisor, or someone at work, seems to care about me as a person.” My chief HR officer friends tell me that engagement surveys fail to tell them how to improve. If your scores are low, do you raise them by somehow convincing more employees to be best friends? Or, if profits are low, is the best fix to start praising people more? We do measure some similar topics at Google (along with dozens more), but don’t merge them into a single all-encompassing construct like engagement. We see better results by instead understanding very specific areas like career development or manager quality.",Work Rules!: Insights from Inside Google That Will Transform How You Live and Lead,Laszlo Bock,[]
"Now we asked for one single thing the person should do more of, and one thing they could do differently to have more impact. We",Work Rules!: Insights from Inside Google That Will Transform How You Live and Lead,Laszlo Bock,[]
"Now we asked them to list specific projects, their roles, and what they accomplished. We",Work Rules!: Insights from Inside Google That Will Transform How You Live and Lead,Laszlo Bock,[]
"Peer reviewers were then asked to rate (using a slider on the screen) how well they knew that particular project and how large the individual’s impact was, and to add any comments. Over",Work Rules!: Insights from Inside Google That Will Transform How You Live and Lead,Laszlo Bock,[]
"Googlers are also free to solicit feedback on specific topics at any point in the year, rather than waiting for a single day.",Work Rules!: Insights from Inside Google That Will Transform How You Live and Lead,Laszlo Bock,[]
"To make sure employees’ conversations with their managers were more useful, we developed a one-page handout for them to use during their performance conversation. Again,",Work Rules!: Insights from Inside Google That Will Transform How You Live and Lead,Laszlo Bock,[]
"By now you’ll guess that promotion decisions, like rating decisions, are made by committees. They",Work Rules!: Insights from Inside Google That Will Transform How You Live and Lead,Laszlo Bock,[]
There’s just one other twist. Googlers working in engineering or product management can nominate themselves for promotion.,Work Rules!: Insights from Inside Google That Will Transform How You Live and Lead,Laszlo Bock,[]
"If you are not promoted, the committee provides feedback on what to do to improve your chances next time. Seems",Work Rules!: Insights from Inside Google That Will Transform How You Live and Lead,Laszlo Bock,[]
"First, set goals correctly. Make them public. Make them ambitious.",Work Rules!: Insights from Inside Google That Will Transform How You Live and Lead,Laszlo Bock,[]
"Third, for evaluation, adopt some kind of calibration process. We",Work Rules!: Insights from Inside Google That Will Transform How You Live and Lead,Laszlo Bock,[]
"Fourth, split reward conversations from development conversations. Combining",Work Rules!: Insights from Inside Google That Will Transform How You Live and Lead,Laszlo Bock,[]
"Performance management as practiced by most organizations has become a rule-based, bureaucratic process, existing as an end in itself rather than actually shaping performance. Employees hate it. Managers hate it. Even HR departments hate it.",Work Rules!: Insights from Inside Google That Will Transform How You Live and Lead,Laszlo Bock,[]
"Once it’s explained, it seems self-evident. But how many of us have taken the time to look for the deeper meaning in our work? How many of our companies make a practice of giving everyone, especially those most remote from the front office, access to your customers so employees can witness the human effect of their labors? Would it be hard to start?",Work Rules!: Insights from Inside Google That Will Transform How You Live and Lead,Laszlo Bock,[]
"The most talented people on the planet are increasingly physically mobile, increasingly connected through technology, and—importantly—increasingly discoverable by employers. This global cadre want to be in high-freedom companies, and talent will flow to those companies. And leaders who build the right kind of environments will be magnets for the most talented people on the planet.",Work Rules!: Insights from Inside Google That Will Transform How You Live and Lead,Laszlo Bock,[]
"What’s a manager to do without these traditional sticks and carrots? The only thing that’s left. “Managers serve the team,” according to our executive chairman, Eric Schmidt. Like any place, we of course have exceptions and failures, but the default leadership style at Google is one where a manager focuses not on punishments or rewards but on clearing roadblocks and inspiring her team.",Work Rules!: Insights from Inside Google That Will Transform How You Live and Lead,Laszlo Bock,[]
You just need to fight the petty seductions of management and the command-and-control impulses that accompany seniority.,Work Rules!: Insights from Inside Google That Will Transform How You Live and Lead,Laszlo Bock,[]
We believe it is easy to be penny wise and pound foolish with respect to benefits that can save employees considerable time and improve their health and productivity.,Work Rules!: Insights from Inside Google That Will Transform How You Live and Lead,Laszlo Bock,[]
"At Google, we front-load our people investment. This means the majority of our time and money spent on people is invested in attracting, assessing, and cultivating new hires. We spend more than twice as much on recruiting, as a percentage of our people budget, as an average company. If we are better able to select people up front, that means we have less work to do with them once they are hired. The worst case with a 90th percentile candidate is that they have an average year. They are unlikely to become the worst performer in the company. An average candidate, however, will not only consume massive training resources, but is also just as likely to end up performing well below average as above average.",Work Rules!: Insights from Inside Google That Will Transform How You Live and Lead,Laszlo Bock,[]
The 8 Project Oxygen Attributes Be a good coach. Empower the team and do not micromanage. Express interest/concern for team members’ success and personal well-being. Be very productive/results-oriented. Be a good communicator—listen and share information. Help the team with career development. Have a clear vision/strategy for the team. Have important technical skills that help advise the team.,Work Rules!: Insights from Inside Google That Will Transform How You Live and Lead,Laszlo Bock,[]
"If you believe people are good, you must be unafraid to share information with them",Work Rules!: Insights from Inside Google That Will Transform How You Live and Lead,Laszlo Bock,[]
"Henry Ford is best known for his sweeping adoption of the assembly line. It’s less well known that his philosophy of recognizing and rewarding work was remarkably progressive for the time: The kind of workman who gives the business the best that is in him is the best kind of workman a business can have. And he cannot be expected to do this indefinitely without proper recognition. … [I]f a man feels that his day’s work is not only supplying his basic need, but is also giving him a margin of comfort, and enabling him to give his boys and girls their opportunity and his wife some pleasure in life, then his job looks good to him and he is free to give it of his best. This is a good thing for him and a good thing for the business. The man who does not get a certain satisfaction out of his day’s work is losing the best part of his pay.",Work Rules!: Insights from Inside Google That Will Transform How You Live and Lead,Laszlo Bock,[]
"Pay unfairly: Your best people are better than you think, and worth more than you pay them In a misguided attempt to be “fair,” most companies design compensation systems that encourage the best performers and those with the most potential to quit.",Work Rules!: Insights from Inside Google That Will Transform How You Live and Lead,Laszlo Bock,[]
"Performance improved only when companies implemented programs to empower employees (for example, by taking decision-making authority away from managers and giving it to individuals or teams), provided learning opportunities that were outside what people needed to do their jobs, increased their reliance on teamwork (by giving teams more autonomy and allowing them to self-organize), or a combination of these.",Work Rules!: Insights from Inside Google That Will Transform How You Live and Lead,Laszlo Bock,[]
"Building this kind of repetition and focus into training might seem costly, but it’s not. As we’ll discuss later, most organizations measure training based on the time spent, not on the behaviors changed. It’s a better investment to deliver less content and have people retain it, than it is to deliver more hours of “learning” that is quickly forgotten.",Work Rules!: Insights from Inside Google That Will Transform How You Live and Lead,Laszlo Bock,[]
"when we were consultants. In the minutes before every client meeting, he would take me aside and ask me questions: “What are your goals for this meeting?” “How do you think each client will respond?” “How do you plan to introduce a difficult topic?” We’d conduct the meeting, and on the drive back to our office he would again ask questions that forced me to learn: “How did your approach work out?” “What did you learn?” “What do you want to try differently next time?” I would also ask Frank questions about the interpersonal dynamic in the room and why he pushed on one issue but not another. I shared responsibility with him for ensuring I was improving.",Work Rules!: Insights from Inside Google That Will Transform How You Live and Lead,Laszlo Bock,[]
"Training is, quite simply, one of the highest-leverage activities a manager can perform. Consider for a moment the possibility of your putting on a series of four lectures for members of your department. Let’s count on three hours of preparation for each hour of course time—twelve hours of work in total. Say that you have ten students in your class. Next year they will work a total of about twenty thousand hours for your organization. If your training results in a 1 percent improvement in your subordinates’ performance, your company will gain the equivalent of two hundred hours of work as the result of the expenditure of your twelve hours.",Work Rules!: Insights from Inside Google That Will Transform How You Live and Lead,Laszlo Bock,[]
"Groysberg found that exceptional success rarely follows an individual from company to company. Sending your salespeople to the most expensive sales seminars, led by someone who sold products for someone else, is unlikely to revolutionize your sales performance, because the specifics of what your company does matter.",Work Rules!: Insights from Inside Google That Will Transform How You Live and Lead,Laszlo Bock,[]
