quoteText,bookTitle,bookAuthor,tags
"I find the world is full of people who think that their dependence on others is decreasing, or that they would be better off if they were more self-sufficient, or that technological progress has brought no improvement in the standard of living, or that the world is steadily deteriorating, or that the exchange of things and ideas is a superfluous irrelevance.",The Rational Optimist,Matt Ridley,[]
"Like Milton Friedman, I notice that ‘business corporations in general are not defenders of free enterprise. On the contrary, they are one of the chief sources of danger.",The Rational Optimist,Matt Ridley,[]
"By striking contrast, there is not a single non-renewable resource that has run out yet: not coal, oil, gas, copper, iron, uranium, silicon, or stone.",The Rational Optimist,Matt Ridley,[]
"The cumulative accretion of knowledge by specialists that allows us each to consume more and more different things by each producing fewer and fewer is, I submit, the central story of humanity",The Rational Optimist,Matt Ridley,[]
Imports are Christmas morning; exports are January’s MasterCard bill. P.J. O’ROURKE,The Rational Optimist,Matt Ridley,[]
The characteristic signature of poverty is a return to self-sufficiency.,The Rational Optimist,Matt Ridley,[]
firms are temporary aggregations of people to help them do their producing in such a way as to help others do their consuming.,The Rational Optimist,Matt Ridley,[]
"But is trade made possible by the milk of human kindness, or the acid of human self-interest?",The Rational Optimist,Matt Ridley,[]
"if sympathy allows you to please yourself by pleasing others, are you being selfish or altruistic?",The Rational Optimist,Matt Ridley,[]
"people are programmed to desire, not to appreciate.",The Rational Optimist,Matt Ridley,[]
"The cultural progress of the Species encountered impediments along the way. Overpopulation was a constant problem: as soon as the capacity of the local environment to support the population began to suffer, so individuals began to retreat from specialisation and exchange into defensive self-sufficiency, broadening their production and narrowing their consumption. This reduced the collective intelligence they could draw upon, which reduced the size of the niche they occupied, putting further pressure on population. So there were crashes, even local extinctions.",The Rational Optimist,Matt Ridley,[]
"If climate change proves to be mild but cutting carbon causes real pain, we may find we have stopped a nose bleed by putting a tourniquet round our neck.",The Rational Optimist: How Prosperity Evolves,Matt Ridley,[]
"It is a common trick to forecast the future on the assumption of no technological change, and find it dire. This is not wrong. The future would indeed be dire if invention and discovery ceased. As Paul Romer puts it: ‘Every generation has perceived the limits to growth that finite resources and undesirable side effects would pose if no new recipes or ideas were discovered. And every generation has underestimated the potential for finding new recipes and ideas. We consistently fail to grasp how many ideas remain to be discovered.’ By far the most dangerous, and indeed unsustainable thing the human race could do to itself would be to turn off the innovation tap.",The Rational Optimist,Matt Ridley,[]
"The cumulative accretion of knowledge by specialists that allows us each to consume more and more different things by each producing fewer and fewer is, I submit, the central story of humanity. Innovation changes the world",The Rational Optimist,Matt Ridley,[]
"If you can store the labour of others for future use, then you can spare yourself the time and the energy of working for your own immediate needs,",The Rational Optimist,Matt Ridley,[]
"If you can store the labour of others for future use, then you can spare yourself the time and the energy of working for your own immediate needs, which means you can invest in something new that will bring even greater reward.",The Rational Optimist,Matt Ridley,[]
(Whether the oil will last long enough is a different subject and one I tackle later in the book: briefly my answer is that substitutes will be adopted if the price rises high enough.),The Rational Optimist,Matt Ridley,[]
That is possible only because each square metre is encouraged to grow whatever it is good at growing and global trade distributes the result to ensure that everybody gets a bit of everything,The Rational Optimist,Matt Ridley,[]
"Yet merely to board a passing bandwagon of protest publicity, the leaders of the organic movement locked themselves out of a new technology that has delivered huge reductions in the use of synthetic pesticides.",The Rational Optimist,Matt Ridley,[]
"Globalgiving.com,",The Rational Optimist,Matt Ridley,[]
The characteristic signature of prosperity is increasing specialisation.,The Rational Optimist,Matt Ridley,[]
"Besides, a million years of natural selection shaped human nature to be ambitious to rear successful children, not to settle for contentment: people are programmed to desire, not to appreciate.",The Rational Optimist,Matt Ridley,[]
"China, meanwhile, was heading the other way, into stagnation and poverty. China went from a state of economic and technological exuberance in around AD 1000 to one of dense population, agrarian backwardness and desperate poverty in 1950. According to Angus Maddison’s estimates, it was the only region in the world with a lower GDP per capita in 1950 than in 1000. The blame for this lies squarely with China’s governments.",The Rational Optimist,Matt Ridley,[]
"Smith’s genius as an individual, but I have one great advantage over him – I can read his book.",The Rational Optimist,Matt Ridley,[]
markets in goods and services for immediate consumption – haircuts and hamburgers – work so well that it is hard to design them so they fail to deliver efficiency and innovation; while markets in assets are so automatically prone to bubbles and crashes that it is hard to design them so they work at all.,The Rational Optimist: How Prosperity Evolves,Matt Ridley,[]
"Or, as one economist put it: ‘The hippies were right all along’.",The Rational Optimist,Matt Ridley,[]
the true metric of prosperity is time.,The Rational Optimist,Matt Ridley,[]
"although within a country rich people were generally happier than poor people, richer countries did not have happier citizens than poor countries. Since then the ‘Easterlin paradox",The Rational Optimist,Matt Ridley,[]
"All are well written, and extremely eye-opening. They are:  The Rational Optimist: How Prosperity Evolves, by Matt Ridley Factfulness: Ten Reasons We’re Wrong About the World—and Why Things Are Better Than You Think, by Hans Rosling. The Better Angels of our Nature: Why Violence Has Declined, by Steven Pinker Enlightenment: The Case for Reason, Science, Humanism, and Progress, also by Steven Pinker Abundance: The Future is Better Than you Think, by Peter H. Diamandis and Steven Kotler Of the five, if you could only choose one, I would choose Factfulness, and if you could only choose two, Factfulness and The Rational Optimist. In terms of sheer amount of data, Enlightenment and Factfulness both have endless graphs showing improvements on endless dimensions, with Factfulness being a much easier read for the lay person. These were two new books I read just for this novel, so were not mentioned in Seeker.",Veracity,Douglas E. Richards,[]
"The cumulative accretion of knowledge by specialists that allows us each to consume more and more different things by each producing fewer and fewer is, I submit, the central story of humanity.",The Rational Optimist,Matt Ridley,[]
"Only towards the edge of its range, on an isolated island, or in a remote valley or on a lonely hill top, does natural selection occasionally cause part of a species to morph into something different",The Rational Optimist,Matt Ridley,[]
Exchange is to technology as sex is to evolution.,The Rational Optimist,Matt Ridley,[]
a smaller quantity of labour produce a greater quantity of work’.,The Rational Optimist,Matt Ridley,[]
"So this is what poverty means. You are poor to the extent that you cannot afford to sell your time for sufficient price to buy the services you need,",The Rational Optimist,Matt Ridley,[]
True barter requires that you give up something you value in exchange for something else you value slightly more.,The Rational Optimist,Matt Ridley,[]
"In most hunter-gatherers, women spend long hours gathering, preparing and cooking staple foods while men are out hunting for delicacies.",The Rational Optimist,Matt Ridley,[]
"Trust is the foundation upon which our success and prosperity rest, and it must be re-earned every day, in every way, by every one of us.",The Rational Optimist,Matt Ridley,[]
"Every acre of maize or sugar cane requires tractor fuel, fertilisers, pesticides, truck fuel and distillation fuel – all of which are fuel. So the question is: how much fuel does it take to grow fuel? Answer: about the same amount. The US Department of Agriculture estimated in 2002 that each unit of energy put into growing maize ethanol produces 1.34 units of output, but only by counting the energy of dried distillers’ grain, a by-product of the production process that can go into cattle feed.",The Rational Optimist,Matt Ridley,[]
"Getting richer is not the only or even the best way of getting happier. Social and political liberation is far more effective, says the political scientist Ronald Ingleheart: the big gains in happiness come from living in a society that frees you to make choices about your lifestyle – about where to live, who to marry, how to express your sexuality and so on.",The Rational Optimist: How Prosperity Evolves,Matt Ridley,[]
"So this is what poverty means. You are poor to the extent that you cannot afford to sell your time for sufficient price to buy the services you need, and rich to the extent that you can afford to buy not just the services you need but also those you crave. Prosperity, or growth, has been synonymous with moving from self-sufficiency to interdependence, transforming the family from a unit of laborious, slow and diverse production to a unit of easy, fast and diverse consumption paid for by a burst of specialised production.",The Rational Optimist: How Prosperity Evolves,Matt Ridley,[]
"As Friedrich Hayek first clearly saw, knowledge ‘never exists in concentrated or integrated form but solely as the dispersed bits of incomplete and frequently contradictory knowledge which all the separate individuals possess’.",The Rational Optimist,Matt Ridley,[]
"Famously, no other species of ape can encounter strangers without trying to kill them, and the instinct still lurks in the human breast.",The Rational Optimist,Matt Ridley,[]
Technology was made possible by division of labour: market exchange calls forth innovation.,The Rational Optimist,Matt Ridley,[]
"The wonderful thing about knowledge is that it is genuinely limitless. There is not even a theoretical possibility of exhausting the supply of ideas, discoveries and inventions.",The Rational Optimist,Matt Ridley,[]
"A large, interconnected population meant faster cumulative invention – a surprising truth even to this day, as Hong Kong and Manhattan islands demonstrate.",The Rational Optimist,Matt Ridley,[]
Money is not metal. It is trust inscribed. NIALL FERGUSON,The Rational Optimist,Matt Ridley,[]
The argument is not that exchange teaches people to be kind; it is that exchange teaches people to recognise their enlightened self-interest lies in seeking cooperation.,The Rational Optimist,Matt Ridley,[]
"But so long as somewhere somebody is incentivised to invent ways of serving others’ needs better, then the rational optimist must conclude that the betterment of human lives will eventually resume.",The Rational Optimist,Matt Ridley,[]
"Which would have advanced the most at the end of a month,’ Henry David Thoreau asked: ‘the boy who had made his own jack-knife from the ore which he had dug and smelted, reading as much as would be necessary for this – or the boy who had attended the lectures on metallurgy at the Institute in the meanwhile, and had received a Rodgers’ penknife from his father?",The Rational Optimist,Matt Ridley,[]
"On what principle is it, that when we see nothing but improvement behind us, we are to expect nothing but deterioration before us? THOMAS BABINGTON MACAULAY",The Rational Optimist,Matt Ridley,[]
"despite the constant temptation to moan, the world is as good a place to live as it has ever been for the average human being – even now in a deep recession.",The Rational Optimist,Matt Ridley,[]
knowledge ‘never exists in concentrated or integrated form but solely as the dispersed bits of incomplete and frequently contradictory knowledge which all the separate individuals possess’.,The Rational Optimist,Matt Ridley,[]
"An evolutionary bargain seems to have been struck: in exchange for sexual exclusivity, the man brings meat and protects the fire from thieves and bullies; in exchange for help rearing the children, the woman brings veg and does much of the cooking. This may explain why human beings are the only great apes with long pair bonds.",The Rational Optimist,Matt Ridley,[]
"At the cost of some extra work, women get to eat some good protein without having to chase it; men get to know where the next meal is coming from if they fail to kill a deer.",The Rational Optimist,Matt Ridley,[]
Man’s Search for Meaning by Viktor E. Frankl The Rational Optimist by Matt Ridley The Better Angels of Our Nature by Steven Pinker Sapiens by Yuval Noah Harari Poor Charlie’s Almanack by Charlie Munger,Tribe of Mentors: Short Life Advice from the Best in the World,Timothy Ferriss,[]
"The Rational Optimist: How Prosperity Evolves, by Matt Ridley Factfulness: Ten Reasons We’re Wrong About the World—and",The Enigma Cube,Douglas E. Richards,[]
What is it about human beings that enables them to keep changing their lives in this tumultuous way?,The Rational Optimist,Matt Ridley,[]
"That is what I mean by collective intelligence. No single person knows how to make a computer mouse. The person who assembled it in the factory did not know how to drill the oil well from which the plastic came, or vice versa. At some point, human intelligence became collective and cumulative in a way that happened to no other animal.",The Rational Optimist,Matt Ridley,[]
"The more human beings diversified as consumers and specialised as producers, and the more they then exchanged, the better off they have been, are and will be.",The Rational Optimist,Matt Ridley,[]
"Had I only known it, experiments in laboratories by the economist Vernon Smith and his colleagues have long confirmed that markets in goods and services for immediate consumption – haircuts and hamburgers – work so well that it is hard to design them so they fail to deliver efficiency and innovation; while markets in assets are so automatically prone to bubbles and crashes that it is hard to design them so they work at all.",The Rational Optimist,Matt Ridley,[]
"In The Rational Optimist Matt Ridley shows how human beings have always been at their most innovative when connected to large, diverse networks.","The Slow Fix: Solve Problems, Work Smarter, and Live Better In a World Addicted to Speed",Carl Honoré,[]
"If culture consisted simply of learning habits from others, it would soon stagnate. For culture to turn cumulative, ideas needed to meet and mate.",The Rational Optimist,Matt Ridley,[]
"Likewise, when the credit card took off in California in the 1960s, driven by Joseph Williams of Bank of America, there was nothing new about buying on credit. It was as old as Babylon. There was not even anything new about charge cards. Diner’s Club had been issuing cards for the convenience of restaurant users since the early 1950s and department stores for longer than that. What the BankAmericard achieved, especially once it emerged as Visa from the chaos of the mass mailings in the late 1960s, under Dee Hock’s reinvention, was the democratisation of credit. The electronic possibility that your card could be authorised for a purchase anywhere in the country or even the world was a powerful lubricant to specialisation and exchange in the economy of the late twentieth century, allowing consumers to express their choice to borrow against future earnings when it made sense. There was, of course, irresponsibility, but the credit card did not lead, as most intellectual grandees had feared,",The Rational Optimist,Matt Ridley,[]
"to financial chaos. In the early 1970s, when credit cards were new, politicians of all stripes denounced them as unsound, unsafe and predatory, a view widely shared even by those who used the cards themselves: Lewis Mandell discovered that Americans were ‘far more likely to use credit cards than to approve of them’. This nicely captures the paradox of the modern world, that people embrace technological change and hate it at the same time. ‘People don’t like change,’ Michael Crichton once told me, ‘and the notion that technology is exciting is true for only a handful of people. The rest are depressed or annoyed by the changes.’ Pity the inventor’s lot then. He is the source of society’s enrichment and yet nobody likes what he does.",The Rational Optimist,Matt Ridley,[]
"For 200 years pessimists have had all the headlines, even though optimists have far more often been right. Archpessimists are feted, showered with honours and rarely challenged, let alone confronted with their past mistakes. Should you ever listen to pessimists? Certainly. In the case of the ozone layer, a briefly fashionable scare of the early 1990s, the human race probably did itself and its environment a favour by banning chlorofluorocarbons, even though the excess ultraviolet light getting through the ozone layer in the polar regions never even approached one-five-hundredth of the level that is normally experienced by somebody living in the tropics – and even though a new theory suggests that cosmic rays are a bigger cause of the Antarctic ozone hole than chlorine is. Still, I should stop carping: in this case, getting chlorine out of the atmosphere was on balance the wise course of action and the costs to human welfare, though not negligible, were small.",The Rational Optimist,Matt Ridley,[]
"The Rational Optimist: How Prosperity Evolves, Matt Ridley elaborates: ‘If I sew you a hide tunic today, you can sew me one tomorrow’ brings limited rewards and diminishing returns. ‘[But] … I make the clothes, you catch the food’ brings increasing returns. Indeed, it has the beautiful property that it does not even need to be fair. For barter to work, two individuals do not need to offer things of equal value. Trade is often unequal but it still benefits both sides.",Abundance: The Future is Better Than You Think,Peter H. Diamandis,[]
"Without trade, innovation just does not happen. Exchange is to technology as sex is to evolution. It stimulates novelty.",The Rational Optimist,Matt Ridley,[]
"So growth will resume – unless prevented by the wrong policies. Somebody, somewhere, is still tweaking a piece of software, testing a new material, or transferring a gene that will make your and my life easier in the future.",The Rational Optimist,Matt Ridley,[]
"It is just possible that the predators and parasites will actually win altogether, or rather that ambitious ideological busybodies will succeed in shutting down the catallaxy and crashing the world back into pre-industrial poverty some time during the coming century. There is even a new reason for such pessimism: the integrated nature of the world means that it may soon be possible to capture the entire world on behalf of a foolish idea, where before you could only capture a country, or perhaps if you were lucky an empire.",The Rational Optimist,Matt Ridley,[]
"Freedom by Jiddu Krishnamurti. A rationalist’s guide to the perils of the human mind. The spiritual book that I keep returning to. Sapiens by Yuval Noah Harari. A history of the human species, with observations, frameworks, and mental models that will have you looking at history and your fellow humans differently. Everything by Matt Ridley. Matt is a scientist, optimist, and forward thinker. Genome, The Red Queen, The Origins of Virtue, The Rational Optimist—they’re all great. How has a failure, or apparent failure, set you up for later success? Do you have a favorite failure of yours? Suffering is a moment of clarity, when you can no longer deny the truth of a situation and are forced into uncomfortable change. I’m lucky that I didn’t get everything I wanted in my life, or I’d be happy with my first good job, my college sweetheart, my college town.",Tribe of Mentors: Short Life Advice from the Best in the World,Timothy Ferriss,[]
"Whenever you see the word equilibrium in a textbook, blot it out.’ It is wrong because it assumes perfect competition, perfect knowledge and perfect rationality, none of which do or can exist.",The Rational Optimist,Matt Ridley,[]
"Friedrich Hayek argued, knowledge is dispersed throughout society, because each person has a special perspective. Knowledge can never be gathered together in one place. It is collective, not individual.",The Rational Optimist,Matt Ridley,[]
"As Heraclitus put it, ‘Nothing endures but change.",The Rational Optimist,Matt Ridley,[]
"There is no country in the world that has a higher birth rate than it had in 1960, and in the less developed world as a whole the birth rate has approximately halved.",The Rational Optimist,Matt Ridley,[]
