quoteText,bookTitle,bookAuthor,tags
"Random violence makes the news precisely because it is so rare, routine kindness does not make the news precisely because it is so commonplace. (104)",The Rational Optimist: How Prosperity Evolves,Matt Ridley,"['inspirational', 'life']"
"Because it is a monopoly, government brings inefficiency and stagnation to most things it runs; government agencies pursue the inflation of their budgets rather than the service of their customers; pressure groups form an unholy alliance with agencies to extract more money from taxpayers for their members. Yet despite all this, most clever people still call for government to run more things and assume that if it did so, it would somehow be more perfect, more selfless, next time.",The Rational Optimist: How Prosperity Evolves,Matt Ridley,[]
"It is strange to me that most people assume companies will be imperfect (as they are), but they assume that government agencies will be perfect, which they are not.",The Rational Optimist: How Prosperity Evolves,Matt Ridley,[]
"At some point, human intelligence became collective and cumulative in a way that happened to no other animal.",The Rational Optimist,Matt Ridley,"['evolution', 'life']"
"The Sun King had dinner each night alone. He chose from forty dishes, served on gold and silver plate. It took a staggering 498 people to prepare each meal. He was rich because he consumed the work of other people, mainly in the form of their services. He was rich because other people did things for him. At that time, the average French family would have prepared and consumed its own meals as well as paid tax to support his servants in the palace. So it is not hard to conclude that Louis XIV was rich because others were poor.",The Rational Optimist: How Prosperity Evolves,Matt Ridley,"['prosperity', 'specialization']"
"Humanity is experiencing an extraordinary burst of evolutionary change, driven by good old-fashioned Darwinian natural selection. But it is selection among ideas, not among genes.",The Rational Optimist,Matt Ridley,[]
"Those of libertarian bent often prove more generous than those of a socialist persuasion: where the socialist feels that it is government’s job to look after the poor using taxes, libertarians think it is their duty.",The Rational Optimist,Matt Ridley,[]
It is common to find that two traders both think their counterparts are idiotically overpaying: that is the beauty of Ricardo’s magic trick.,The Rational Optimist,Matt Ridley,[]
"As I write this, it is nine o’clock in the morning. In the two hours since I got out of bed I have showered in water heated by North Sea gas, shaved using an American razor running on electricity made from British coal, eaten a slice of bread made from French wheat, spread with New Zealand butter and Spanish marmalade, then brewed a cup of tea using leaves grown in Sri Lanka, dressed myself in clothes of Indian cotton and Australian wool, with shoes of Chinese leather and Malaysian rubber, and read a newspaper made from Finnish wood pulp and Chinese ink.",The Rational Optimist,Matt Ridley,[]
It is my proposition that the human race has become a collective problem-solving machine and it solves problems by changing its ways. It,The Rational Optimist,Matt Ridley,[]
"In 1900, the average American spent $76 of every $100 on food, clothing and shelter. Today he spends $37.",The Rational Optimist,Matt Ridley,[]
Think of this: never before this generation has the average person been able to afford to have somebody else prepare his meals. You,The Rational Optimist,Matt Ridley,[]
"the Australian economist Peter Saunders argues, ‘Nobody planned the global capitalist system, nobody runs it, and nobody really comprehends it. This particularly offends intellectuals, for capitalism renders them redundant. It gets on perfectly well without them.",The Rational Optimist,Matt Ridley,[]
Yet as soon as Greece was unified into an empire by a thug – Philip of Macedon in 338 BC – it lost its edge.,The Rational Optimist,Matt Ridley,[]
The cornucopia that greets you as you enter the supermarket dwarfs anything that Louis XIV ever experienced (and it is probably less likely to contain salmonella).,The Rational Optimist,Matt Ridley,[]
The big firms that survive will do so by turning themselves into bottom-up evolvers.,The Rational Optimist,Matt Ridley,[]
"Then there appeared upon the earth a new kind of hominid, which refused to play by the rules. Without any changes in its body, and without any succession of species, it just kept changing its habits. For the first time its technology changed faster than its anatomy. This was an evolutionary novelty, and you are it. When",The Rational Optimist,Matt Ridley,[]
"In other words, cooking encourages specialisation by sex. The first and deepest division of labour is the sexual one.",The Rational Optimist,Matt Ridley,[]
"An evolutionary bargain seems to have been struck: in exchange for sexual exclusivity, the man brings meat and protects the fire from thieves and bullies; in exchange for help rearing the children, the woman brings veg and does much of the cooking. This may explain why human beings are the only great apes with long pair bonds. Just",The Rational Optimist,Matt Ridley,[]
Futurology always ends up telling you more about your own time than about the future.,The Rational Optimist: How Prosperity Evolves,Matt Ridley,['future']
Vernon Smith and his colleagues have long confirmed that markets in goods and services for immediate consumption – haircuts and hamburgers – work so well that it is hard to design them so they fail to deliver efficiency and innovation; while markets in assets are so automatically prone to bubbles and crashes that it is hard to design them so they work at all.,The Rational Optimist,Matt Ridley,[]
"There is a neat economic explanation for the sexual division of labour in hunter-gatherers. In terms of nutrition, women generally collect dependable, staple carbohydrates whereas men fetch precious protein. Combine the two – predictable calories from women and occasional protein from men – and you get the best of both worlds. At the cost of some extra work, women get to eat some good protein without having to chase it; men get to know where the next meal is coming from if they fail to kill a deer. That very fact makes it easier for them to spend more time chasing deer and so makes it more likely they will catch one. Everybody gains – gains from trade. It is as if the species now has two brains and two stores of knowledge instead of one – a brain that learns about hunting and a brain that learns about gathering.",The Rational Optimist: How Prosperity Evolves,Matt Ridley,"['evolution', 'game-theory', 'sexuality']"
"Not inventing, and not adopting new ideas, can itself be both dangerous and immoral.",The Rational Optimist,Matt Ridley,[]
"Half of the biggest American companies of 1980 have now disappeared by take-over or bankruptcy; half of today’s biggest companies did not even exist in 1980. The same is not true of government monopolies: the Internal Revenue Service and the National Health Service will not die, however much incompetence they might display. Yet most anti-corporate activists have faith in the good will of the leviathans that can force you to do business with them, but are suspicious of the behemoths that have to beg for your business. I find that odd. Moreover,",The Rational Optimist,Matt Ridley,[]
"Specialisation encouraged innovation, because it encouraged the investment of time in a tool-making tool. That saved time, and prosperity is simply time saved, which is proportional to the division of labour.",The Rational Optimist,Matt Ridley,[]
It is easier to wax elegiac for the life of a peasant when you do not have to use a long-drop toilet.,The Rational Optimist,Matt Ridley,[]
"As Edward Glaeser put it, ‘Thoreau was wrong. Living in the country is not the right way to care for the Earth. The best thing that we can do for the planet is build more skyscrapers.",The Rational Optimist,Matt Ridley,[]
The evolutionary biologist Richard Dawkins in 1976 coined the term ‘meme’ for a unit of cultural imitation.,The Rational Optimist,Matt Ridley,[]
"The lesson of this study is that, on the whole, having to deal with strangers teaches you to be polite to them, and that in order for such generosity to emerge, costly punishment of selfishness may be necessary.",The Rational Optimist,Matt Ridley,[]
"Humanity is experiencing an extraordinary burst of evolutionary change, driven by good old-fashioned Darwinian natural selection. But it is selection among ideas, not among genes. The habitat in which these ideas reside consists of human brains.",The Rational Optimist,Matt Ridley,[]
The Dark Ages were a massive experiment in the back-to-the-land hippy lifestyle (without the trust fund):,The Rational Optimist,Matt Ridley,[]
"Thanks to a newly perfected technology, the camel, the people of the Arabian Peninsula found themselves well placed to profit from trade between East and West.",The Rational Optimist,Matt Ridley,[]
"The success of human beings depends crucially, but precariously, on numbers and connections. A few hundred people cannot sustain a sophisticated technology: trade is a vital part of the story.",The Rational Optimist: How Prosperity Evolves,Matt Ridley,[]
"Two economists recently concluded, after studying the issue, that the entire concept of food miles is ‘a profoundly flawed sustainability indicator’. Getting food from the farmer to the shop causes just 4 per cent of all its lifetime emissions. Ten times as much carbon is emitted in refrigerating British food as in air-freighting it from abroad, and fifty times as much is emitted by the customer travelling to the shops.",The Rational Optimist,Matt Ridley,[]
Most aid is delivered by governments to governments.,The Rational Optimist,Matt Ridley,[]
"Economists are quick to speak of ‘market failure’, and rightly so, but a greater threat comes from ‘government failure’.",The Rational Optimist,Matt Ridley,[]
"In America, roughly 15 per cent of jobs are destroyed every year; and roughly 15 per cent created.",The Rational Optimist,Matt Ridley,[]
The message from history is so blatantly obvious – that free trade causes mutual prosperity while protectionism causes poverty – that it seems incredible that anybody ever thinks otherwise.,The Rational Optimist,Matt Ridley,[]
"This isn’t about auctions,’ said Meg Whitman, the chief executive of eBay, ‘in fact it’s not about economic warfare. It’s the opposite.’ It was survival of the nicest.",The Rational Optimist,Matt Ridley,[]
The great success of ants and termites – between them they may comprise one-third of all the animal biomass of land animals – is undoubtedly down to their division of labour.,The Rational Optimist,Matt Ridley,[]
"homini lupus’, said Plautus. ‘Man is a wolf to man.",The Rational Optimist,Matt Ridley,[]
"The generation that has experienced more peace, freedom, leisure time, education, medicine, travel, movies, mobile phones and massages than any generation in history is lapping up gloom at every opportunity.",The Rational Optimist,Matt Ridley,[]
"Europe was, in Joel Mokyr’s words, ‘the first society to build an economy on non-human power rather than on the backs of slaves and coolies’.",The Rational Optimist,Matt Ridley,[]
[...] the Stone Age did not come to an end for lack of stone.,The Rational Optimist: How Prosperity Evolves,Matt Ridley,[]
"This is the diagnostic feature of modern life, the very definition of a high standard of living: diverse consumption, simplified production. Make one thing, use lots.",The Rational Optimist,Matt Ridley,[]
I forecast that the twenty-first century will show a continuing expansion of catallaxy – Hayek’s word for spontaneous order created by exchange and specialisation.,The Rational Optimist,Matt Ridley,[]
"Falling consumer prices is what enriches people (deflation of asset prices can ruin them, but that is because they are using asset prices to get them the wherewithal to purchase consumer items). And, once again, notice that the true metric of prosperity is time. If Cornelius Vanderbilt or Henry Ford not only moves you faster to where you want to go, but requires you to work fewer hours to earn the ticket price, then he has enriched you by granting you a dollop of free time.",The Rational Optimist,Matt Ridley,[]
"Arguably, the orang-utan, being devastated by the loss of forest to palm oil bio-fuel plantations in Borneo, is under greater threat from renewable energy than the polar bear is from global warming.",The Rational Optimist,Matt Ridley,[]
"Merchants and craftsmen make prosperity; chiefs, priests and thieves fritter it away.",The Rational Optimist,Matt Ridley,[]
"Today, of Americans officially designated as ‘poor’, 99 per cent have electricity, running water, flush toilets, and a refrigerator; 95 per cent have a television, 88 per cent a telephone, 71 per cent a car and 70 per cent air conditioning. Cornelius Vanderbilt had none of these.",The Rational Optimist,Matt Ridley,[]
"Posterity can pay for its ancestors’ lives because posterity can be richer through innovation. If somebody somewhere takes out a mortgage, which he will repay in three decades’ time, to invest in a business that invents a gadget that saves his customers time, then that money, brought forward from the future, will enrich both him and those customers to the point where the loan can be repaid to posterity. That is growth. If, on the other hand, somebody takes out a loan just to support his luxury lifestyle, or to speculate on asset markets by buying a second home, then posterity will be the loser.",The Rational Optimist,Matt Ridley,[]
Sisyphean,The Rational Optimist,Matt Ridley,[]
Most species do not change their habits during their few million years on earth or alter their lifestyle much in different parts of their range.,The Rational Optimist,Matt Ridley,[]
"Suppose you had said to my hypothetical family of 1800, eating their gristly stew in front of a log fire, that in two centuries their descendants would need to fetch no logs or water, and carry out no sewage, because water, gas, and a magic form of invisible power called electricity would come into their home through pipes and wires. They would jump at the chance to have such a home, but they would warily ask ho they could possibly afford it. Suppose that you then told them that to earn such a home, they need only ensure that father and mother both have to go to work for eight hours in an office, travelling roughly forty minutes each way in a horseless carriage, and that the children need not work at all, but should go to school to be sure of getting such jobs when they start to work at twenty. They would be more than dumbfounded; they would be delirious with excitement.",The Rational Optimist: How Prosperity Evolves,Matt Ridley,[]
"As a result, whereas other primates have guts weighing four times their brains, the human brain weighs more than the human intestine. Cooking enabled hominids to trade gut size for brain size. Erectus",The Rational Optimist,Matt Ridley,[]
"In 2009, an artist named Thomas Thwaites set out to make his own toaster, of the sort that he could buy from a shop for about £4.",The Rational Optimist,Matt Ridley,[]
In the 1950s it took thirty minutes work to earn the price of a McDonald’s cheeseburger; today it takes three minutes.,The Rational Optimist,Matt Ridley,[]
"Economists are quick to speak of ‘market failure’, and rightly so, but a greater threat comes from ‘government failure‘. Because it is a monopoly, government brings inefficiency and stagnation to most things it runs; government agencies pursue the inflation of their budgets rather than the service of their customers; pressure groups form an unholy alliance with agencies to extract more money from taxpayers for their members. Yet despite all this, most clever people still call for government to run more things and assume that if it did so, it would somehow be more perfect, more selfless, next time.",The Rational Optimist: How Prosperity Evolves,Matt Ridley,[]
"The top four priorities would be food, fuel, clothing and shelter. Dig the garden, feed the pig, fetch water from the brook, gather wood from the forest, wash some potatoes, light a fire (no matches), cook lunch, repair the roof, fetch fresh bracken for clean bedding, whittle a needle, spin some thread, sew leather for shoes, wash in the stream, fashion a pot out of clay, catch and cook a chicken for dinner.",The Rational Optimist,Matt Ridley,[]
"The four horsemen of the human apocalypse, which cause the most premature and avoidable death in poor countries, are and will be for many years the same: hunger, dirty water, indoor smoke and malaria, which kill respectively about seven, three, three and two people per minute. If you want to do your fellow human beings good, spend your effort on combating those so that people can prosper, ready to meet climate challenges as they arrive. Economists estimate that a dollar spent on mitigating climate change brings ninety cents of benefits compared with $20 benefits per dollar spent on healthcare and $16 per dollar spent on hunger. Keeping climate at 1990 levels, assuming it could be done, would leave more than 90 per cent of human mortality causes untouched.",The Rational Optimist: How Prosperity Evolves,Matt Ridley,[]
"This is the diagnostic feature of modern life, the very definition of a high standard of living: diverse consumption, simplified production.",The Rational Optimist,Matt Ridley,[]
They had stumbled on what Friedrich Hayek called the catallaxy: the ever-expanding possibility generated by a growing division of labour.,The Rational Optimist,Matt Ridley,[]
"For barter to work, two individuals do not need to offer things of equal value. Trade is often unequal, but still benefits both sides.",The Rational Optimist,Matt Ridley,[]
"Even allowing for the hundreds of millions who still live in abject poverty, disease and want, this generation of human beings has access to more calories, watts, lumen-hours, square feet, gigabytes, megahertz, light-years, nanometres, bushels per acre, miles per gallon, food miles, air miles, and of course dollars",The Rational Optimist,Matt Ridley,[]
"Neanderthals had all of these: huge brains, probably complex languages, lots of technology. But they never burst out of their niche. It is my contention that in looking inside our heads, we would be looking in the wrong place to explain this extraordinary capacity for change in the species. It was not something that happened within a brain. It was some thing that happened between brains. It was a collective phenomenon. Look",The Rational Optimist,Matt Ridley,[]
"First, I need to convince you that human progress has, on balance, been a good thing, and that, despite the constant temptation to moan, the world is as good a place to live as it has ever been for the average human being – even now in a deep recession.",The Rational Optimist,Matt Ridley,[]
"Fundamentally, other animals do not do barter.",The Rational Optimist,Matt Ridley,[]
"today people farm (i.e., plough, crop or graze) just 38 per cent of the land area of the earth, whereas with 1961 yields they would have to farm 82 per cent to feed today’s population.",The Rational Optimist,Matt Ridley,[]
"So – as animal experiments have suggested – oxytocin does not affect reciprocity, just the tendency to take a social risk, to go out on a limb.",The Rational Optimist,Matt Ridley,[]
"as Isaiah Berlin put it, ‘disregard for the preferences and interests of individuals alive today in order to pursue some distant social goal that their rulers have claimed is their duty to promote has been a common cause of misery",The Rational Optimist,Matt Ridley,[]
"This is not true for other creatures, not even brainy ones like chimpanzees, bottlenose dolphins, parrots and octopi. They may occasionally use tools, they may occasionally shift their ecological niche, but they do not ‘raise their standard of living’, or experience ‘economic growth’. They do not encounter ‘poverty’ either. They do not progress from one mode of living to another – nor do they deplore doing so. They do not experience agricultural, urban, commercial, industrial and information revolutions, let alone Renaissances, Reformations, Depressions, Demographic Transitions, civil wars, cold wars, culture wars and credit crunches.",The Rational Optimist,Matt Ridley,[]
This is what prosperity is: the increase in the amount of goods or services you can earn with the same amount of work.,The Rational Optimist,Matt Ridley,[]
"The more prosperous and free that people become, the more their birth rate settles at around two children per woman with no coercion necessary.",The Rational Optimist,Matt Ridley,[]
"The success of trust-based peer organizations such as eBay, Wikipedia, and the open-source movement, indicates that trust is a highly expandable network property.",The Rational Optimist,Matt Ridley,[]
"The Rational Optimist: How Prosperity Evolves, by Matt Ridley The Better Angels of our Nature: Why Violence Has Declined, by Steven Pinker, Harvard Professor and two-time Pulitzer Prize finalist Abundance: The Future is Better Than you Think, by Peter H. Diamandis and Steven Kotler",Seeker,Douglas E. Richards,[]
"Imagine you are a deer. You have essentially only four things to do during the day: sleep, eat, avoid being eaten and socialise (by which I mean mark a territory, pursue a member of the opposite sex, nurse a fawn, whatever).",The Rational Optimist,Matt Ridley,[]
in a sorry world there is no safety to be found in standing still.,The Rational Optimist,Matt Ridley,[]
"So one way to raise your standard of living would be to lower somebody else’s: buy a slave. That was indeed how people got rich for thousands of years. Yet,",The Rational Optimist,Matt Ridley,[]
"Imagine if you had to be completely self-sufficient (not just pretending, like Thoreau).",The Rational Optimist,Matt Ridley,[]
"Some are worse off than they were just a few months or years before. But the vast majority of people are much better fed, much better sheltered, much better entertained, much better protected against disease and much more likely to live to old age than their ancestors have ever been. The availability of almost everything a person could want or need has been going rapidly upwards for 200 years and erratically upwards for 10,000 years before",The Rational Optimist,Matt Ridley,[]
Modern philosophers who aspire to rise above the sordid economic reality of the world would do well to recall that this trade made possible the cross-fertilisation of ideas that led to great discoveries.,The Rational Optimist,Matt Ridley,[]
"This is the diagnostic feature of modern life, the very definition of a high standard of living: diverse consumption, simplified production",The Rational Optimist,Matt Ridley,[]
Good institutions cannot usually be imposed from above: that way they are oxymorons.,The Rational Optimist,Matt Ridley,[]
"In truth, far from being unsustainable, the interdependence of the world through trade is the very thing that makes modern life as sustainable as it is.",The Rational Optimist,Matt Ridley,[]
if commercial behaviour might make people more moral.,The Rational Optimist: How Prosperity Evolves,Matt Ridley,[]
That is the point of agriculture: it diverts the labour of other species to providing services for human beings.,The Rational Optimist,Matt Ridley,[]
"When I go into the local superstore, I never see people driven to misery by the impossibility of choice. I see people choosing.",The Rational Optimist,Matt Ridley,[]
Perhaps the internet has returned us to a world a bit like the Stone Age in which there is no place for a fraudster to hide.,The Rational Optimist,Matt Ridley,[]
"The world’s cities already contain half the world’s people, but they occupy less than 3 per cent of the world’s land area.",The Rational Optimist,Matt Ridley,[]
"The internet, in other words, may be the best forum for crime, but it is also the best forum for free and fair exchange the world has ever seen.",The Rational Optimist,Matt Ridley,[]
"In civilized society,’ wrote Adam Smith, an individual ‘stands at all times in need of the co-operation and assistance of great multitudes, while his whole life is scarce sufficient to gain the friendship of a few persons.",The Rational Optimist,Matt Ridley,[]
"Political decisions are by definition monopolistic, disenfranchising and despotically majoritarian; markets are good at supplying minority needs.",The Rational Optimist,Matt Ridley,[]
"the market system makes self interest into something thoroughly virtuous.’ This is the extraordinary feature of markets: just as they can turn many individually irrational individuals into a collectively rational outcome, so they can turn many individually selfish motives into a collectively kind result.",The Rational Optimist: How Prosperity Evolves,Matt Ridley,[]
"As a broad generalisation, the more people trust each other in a society, the more prosperous that society is, and trust growth seems to precede income growth.",The Rational Optimist,Matt Ridley,[]
What is miraculous is that in modern society you can trust and be trusted by a shopkeeper you do not know.,The Rational Optimist,Matt Ridley,[]
"And the good news is that there is no inevitable end to this process. The more people are drawn into the global division of labour, the more people can specialise and exchange, the wealthier we will all be. Moreover, along the way there is no reason we cannot solve the problems that beset us, of economic crashes, population explosions, climate change and terrorism, of poverty, AIDS, depression and obesity.",The Rational Optimist,Matt Ridley,[]
