quoteText,bookTitle,bookAuthor,tags
"Whereas penetration most often means that industry demand will level off, for durable goods, achieving penetration can lead to an abrupt drop in industry demand. After most potential customers have purchased the product, its durability implies that few will buy replacements for a number of years. If industry penetration has been rapid, this situation may translate into several very lean years for industry demand. For example, industry sales of snowmobiles, which underwent very rapid penetration, fell from 425,000 units per year in the peak year (1970-1971) to 125,000 to 200,000 units per year in 1976-1977.6 Recreational vehicles underwent a similar though not quite so dramatic decline. The relation between the growth rate after penetration and growth before penetration will be a function of how fast penetration has been reached and the average time before replacement, and this figure can be calculated.",Competitive Strategy: Techniques for Analyzing Industries and Competitors,Michael E. Porter,[]
"Overcoming fragmentation can be a very significant strategic opportunity. The payoff to consolidating a fragmented industry can be high because the costs of entry into it are by definition low, and there tend to be small and relatively weak competitors who offer little threat of retaliation. I have stressed earlier in this book that an industry must be viewed as an interrelated system, and this fact applies to fragmented industries as well. An industry can be fragmented because of only one of the factors listed in the previous section. If this fundamental block to consolidation can be somehow overcome, this often triggers a process by which the entire structure of the industry changes.",Competitive Strategy: Techniques for Analyzing Industries and Competitors,Michael E. Porter,[]
"The beef cattle industry provides a good example of how a fragmented industry can change in structure. The industry has historically been characterized by a large number of small ranchers grazing cattle on rangelands and transporting them to a meat-packer for processing. Raising cattle has traditionally involved few economies of scale; if anything, there could well be diseconomies of controlling a very large herd and moving it from area to area. However, technological developments have led to the wider use of the feedlot as an alternative process for fattening cattle. Under carefully controlled conditions, the feedlot has proven to be a far cheaper way to put weight on animals. Constructing feedlots requires large capital outlays, though, and there appear to be significant economies of scale in their operation. As a result, some large beef growers, such as Iowa Beef and Monfort, are emerging and the industry is concentrating. These large growers are beginning to be large enough to backward integrate into processing of feeds and to forward integrate into meat processing and distribution. The latter has led to the development of brand names. In this industry the fundamental cause of fragmentation was the production technology utilized for fattening cattle. Once this impediment to consolidation was removed, a process of structural change was triggered which has encompassed many elements of industry structure going far beyond feedlots alone.",Competitive Strategy: Techniques for Analyzing Industries and Competitors,Michael E. Porter,[]
"Although external changes can be the problem, the greater threat to strategy often comes from within. A sound strategy is undermined by a misguided view of competition, by organizational failures, and, especially, by the desire to grow. Managers",HBR's 10 Must Reads on Strategy,Michael E. Porter,[]
"In many industries, however, what some call hypercompetition is a self-inflicted wound, not the inevitable outcome of a changing paradigm of competition. The root of the problem is the failure to distinguish between operational effectiveness and strategy. The quest for productivity, quality, and speed has spawned a remarkable number of management tools and techniques: total quality management, benchmarking, time-based competition, outsourcing, partnering, reengineering, change management. Although the resulting operational improvements have often been dramatic, many companies have been frustrated by their inability to translate those gains into sustainable profitability. And bit by bit, almost imperceptibly, management tools have taken the place of strategy. As managers push to improve on all fronts, they move farther away from viable competitive positions. Operational effectiveness: necessary",HBR's 10 Must Reads on Strategy,Michael E. Porter,[]
Competitive forces = the underlying drivers of profitability P.25,HBR's 10 Must Reads on Strategy,Michael E. Porter,"['competition', 'competitive-forces', 'strategic', 'strategy']"
"Perhaps the single most important determinant of the receptivity of the buyer to a new product or service is the nature of the expected benefit. We can imagine a continuum of benefits ranging from a new product that offers a performance advantage unachievable through other means to one that offers solely a cost advantage. Intermediate cases are those offering an advantage in performance but one that could be replicated through other means at higher cost. The earliest markets purchasing a new product, other things being equal, are usually those in which the advantage is one of performance. This situation occurs because the achievement of a cost advantage in practice is often viewed with suspicion when buyers confront the newness, uncertainty, and often erratic performance of the emerging industry,",Competitive Strategy: Techniques for Analyzing Industries and Competitors,Michael E. Porter,[]
"A firm may achieve differentiation, yet this differentiation will usually sustain only so much of a price differential. Thus if a differentiated firm gets too far behind in cost due to technological change or simply inattention, the low cost firm may be in a position to make major inroads. For example, Kawasaki and other Japanese motorcycle producers have been able to successfully attack differentiated producers such as Harley-Davidson and Triumph in large motorcycles by offering major cost savings to buyers.",Competitive Strategy: Techniques for Analyzing Industries and Competitors,Michael E. Porter,[]
quality differentials have a tendency to erode as an industry matures,Competitive Strategy: Techniques for Analyzing Industries and Competitors,Michael E. Porter,[]
"Southwest’s strategy involves a whole system of activities, not a collection of parts. Its competitive advantage comes from the way its activities fit and reinforce one another. Fit",HBR's 10 Must Reads on Strategy,Michael E. Porter,[]
"Consistency ensures that the competitive advantages of activities cumulate and do not erode or cancel themselves out. It makes the strategy easier to communicate to customers, employees, and shareholders, and improves implementation through single-mindedness in the corporation. Second-order",HBR's 10 Must Reads on Strategy,Michael E. Porter,[]
"Strategic positioning attempts to achieve sustainable competitive advantage by preserving what is distinctive about a company. It means performing different activities from rivals, or performing similar activities in different ways.",HBR's 10 Must Reads on Strategy,Michael E. Porter,[]
"From my examination of many declining industries, the firms that seem to be the most objective about managing the decline process are those that also participate in the substitute industry. They have a clearer perception concerning the prospects of the substitute product and the threat of decline.",Competitive Strategy: Techniques for Analyzing Industries and Competitors,Michael E. Porter,[]
"We usually think of suppliers as other firms, but labor must be recognized as a supplier as well, and one that exerts great power in many industries. There is substantial empirical evidence that scarce, highly skilled employees and/or tightly unionized labor can bargain away a significant fraction of potential profits in an industry.",Competitive Strategy: Techniques for Analyzing Industries and Competitors,Michael E. Porter,[]
"In essence, the job of the strategist is to understand and cope with competition. P. 25",HBR's 10 Must Reads on Strategy,Michael E. Porter,"['competition', 'competitive-forces', 'strategic', 'strategy']"
