quoteText,bookTitle,bookAuthor,tags
"As teams and companies grow larger, the stakes in outcome decrease while the perks of rank increase. When the two cross, the system snaps. Incentives begin encouraging behavior no one wants. Those same groups—with the same people—begin rejecting loonshots.","Loonshots: How to Nurture the Crazy Ideas That Win Wars, Cure Diseases, and Transform Industries",Safi Bahcall,[]
"People may think of Endo and Folkman as great inventors, but arguably their greatest skill was investigating failure. They learned to separate False Fails from true fails.","Loonshots: How to Nurture the Crazy Ideas That Win Wars, Cure Diseases, and Transform Industries",Safi Bahcall,[]
"When groups are small, for example, everyone’s stake in the outcome of the group project is high. At a small biotech, if the drug works, everyone will be a hero and a millionaire. If it fails, everyone will be looking for a job. The perks of rank—job titles or the increase in salary from being promoted—are small compared to those high stakes. As teams and companies grow larger, the stakes in outcome decrease while the perks of rank increase. When the two cross, the system snaps. Incentives begin encouraging behavior no one wants. Those same groups—with the same people—begin rejecting loonshots.","Loonshots: How to Nurture the Crazy Ideas That Win Wars, Cure Diseases, and Transform Industries",Safi Bahcall,[]
"When asked what it takes to win a Nobel Prize, Crick said, ‘Oh it’s very simple. My secret had been I know what to ignore.","Loonshots: How to Nurture the Crazy Ideas That Win Wars, Cure Diseases, and Transform Industries",Safi Bahcall,[]
"The collapse, for example, of IBM’s legendary 80-year-old hardware business in the 1990s sounds like a classic P-type story. New technology (personal computers) displaces old (mainframes) and wipes out incumbent (IBM). But it wasn’t. IBM, unlike all its mainframe competitors, mastered the new technology. Within three years of launching its first PC, in 1981, IBM achieved $5 billion in sales and the #1 position, with everyone else either far behind or out of the business entirely (Apple, Tandy, Commodore, DEC, Honeywell, Sperry, etc.). For decades, IBM dominated computers like Pan Am dominated international travel. Its $13 billion in sales in 1981 was more than its next seven competitors combined (the computer industry was referred to as “IBM and the Seven Dwarfs”). IBM jumped on the new PC like Trippe jumped on the new jet engines. IBM owned the computer world, so it outsourced two of the PC components, software and microprocessors, to two tiny companies: Microsoft and Intel. Microsoft had all of 32 employees. Intel desperately needed a cash infusion to survive. IBM soon discovered, however, that individual buyers care more about exchanging files with friends than the brand of their box. And to exchange files easily, what matters is the software and the microprocessor inside that box, not the logo of the company that assembled the box. IBM missed an S-type shift—a change in what customers care about. PC clones using Intel chips and Microsoft software drained IBM’s market share. In 1993, IBM lost $8.1 billion, its largest-ever loss. That year it let go over 100,000 employees, the largest layoff in corporate history. Ten years later, IBM sold what was left of its PC business to Lenovo. Today, the combined market value of Microsoft and Intel, the two tiny vendors IBM hired, is close to $1.5 trillion, more than ten times the value of IBM. IBM correctly anticipated a P-type loonshot and won the battle. But it missed a critical S-type loonshot, a software standard, and lost the war.","Loonshots: How to Nurture the Crazy Ideas That Win Wars, Cure Diseases, and Transform Industries",Safi Bahcall,[]
"Let’s call it the Moses Trap: When ideas advance only at the pleasure of a holy leader—rather than the balanced exchange of ideas and feedback between soldiers in the field and creatives at the bench selecting loonshots on merit—that is exactly when teams and companies get trapped. The leader raises his staff and parts the seas to make way for the chosen loonshot. The dangerous virtuous cycle spins faster and faster: loonshot feeds franchise feeds bigger, faster, more. The all-powerful leader begins acting for love of loonshots rather than strength of strategy. And then the wheel turns one too many times.","Loonshots: How to Nurture the Crazy Ideas That Win Wars, Cure Diseases, and Transform Industries",Safi Bahcall,[]
"Bush and Vail understood that the doomsday cycle is not inevitable, and that the best chance for sustainable, renewable creativity and growth comes from bringing an organization to the top-right quadrant: separate phases connected by a balanced, dynamic equilibrium.","Loonshots: How to Nurture the Crazy Ideas That Win Wars, Cure Diseases, and Transform Industries",Safi Bahcall,[]
"Keeping the forces in balance is so difficult because loonshots and franchises follow such different paths. Surviving those journeys requires passionate, intensely committed people—with very different skills and values. Artists and soldiers.","Loonshots: How to Nurture the Crazy Ideas That Win Wars, Cure Diseases, and Transform Industries",Safi Bahcall,[]
"Peter Thiel and Ken Howery at Founders Fund, however, reached out to their friends behind the scenes at Friendster. They dug into why users were leaving the site. Like other users, Thiel and Howery knew that Friendster crashed often. They also knew that the team behind Friendster had received, and ignored, crucial advice on how to scale their site—how to transform a system built for a few thousand users into one that could support millions of users. They asked for and received a copy of Friendster’s data on user retention. They were stunned by how long users stayed with the site, despite the irritating crashes. They concluded that users weren’t leaving because social networks were weak business models, like clothing brands. They were leaving because of a software glitch. It was a False Fail. Thiel wrote Zuckerberg a check for $500,000. Eight years later, he sold most of his stake in Facebook for roughly a billion dollars.","Loonshots: How to Nurture the Crazy Ideas That Win Wars, Cure Diseases, and Transform Industries",Safi Bahcall,[]
"On the creative side, inventors (artists) often believe that their work should speak for itself. Most find any kind of promotion distasteful. On the business side, line managers (soldiers) don’t see the need for someone who doesn’t make or sell stuff—for someone whose job is simply to promote an idea internally. But great project champions are much more than promoters. They are bilingual specialists, fluent in both artist-speak and soldier-speak, who can bring the two sides together.","Loonshots: How to Nurture the Crazy Ideas That Win Wars, Cure Diseases, and Transform Industries",Safi Bahcall,[]
"Bush wrote, he learned “how not to fight a war.” In the high-stakes competition between weapons and counterweapons, the weak link was not the supply of new ideas. It was the transfer of those ideas to the field. Transfer requires trust and respect on both sides.","Loonshots: How to Nurture the Crazy Ideas That Win Wars, Cure Diseases, and Transform Industries",Safi Bahcall,[]
"I’ve always appreciated authors who explain their points simply, right up front. So here’s the argument in brief: 1. The most important breakthroughs come from loonshots, widely dismissed ideas whose champions are often written off as crazy. 2. Large groups of people are needed to translate those breakthroughs into technologies that win wars, products that save lives, or strategies that change industries. 3. Applying the science of phase transitions to the behavior of teams, companies, or any group with a mission provides practical rules for nurturing loonshots faster and better.","Loonshots: How to Nurture the Crazy Ideas That Win Wars, Cure Diseases, and Transform Industries",Safi Bahcall,[]
"While the individual man is an insoluble puzzle, in the aggregate he becomes a mathematical certainty.","Loonshots: How to Nurture the Crazy Ideas That Win Wars, Cure Diseases, and Transform Industries",Safi Bahcall,[]
"S-type loonshots are so difficult to spot and understand, even in hindsight, because they are so often masked by the complex behaviors of buyers, sellers, and markets. In science, complexities often mask deep truths: mountains of noise conceal a pebble of signal.","Loonshots: How to Nurture the Crazy Ideas That Win Wars, Cure Diseases, and Transform Industries",Safi Bahcall,[]
"In the real world, ideas are ridiculed, experiments fail, budgets are cut, and good people are fired for stupid reasons.","Loonshots: How to Nurture the Crazy Ideas That Win Wars, Cure Diseases, and Transform Industries",Safi Bahcall,[]
The twisted paths leading to great discoveries are the rule rather than the exception.,"Loonshots: How to Nurture the Crazy Ideas That Win Wars, Cure Diseases, and Transform Industries",Safi Bahcall,[]
"Bush wrote, he learned “how not to fight a war.” In the high-stakes competition between weapons and counterweapons, the weak link was not the supply of new ideas. It was the transfer of those ideas to the field.","Loonshots: How to Nurture the Crazy Ideas That Win Wars, Cure Diseases, and Transform Industries",Safi Bahcall,[]
"By 1938, Hitler had annexed Austria and the Sudetenland; Franco and his Nationalists had captured most of Spain; Mussolini was in full control of Italy; and Japan had invaded China and captured Beijing. Bush and a handful of other scientific leaders—including James Conant, a chemist and the president of Harvard University—believed war was coming and the US was dangerously unprepared. Both had witnessed the tendency of generals to fight a war with the weapons and tactics of the preceding war. They understood that the same mistake this time—facing a much greater German threat—could be fatal.","Loonshots: How to Nurture the Crazy Ideas That Win Wars, Cure Diseases, and Transform Industries",Safi Bahcall,[]
"Although every person, individually, may enthusiastically believe in innovation, collectively the Invisible Axe emerges.","Loonshots: How to Nurture the Crazy Ideas That Win Wars, Cure Diseases, and Transform Industries",Safi Bahcall,"['innovation', 'loonshot', 'rationality']"
"The science of understanding how people respond to subtle changes in environment has grown rapidly over the past decade (see the postscript at the end of the chapter). Companies with outstanding chief incentives officers—experts who understand the complex psychology of cognitive biases, are skilled in using both tangible and intangible equity, and can spot perverse incentives—are likely to do a better job than their competitors in attracting, retaining, and motivating great people. In other words, they will create a strategic advantage.","Loonshots: How to Nurture the Crazy Ideas That Win Wars, Cure Diseases, and Transform Industries",Safi Bahcall,[]
"Separate the phases • Separate your artists and soldiers • Tailor the tools to the phase • Watch your blind side: nurture both types of loonshots (product and strategy) 2. Create dynamic equilibrium • Love your artists and soldiers equally • Manage the transfer, not the technology: be a gardener, not a Moses • Appoint, and train, project champions to bridge the divide 3. Spread a system mindset • Keep asking why the organization made the choices that it did • Keep asking how the decision-making process can be improved • Identify teams with outcome mindsets, and help them adopt system mindsets This","Loonshots: How to Nurture the Crazy Ideas That Win Wars, Cure Diseases, and Transform Industries",Safi Bahcall,[]
"Evaluating decisions and outcomes separately is equally important in the opposite case: bad decisions may occasionally result in good outcomes. You may have a flawed strategy, but your opponent made an unforced error, so you won anyway. You kicked the ball weakly toward the goalkeeper, but he slipped on some mud, and you scored. Which is why probing wins, critically, is as important, if not more so, as probing losses. Failing to analyze wins can reinforce a bad process or strategy. You may not be lucky next time. You don’t want to be the person who makes a poor investment, gets lucky because of a bubble, concludes he is an investment genius, bets his fortune, and then loses it all next time around.","Loonshots: How to Nurture the Crazy Ideas That Win Wars, Cure Diseases, and Transform Industries",Safi Bahcall,[]
"In Italy, for 30 years under the Borgias, they had warfare, terror, murder and bloodshed, but they produced Michelangelo, Leonardo da Vinci, and the Renaissance. In Switzerland, they had brotherly love, they had 500 years of democracy and peace—and what did that produce? The cuckoo clock. —Orson Welles as Harry Lime, The Third Man (1949)","Loonshots: How to Nurture the Crazy Ideas That Win Wars, Cure Diseases, and Transform Industries",Safi Bahcall,[]
"The whole notion of how you build a company is fascinating,” Jobs told his biographer, Walter Isaacson. “I discovered that the best innovation is sometimes the company, the way you organize.","Loonshots: How to Nurture the Crazy Ideas That Win Wars, Cure Diseases, and Transform Industries",Safi Bahcall,[]
"We can think of the two competing incentives, loosely, as stake and rank. When groups are small, for example, everyone’s stake in the outcome of the group project is high.","Loonshots: How to Nurture the Crazy Ideas That Win Wars, Cure Diseases, and Transform Industries",Safi Bahcall,[]
"New frontiers of the mind are before us, and if they are pioneered with the same vision, boldness, and drive with which we have waged this war we can create a fuller and more fruitful employment and a fuller and more fruitful life.","Loonshots: How to Nurture the Crazy Ideas That Win Wars, Cure Diseases, and Transform Industries",Safi Bahcall,[]
"Bush changed national research the same way Vail changed corporate research. Both recognized that the big ideas—the breakthroughs that change the course of science, business, and history—fail many times before they succeed. Sometimes they survive through the force of exceptional skill and personality. Sometimes they survive through sheer chance. In other words, the breakthroughs that change our world are born from the marriage of genius and serendipity.","Loonshots: How to Nurture the Crazy Ideas That Win Wars, Cure Diseases, and Transform Industries",Safi Bahcall,[]
"Rather than champion any individual loonshot, they create an outstanding structure for nurturing many loonshots. Rather than visionary innovators, they are careful gardeners. They ensure that both loonshots and franchises are tended well, that neither side dominates the other, and that each side nurtures and supports the other.","Loonshots: How to Nurture the Crazy Ideas That Win Wars, Cure Diseases, and Transform Industries",Safi Bahcall,[]
"1. SEPARATE THE PHASES Separate your artists and soldiers People responsible for developing high-risk, early-stage ideas (call them “artists”) need to be sheltered from the “soldiers” responsible for the already-successful, steady-growth part of an organization. Early-stage projects are fragile.","Loonshots: How to Nurture the Crazy Ideas That Win Wars, Cure Diseases, and Transform Industries",Safi Bahcall,[]
2. DYNAMIC EQUILIBRIUM Love your artists and soldiers equally Maintaining balance so that neither phase overwhelms the other requires something that sounds soft and fuzzy but is very real and often overlooked. Artists working on loonshots and soldiers working on franchises have to feel equally loved.,"Loonshots: How to Nurture the Crazy Ideas That Win Wars, Cure Diseases, and Transform Industries",Safi Bahcall,[]
"Manage the transfer, not the technology Bush, although a brilliant inventor and engineer, pointedly stayed out of the details of any one loonshot. “I made no technical contribution whatever to the war effort,” he wrote. “Not a single technical idea of mine ever amounted to shucks. At times I have been called an ‘atomic scientist.’ It would be fully as accurate to call me a child psychologist.","Loonshots: How to Nurture the Crazy Ideas That Win Wars, Cure Diseases, and Transform Industries",Safi Bahcall,[]
"Both Bush and Vail saw their jobs as managing the touch and the balance between loonshots and franchises—between scientists exploring the bizarre and soldiers assembling munitions; between the blue-sky research of Bell Labs and the daily grind of telephone operations. Rather than dive deep into one or the other, they focused on the transfer between the two.","Loonshots: How to Nurture the Crazy Ideas That Win Wars, Cure Diseases, and Transform Industries",Safi Bahcall,[]
"And then we’ll see how small changes in structure, rather than culture, can transform the behavior of groups, the same way a small change in temperature can transform rigid ice to flowing water. Which will give all of us the tools to become the initiators, not the victims, of innovative surprise.","Loonshots: How to Nurture the Crazy Ideas That Win Wars, Cure Diseases, and Transform Industries",Safi Bahcall,[]
"If we want more Junos and Slumdog Millionaires, we need the next Avengers and Transformers. If we want better drugs for cancer and Alzheimer’s, we need the next statin.","Loonshots: How to Nurture the Crazy Ideas That Win Wars, Cure Diseases, and Transform Industries",Safi Bahcall,[]
"Bush and Vail managed the transfer rather than the technology. They cared for the touch and balance between loonshots and franchises. Land, on the other hand, was the “principal cheerleader and spokesperson” for the Polavision project.","Loonshots: How to Nurture the Crazy Ideas That Win Wars, Cure Diseases, and Transform Industries",Safi Bahcall,[]
"Applying the science of phase transitions to the behavior of teams, companies, or any group with a mission provides practical rules for nurturing loonshots faster and better.","Loonshots: How to Nurture the Crazy Ideas That Win Wars, Cure Diseases, and Transform Industries",Safi Bahcall,[]
"Teams with a system mindset, level 2, probe the decision-making process behind a failure. How did we arrive at that decision? Should a different mix of people be involved, or involved in a different way? Should we change how we analyze opportunities before making similar decisions in the future? How do the incentives we have in place affect our decision-making? Should those be changed?","Loonshots: How to Nurture the Crazy Ideas That Win Wars, Cure Diseases, and Transform Industries",Safi Bahcall,[]
"One of the reasons that crazy projects like the Red Balloon Challenge can succeed inside DARPA is that there is no career ladder. Project managers are hired for fixed terms, typically between two and four years (their employee badges are printed with an expiration date). DARPA’s structure has eliminated the benefit of spending any time on politics, of trying to sound smart in meetings and put down your colleagues by highlighting the warts in their nutty loonshots so that you can curry favor and win promotions.","Loonshots: How to Nurture the Crazy Ideas That Win Wars, Cure Diseases, and Transform Industries",Safi Bahcall,[]
"When interviewing new scientists for his team, he would pose a challenge: “You are about to land at dead of night in a rubber raft on a German-held coast. Your mission is to destroy a vital enemy wireless installation that is defended by armed guards, dogs, and searchlights. You can have with you any weapon you can imagine. Describe that weapon.” Scientists got the message. Being practical was a matter of life or death.","Loonshots: How to Nurture the Crazy Ideas That Win Wars, Cure Diseases, and Transform Industries",Safi Bahcall,[]
"Systems snap—liquids suddenly freeze, traffic suddenly jams, forests or terror networks suddenly erupt—when the tide turns in a microscopic battle. Two forces compete, and the victory flag changes sides.","Loonshots: How to Nurture the Crazy Ideas That Win Wars, Cure Diseases, and Transform Industries",Safi Bahcall,[]
"Dunbar proposed a novel idea: the size of a species’ brain determines the optimal size of their social groups. Maintaining relationships, argued Dunbar, requires brain power. More relationships require more neurons. Extrapolating his straight line from primate brains to human brains, he found that the optimal human group size, if this hypothesis were true, would be an interesting number: 150.","Loonshots: How to Nurture the Crazy Ideas That Win Wars, Cure Diseases, and Transform Industries",Safi Bahcall,[]
"Then, in 2000, Malcolm Gladwell published The Tipping Point, a blockbuster that included a chapter titled “The Magic Number 150.","Loonshots: How to Nurture the Crazy Ideas That Win Wars, Cure Diseases, and Transform Industries",Safi Bahcall,[]
"time to build a new plant.” The idea of a hard-wired cutoff at 150 human relationships, set by volume of the human brain, went viral.","Loonshots: How to Nurture the Crazy Ideas That Win Wars, Cure Diseases, and Transform Industries",Safi Bahcall,[]
"Just because a theory might be a bit wacky, however, doesn’t mean there isn’t something to the observation.","Loonshots: How to Nurture the Crazy Ideas That Win Wars, Cure Diseases, and Transform Industries",Safi Bahcall,[]
Dismissing the loonshot in favor of the franchise project is the rational choice.,"Loonshots: How to Nurture the Crazy Ideas That Win Wars, Cure Diseases, and Transform Industries",Safi Bahcall,[]
"As the small startup’s size gradually increases, it will eventually reach a breakeven point where the two incentives, pulling in opposing directions, are equal. Above that size, a behavior appears across the organization that favors killing loonshots and supporting franchises. Let’s call that behavior the Invisible Axe. The sudden emergence of that Invisible Axe is a phase transition.","Loonshots: How to Nurture the Crazy Ideas That Win Wars, Cure Diseases, and Transform Industries",Safi Bahcall,[]
"Hemingway wrote that “the dignity of movement of an iceberg is due to only one-eighth of it being above water.” He called it his Theory of Omission. The power of beautiful prose comes from what you leave out. In science, it’s the same. The power of a beautiful model comes from what you choose to omit.","Loonshots: How to Nurture the Crazy Ideas That Win Wars, Cure Diseases, and Transform Industries",Safi Bahcall,[]
"to understand what causes a phase transition inside organizations, we need a simple-model organization, one that captures just enough to illustrate the basic idea.","Loonshots: How to Nurture the Crazy Ideas That Win Wars, Cure Diseases, and Transform Industries",Safi Bahcall,[]
"Endo had spent many months on experiments trying to understand why his drug didn’t behave as he expected. He already suspected what’s called a species difference (when a drug behaves very differently across animal species). He knew to act quickly when the opportunity appeared. Where others assumed Friendster was yet another example of a social network fad, Thiel and Howery investigated more deeply why users were leaving and found a contrarian answer, in which they had confidence. Contrarian answers, with confidence, create very attractive investments.","Loonshots: How to Nurture the Crazy Ideas That Win Wars, Cure Diseases, and Transform Industries",Safi Bahcall,[]
"Entrepreneurs, for example, often say that big companies fail because big-corporate types are conservative and risk-averse. The most exciting ideas come from small companies, because—we tell ourselves—we are the truly passionate risk-takers.","Loonshots: How to Nurture the Crazy Ideas That Win Wars, Cure Diseases, and Transform Industries",Safi Bahcall,[]
It was Branch Rickey who originated the saying cited in part one: “Luck is the residue of design.,"Loonshots: How to Nurture the Crazy Ideas That Win Wars, Cure Diseases, and Transform Industries",Safi Bahcall,[]
"Loonshot: A neglected project, widely dismissed, its champion written off as unhinged.","Loonshots: How to Nurture the Crazy Ideas That Win Wars, Cure Diseases, and Transform Industries",Safi Bahcall,[]
"The researchers found a middle ground by creating a model that was simple, but not simplistic. Throw away too much detail, and you explain nothing. Retain all the detail—same thing.","Loonshots: How to Nurture the Crazy Ideas That Win Wars, Cure Diseases, and Transform Industries",Safi Bahcall,[]
"We want a model that is just simple enough so that we can extract macro insights with confidence in their micro origins. In other words, we want a model that describes the forest but is built from the trees.","Loonshots: How to Nurture the Crazy Ideas That Win Wars, Cure Diseases, and Transform Industries",Safi Bahcall,[]
Whether a computer virus spreads widely across the internet or disappears quickly; whether a tiny neuronal misfiring is harmless or erupts into a seizure engulfing your brain; whether an idea spreads explosively throughout a population or fades away quickly—all are governed by similar dynamics: percolation on a small-world network.,"Loonshots: How to Nurture the Crazy Ideas That Win Wars, Cure Diseases, and Transform Industries",Safi Bahcall,[]
