quoteText,bookTitle,bookAuthor,tags
"Most researchers tried to solve the fat tail problem by studying the behavior of individual traders. Johnson, instead, looked at clusters. He asked what would happen if we assumed traders acted in cliques: small groups whose members all behave the same way, that is, they make the same buy or sell decisions. (The evidence for groupthink in markets, from tulip mania to the internet bubble, is strong.) The clusters need not be permanent","Loonshots: How to Nurture the Crazy Ideas That Win Wars, Cure Diseases, and Transform Industries",Safi Bahcall,[]
"Most researchers tried to solve the fat tail problem by studying the behavior of individual traders. Johnson, instead, looked at clusters. He asked what would happen if we assumed traders acted in cliques: small groups whose members all behave the same way, that is, they make the same buy or sell decisions. (The evidence for groupthink in markets, from tulip mania to the internet bubble, is strong.) The clusters need not be permanent. Just like cliques in high school, members come and go, trading cliques form and dissolve, they merge with other cliques or split into two.","Loonshots: How to Nurture the Crazy Ideas That Win Wars, Cure Diseases, and Transform Industries",Safi Bahcall,[]
"Earlier I mentioned that Newton and Jobs were great synthesizers. Newton brought together planetary astronomy, laws of motion, differential mathematics—ideas developed by others—and synthesized them into a coherent whole the world hadn’t seen. Jobs brought together design, marketing, and technology into a coherent whole, as few others could do. But he was missing a key ingredient. Like Land before him, who brought similar skills together, Jobs had led only as a Moses. Which is why the most valuable gift that Jobs received—from the perspective of Apple product lovers today—was not the financial reward of his Pixar investment. It was seeing the Bush-Vail rules in action. He learned a different model for leading, for how to nurture loonshots and grow franchises while balancing the tensions between the two. That missing ingredient became the key to his third act, when he returned to hardware and revived his previous company—along with the entire American consumer electronics industry.","Loonshots: How to Nurture the Crazy Ideas That Win Wars, Cure Diseases, and Transform Industries",Safi Bahcall,[]
"In June 1940, FDR asked Trippe to build 25 new airports in South America, which could double as American bases, under the cover of Pan Am’s commercial needs. America was officially neutral, but FDR knew of the strong German ties to the continent.","Loonshots: How to Nurture the Crazy Ideas That Win Wars, Cure Diseases, and Transform Industries",Safi Bahcall,[]
"Trippe heard about a new kind of engine. One more loonshot. A technology that quadrupled maximum takeoff weight. A plane with the new bypass jet engine, with its extra propeller in front, could carry nearly 500 passengers, two and a half times as many as the Boeing 707. The music of the Jazz Age, now the Jet Age, keeps playing. The wheel in the sky keeps on turning. The franchise feeds the P-type loonshots that feed the franchise. Bigger, faster, more. Trippe had to have it.","Loonshots: How to Nurture the Crazy Ideas That Win Wars, Cure Diseases, and Transform Industries",Safi Bahcall,[]
"On December 22, they signed, once again, the largest corporate deal in history to that time: $525 million for 25 production models of a new, first-in-class plane. Allen gave it a name: the Boeing 747.","Loonshots: How to Nurture the Crazy Ideas That Win Wars, Cure Diseases, and Transform Industries",Safi Bahcall,[]
"To fill two and a half times as many seats, an airline needs two and a half times as many passengers. Pan Am’s lock on international travel, however, had been weakening. Congress had launched an antitrust investigation of Pan Am’s monopoly on foreign routes in the 1950s. Populist voices complained that regulators were protecting industry giants rather than consumers. Some of the loudest complaints came from startups—Texas Air, Braniff, and, eventually, Southwest Airlines. The startups also brought new ideas to the industry. Hub and spoke. Flying to secondary airports. Reducing turnaround times to 20 minutes. Like Sam Walton’s supersized stores far outside cities, none of the ideas involved new technologies. They were all small changes in strategy that no one thought would amount to much. They were all S-type loonshots.","Loonshots: How to Nurture the Crazy Ideas That Win Wars, Cure Diseases, and Transform Industries",Safi Bahcall,[]
"The faint glimmers from those S-type loonshots were dwarfed by the decade’s most glamorous P-type loonshot: the 747 jumbo-jet airliner. Until deregulation. Small changes that improved efficiency and lowered costs—not glamorous, kind of boring—suddenly became the key to survival. Those S-type loonshots, nurtured by startups like Southwest or major carriers like Bob Crandall’s American, spread quickly through the industry. They annihilated every unprepared airline.","Loonshots: How to Nurture the Crazy Ideas That Win Wars, Cure Diseases, and Transform Industries",Safi Bahcall,[]
"The demise of Pan Am was a remarkable story, but not a unique one. Nearly every company led by a master P-type innovator like Trippe gets shocked. Some sudden change, whether from a regulatory agency or a new competitor, stops the music. The loonshot-franchise cycle stops working. The wheel turns one too many times, and suddenly there’s a fleet of 747s that no one wants to fly.","Loonshots: How to Nurture the Crazy Ideas That Win Wars, Cure Diseases, and Transform Industries",Safi Bahcall,[]
"The graveyard of unexplained experiments, as Land would soon show, is a great place to find a False Fail.","Loonshots: How to Nurture the Crazy Ideas That Win Wars, Cure Diseases, and Transform Industries",Safi Bahcall,[]
"Polaroid sales grew from just under $1.5 million in 1948 to $1.4 billion in 1978. For 30 years, Polaroid dominated instant print like Pan Am dominated international travel: by delivering spectacular breakthroughs, year after year, which delighted customers. In both cases, a master P-type innovator at the top fueled those loonshots, which grew the franchise, which, in turn, fueled more loonshots. The wheel in the camera kept on turning. The dangerous virtuous cycle spun faster and faster.","Loonshots: How to Nurture the Crazy Ideas That Win Wars, Cure Diseases, and Transform Industries",Safi Bahcall,[]
"Land was not surprised by digital photography. He’d argued for that loonshot in front of the president of the United States. He did so before anyone else was even in the game. In a 1988 ceremony honoring Land, the director of the CIA, William Webster, declared, “The contributions Dr. Land has made to national security are innumerable, and the influence he has had on our present intelligence capabilities is unequaled.” So what happened with Polaroid? Why didn’t Land jump on digital for his own company, exploit the head start from his national intelligence connections, and use those advantages to beat Sony, Canon, and Nikon to the punch? FALLING IN LOVE Moses Trap: When ideas advance only at the pleasure of a holy leader, who acts for love of loonshots rather than strength of strategy","Loonshots: How to Nurture the Crazy Ideas That Win Wars, Cure Diseases, and Transform Industries",Safi Bahcall,[]
"The familiar story of the decline of industry Goliaths begins with decades of success, after which the proud old company grows stale. It loses its hunger. A young upstart, a small David, comes along and slays the lumbering giant with an unexpected weapon. It’s a new idea or technology that everyone else overlooked. Some kind of loonshot. The Goliaths built by Edwin Land, Juan Trippe, and—as we will see in the next chapter—Steve Jobs 1.0 don’t fit this picture. Land, Trippe, and Jobs were all master P-type innovators who never lost their hunger, their taste for bold, risky projects. Their Goliaths disappeared (or nearly disappeared, in the case of Jobs) because all three followed the same pattern into the same trap.","Loonshots: How to Nurture the Crazy Ideas That Win Wars, Cure Diseases, and Transform Industries",Safi Bahcall,[]
"Each of those visionary leaders created a brilliant loonshot nursery; they achieved Bush-Vail rule #1: phase separation. But they remained judge and jury of new ideas. Unlike Bush and Vail, who saw their role as gardeners tending to the touch and balance between loonshots and franchises, encouraging transfer and exchange, those three master P-type innovators saw themselves as Moses, raising their staffs, anointing the chosen loonshot.","Loonshots: How to Nurture the Crazy Ideas That Win Wars, Cure Diseases, and Transform Industries",Safi Bahcall,[]
"The dangerous, virtuous cycle builds momentum P-type loonshots feed a growing franchise, which in turn feeds more P-type loonshots.","Loonshots: How to Nurture the Crazy Ideas That Win Wars, Cure Diseases, and Transform Industries",Safi Bahcall,[]
"Only those P-type loonshots that continue to spin the wheel matter. Trippe saw the new ways of doing business, the S-type loonshots from Bob Crandall and other large carriers, or from local discounters like Pacific Southwest Airlines—but he ignored them. Edwin Land not only saw digital, he dove deep on digital. But he ignored it, for his company, in favor of Polavision.","Loonshots: How to Nurture the Crazy Ideas That Win Wars, Cure Diseases, and Transform Industries",Safi Bahcall,[]
"Moses grows all-powerful and anoints loonshots by decree Bush and Vail managed the transfer rather than the technology. They cared for the touch and balance between loonshots and franchises. Land, on the other hand, was the “principal cheerleader and spokesperson” for the Polavision project.","Loonshots: How to Nurture the Crazy Ideas That Win Wars, Cure Diseases, and Transform Industries",Safi Bahcall,[]
"Like Polavision or the Boeing 747, the NeXT Cube was a beautiful, technologically remarkable, wildly expensive machine—with no customers. The new optical drives had many times the memory of magnetic drives or floppy disks. But competitors offered more convenience, more useful applications, and lower costs. The summary of Polavision—“a product that has much more scientific and aesthetic appeal than commercial significance”—applied equally well to the NeXT computer.","Loonshots: How to Nurture the Crazy Ideas That Win Wars, Cure Diseases, and Transform Industries",Safi Bahcall,[]
"As mentioned earlier, after founding what became Bell Labs, Theodore Vail said that no group “can be either ignored or favored at the expense of the others without unbalancing the whole.” Vannevar Bush, during the Second World War, took every chance he could to emphasize his respect for the military, even as he spent nearly all his time with scientists like himself. Loving your loonshot and franchise groups equally, however, requires overcoming natural preferences. Artists tend to favor artists. Soldiers tend to favor soldiers.","Loonshots: How to Nurture the Crazy Ideas That Win Wars, Cure Diseases, and Transform Industries",Safi Bahcall,[]
Bill Gore and Brigham Young limited groups to 150 people. We intuitively understand that something changes inside teams and companies as they cross a certain threshold in size. But the volume of our neocortex might have nothing to do with it.,"Loonshots: How to Nurture the Crazy Ideas That Win Wars, Cure Diseases, and Transform Industries",Safi Bahcall,[]
"In the real world, ideas are ridiculed, experiments fail, budgets are cut, and good people are fired for stupid reasons. Companies fall apart and their best projects remain buried, sometimes forever. The Three Deaths tells the honest history, as opposed to the revisionist history, of nearly every important breakthrough I’m aware of or have personally experienced (the Three often stretches to Four, Five, or Ten). The need to nurture and protect fragile loonshots so they can survive those stumbles and setbacks, whether self-inflicted or caused by others, is the central idea behind the systems of Bush and Vail. As we will see, failing to understand the surprising fragility of the loonshot—assuming that the best ideas will blast through barriers, fueled by the power of their brilliance—can be a very expensive mistake. It can mean missing one of the most important discoveries in medicine of the century.","Loonshots: How to Nurture the Crazy Ideas That Win Wars, Cure Diseases, and Transform Industries",Safi Bahcall,[]
"As NeXT began to struggle, even as Jobs’s star was rising, several employees at NeXT, as well as executives from Compaq and Dell, approached Jobs with an idea: get out of hardware. NeXT’s software was excellent. Its graphical interface and programming tools were more elegant and powerful than Microsoft’s DOS and early Windows. Jobs could offer PC makers an alternative to Microsoft, which they desperately wanted. In return, the PC makers could offer NeXT something it desperately needed: a future. The idea of switching from hardware to software was a classic S-type loonshot. Jobs had risen to fame selling hardware. Bigger, faster, more, every year. The stars of the day—IBM, DEC, Compaq, Dell—sold shiny machines stamped with their famous logos. Everyone knew there was no money to be made in software; the money was in hardware.","Loonshots: How to Nurture the Crazy Ideas That Win Wars, Cure Diseases, and Transform Industries",Safi Bahcall,[]
"And dozens of stories hailed Jobs as the master P-type innovator of his generation. Just like Edwin Land and Juan Trippe before him. Abandon hardware? Not this Moses. In fact, Jobs had already doubled down. Not long after he left Apple, Jobs got back in touch with the team of engineers in Marin County developing a graphics computer. Why bet on just one bigger, faster machine if you could have two? He bought their business and left them alone to build an even more powerful computer than NeXT. Jobs had no idea that those engineers held the key to rescuing him from the Moses Trap. And it would have nothing to do with their machine.","Loonshots: How to Nurture the Crazy Ideas That Win Wars, Cure Diseases, and Transform Industries",Safi Bahcall,[]
"Hooke suggested to Newton how gravity can explain planetary motion. Hooke’s suggestions launched Newton on the path to his masterpiece, Principia. Although Hooke suggested some of the initial ideas, he did not have the skills to create a complete system. Newton did. Newton was a great synthesizer, just as Jobs was a great synthesizer. Isaac Newton had Robert Hooke. Steve Jobs had Jef Raskin.","Loonshots: How to Nurture the Crazy Ideas That Win Wars, Cure Diseases, and Transform Industries",Safi Bahcall,[]
Raskin launched the original Macintosh project and suggested some of its core ideas to Jobs. But he did not have the skills to develop those ideas into a complete system. Jobs did. Jobs was a great synthesizer.,"Loonshots: How to Nurture the Crazy Ideas That Win Wars, Cure Diseases, and Transform Industries",Safi Bahcall,[]
"Like NeXT, like Polavision, like the Boeing 747, the PIC was a beautiful, turbo-powered, wildly expensive machine—with no customers. Once again, love of loonshots had triumphed over strength of strategy, just as it had with Juan Trippe and Edwin Land. Only Jobs, unlike the other two, had doubled down on the Moses Trap. After two more years and over $50 million invested, Jobs finally pulled the plug on the PIC. In April 1990, Pixar sold its hardware business to a California-based technology company, Vicom Systems.","Loonshots: How to Nurture the Crazy Ideas That Win Wars, Cure Diseases, and Transform Industries",Safi Bahcall,[]
"With Pixar, however, Jobs gained not only time—and a product he never expected—but an idea. He found a different way to nurture loonshots.","Loonshots: How to Nurture the Crazy Ideas That Win Wars, Cure Diseases, and Transform Industries",Safi Bahcall,[]
Both Genentech and Pixar—like any good drug-discovery company or film studio—learned how to balance both loonshots and franchises because they had to. There are no other kinds of products in movies and drugs.,"Loonshots: How to Nurture the Crazy Ideas That Win Wars, Cure Diseases, and Transform Industries",Safi Bahcall,[]
"Here is Catmull describing the need to maintain the balance between loonshots and franchises—“the Beast”—in film: Originality is fragile. And, in its first moments, it’s often far from pretty. This is why I call early mock-ups of our films “Ugly Babies.” They are not beautiful, miniature versions of the adults they will grow up to be. They are truly ugly: awkward and unformed, vulnerable and incomplete. They need nurturing—in the form of time and patience—in order to grow. What this means is that they have a hard time coexisting with the Beast.… When I talk about the Beast and the Baby, it can seem very black and white—that the Beast is all bad and the Baby is all good. The truth is, reality lies somewhere in between. The Beast is a glutton but also a valuable motivator. The Baby is so pure and unsullied, so full of potential, but it’s also needy and unpredictable and can keep you up at night. The key is for your Beast and your Babies to coexist peacefully, and that requires that you keep various forces in balance.","Loonshots: How to Nurture the Crazy Ideas That Win Wars, Cure Diseases, and Transform Industries",Safi Bahcall,[]
"Franchise projects are easier to understand than loonshots, easier to quantify, and easier to sell up the chain of command in large companies. The challenge for these sequels and follow-ons is not in making it through the long dark tunnel of skepticism and uncertainty. Their challenge is in exceeding what came before.","Loonshots: How to Nurture the Crazy Ideas That Win Wars, Cure Diseases, and Transform Industries",Safi Bahcall,[]
"Inventors or creatives championing loonshots are often tempted to ridicule franchises—as Steve Jobs 1.0 did with the “bozos” developing Apple II follow-ons. But both sides need each other. Without the certainties of franchises, the high failure rates of loonshots would bankrupt companies and industries. Without fresh loonshots, franchise developers would shrivel and die.","Loonshots: How to Nurture the Crazy Ideas That Win Wars, Cure Diseases, and Transform Industries",Safi Bahcall,[]
"We can think of analyzing why a move is bad—why pawn-takes-bishop, for example, lost the game—as level 1 strategy, or outcome mindset. After a bad move costs him a game, however, Kasparov analyzes not just why the move was bad, but how he should change the decision process behind the move. In other words, how he decided on that move, in that moment, in the context of that opponent, and what that means for how he should change his decision-making and game-preparation routine in the future. Analyzing the decision process behind a move I’ll call level 2 strategy, or system mindset.","Loonshots: How to Nurture the Crazy Ideas That Win Wars, Cure Diseases, and Transform Industries",Safi Bahcall,[]
"Teams with an outcome mindset, level 1, analyze why a project or strategy failed. The storyline was too predictable. The product did not stand out enough from competitors’ products. The drug candidate’s data package was too weak. Those teams commit to working harder on storyline or unique product features or a better data package in the future. Teams with a system mindset, level 2, probe the decision-making process behind a failure. How did we arrive at that decision? Should a different mix of people be involved, or involved in a different way? Should we change how we analyze opportunities before making similar decisions in the future? How do the incentives we have in place affect our decision-making? Should those be changed?","Loonshots: How to Nurture the Crazy Ideas That Win Wars, Cure Diseases, and Transform Industries",Safi Bahcall,[]
"A failed outcome, for example, does not necessarily mean the decision or decision process behind it was bad. There are good decisions with bad outcomes. Those are intelligent risks, well taken, that didn’t play out. For example, if a lottery is paying out at 100 to 1, but only three tickets are sold, one of which will win, then yes, purchasing one of those three tickets is a good decision.","Loonshots: How to Nurture the Crazy Ideas That Win Wars, Cure Diseases, and Transform Industries",Safi Bahcall,[]
Evaluating decisions and outcomes separately is equally important in the opposite case: bad decisions may occasionally result in good outcomes.,"Loonshots: How to Nurture the Crazy Ideas That Win Wars, Cure Diseases, and Transform Industries",Safi Bahcall,[]
"At Pixar, Catmull probed both systems and processes, after both wins and stumbles.","Loonshots: How to Nurture the Crazy Ideas That Win Wars, Cure Diseases, and Transform Industries",Safi Bahcall,[]
"Like Vannevar Bush, who insisted, as described in chapter 1, that he “made no technical contribution whatever to the war effort,” Catmull saw his job as minding the system rather than managing the projects.","Loonshots: How to Nurture the Crazy Ideas That Win Wars, Cure Diseases, and Transform Industries",Safi Bahcall,[]
"That message got through to Jobs. Jobs had a role in the system—he was a brilliant deal-maker and financier. It was Jobs, for example, who insisted on timing the Pixar IPO with the Toy Story release, and Jobs who negotiated the Pixar deals with Disney. But he was asked to stay out of the early feedback loop on films. The gravity of his presence could crush the delicate candor needed to nurture early-stage, fragile projects. On those occasions he was invited to help near-finished films, Jobs would preface his remarks: “I’m not a filmmaker. You can ignore everything I say.” Jobs had learned to mind the system, not manage the project.","Loonshots: How to Nurture the Crazy Ideas That Win Wars, Cure Diseases, and Transform Industries",Safi Bahcall,[]
"Ferocious attention to scientific detail—or artistic vision or engineering design—is one tool, tailored to the phase, that motivates excellence among scientists, artists, or any type of creative.","Loonshots: How to Nurture the Crazy Ideas That Win Wars, Cure Diseases, and Transform Industries",Safi Bahcall,[]
"champion is not the same as relinquishing attention to detail. The chief executive at Genentech for fourteen years, Art Levinson, was famous—and feared—for his insistence on scientific precision.","Loonshots: How to Nurture the Crazy Ideas That Win Wars, Cure Diseases, and Transform Industries",Safi Bahcall,[]
"In April 2000, three years after Steve Jobs returned to Apple, he invited Art Levinson to join his new board of directors. After Jobs passed away in 2011, Levinson replaced him as chairman of Apple.","Loonshots: How to Nurture the Crazy Ideas That Win Wars, Cure Diseases, and Transform Industries",Safi Bahcall,[]
"When Jobs finally took over, gone was the dismissive attitude toward soldiers. In March 1998, he hired Tim Cook, known as the “Attila the Hun of inventory,” from Compaq to run operations.","Loonshots: How to Nurture the Crazy Ideas That Win Wars, Cure Diseases, and Transform Industries",Safi Bahcall,[]
"Apple’s P-type loonshots, of course, transformed their industries: the iPod, the iPhone, and the iPad. But what ultimately made them so successful, aside from excellence in design and marketing (most, although not all, of the technologies inside had been invented by others), was an underlying S-type loonshot. It was a strategy that had been rejected by nearly all others in the industry: a closed ecosystem.","Loonshots: How to Nurture the Crazy Ideas That Win Wars, Cure Diseases, and Transform Industries",Safi Bahcall,[]
"Apple’s P-type loonshots, of course, transformed their industries: the iPod, the iPhone, and the iPad. But what ultimately made them so successful, aside from excellence in design and marketing (most, although not all, of the technologies inside had been invented by others), was an underlying S-type loonshot. It was a strategy that had been rejected by nearly all others in the industry: a closed ecosystem. Many companies had tried, and failed, to impose a closed ecosystem on customers. IBM built a personal computer with a proprietary operating system called OS/2. Both the computer and the operating system disappeared. Analysts, observers, and industry experts concluded that a closed ecosystem could never work: customers wanted choice. Apple, while Jobs was exiled to NeXT, followed the advice of the analysts and experts. It opened its system, licensing out Macintosh software and architecture. Clones proliferated, just like Windows-based PCs. When Jobs returned to Apple, he insisted that the board agree to shut down the clones. It cost Apple over $100 million to cancel existing contracts at a time when it was desperately fighting bankruptcy. But that S-type loonshot, closing the ecosystem, drove the phenomenal rise of Apple’s products. The sex appeal of the new products lured customers in; the fence made it difficult to leave.","Loonshots: How to Nurture the Crazy Ideas That Win Wars, Cure Diseases, and Transform Industries",Safi Bahcall,[]
