quoteText,bookTitle,bookAuthor,tags
"This book has pushed back against the randomness thesis, emphasizing instead the skill in venture capital. It has done so for four reasons. First, the existence of path dependency does not actually prove that skill is absent. Venture capitalists need skill to enter the game: as the authors of the NBER paper say, path dependency can only influence which among the many skilled players gets to be the winner. Nor is it clear that path dependency explains why some skilled operators beat other ones. The finding that a partnership’s future IPO rate rises by 1.6 percentage points is not particularly strong, and the history recounted in these pages shows that path dependency is frequently disrupted.[5] Despite his powerful reputation, Arthur Rock was unsuccessful after his Apple investment. Mayfield was a leading force during the 1980s; it too faded. Kleiner Perkins proves that you can dominate the Valley for a quarter of a century and then decline precipitously. Accel succeeded early, hit a rough patch, and then built itself back. In an effort to maintain its sense of paranoia and vigilance, Sequoia once produced a slide listing numerous venture partnerships that flourished and then failed. “The Departed,” it called them. The second reason to believe in skill lies in the origin story of some partnerships. Occasionally a newcomer breaks into the venture elite in such a way that skill obviously does matter. Kleiner Perkins became a leader in the business because of Tandem and Genentech. Both companies were hatched from within the KP office and actively shaped by Tom Perkins; there was nothing lucky about this. Tiger Global and Yuri Milner invented the art of late-stage venture capital. They had a genuinely novel approach to tech investing; they offered much more than the equivalent of another catchy tune competing against others. Paul Graham’s batch-processing method at Y Combinator offered an equally original approach to seed-stage investing. A clever innovation, not random fortune, explains Graham’s place in venture history.",The Power Law: Venture Capital and the Making of the New Future,Sebastian Mallaby,[]
"By September 2004, Zuckerberg was referring to Parker as Facebook’s president, and Parker was steering Zuckerberg away from conventional venture capitalists. He told Benchmark and Google to back off, preferring to take a leaf out of Google’s own book; he wanted to raise capital from angels. His first port of call was an entrepreneur named Reid Hoffman, who had coached him through the Plaxo denouement. Hoffman declined to lead an investment in Facebook; he had himself founded a social network called LinkedIn, and there might be some rivalry. So Hoffman put Parker in touch with a Stanford friend named Peter Thiel, the co-founder of an online payments company called PayPal. Pretty soon, Thiel agreed to kick in $500,000 in exchange for 10.2 percent of the firm, with Hoffman providing a further $38,000.[11] A third social-networking entrepreneur named Mark Pincus also wrote a check for $38,000.",The Power Law: Venture Capital and the Making of the New Future,Sebastian Mallaby,[]
"Recalling the atmosphere of this period, Mark Pincus remarked, “There were about six people that I knew who were interested in doing anything in the consumer internet, and we all kind of went to the same two coffee shops.",The Power Law: Venture Capital and the Making of the New Future,Sebastian Mallaby,[]
"Third, the idea that venture capitalists get into deals on the strength of their brands can be exaggerated. A deal seen by a partner at Sequoia will also be seen by rivals at other firms: in a fragmented cottage industry, there is no lack of competition. Often, winning the deal depends on skill as much as brand: it’s about understanding the business model well enough to impress the entrepreneur; it’s about judging what valuation might be reasonable. One careful tally concluded that new or emerging venture partnerships capture around half the gains in the top deals, and there are myriad examples of famous VCs having a chance to invest and then flubbing it.[6] Andreessen Horowitz passed on Uber. Its brand could not save it. Peter Thiel was an early investor in Stripe. He lacked the conviction to invest as much as Sequoia. As to the idea that branded venture partnerships have the “privilege” of participating in supposedly less risky late-stage investment rounds, this depends from deal to deal. A unicorn’s momentum usually translates into an extremely high price for its shares. In the cases of Uber and especially WeWork, some late-stage investors lost millions. Fourth, the anti-skill thesis underplays venture capitalists’ contributions to portfolio companies. Admittedly, these contributions can be difficult to pin down. Starting with Arthur Rock, who chaired the board of Intel for thirty-three years, most venture capitalists have avoided the limelight. They are the coaches, not the athletes. But this book has excavated multiple cases in which VC coaching made all the difference. Don Valentine rescued Atari and then Cisco from chaos. Peter Barris of NEA saw how UUNET could become the new GE Information Services. John Doerr persuaded the Googlers to work with Eric Schmidt. Ben Horowitz steered Nicira and Okta through their formative moments. To be sure, stories of venture capitalists guiding portfolio companies may exaggerate VCs’ importance: in at least some of these cases, the founders might have solved their own problems without advice from their investors. But quantitative research suggests that venture capitalists do make a positive impact: studies repeatedly find that startups backed by high-quality VCs are more likely to succeed than others.[7] A quirky contribution to this literature looks at what happens when airline routes make it easier for a venture capitalist to visit a startup. When the trip becomes simpler, the startup performs better.[8]",The Power Law: Venture Capital and the Making of the New Future,Sebastian Mallaby,[]
"Only a fraction of 1 percent of firms in the United States receive venture backing.[34] But in a study covering the quarter century from 1995 to 2019, Josh Lerner and Ramana Nanda find that VC-backed companies accounted for fully 47 percent of U.S. nonfinancial IPOs;",The Power Law: Venture Capital and the Making of the New Future,Sebastian Mallaby,[]
"Thus, even though VC-backed firms accounted for 47 percent of IPOs, they accounted for 76 percent of the market value at the end of the study. They also accounted for fully 89 percent of R&D spending.[35",The Power Law: Venture Capital and the Making of the New Future,Sebastian Mallaby,[]
"The six other members of the Traitorous Eight bought shares, and Robert Noyce saw to it that his small alma mater, Grinnell College, was invited to participate.",The Power Law: Venture Capital and the Making of the New Future,Sebastian Mallaby,[]
"In a famous essay in Esquire, the master storyteller Tom Wolfe presents Robert Noyce, the charismatic leader of Fairchild’s eight traitors, as the father of Silicon Valley.[51] Noyce came from a family of Congregational ministers in Grinnell, Iowa, the very middle of the Midwest, where the land was as flat as the social structure. When Noyce moved out to California, he brought Grinnell with him, “as though sewn into the lining of his coat.",The Power Law: Venture Capital and the Making of the New Future,Sebastian Mallaby,[]
"For politicians who worry about technology’s geopolitical impact, it’s tempting to get the government directly involved in subsidizing venture capital. But this is a mistake. In most cases, four simple steps will pay off more. Encourage limited partnerships. Encourage stock options. Invest in scientific education and research. Think globally.",The Power Law: Venture Capital and the Making of the New Future,Sebastian Mallaby,[]
"The prevailing narrative about Silicon Valley’s culture lionizes company founders, and Tom Wolfe’s exquisite storytelling has played up Noyce’s roots in small-town Iowa as the genesis of the egalitarian, stock-for-everyone business culture of the West Coast.[66] But, as we have seen, it was Arthur Rock who provided the impetus for Fairchild’s creation and who opened the founders’ eyes to the possibility of owning the fruits of their research. It was Rock who demonstrated the potential of the limited partnership that developed the Valley’s equity culture, and Rock who helped to catalyze the failure of the corporate venture model at Fairchild by prying away Jean Hoerni and Jay Last. When it came to the creation of Intel’s employee stock plan, moreover, it was probably Rock who proposed access for everyone, and it was certainly Rock who devised the plan’s details.[67] In a letter laying out his thinking in August 1968, Rock described a way of balancing the interests of investors and workers: Intel should avoid equity grants to short-term employees but extend them to everyone who made a long-term commitment. “There are too many millionaires who did nothing for their company except leave after a short period,” he observed wisely.[68] Without Rock’s judicious counsel, Intel’s employee stock program would not have set the standard in the Valley, because it would not have been sustainable.",The Power Law: Venture Capital and the Making of the New Future,Sebastian Mallaby,[]
"Council members Nick Beim, Steve Denning, and Auren Hoffman helped with early Silicon Valley introductions.",The Power Law: Venture Capital and the Making of the New Future,Sebastian Mallaby,[]
"Noyce was indeed the son and grandson of Congregational ministers, as Tom Wolfe correctly emphasized. But Rock hated hierarchies with at least as much passion. He was the bullied, Jewish, physically insecure boy in a small town. He was the youth who despised the ranked rigidity of the army. He was the man who liberated himself from the corporate establishment of the East Coast at the first opportunity. In his laconic, just-the-facts, plainspoken lucidity, Rock was as hostile to posturing and pretension as Noyce was. If Tom Wolfe had written an epic profile of Rock rather than Noyce, the origins of Silicon Valley’s egalitarian culture might be ascribed not to the entrepreneur but to the financier.",The Power Law: Venture Capital and the Making of the New Future,Sebastian Mallaby,[]
"Rather than merely identifying entrepreneurs and monitoring them, as Rock had done, the new venture capitalists actively shaped them: they told company founders whom to hire, how to sell, and how to structure their research. And to ensure that their instructions were implemented, the new venture capitalists came up with a second innovation: rather than organizing one large fundraising, they doled out capital in tranches, with each cautious infusion calibrated to support the company until it reached an agreed milestone. If the 1950s had revealed the power of liberation capital, and if the 1960s had brought the equity-only, time-limited venture fund, the advances of the 1970s were twofold: hands-on activism and stage-by-stage finance.",The Power Law: Venture Capital and the Making of the New Future,Sebastian Mallaby,[]
"It took Valentine a year and a half to raise $5 million for his first fund.[18] But in the end he succeeded by tapping pools of capital that enjoyed charitable status: the universities and endowments that escaped not only regulation but also capital-gains tax. The Ford Foundation came in first, later to be joined by Yale, Vanderbilt, and eventually Harvard; ironically, the Ivy League investment bosses showed a greater open-mindedness about a gruff Fordham graduate than many alumni could muster. In so doing, the endowments set in motion one of the great virtuous cycles of the American system. Venture capitalists backed knowledge-intensive startups, and some of the profits flowed to research institutions that generated more knowledge.[19",The Power Law: Venture Capital and the Making of the New Future,Sebastian Mallaby,[]
"Was this luck, or was it more than that? Proving skill is difficult in venture investing because, as we have seen, it hinges on subjective judgment calls rather than objective or quantifiable metrics. If a distressed-debt hedge fund hires analysts and lawyers to scrutinize a bankrupt firm, it can learn precisely which bond is backed by which piece of collateral, and it can foresee how the bankruptcy judge is likely to rule; its profits are not lucky. Likewise, if an algorithmic hedge fund hires astrophysicists to look for patterns in markets, it may discover statistical signals that are reliably profitable. But when Perkins backed Tandem and Genentech, or when Valentine backed Atari, they could not muster the same certainty. They were investing in human founders with human combinations of brilliance and weakness. They were dealing with products and manufacturing processes that were untested and complex; they faced competitors whose behaviors could not be forecast; they were investing over long horizons. In consequence, quantifiable risks were multiplied by unquantifiable uncertainties; there were known unknowns and unknown unknowns; the bracing unpredictability of life could not be masked by neat financial models. Of course, in this environment, luck played its part. Kleiner Perkins lost money on six of the fourteen investments in its first fund. Its methods were not as fail-safe as Tandem’s computers. But Perkins and Valentine were not merely lucky. Just as Arthur Rock embraced methods and attitudes that put him ahead of ARD and the Small Business Investment Companies in the 1960s, so the leading figures of the 1970s had an edge over their competitors. Perkins and Valentine had been managers at leading Valley companies; they knew how to be hands-on; and their contributions to the success of their portfolio companies were obvious. It was Perkins who brought in the early consultants to eliminate the white-hot risks at Tandem, and Perkins who pressed Swanson to contract Genentech’s research out to existing laboratories. Similarly, it was Valentine who drove Atari to focus on Home Pong and to ally itself with Sears, and Valentine who arranged for Warner Communications to buy the company. Early risk elimination plus stage-by-stage financing worked wonders for all three companies. Skeptical observers have sometimes asked whether venture capitalists create innovation or whether they merely show up for it. In the case of Don Valentine and Tom Perkins, there was not much passive showing up. By force of character and intellect, they stamped their will on their portfolio companies.",The Power Law: Venture Capital and the Making of the New Future,Sebastian Mallaby,[]
"there is no single decision you will make that will impact your company value more than the pricing,"" Horowitz declared, with oracular finality. When a software company market a new product - something original that nobody has seen before - it has once chance to set the price. Whatever point it chooses will stick in customers' minds, making it hard to raise prices later. Moreover, any given price difference will generate a bigger difference in a company's profit margin.",The Power Law: Venture Capital and the Art of Disruption,Sebastian Mallaby,[]
"Blitzscaling isn't really a recipe for success but rather survivorship bias masquerading as a strategy""",The Power Law: Inside Silicon Valley's Venture Capital Machine,Sebastian Mallaby,[]
"Mosaic also marked a new stage in the evolution of the power law. Venture-capital returns are dominated by grand slams partly because of the dynamics of startups: most young businesses fail, but the ones that gain traction can grow exponentially. This is true of fashion brands or hotel chains as well as technology companies. But tech-focused venture portfolios are dominated by the power law for an additional reason: tech startups are founded upon technologies that may themselves progress exponentially. Because of his experience and temperament, Doerr was especially attuned to this phenomenon. As a young engineer at Intel, he had seen how Moore’s law transformed the value of companies that used semiconductors: the power of chips was doubling every two years, so startups that put them to good use could make better, cheaper products. For any given modem, digital watch, or personal computer, the cost of the semiconductors inside the engine would fall by 50 percent in two years, 75 percent in four years, and 87.5 percent in eight. With that sort of wind at a tech startup’s back, no wonder profits could grow exponentially. Mosaic, and the internet more generally, turbocharged this phenomenon. Again, Doerr grasped this better than most others. As well as working at Intel, he had known Bob Metcalfe, so he understood that Metcalfe’s law was even more explosive than Moore’s law. Rather than merely doubling in power every two years, as semiconductors did, the value of a network would rise as the square of the number of users.[70] Progress would thus be quadratic rather than merely exponential; something that keeps on squaring will soon grow a lot faster than something that keeps on doubling. Moreover, progress would not be tethered to the passage of time; it would be a function of the number of users. At the moment when Doerr met Clark, the number of internet users was about to triple over the next two years, meaning that the value of the network would jump ninefold, an effect massively more powerful than the mere doubling in the power of semiconductors over that same period. What’s more, Metcalfe’s law was not supplanting Moore’s law, which would have been dramatic enough. Rather, it was compounding it. The explosion of internet traffic would be fueled both by its rapid growth in usefulness (Metcalfe’s law) and by the falling cost of modems and computers (Moore’s law).[71] After listening to Clark’s pitch, Doerr was determined to invest. A magical browser that attracted millions to the internet had almost limitless potential. The price Doerr had to pay was secondary.",The Power Law: Venture Capital and the Making of the New Future,Sebastian Mallaby,[]
"Son arrived at Yahoo’s office looking as slight and uncommanding as ever. But he brought a bazooka. In a bid without precedent in the history of the Valley, he proposed to invest fully $100 million in Yahoo. In return he wanted an additional 30 percent of the company. Son’s bid implied that Yahoo’s value had shot up eight times since his investment four months earlier. But the astonishing thing about his offer was the size of his proposed check: Silicon Valley had never seen a venture stake of such proportions.[21] The typical fund raised by a top-flight venture partnership weighed in at around $250 million, and there was no way it would put 40 percent of its resources into a single $100 million wager.[22] Private-equity investors and corporate acquirers sometimes made investments in the $100 million range, but in return they expected to take full control of companies.[23] Son, in contrast, would be a minority investor and on an unheralded scale. Because he had SoftBank’s corporate balance sheet behind him, he could pump in fully one hundred times more capital than Sequoia had provided when Yahoo got started. After Son dropped his bombshell, Yang, Filo, and Moritz sat in silence. Disconcerted, Yang said he was flattered but didn’t need the capital.[24] “Jerry, everyone needs $100 million,” Son retorted.[25]",The Power Law: Venture Capital and the Making of the New Future,Sebastian Mallaby,[]
"Growth was running at 40 percent per month, but what was more impressive was the motor that was driving it. Unlike Yahoo, which was pouring money into marketing, eBay’s marketing budget was zero. Its hectic expansion was instead propelled by Metcalfe’s law: as the size of its auction network grew, its value rose exponentially. The more sellers listed stuff on eBay, the more bargain hunters were drawn to the site; the more buyers there were, the more sellers turned to it.",The Power Law: Venture Capital and the Making of the New Future,Sebastian Mallaby,[]
"The first notable spinout was Kathy Xu, another woman who managed to flourish in China's venture industry. Rather than studying in the United States, Xu had experienced U.S. instruction at Nanjing University, where she had majored in English. One teacher, an impressive African American woman named Donda West, instilled in her pupils an American ethos. 'You are unique, you are a marvel. There has been no person like you in the last 500 years, and there will be no person like you in the next 500 years,' she lectured. The paean to individualism was, as Xu recalled vividly, an eye-opening experience for a Chinese teenager from Sichuan. Donda West also stuck in Xu's memory because of her son, who was often seen performing acrobatic tricks on campus. Years later, Xu was intrigued to discover that the boy, named Kanye, had become famous.",The Power Law: Venture Capital and the Art of Disruption,Sebastian Mallaby,['donda']
"Tom Perkins’s dictums: you succeed in venture capital by backing the right deals, not by haggling over valuations.",The Power Law: Venture Capital and the Making of the New Future,Sebastian Mallaby,[]
Accel’s culture of training and trusting young investors seemed to hold the secret of success.,The Power Law: Venture Capital and the Making of the New Future,Sebastian Mallaby,[]
"To fill this gap in the capital market, Davis and Rock set themselves up as a limited partnership, the same legal structure that had been used by a short-lived rival called Draper, Gaither & Anderson.[18] Rather than identifying startups and then seeking out corporate investors, they began by raising a fund that would render corporate investors unnecessary. As the two active, or “general,” partners, Davis and Rock each seeded the fund with $100,000 of their own capital. Then, ignoring the easy loans to be had from the fashionable SBIC structure, they raised just under $3.2 million from some thirty “limited” partners—rich individuals who served as passive investors.[19] The beauty of this size and structure was that the Davis & Rock partnership now had a war chest seven and a half times larger than an SBIC, and with it the ammunition to supply companies with enough capital to grow aggressively. At the same time, by keeping the number of passive investors under the legal threshold of one hundred, the partnership flew under the regulatory radar, avoiding the restrictions that ensnared the SBICs and Doriot’s ARD.[20] Sidestepping yet another weakness to be found in their competitors, Davis and Rock promised at the outset to liquidate their fund after seven years. The general partners had their own money in the fund, and thus a healthy incentive to invest with caution. At the same time, they could deploy the outside partners’ capital for a limited time only. Their caution would be balanced with deliberate aggression. Indeed, everything about the fund’s design was calculated to support an intelligent but forceful growth mentality. Unlike the SBICs, Davis & Rock raised money purely in the form of equity, not debt. The equity providers—that is, the outside limited partners—knew not to expect dividends, so Davis and Rock were free to invest in ambitious startups that used every dollar of capital to expand their business.[21] As general partners, Davis and Rock were personally incentivized to prioritize expansion: they took their compensation in the form of a 20 percent share of the fund’s capital appreciation. Meanwhile, Rock was at pains to extend this equity mentality to the employees of his portfolio companies. Having witnessed the effect of employee share ownership on the early culture of Fairchild, he believed in awarding managers, scientists, and salesmen with stock and stock options. In sum, everybody in the Davis & Rock orbit—the limited partners, the general partners, the entrepreneurs, their key employees—was compensated in the form of equity.",The Power Law: Venture Capital and the Making of the New Future,Sebastian Mallaby,[]
"Rock and his partner articulated an approach to risk management that would resonate with future venture capitalists. Modern portfolio theory, the set of ideas that was coming to dominate academic finance, stressed diversification: by owning a broad mix of assets exposed to a wide variety of uncorrelated risks, investors could reduce the overall volatility of their holdings and improve their risk-return ratio. Davis and Rock ignored this teaching: they promised to make concentrated bets on a dozen or so companies. Although this would entail obvious perils, these would be tolerable for two reasons. First, by buying just under half of a firm’s equity, the Davis & Rock partnership would get a seat on the board and a say in its strategy: in the absence of diversification, a venture capitalist could manage his risk by exercising a measure of control over his assets. Second, Davis and Rock insisted that they would invest only in ambitious, high-growth companies—ones whose value might jump at least tenfold in five to seven years. To critics who called this test excessively demanding, Davis retorted that it would be “unwise to accept a less stringent one.” Venture investing was necessarily speculative, he explained, and most startups would fail; therefore, the winners would have to win big enough to make a success of the portfolio.[25]",The Power Law: Venture Capital and the Making of the New Future,Sebastian Mallaby,[]
"Horsley Bridge is an investment company with stakes in venture funds that backed 7,000 startups between 1985 and 2014.",The Power Law: Venture Capital and the Making of the New Future,Sebastian Mallaby,[]
